headline,pub_date,snippet,web_url,word_count,abstract,section_name,pillar_name,type,byline,keywords,article_id
"Morning mail: chief scientist's renewables plea, vaccine shortfall, Covid's sit-down gigs",2020-11-10T19:53:27Z,<p><strong>Wednesday</strong>: physicist Cathy Foley says Australia should be a leader in renewable energy. Plus: Covid-safe rules reshaping live events </p>,https://www.theguardian.com/australia-news/2020/nov/11/morning-mail-chief-scientists-renewables-plea-vaccine-shortfall-covids-sit-down-gigs,1286,<p><strong>Wednesday</strong>: physicist Cathy Foley says Australia should be a leader in renewable energy. Plus: Covid-safe rules reshaping live events </p>,Australia news,News,article,Tamara Howie,,australia-news/2020/nov/11/morning-mail-chief-scientists-renewables-plea-vaccine-shortfall-covids-sit-down-gigs
Conservative US supreme court justices suggest Obamacare will be upheld,2020-11-10T18:48:37Z,<p>Brett Kavanaugh and John Roberts indicated law could be upheld even if court deems one part of it unconstitutional </p>,https://www.theguardian.com/us-news/2020/nov/10/obamacare-supreme-court-hearing-trump-lawyers-argue-to-end,805,<p>Brett Kavanaugh and John Roberts indicated law could be upheld even if court deems one part of it unconstitutional </p>,US news,News,article,Amanda Holpuch in New York,"US healthcare, US supreme court, US news, Law (US), US politics",us-news/2020/nov/10/obamacare-supreme-court-hearing-trump-lawyers-argue-to-end
Trump's vote fraud claims go viral on social media despite curbs,2020-11-10T18:43:08Z,"<p>President’s posts are top on Facebook as efforts to stop misinformation about election prove ineffective</p><ul><li><a href=""https://www.theguardian.com/us-news/live/2020/nov/10/us-election-2020-joe-biden-donald-trump-supreme-court-obamacare-affordable-care-act-coronavirus-covid-live-updates"">US politics: live updates</a></li></ul>",https://www.theguardian.com/us-news/2020/nov/10/trumps-vote-claims-go-viral-on-social-media-despite-curbs,668,"<p>President’s posts are top on Facebook as efforts to stop misinformation about election prove ineffective</p><ul><li><a href=""https://www.theguardian.com/us-news/live/2020/nov/10/us-election-2020-joe-biden-donald-trump-supreme-court-obamacare-affordable-care-act-coronavirus-covid-live-updates"">US politics: live updates</a></li></ul>",US news,News,article,Alex Hern Technology editor,"US elections 2020, Social media, UK news, US news, World news, US politics, X, Facebook, YouTube, Donald Trump, Digital media, Internet, Technology, Social networking, Joe Biden",us-news/2020/nov/10/trumps-vote-claims-go-viral-on-social-media-despite-curbs
Donald Trump's latest endeavor? Asking his supporters to pay his debts,2020-11-10T18:30:37Z,<p>The outgoing president has two ‘election defense funds’ – but the small print shows donations will go towards paying off debt</p>,https://www.theguardian.com/lifeandstyle/2020/nov/10/donald-trump-election-fund-debt,699,<p>The outgoing president has two ‘election defense funds’ – but the small print shows donations will go towards paying off debt</p>,US news,News,article,Poppy Noor,"Donald Trump, US news, US elections 2020, US politics",lifeandstyle/2020/nov/10/donald-trump-election-fund-debt
DoJ officials condemn Barr's approval of voter fraud inquiries without evidence,2020-11-10T18:14:52Z,"<p>Richard Pilger, justice department official in charge of voter fraud investigations, resigned due to ‘ramifications’ of Barr’s move</p><ul><li><a href=""https://www.theguardian.com/us-news/2020/nov/10/donald-trump-longshot-election-lawsuits"">Trump’s longshot election lawsuits: where do things stand?</a></li><li><a href=""https://www.theguardian.com/us-news/live/2020/nov/10/us-election-2020-joe-biden-donald-trump-supreme-court-obamacare-affordable-care-act-coronavirus-covid-live-updates"">US politics – live updates</a></li></ul>",https://www.theguardian.com/us-news/2020/nov/10/william-barr-voter-fraud-inquiries-justice-department,924,"<p>Richard Pilger, justice department official in charge of voter fraud investigations, resigned due to ‘ramifications’ of Barr’s move</p><ul><li><a href=""https://www.theguardian.com/us-news/2020/nov/10/donald-trump-longshot-election-lawsuits"">Trump’s longshot election lawsuits: where do things stand?</a></li><li><a href=""https://www.theguardian.com/us-news/live/2020/nov/10/us-election-2020-joe-biden-donald-trump-supreme-court-obamacare-affordable-care-act-coronavirus-covid-live-updates"">US politics – live updates</a></li></ul>",US news,News,article,Ed Pilkington in New York,"William Barr, US elections 2020, Trump administration, US politics, US news, World news",us-news/2020/nov/10/william-barr-voter-fraud-inquiries-justice-department
UK coronavirus: Hancock to consider using rapid-result tests for people told to self-isolate - as it happened,2020-11-10T17:53:17Z,"<p>This live blog is now closed. <a href=""https://www.theguardian.com/world/live/2020/nov/10/coronavirus-live-news-who-warns-covid-not-tired-of-us-as-top-uk-scientist-says-vaccine-feels-like-watershed-moment"">For the latest coronavirus updates from around the world, head over to our global blog </a></p><ul><li><a href=""https://www.theguardian.com/world/2020/nov/10/covid-vaccine-nhs-england-sets-out-plans-for-gp-clinics"">England GP clinics to administer at least 975 vaccines a week</a></li><li><a href=""https://www.theguardian.com/world/2020/nov/10/6-key-questions-about-the-pfizer-biontech-covid-19-vaccine"">Six key questions about Pfizer/BioNTech vaccine </a></li><li><a href=""https://www.theguardian.com/world/2020/nov/10/nhs-test-and-trace-dido-harding-says-scheme-failed-to-predict-demand"">Dido Harding says test and trace scheme failed to predict demand</a></li><li><a href=""https://www.theguardian.com/uk-news/2020/nov/10/wales-government-no-gcse-a-levels-exams-next-summer"">Welsh move to cancel GCSE and A-level exams puts pressure on No10</a><br></li><li><a href=""https://www.theguardian.com/world/series/coronavirus-live/latest"">Coronavirus global updates - live</a><br></li></ul>",https://www.theguardian.com/politics/live/2020/nov/10/uk-covid-coronavirus-live-news-updates-pfizer-vaccine-boris-johnson-brexit-nhs,8716,"<p>This live blog is now closed. <a href=""https://www.theguardian.com/world/live/2020/nov/10/coronavirus-live-news-who-warns-covid-not-tired-of-us-as-top-uk-scientist-says-vaccine-feels-like-watershed-moment"">For the latest coronavirus updates from around the world, head over to our global blog </a></p><ul><li><a href=""https://www.theguardian.com/world/2020/nov/10/covid-vaccine-nhs-england-sets-out-plans-for-gp-clinics"">England GP clinics to administer at least 975 vaccines a week</a></li><li><a href=""https://www.theguardian.com/world/2020/nov/10/6-key-questions-about-the-pfizer-biontech-covid-19-vaccine"">Six key questions about Pfizer/BioNTech vaccine </a></li><li><a href=""https://www.theguardian.com/world/2020/nov/10/nhs-test-and-trace-dido-harding-says-scheme-failed-to-predict-demand"">Dido Harding says test and trace scheme failed to predict demand</a></li><li><a href=""https://www.theguardian.com/uk-news/2020/nov/10/wales-government-no-gcse-a-levels-exams-next-summer"">Welsh move to cancel GCSE and A-level exams puts pressure on No10</a><br></li><li><a href=""https://www.theguardian.com/world/series/coronavirus-live/latest"">Coronavirus global updates - live</a><br></li></ul>",Politics,News,liveblog,Andrew Sparrow,"Coronavirus, Politics, UK news, Health, Matt Hancock, Infectious diseases, Office for National Statistics, Science, Medical research, Wales, John Major",politics/live/2020/nov/10/uk-covid-coronavirus-live-news-updates-pfizer-vaccine-boris-johnson-brexit-nhs
Trumpism may well endure in a dangerously divided country,2020-11-10T17:31:13Z,<p><strong>Marguerite Alexander</strong> and <strong>Frank Land </strong>on the after-effects of Donald Trump’s Manichaean world</p>,https://www.theguardian.com/us-news/2020/nov/10/trumpism-may-well-endure-in-a-dangerously-divided-country,402,<p><strong>Marguerite Alexander</strong> and <strong>Frank Land </strong>on the after-effects of Donald Trump’s Manichaean world</p>,US news,News,article,Letters,"Donald Trump, Joe Biden, US politics",us-news/2020/nov/10/trumpism-may-well-endure-in-a-dangerously-divided-country
Charming case of mistaken identity,2020-11-10T17:30:25Z,<p>Northern vegetable divide | Ballina | Centimillionaires | Trump and Farage | Virgin hyperloop</p>,https://www.theguardian.com/us-news/2020/nov/10/charming-case-of-mistaken-identity,273,<p>Northern vegetable divide | Ballina | Centimillionaires | Trump and Farage | Virgin hyperloop</p>,US news,News,article,Letters,"Donald Trump, Vegetables, Joe Biden, Ireland, Hyperloop, Food, Technology",us-news/2020/nov/10/charming-case-of-mistaken-identity
Trump was always destined to lose – and he has only himself to blame,2020-11-10T17:20:18Z,"<p>Voters over 65, a key demographic that gave Trump an edge in 2016, began to desert him in mid-2019, even before coronavirus</p>",https://www.theguardian.com/commentisfree/2020/nov/10/trump-was-always-destined-to-lose-and-he-has-only-himself-to-blame,610,"<p>Voters over 65, a key demographic that gave Trump an edge in 2016, began to desert him in mid-2019, even before coronavirus</p>",Opinion,Opinion,article,Walter Shapiro,"US elections 2020, Donald Trump, US politics, US news",commentisfree/2020/nov/10/trump-was-always-destined-to-lose-and-he-has-only-himself-to-blame
"Deal or no deal on Brexit, Boris Johnson's only care is that no one blames him",2020-11-10T17:05:52Z,<p>On EU negotiations he’s already ditched the good options. His priority now is simply to deflect attention from his failings<br></p>,https://www.theguardian.com/commentisfree/2020/nov/10/brexit-deal-boris-johnson-eu-negotiations,1194,<p>On EU negotiations he’s already ditched the good options. His priority now is simply to deflect attention from his failings<br></p>,Opinion,Opinion,article,Rafael Behr,"Brexit, European Union, Foreign policy, Europe, Politics, UK news, World news, Joe Biden, US news, Boris Johnson",commentisfree/2020/nov/10/brexit-deal-boris-johnson-eu-negotiations
"Jimmy Kimmel: 'Darth Tax Evader has been toppled, and America responded with a dance party'",2020-11-10T17:04:51Z,<p>Late-night hosts celebrate Biden’s victory and look forward to calmer days despite the White House’s ongoing denial of reality</p>,https://www.theguardian.com/culture/2020/nov/10/jimmy-kimmel-trump-stephen-colbert-seth-meyers-trevor-noah,920,<p>Late-night hosts celebrate Biden’s victory and look forward to calmer days despite the White House’s ongoing denial of reality</p>,Culture,Arts,article,Adrian Horton,"Late-night TV roundup, Jimmy Kimmel, Stephen Colbert, Seth Meyers, Trevor Noah, TV comedy, Comedy, US television, Culture, Television & radio, Television",culture/2020/nov/10/jimmy-kimmel-trump-stephen-colbert-seth-meyers-trevor-noah
Saeb Erekat obituary,2020-11-10T16:55:35Z,Palestinian politician and peace negotiator widely regarded as a moderate and realist,https://www.theguardian.com/world/2020/nov/10/saeb-erekat-obituary,1078,Palestinian politician and peace negotiator widely regarded as a moderate and realist,World news,News,article,Ian Black,"Palestine, Middle East and north Africa, World news, Israel, Benjamin Netanyahu, US news, University of Bradford",world/2020/nov/10/saeb-erekat-obituary
Trump's longshot election lawsuits: where do things stand?,2020-11-10T16:42:40Z,"<p>The president and other Republicans have filed a series of lawsuits in different states that several judges have already dismissed</p><ul><li><a href=""https://www.theguardian.com/us-news/live/2020/nov/10/us-election-2020-joe-biden-donald-trump-supreme-court-obamacare-affordable-care-act-coronavirus-covid-live-updates"">US politics live – follow all the latest</a></li></ul>",https://www.theguardian.com/us-news/2020/nov/10/donald-trump-longshot-election-lawsuits,1623,"<p>The president and other Republicans have filed a series of lawsuits in different states that several judges have already dismissed</p><ul><li><a href=""https://www.theguardian.com/us-news/live/2020/nov/10/us-election-2020-joe-biden-donald-trump-supreme-court-obamacare-affordable-care-act-coronavirus-covid-live-updates"">US politics live – follow all the latest</a></li></ul>",US news,News,article,Sam Levine in New York,"US elections 2020, US politics, US news, World news, Arizona, Michigan, Nevada, Pennsylvania, Georgia",us-news/2020/nov/10/donald-trump-longshot-election-lawsuits
Sideshow Greg wasn’t done yet and promptly stepped on another rake,2020-11-10T16:11:38Z,"<p><a href=""https://www.theguardian.com/info/2016/jan/05/the-fiver-email-sign-up"">Sign up now! Sign up now! Sign up now? Sign up now</a>!</p>",https://www.theguardian.com/football/2020/nov/10/the-fiver-greg-clarke-another-fine-mess,1177,"<p><a href=""https://www.theguardian.com/info/2016/jan/05/the-fiver-email-sign-up"">Sign up now! Sign up now! Sign up now? Sign up now</a>!</p>",Football,Sport,article,Barry Glendenning,"Football, Sport",football/2020/nov/10/the-fiver-greg-clarke-another-fine-mess
What does Obamacare actually do and when will the supreme court rule on it?,2020-11-10T15:40:26Z,<p>This is the third time the supreme court is considering a challenge to the 2010 law – here’s what you need to know</p>,https://www.theguardian.com/us-news/2020/nov/10/obamacare-supreme-court-aca-what-is-it,563,<p>This is the third time the supreme court is considering a challenge to the 2010 law – here’s what you need to know</p>,US news,News,article,Amanda Holpuch in New York,"US healthcare, US supreme court, Law (US), US news, Law, World news",us-news/2020/nov/10/obamacare-supreme-court-aca-what-is-it
Now what does Giuliani's Four Seasons Total Landscaping farce remind me of?,2020-11-10T14:23:56Z,"<p>Lucky for us Brits, we have our own version of Donald Trump’s lawyer toughing it out in a suburban car park</p>",https://www.theguardian.com/commentisfree/2020/nov/10/four-seasons-total-landscaping-rudy-giuliani,1017,"<p>Lucky for us Brits, we have our own version of Donald Trump’s lawyer toughing it out in a suburban car park</p>",Opinion,Opinion,article,Marina Hyde,"Donald Trump, Republicans, Rudy Giuliani, US elections 2020, US news, Brexit, UK news, US politics, World news",commentisfree/2020/nov/10/four-seasons-total-landscaping-rudy-giuliani
"Biden ‘never going to see Trump again’ after inauguration, says sister",2020-11-10T14:13:51Z,"<p>Valerie Biden Owens made remark to Axios on HBO when asked if there can be any forgiveness once Trump leaves national stage</p><ul><li><a href=""https://www.theguardian.com/us-news/live/2020/nov/10/us-election-2020-joe-biden-donald-trump-supreme-court-obamacare-affordable-care-act-coronavirus-covid-live-updates"">US politics – live updates</a></li></ul>",https://www.theguardian.com/us-news/2020/nov/10/joe-biden-donald-trump-never-see-again-valerie-biden-owens-interview-axios,523,"<p>Valerie Biden Owens made remark to Axios on HBO when asked if there can be any forgiveness once Trump leaves national stage</p><ul><li><a href=""https://www.theguardian.com/us-news/live/2020/nov/10/us-election-2020-joe-biden-donald-trump-supreme-court-obamacare-affordable-care-act-coronavirus-covid-live-updates"">US politics – live updates</a></li></ul>",US news,News,article,Martin Pengelly in New York,"Joe Biden, Donald Trump, US politics, US news, World news",us-news/2020/nov/10/joe-biden-donald-trump-never-see-again-valerie-biden-owens-interview-axios
What is the future for Latino voters in the US? Five experts weigh in,2020-11-10T13:59:50Z,<p>Latinos helped Trump win Florida –and Biden win Arizona and elsewhere. What should Democrats learn from this election?<br></p>,https://www.theguardian.com/commentisfree/2020/nov/10/what-is-the-future-for-latino-voters-in-the-us-five-experts-weigh-in,1003,<p>Latinos helped Trump win Florida –and Biden win Arizona and elsewhere. What should Democrats learn from this election?<br></p>,Opinion,Opinion,article,"Chuck Rocha, Cristina Beltrán, Danielle Pilar Clealand, Arlene Dávila, Sonja Diaz","US politics, US elections 2020",commentisfree/2020/nov/10/what-is-the-future-for-latino-voters-in-the-us-five-experts-weigh-in
Lockdown lesbianism and not sleeping with the enemy – the biggest Covid dating trends,2020-11-10T13:00:09Z,"<p>According to OkCupid, the pandemic has led to some changes in the way we pursue relationships – including being less willing to date people who hold opposing political views<br></p>",https://www.theguardian.com/commentisfree/2020/nov/10/lockdown-lesbianism-and-not-sleeping-with-the-enemy-the-biggest-covid-dating-trends,555,"<p>According to OkCupid, the pandemic has led to some changes in the way we pursue relationships – including being less willing to date people who hold opposing political views<br></p>",Opinion,Opinion,article,Arwa Mahdawi,"Online dating, Coronavirus, Dating",commentisfree/2020/nov/10/lockdown-lesbianism-and-not-sleeping-with-the-enemy-the-biggest-covid-dating-trends
"Saeb Erekat, veteran Palestinian peace negotiator, dies after Covid diagnosis",2020-11-10T12:47:41Z,<p>Key PLO figure and advocate for two-state solution dies aged 65 </p>,https://www.theguardian.com/world/2020/nov/10/saeb-erekat-veteran-palestinian-peace-negotiator-dies-at-65,775,<p>Key PLO figure and advocate for two-state solution dies aged 65 </p>,World news,News,article,Oliver Holmes Jerusalem correspondent,"Palestine, Middle East and north Africa, World news, Coronavirus, Science, Israel",world/2020/nov/10/saeb-erekat-veteran-palestinian-peace-negotiator-dies-at-65
Can Joe Biden avoid Obama's mistakes? He must – for the future of the party,2020-11-10T12:23:08Z,<p>Democrats must act to ward off the electoral rise of rightwing extremism by delivering gains for the working class</p>,https://www.theguardian.com/commentisfree/2020/nov/10/can-joe-biden-obamas-mistakes-future-of-the-party,1250,<p>Democrats must act to ward off the electoral rise of rightwing extremism by delivering gains for the working class</p>,Opinion,Opinion,article,David Sirota,"US politics, US elections 2020, Joe Biden, US news",commentisfree/2020/nov/10/can-joe-biden-obamas-mistakes-future-of-the-party
Reproductive health NGOs pin hopes on Biden reversing ‘global gag rule’,2020-11-10T11:28:23Z,<p>Next US president expected to rescind rule that blocks aid for groups providing abortion services</p>,https://www.theguardian.com/society/2020/nov/10/reproductive-health-ngos-abortion-pin-hopes-on-biden-reversing-global-gag-rule,965,<p>Next US president expected to rescind rule that blocks aid for groups providing abortion services</p>,Society,News,article,Shaun Walker,"Reproductive rights, Abortion, Aid, 'Global gag rule', US foreign policy, US news, Joe Biden, Global development, World news, Women",society/2020/nov/10/reproductive-health-ngos-abortion-pin-hopes-on-biden-reversing-global-gag-rule
Black voters drove Joe Biden's victory – and have offered this country a reboot,2020-11-10T11:25:07Z,"<p>We have mountains yet to climb, but Black voters should feel pride in our incredible voter mobilization. Look at the numbers<br></p>",https://www.theguardian.com/commentisfree/2020/nov/10/black-voters-drove-joe-biden-victory-reboot-2020,820,"<p>We have mountains yet to climb, but Black voters should feel pride in our incredible voter mobilization. Look at the numbers<br></p>",Opinion,Opinion,article,Cliff Albright,"US elections 2020, Joe Biden, Race, Kamala Harris, Democrats, US politics, US news",commentisfree/2020/nov/10/black-voters-drove-joe-biden-victory-reboot-2020
Brace yourselves. The next Donald Trump could be much worse,2020-11-10T11:17:07Z,"<p>If Biden governs as an establishment Democrat, it won’t be long before the US elects another, far more effective Donald Trump</p>",https://www.theguardian.com/commentisfree/2020/nov/10/biden-establishment-democrat-next-donald-trump,769,"<p>If Biden governs as an establishment Democrat, it won’t be long before the US elects another, far more effective Donald Trump</p>",Opinion,Opinion,article,Bhaskar Sunkara,"Donald Trump, Joe Biden, US politics, Democrats",commentisfree/2020/nov/10/biden-establishment-democrat-next-donald-trump
'The most misunderstood state': why California's not as liberal as you think,2020-11-10T11:00:07Z,"<p>Biden easily won the state, but votes for Congress and on gig work and affirmative action tell a different story</p>",https://www.theguardian.com/us-news/2020/nov/10/california-ballot-proposition-22-liberal-congress,1279,"<p>Biden easily won the state, but votes for Congress and on gig work and affirmative action tell a different story</p>",US news,News,article,Gabrielle Canon,"California, US elections 2020, US news, US politics, Gig economy",us-news/2020/nov/10/california-ballot-proposition-22-liberal-congress
US accused of using Covid as excuse to deny children their right to asylum,2020-11-10T11:00:07Z,"<p>Since tighter migration controls were announced in March, US has deported more than 1,400 unaccompanied minors to Guatemala</p>",https://www.theguardian.com/world/2020/nov/10/us-child-deportations-guatemala-pandemic,697,"<p>Since tighter migration controls were announced in March, US has deported more than 1,400 unaccompanied minors to Guatemala</p>",World news,News,article,Jeff Abbott in Guatemala City,"Guatemala, World news, Americas, US immigration, US news",world/2020/nov/10/us-child-deportations-guatemala-pandemic
First Thing election special: Barr authorises baseless voter fraud investigation,2020-11-10T10:39:31Z,"<p>Attorney general has authorised prosecutors to look into ‘substantial allegations’ of voter fraud, despite a lack of evidence. Plus, Trump sacks defense secretary</p>",https://www.theguardian.com/us-news/2020/nov/10/first-thing-election-special-barr-authorises-baseless-voter-investigation,860,"<p>Attorney general has authorised prosecutors to look into ‘substantial allegations’ of voter fraud, despite a lack of evidence. Plus, Trump sacks defense secretary</p>",US news,News,article,Molly Blackall,,us-news/2020/nov/10/first-thing-election-special-barr-authorises-baseless-voter-investigation
Trump poised to leave legacy of chaos with last-minute foreign policy moves,2020-11-10T10:00:05Z,"<p>Analysis: With defence secretary’s firing and potential new Iran sanctions, Trump raises fears over impact of a vengeful president</p>",https://www.theguardian.com/us-news/2020/nov/10/donald-trump-mark-esper-foreign-policy-joe-biden-iran,907,"<p>Analysis: With defence secretary’s firing and potential new Iran sanctions, Trump raises fears over impact of a vengeful president</p>",US news,News,article,Julian Borger in Washington,"Donald Trump, US foreign policy, US news, Biden administration, Trump administration, Joe Biden, US politics, Iran, Middle East and north Africa, World news",us-news/2020/nov/10/donald-trump-mark-esper-foreign-policy-joe-biden-iran
Saudi Arabia considers clemency for female activists ahead of G20,2020-11-10T09:57:48Z,"<p>Summit host mulling whether detentions do it more harm than good, UK ambassador says </p>",https://www.theguardian.com/world/2020/nov/10/saudi-arabia-considers-clemency-for-female-activists-ahead-of-g20,884,"<p>Summit host mulling whether detentions do it more harm than good, UK ambassador says </p>",World news,News,article,Patrick Wintour Diplomatic editor,"Saudi Arabia, Human rights, Middle East and north Africa, World news, G20, Women's rights and gender equality",world/2020/nov/10/saudi-arabia-considers-clemency-for-female-activists-ahead-of-g20
"With Biden elected, a no-deal Brexit would make Britain a pariah. It can't happen",2020-11-10T09:00:04Z,<p>These are the end days when Boris Johnson must finally confront his own lies: the humiliation will be eye-watering<br></p>,https://www.theguardian.com/commentisfree/2020/nov/10/biden-no-deal-brexit-cant-happen-boris-johnson,936,<p>These are the end days when Boris Johnson must finally confront his own lies: the humiliation will be eye-watering<br></p>,Opinion,Opinion,article,Polly Toynbee,"Brexit, Good Friday agreement, European Union, Europe, Foreign policy, Politics, World news, UK news, US elections 2020, Northern Ireland",commentisfree/2020/nov/10/biden-no-deal-brexit-cant-happen-boris-johnson
