headline,pub_date,snippet,web_url,word_count,abstract,section_name,pillar_name,type,byline,keywords,article_id
'The fight doesn't stop here': what LGBTQ+ advocates want from a Biden presidency,2020-11-19T11:00:10Z,"<p><strong>The new administration has promised to undo Trump’s discriminatory policies, but activists want to see bold support for queer and trans rights</strong></p>",https://www.theguardian.com/world/2020/nov/19/joe-bidens-win-was-a-sigh-of-relief-for-lgbtq-people-now-activists-want-stronger-protections,1283,"<p><strong>The new administration has promised to undo Trump’s discriminatory policies, but activists want to see bold support for queer and trans rights</strong></p>",World news,News,article,Sam Levin in Los Angeles,"LGBTQ+ rights, Biden administration, Joe Biden, US news, Trump administration, US politics",world/2020/nov/19/joe-bidens-win-was-a-sigh-of-relief-for-lgbtq-people-now-activists-want-stronger-protections
Kristi Noem rigidly follows Trump strategy of denial as Covid ravages South Dakota,2020-11-19T09:00:08Z,<p>Republican governor clings to the president despite his defeat and claims ‘we’re doing really good’ with state’s positivity rate at 60%</p>,https://www.theguardian.com/us-news/2020/nov/19/kristi-noem-trump-strategy-denial-covid-ravages-south-dakota,1057,<p>Republican governor clings to the president despite his defeat and claims ‘we’re doing really good’ with state’s positivity rate at 60%</p>,US news,News,article,Ed Pilkington,"South Dakota, Republicans, Donald Trump, US news, US politics",us-news/2020/nov/19/kristi-noem-trump-strategy-denial-covid-ravages-south-dakota
Endangered animals get entangled in plastics that riddle US oceans – study,2020-11-19T08:00:07Z,"<p>More than 1,800 marine animals from 40 species suffering from contact with plastics over the past decade</p>",https://www.theguardian.com/environment/2020/nov/19/endangered-animals-get-entangled-plastics-riddle-us-oceans,600,"<p>More than 1,800 marine animals from 40 species suffering from contact with plastics over the past decade</p>",Environment,News,article,Oliver Milman,"Oceans, Plastics, Environment, Animals",environment/2020/nov/19/endangered-animals-get-entangled-plastics-riddle-us-oceans
Thursday briefing: Standoff as Starmer doesn't return the whip to Corbyn,2020-11-19T06:30:54Z,"<p>Situation under review, says Labour leader … Australian special forces accused of ‘blooding’ murders in Afghanistan … Bill Bailey on his Strictly turn</p>",https://www.theguardian.com/world/2020/nov/19/thursday-briefing-standoff-as-starmer-wont-rehabilitate-corbyn,1489,"<p>Situation under review, says Labour leader … Australian special forces accused of ‘blooding’ murders in Afghanistan … Bill Bailey on his Strictly turn</p>",World news,News,article,,,world/2020/nov/19/thursday-briefing-standoff-as-starmer-wont-rehabilitate-corbyn
'A story that hadn't been told': inside a groundbreaking trans surgery center,2020-11-19T06:05:04Z,"<p>In a moving new documentary Born to Be, the work of pioneering surgeon Dr Jess Ting and the lives of his patients are brought to the screen with sensitivity</p>",https://www.theguardian.com/film/2020/nov/19/born-to-be-documentary-trans-surgery-center,1310,"<p>In a moving new documentary Born to Be, the work of pioneering surgeon Dr Jess Ting and the lives of his patients are brought to the screen with sensitivity</p>",Film,Arts,article,Adrian Horton,"Documentary films, Transgender, Film, Society, Culture",film/2020/nov/19/born-to-be-documentary-trans-surgery-center
The conniptions about Harry Styles in a dress are the desperate cry of losers in a culture war,2020-11-19T01:20:29Z,"<p>The Trump project they championed now lies in smoky ruins, overrun by an extraordinary coalition of liberals, leftists and those who’ve just had enough</p>",https://www.theguardian.com/commentisfree/2020/nov/19/the-conniptions-about-harry-styles-in-a-dress-are-the-desperate-cry-of-losers-in-a-culture-war,696,"<p>The Trump project they championed now lies in smoky ruins, overrun by an extraordinary coalition of liberals, leftists and those who’ve just had enough</p>",Opinion,Opinion,article,Van Badham,"Harry Styles, Vogue, Donald Trump, US news, Fashion",commentisfree/2020/nov/19/the-conniptions-about-harry-styles-in-a-dress-are-the-desperate-cry-of-losers-in-a-culture-war
"More than 250,000 Americans have died from coronavirus as US cases soar - as it happened",2020-11-19T01:11:02Z,"<ul><li><a href=""https://www.theguardian.com/us-news/live/2020/nov/18/us-election-donald-trump-joe-biden-chris-krebs-coronavirus-covid-19-live-updates?page=with:block-5fb577418f08b4f3c56759fb#block-5fb577418f08b4f3c56759fb"">States implement stricter guidelines to mitigate virus’ spread</a></li><li><a href=""https://www.theguardian.com/us-news/live/2020/nov/18/us-election-donald-trump-joe-biden-chris-krebs-coronavirus-covid-19-live-updates?page=with:block-5fb576468f081d2fbd0d93f3#block-5fb576468f081d2fbd0d93f3"">New York City public schools to close again on Thursday</a></li><li><a href=""https://www.theguardian.com/us-news/live/2020/nov/18/us-election-donald-trump-joe-biden-chris-krebs-coronavirus-covid-19-live-updates?page=with:block-5fb56a708f08161b0b9c7b37#block-5fb56a708f08161b0b9c7b37"">President-elect Biden peaks virtually with healthcare workers</a></li><li><a href=""https://www.theguardian.com/us-news/live/2020/nov/18/us-election-donald-trump-joe-biden-chris-krebs-coronavirus-covid-19-live-updates?page=with:block-5fb548058f08161b0b9c78c1#block-5fb548058f08161b0b9c78c1"">Trump campaign to request recounts in two Wisconsin counties</a><br></li><li><a href=""https://www.theguardian.com/us-news/live/2020/nov/18/us-election-donald-trump-joe-biden-chris-krebs-coronavirus-covid-19-live-updates?page=with:block-5fb538568f08161b0b9c77ac#block-5fb538568f08161b0b9c77ac"">House Democrats reelect Pelosi as nominee for speaker</a></li><li><a href=""https://www.theguardian.com/info/2018/sep/17/guardian-us-morning-briefing-sign-up-to-stay-informed"">Sign up to receive First Thing – our daily briefing by email</a><br></li></ul>",https://www.theguardian.com/us-news/live/2020/nov/18/us-election-donald-trump-joe-biden-chris-krebs-coronavirus-covid-19-live-updates,14408,"<ul><li><a href=""https://www.theguardian.com/us-news/live/2020/nov/18/us-election-donald-trump-joe-biden-chris-krebs-coronavirus-covid-19-live-updates?page=with:block-5fb577418f08b4f3c56759fb#block-5fb577418f08b4f3c56759fb"">States implement stricter guidelines to mitigate virus’ spread</a></li><li><a href=""https://www.theguardian.com/us-news/live/2020/nov/18/us-election-donald-trump-joe-biden-chris-krebs-coronavirus-covid-19-live-updates?page=with:block-5fb576468f081d2fbd0d93f3#block-5fb576468f081d2fbd0d93f3"">New York City public schools to close again on Thursday</a></li><li><a href=""https://www.theguardian.com/us-news/live/2020/nov/18/us-election-donald-trump-joe-biden-chris-krebs-coronavirus-covid-19-live-updates?page=with:block-5fb56a708f08161b0b9c7b37#block-5fb56a708f08161b0b9c7b37"">President-elect Biden peaks virtually with healthcare workers</a></li><li><a href=""https://www.theguardian.com/us-news/live/2020/nov/18/us-election-donald-trump-joe-biden-chris-krebs-coronavirus-covid-19-live-updates?page=with:block-5fb548058f08161b0b9c78c1#block-5fb548058f08161b0b9c78c1"">Trump campaign to request recounts in two Wisconsin counties</a><br></li><li><a href=""https://www.theguardian.com/us-news/live/2020/nov/18/us-election-donald-trump-joe-biden-chris-krebs-coronavirus-covid-19-live-updates?page=with:block-5fb538568f08161b0b9c77ac#block-5fb538568f08161b0b9c77ac"">House Democrats reelect Pelosi as nominee for speaker</a></li><li><a href=""https://www.theguardian.com/info/2018/sep/17/guardian-us-morning-briefing-sign-up-to-stay-informed"">Sign up to receive First Thing – our daily briefing by email</a><br></li></ul>",US news,News,liveblog,"Maanvi Singh (now), Joan E Greve and Martin Belam (earlier)","US news, World news, Joe Biden, Donald Trump, Coronavirus, US elections 2020, US politics, New York, Schools, Education",us-news/live/2020/nov/18/us-election-donald-trump-joe-biden-chris-krebs-coronavirus-covid-19-live-updates
"Obama’s A Promised Land sells almost 890,000 copies on first day",2020-11-19T00:42:44Z,"<p>First day sales in the US and Canada put it on track to be best selling presidential memoir, and beat sales of Michelle Obama’s Becoming</p>",https://www.theguardian.com/us-news/2020/nov/18/barack-obama-book-presidential-memoir-a-promised-land,469,"<p>First day sales in the US and Canada put it on track to be best selling presidential memoir, and beat sales of Michelle Obama’s Becoming</p>",US news,News,article,Guardian staff and agencies,"Barack Obama, Books, US politics, US news",us-news/2020/nov/18/barack-obama-book-presidential-memoir-a-promised-land
Megaprojects risk pushing forests past tipping point – report,2020-11-19T00:01:57Z,"<p>Huge road, energy and mining projects driving into heart of world’s remaining forests</p>",https://www.theguardian.com/environment/2020/nov/19/megaprojects-risk-pushing-forests-past-tipping-point-report,924,"<p>Huge road, energy and mining projects driving into heart of world’s remaining forests</p>",Environment,News,article,Damian Carrington Environment editor,"Trees and forests, Climate crisis, Mining, Deforestation, Conservation, Environment, Amazon rainforest, Business, Fossil fuels, Coal, Mining, Infrastructure, Energy",environment/2020/nov/19/megaprojects-risk-pushing-forests-past-tipping-point-report
Leaked White House report warns current Covid-19 mitigation efforts 'inadequate',2020-11-18T23:41:21Z,"<ul><li>Record high of over 76,000 people hospitalised Wednesday</li><li>Report warns of ‘further deterioration’ of situation</li></ul>",https://www.theguardian.com/us-news/2020/nov/18/us-coronavirus-deaths-latest-toll-white-house-taskforce-report,845,"<ul><li>Record high of over 76,000 people hospitalised Wednesday</li><li>Report warns of ‘further deterioration’ of situation</li></ul>",US news,News,article,Martin Pengelly in New York,"US news, Coronavirus, World news",us-news/2020/nov/18/us-coronavirus-deaths-latest-toll-white-house-taskforce-report
Italy registers 753 Covid-related deaths; Pfizer vaccine '95% efficacy' – as it happened,2020-11-18T23:38:19Z,"<p><a href=""https://www.theguardian.com/world/live/2020/nov/18/coronavirus-live-news-senator-chuck-grassley-tests-positive-airlines-offer-covid-testing?page=with:block-5fb551ae8f08161b0b9c7979#block-5fb551ae8f08161b0b9c7979"">Cases and deaths</a> surge in Italy; <a href=""https://www.theguardian.com/world/live/2020/nov/18/coronavirus-live-news-senator-chuck-grassley-tests-positive-airlines-offer-covid-testing?page=with:block-5fb50bc78f081d2fbd0d8cab#block-5fb50bc78f081d2fbd0d8cab"">new Pfizer vaccine data</a> better than first reported; Swiss <a href=""https://www.theguardian.com/world/live/2020/nov/18/coronavirus-live-news-senator-chuck-grassley-tests-positive-airlines-offer-covid-testing?page=with:block-5fb50e8e8f08b4f3c56752fe#block-5fb50e8e8f08b4f3c56752fe"">intensive care beds at full capacity</a></p><ul><li><a href=""https://www.theguardian.com/world/2020/nov/18/brutal-second-wave-of-covid-exposes-italys-healthcare-weaknesses"">Brutal second wave exposes Italy’s shortage of intensive care staff</a></li><li><a href=""https://www.theguardian.com/world/2020/nov/18/covid-19-mayo-clinic-hospital-employees-infected"">900 employees at top US hospital catch Covid-19 in two weeks</a></li><li><a href=""https://www.theguardian.com/world/2020/nov/18/pfizer-covid-19-vaccine-95-effective-and-safe-further-tests-show"">Pfizer Covid-19 vaccine 95% effective and safe, further tests show</a></li><li><a href=""https://www.theguardian.com/world/2020/nov/18/covid-19-vaccine-who-are-countries-prioritising-for-first-doses"">Covid-19 vaccine: who are countries prioritising for first doses?</a></li><li><a href=""https://www.theguardian.com/world/2020/nov/18/covid-19-antibodies-fall-faster-in-men-than-women-study-suggests"">Covid-19 antibodies reduce faster in men than women, study finds</a></li></ul>",https://www.theguardian.com/world/live/2020/nov/18/coronavirus-live-news-senator-chuck-grassley-tests-positive-airlines-offer-covid-testing,11652,"<p><a href=""https://www.theguardian.com/world/live/2020/nov/18/coronavirus-live-news-senator-chuck-grassley-tests-positive-airlines-offer-covid-testing?page=with:block-5fb551ae8f08161b0b9c7979#block-5fb551ae8f08161b0b9c7979"">Cases and deaths</a> surge in Italy; <a href=""https://www.theguardian.com/world/live/2020/nov/18/coronavirus-live-news-senator-chuck-grassley-tests-positive-airlines-offer-covid-testing?page=with:block-5fb50bc78f081d2fbd0d8cab#block-5fb50bc78f081d2fbd0d8cab"">new Pfizer vaccine data</a> better than first reported; Swiss <a href=""https://www.theguardian.com/world/live/2020/nov/18/coronavirus-live-news-senator-chuck-grassley-tests-positive-airlines-offer-covid-testing?page=with:block-5fb50e8e8f08b4f3c56752fe#block-5fb50e8e8f08b4f3c56752fe"">intensive care beds at full capacity</a></p><ul><li><a href=""https://www.theguardian.com/world/2020/nov/18/brutal-second-wave-of-covid-exposes-italys-healthcare-weaknesses"">Brutal second wave exposes Italy’s shortage of intensive care staff</a></li><li><a href=""https://www.theguardian.com/world/2020/nov/18/covid-19-mayo-clinic-hospital-employees-infected"">900 employees at top US hospital catch Covid-19 in two weeks</a></li><li><a href=""https://www.theguardian.com/world/2020/nov/18/pfizer-covid-19-vaccine-95-effective-and-safe-further-tests-show"">Pfizer Covid-19 vaccine 95% effective and safe, further tests show</a></li><li><a href=""https://www.theguardian.com/world/2020/nov/18/covid-19-vaccine-who-are-countries-prioritising-for-first-doses"">Covid-19 vaccine: who are countries prioritising for first doses?</a></li><li><a href=""https://www.theguardian.com/world/2020/nov/18/covid-19-antibodies-fall-faster-in-men-than-women-study-suggests"">Covid-19 antibodies reduce faster in men than women, study finds</a></li></ul>",World news,News,liveblog,"Nadeem Badshah (now); Aamna Mohdin, Alexandra Topping, Martin Farrer and Ben Doherty (earlier)","Coronavirus, World news, US news, Science, Infectious diseases, US politics",world/live/2020/nov/18/coronavirus-live-news-senator-chuck-grassley-tests-positive-airlines-offer-covid-testing
"US engulfed in crisis as Covid death toll hits 250,000 – but there are signs of hope",2020-11-18T22:52:59Z,<p>The terrible landmark passed earlier than projected but some Republicans are finally waking up – giving Biden bipartisan room as he prepares to take office</p>,https://www.theguardian.com/world/2020/nov/18/us-coronavirus-death-toll-250000-analysis,1209,<p>The terrible landmark passed earlier than projected but some Republicans are finally waking up – giving Biden bipartisan room as he prepares to take office</p>,World news,News,article,Ed Pilkington,"Coronavirus, US news, Donald Trump, Joe Biden, World news",world/2020/nov/18/us-coronavirus-death-toll-250000-analysis
"More than 250,000 Americans have died from Covid-19. The tragic story in numbers",2020-11-18T22:50:53Z,<p>Covid-19 has been five times as deadly as the deadliest flu season in the last 10 years. Here are key stats so far</p>,https://www.theguardian.com/world/2020/nov/18/more-than-250000-americans-have-died-from-covid-19-the-tragic-story-in-numbers,1397,<p>Covid-19 has been five times as deadly as the deadliest flu season in the last 10 years. Here are key stats so far</p>,World news,News,article,Richard Luscombe and Rashida Kamal,"Coronavirus, US news, Infectious diseases",world/2020/nov/18/more-than-250000-americans-have-died-from-covid-19-the-tragic-story-in-numbers
"US passes 250,000 deaths from coronavirus",2020-11-18T22:49:04Z,<ul><li>Bleak landmark comes as more than 11m have been infected</li><li>Biden Covid adviser warns of further hardship over winter</li></ul>,https://www.theguardian.com/world/2020/nov/18/us-passes-250000-deaths-from-coronavirus,722,<ul><li>Bleak landmark comes as more than 11m have been infected</li><li>Biden Covid adviser warns of further hardship over winter</li></ul>,World news,News,article,Guardian staff,"Coronavirus, US news, World news, US politics",world/2020/nov/18/us-passes-250000-deaths-from-coronavirus
The Guardian view on Johnson's green jobs plan: the right way to start,2020-11-18T19:16:54Z,"<p>The prime minister has correctly identified the challenge, but his record invites doubt that he can turn his rhetoric into reality</p>",https://www.theguardian.com/commentisfree/2020/nov/18/the-guardian-view-on-johnsons-green-jobs-plan-the-right-way-to-start,626,"<p>The prime minister has correctly identified the challenge, but his record invites doubt that he can turn his rhetoric into reality</p>",Opinion,Opinion,article,Editorial,"Climate crisis, Environment, Wind power, Green economy, Boris Johnson, Electric, hybrid and low-emission cars, Greenhouse gas emissions, Energy, Ethical and green living, Politics, Renewable energy, Technology, Travel and transport, UK news",commentisfree/2020/nov/18/the-guardian-view-on-johnsons-green-jobs-plan-the-right-way-to-start
'Pathetic' Trump denounced over Krebs firing as campaign presses for recounts,2020-11-18T18:36:12Z,<ul><li>Senior House Democrat says Trump ‘views truth as his enemy’</li><li>Campaign seeks recounts and investigations in key states</li></ul>,https://www.theguardian.com/us-news/2020/nov/18/trump-chris-krebs-firing-joe-biden-victory-recounts,889,<ul><li>Senior House Democrat says Trump ‘views truth as his enemy’</li><li>Campaign seeks recounts and investigations in key states</li></ul>,US news,News,article,"Maanvi Singh   in Oakland, Sam Levine and Martin Pengelly in New York and Joan E Greve in Washington","Donald Trump, US elections 2020, US politics, US news, Democrats, Republicans, Joe Biden, World news",us-news/2020/nov/18/trump-chris-krebs-firing-joe-biden-victory-recounts
"Digital currency could help with negative interest rates, says BoE's Haldane – as it happened",2020-11-18T16:51:35Z,"<p>Bank of England chief economist explains that digital currency could help central bankers cut interest rates below zero, as part of a ‘new monetary order’</p><ul><li><a href=""https://www.theguardian.com/business/live/2020/nov/18/uk-inflation-cpi-clothing-food-ftse-bitcoin-business-live?page=with:block-5fb51a3d8f08b4f3c56753be#block-5fb51a3d8f08b4f3c56753be"">Latest: Andy Haldane says digital currency could help cut zero lower bound</a></li><li><a href=""https://www.theguardian.com/business/live/2020/nov/18/uk-inflation-cpi-clothing-food-ftse-bitcoin-business-live?page=with:block-5fb4ee6c8f08b4f3c56750f4#block-5fb4ee6c8f08b4f3c56750f4"">House prices jump 4.7% to new peak</a> </li><li><a href=""https://www.theguardian.com/business/live/2020/nov/18/uk-inflation-cpi-clothing-food-ftse-bitcoin-business-live?page=with:block-5fb4c43f8f08161b0b9c718a#block-5fb4c43f8f08161b0b9c718a"">Introduction: UK inflation picked up last month</a><br></li><li><a href=""https://www.theguardian.com/business/2020/nov/18/uk-inflation-rises-on-back-of-increase-in-clothing-prices-covid?CMP=Share_iOSApp_Other"">Full story: Clothing pushes UK inflation higher</a> </li><li><a href=""https://www.theguardian.com/business/live/2020/nov/18/uk-inflation-cpi-clothing-food-ftse-bitcoin-business-live?page=with:block-5fb4d28b8f081d2fbd0d8970#block-5fb4d28b8f081d2fbd0d8970"">Scond-hand cars in demand too</a>; <a href=""https://www.theguardian.com/business/live/2020/nov/18/uk-inflation-cpi-clothing-food-ftse-bitcoin-business-live?page=with:block-5fb4d1ca8f08b4f3c5674fa3#block-5fb4d1ca8f08b4f3c5674fa3"">The key charts</a></li><li><a href=""https://www.theguardian.com/business/live/2020/nov/18/uk-inflation-cpi-clothing-food-ftse-bitcoin-business-live?page=with:block-5fb4e5118f081d2fbd0d8a47#block-5fb4e5118f081d2fbd0d8a47"">Halfords profits double amid bike boom</a></li></ul>",https://www.theguardian.com/business/live/2020/nov/18/uk-inflation-cpi-clothing-food-ftse-bitcoin-business-live,6245,"<p>Bank of England chief economist explains that digital currency could help central bankers cut interest rates below zero, as part of a ‘new monetary order’</p><ul><li><a href=""https://www.theguardian.com/business/live/2020/nov/18/uk-inflation-cpi-clothing-food-ftse-bitcoin-business-live?page=with:block-5fb51a3d8f08b4f3c56753be#block-5fb51a3d8f08b4f3c56753be"">Latest: Andy Haldane says digital currency could help cut zero lower bound</a></li><li><a href=""https://www.theguardian.com/business/live/2020/nov/18/uk-inflation-cpi-clothing-food-ftse-bitcoin-business-live?page=with:block-5fb4ee6c8f08b4f3c56750f4#block-5fb4ee6c8f08b4f3c56750f4"">House prices jump 4.7% to new peak</a> </li><li><a href=""https://www.theguardian.com/business/live/2020/nov/18/uk-inflation-cpi-clothing-food-ftse-bitcoin-business-live?page=with:block-5fb4c43f8f08161b0b9c718a#block-5fb4c43f8f08161b0b9c718a"">Introduction: UK inflation picked up last month</a><br></li><li><a href=""https://www.theguardian.com/business/2020/nov/18/uk-inflation-rises-on-back-of-increase-in-clothing-prices-covid?CMP=Share_iOSApp_Other"">Full story: Clothing pushes UK inflation higher</a> </li><li><a href=""https://www.theguardian.com/business/live/2020/nov/18/uk-inflation-cpi-clothing-food-ftse-bitcoin-business-live?page=with:block-5fb4d28b8f081d2fbd0d8970#block-5fb4d28b8f081d2fbd0d8970"">Scond-hand cars in demand too</a>; <a href=""https://www.theguardian.com/business/live/2020/nov/18/uk-inflation-cpi-clothing-food-ftse-bitcoin-business-live?page=with:block-5fb4d1ca8f08b4f3c5674fa3#block-5fb4d1ca8f08b4f3c5674fa3"">The key charts</a></li><li><a href=""https://www.theguardian.com/business/live/2020/nov/18/uk-inflation-cpi-clothing-food-ftse-bitcoin-business-live?page=with:block-5fb4e5118f081d2fbd0d8a47#block-5fb4e5118f081d2fbd0d8a47"">Halfords profits double amid bike boom</a></li></ul>",Business,News,liveblog,Graeme Wearden,"Eurozone, Business, Inflation, Economics, Stock markets",business/live/2020/nov/18/uk-inflation-cpi-clothing-food-ftse-bitcoin-business-live
Jimmy Kimmel: Trump's 'minions are working hard right now to poison the well',2020-11-18T16:43:02Z,"<p>Late-night hosts recap Lindsey Graham’s reported bid to toss legal ballots in Georgia, and the administration’s reckless Thanksgiving message</p>",https://www.theguardian.com/culture/2020/nov/18/jimmy-kimmel-trump-late-night-tv,740,"<p>Late-night hosts recap Lindsey Graham’s reported bid to toss legal ballots in Georgia, and the administration’s reckless Thanksgiving message</p>",Culture,Arts,article,Adrian Horton,"Late-night TV roundup, Stephen Colbert, Jimmy Kimmel, Trevor Noah, TV comedy, Comedy, US television, Television, Television & radio, Culture",culture/2020/nov/18/jimmy-kimmel-trump-late-night-tv
Germany's low ebb under Löw put into sharp focus by Spain's six-shooters,2020-11-18T15:46:03Z,<p>Germany’s worst result since 1931 raises more questions about the coach’s methods and the players he has frozen out </p>,https://www.theguardian.com/football/blog/2020/nov/18/germany-joachim-low-sharp-focus-spain-six-nations-league,1460,<p>Germany’s worst result since 1931 raises more questions about the coach’s methods and the players he has frozen out </p>,Football,Sport,article,Sid Lowe,"Germany, Spain, Nations League, Football, Sport",football/blog/2020/nov/18/germany-joachim-low-sharp-focus-spain-six-nations-league
Iran admits breach of nuclear deal discovered by UN inspectorate,2020-11-18T14:33:14Z,<p>Iran uses advanced uranium-enriching centrifuges in underground plant in breach of 2015 nuclear agreement</p>,https://www.theguardian.com/world/2020/nov/18/iran-admits-breach-of-nuclear-deal-discovered-by-un-inspectorate,712,<p>Iran uses advanced uranium-enriching centrifuges in underground plant in breach of 2015 nuclear agreement</p>,World news,News,article,Patrick Wintour Diplomatic Editor,"Iran, Nuclear weapons, International Atomic Energy Agency (IAEA), US news, United Nations, Middle East and north Africa, World news",world/2020/nov/18/iran-admits-breach-of-nuclear-deal-discovered-by-un-inspectorate
Biden's cabinet could do a lot – if he resists the urge to fill it with 'consensus' picks,2020-11-18T13:55:06Z,"<p>Wall Street is delighted at the prospect of a divided government, because it’s an excuse for Democrats to avoid seeking real change<br></p>",https://www.theguardian.com/commentisfree/2020/nov/18/bidens-cabinet-appointments-resist-centrists,978,"<p>Wall Street is delighted at the prospect of a divided government, because it’s an excuse for Democrats to avoid seeking real change<br></p>",Opinion,Opinion,article,Max Moran and Miranda Litwak,"Joe Biden, Democrats, US politics, US news, World news",commentisfree/2020/nov/18/bidens-cabinet-appointments-resist-centrists
Think Joe Biden's victory marks the end of rightwing populism? Think again,2020-11-18T12:00:41Z,<p>The loose coalition of disparate groups that came together to defeat Trump has served its purpose. Now the struggle begins</p>,https://www.theguardian.com/commentisfree/2020/nov/18/joe-bidens-victory-end-rightwing-populism-trump,1109,<p>The loose coalition of disparate groups that came together to defeat Trump has served its purpose. Now the struggle begins</p>,Opinion,Opinion,article,Benjamin Moffitt,"Joe Biden, US elections 2020, Donald Trump, US news, World news, US politics, Far right",commentisfree/2020/nov/18/joe-bidens-victory-end-rightwing-populism-trump
