headline,pub_date,snippet,web_url,word_count,abstract,section_name,pillar_name,type,byline,keywords,article_id
Coronavirus: 8 May at a glance,2020-05-08T23:25:29Z,"<p>A summary of the biggest developments in the global coronavirus outbreak</p><ul><li><a href=""https://www.theguardian.com/world/series/coronavirus-live/latest"">Follow our latest coronavirus blog for live news and updates</a></li></ul>",https://www.theguardian.com/world/2020/may/09/coronavirus-latest-at-a-glance-08-may-2020,446,"<p>A summary of the biggest developments in the global coronavirus outbreak</p><ul><li><a href=""https://www.theguardian.com/world/series/coronavirus-live/latest"">Follow our latest coronavirus blog for live news and updates</a></li></ul>",World news,News,article,Molly Blackall,"World news, Coronavirus",world/2020/may/09/coronavirus-latest-at-a-glance-08-may-2020
Britain was led by Churchill then – it’s led by a Churchill tribute act now,2020-05-08T23:16:51Z,"<p>With coronavirus lockdown subduing VE Day, contrasts with 75 years ago were many and varied<br></p><ul><li><a href=""https://www.theguardian.com/world/series/coronavirus-live/latest"">Coronavirus – latest updates</a></li><li><a href=""https://www.theguardian.com/world/coronavirus-outbreak"">See all our coronavirus coverage</a></li></ul>",https://www.theguardian.com/world/2020/may/08/commemorating-ve-day-during-coronavirus-lockdown-somehow-the-quiet-made-it-louder,1498,"<p>With coronavirus lockdown subduing VE Day, contrasts with 75 years ago were many and varied<br></p><ul><li><a href=""https://www.theguardian.com/world/series/coronavirus-live/latest"">Coronavirus – latest updates</a></li><li><a href=""https://www.theguardian.com/world/coronavirus-outbreak"">See all our coronavirus coverage</a></li></ul>",World news,News,article,Jonathan Freedland,"VE Day, UK news, Monarchy, Coronavirus, Second world war, Politics",world/2020/may/08/commemorating-ve-day-during-coronavirus-lockdown-somehow-the-quiet-made-it-louder
US blocks vote on UN's bid for global ceasefire over reference to WHO,2020-05-08T21:07:56Z,<p>Security council had spent weeks seeking resolution but Trump administration opposed mention of organization</p>,https://www.theguardian.com/world/2020/may/08/un-ceasefire-resolution-us-blocks-who,553,<p>Security council had spent weeks seeking resolution but Trump administration opposed mention of organization</p>,World news,News,article,Julian Borger in Washington,"United Nations, World Health Organization, US news, Health, World news, Society, Trump administration, Donald Trump",world/2020/may/08/un-ceasefire-resolution-us-blocks-who
VE Day 2020: 'Never despair' - Queen addresses nation on 75th anniversary — as it happened,2020-05-08T20:22:11Z,"<p>Latest updates as Europe marks 75 years since official surrender of Nazi Germany to Allied forces</p><ul><li><a href=""https://www.theguardian.com/world/2020/may/07/ve-day-75-timetable-prince-charles-to-lead-event-with-two-minute-silence"">VE Day 75 timetable: what’s happening today in the UK</a></li><li><a href=""https://www.theguardian.com/world/2020/may/08/solemnity-celebration-britain-tribute-war-ve-day"">Solemnity and celebration as Britain pays tribute to war generation</a></li><li><a href=""https://www.theguardian.com/world/2020/may/08/european-leaders-mark-heroics-of-war-generation-after-75-years"">European leaders mark heroics in shadow of pandemic</a></li><li><a href=""https://www.theguardian.com/politics/2020/may/08/battle-scarred-britain-find-new-role-world-ve-day-foreign-policy"">Once again a battle-scarred Britain must find a new role in the world</a><br></li><li><a href=""https://www.theguardian.com/world/2020/may/08/a-champagne-toast-and-a-ve-day-party-to-remember"">Picture essay: a VE Day party to remember</a></li></ul>",https://www.theguardian.com/world/live/2020/may/08/ve-day-2020-75th-anniversary-two-minute-silence-red-arrows-flypast-live,11616,"<p>Latest updates as Europe marks 75 years since official surrender of Nazi Germany to Allied forces</p><ul><li><a href=""https://www.theguardian.com/world/2020/may/07/ve-day-75-timetable-prince-charles-to-lead-event-with-two-minute-silence"">VE Day 75 timetable: what’s happening today in the UK</a></li><li><a href=""https://www.theguardian.com/world/2020/may/08/solemnity-celebration-britain-tribute-war-ve-day"">Solemnity and celebration as Britain pays tribute to war generation</a></li><li><a href=""https://www.theguardian.com/world/2020/may/08/european-leaders-mark-heroics-of-war-generation-after-75-years"">European leaders mark heroics in shadow of pandemic</a></li><li><a href=""https://www.theguardian.com/politics/2020/may/08/battle-scarred-britain-find-new-role-world-ve-day-foreign-policy"">Once again a battle-scarred Britain must find a new role in the world</a><br></li><li><a href=""https://www.theguardian.com/world/2020/may/08/a-champagne-toast-and-a-ve-day-party-to-remember"">Picture essay: a VE Day party to remember</a></li></ul>",World news,News,liveblog,Jessica Murray (now) and Sarah Marsh (earlier),"VE Day, UK news, Europe, Second world war, Queen Elizabeth II, King Charles III, World news",world/live/2020/may/08/ve-day-2020-75th-anniversary-two-minute-silence-red-arrows-flypast-live
Covid-19 competence has given Australian governments some political capital. But there's a flipside,2020-05-08T20:00:36Z,"<p>Politicians have set a high bar for themselves – success on coronavirus has created community expectations that will be challenging to shift</p><ul><li><a href=""https://www.theguardian.com/newsletters/2020/mar/28/sign-up-for-guardian-australias-daily-coronavirus-email?CMP=cvau_sfl"">Sign up for Guardian Australia’s daily coronavirus email</a></li><li><a href=""https://www.theguardian.com/technology/ng-interactive/2018/may/15/the-guardian-app?CMP=cvau_sfl"">Download the free Guardian app to get the most important news notifications</a></li></ul>",https://www.theguardian.com/australia-news/2020/may/09/covid-19-competence-has-given-australian-governments-some-political-capital-but-theres-a-flipside,1263,"<p>Politicians have set a high bar for themselves – success on coronavirus has created community expectations that will be challenging to shift</p><ul><li><a href=""https://www.theguardian.com/newsletters/2020/mar/28/sign-up-for-guardian-australias-daily-coronavirus-email?CMP=cvau_sfl"">Sign up for Guardian Australia’s daily coronavirus email</a></li><li><a href=""https://www.theguardian.com/technology/ng-interactive/2018/may/15/the-guardian-app?CMP=cvau_sfl"">Download the free Guardian app to get the most important news notifications</a></li></ul>",Australia news,News,article,Katharine Murphy,"Coronavirus, Australian politics, Health, Australia news, Scott Morrison, Daniel Andrews, Gladys Berejiklian, Victoria, New South Wales",australia-news/2020/may/09/covid-19-competence-has-given-australian-governments-some-political-capital-but-theres-a-flipside
Global report: Madrid told not to ease lockdown as Italy warns rule-breakers,2020-05-08T18:10:48Z,"<p>Cases around world near 3.9m; China denies Trump’s claim that virus escaped from Wuhan lab</p><ul><li><a href=""https://www.theguardian.com/world/series/coronavirus-live/latest"">Coronavirus – latest updates</a></li><li><a href=""https://www.theguardian.com/world/coronavirus-outbreak"">See all our coronavirus coverage</a></li></ul>",https://www.theguardian.com/world/2020/may/08/global-report-spain-and-italy-grapple-with-how-to-end-covid-19-lockdown,1064,"<p>Cases around world near 3.9m; China denies Trump’s claim that virus escaped from Wuhan lab</p><ul><li><a href=""https://www.theguardian.com/world/series/coronavirus-live/latest"">Coronavirus – latest updates</a></li><li><a href=""https://www.theguardian.com/world/coronavirus-outbreak"">See all our coronavirus coverage</a></li></ul>",World news,News,article,Jon Henley in Paris and Sam Jones in Madrid,"Coronavirus, Spain, Italy, Germany, Denmark, World Health Organization, World news",world/2020/may/08/global-report-spain-and-italy-grapple-with-how-to-end-covid-19-lockdown
Four causes for alarm in the US jobs figures – and one possible reason for hope,2020-05-08T18:01:46Z,"<p>More than 20m Americans lost their jobs in April – and Friday’s report suggests there might be much more trouble ahead</p><ul><li><a href=""https://www.theguardian.com/business/2020/may/08/april-jobs-report-us-unemployment-rate"">Jobs figures: April worst month since Great Depression</a></li></ul>",https://www.theguardian.com/business/2020/may/08/us-jobless-figures-unemployment-report,454,"<p>More than 20m Americans lost their jobs in April – and Friday’s report suggests there might be much more trouble ahead</p><ul><li><a href=""https://www.theguardian.com/business/2020/may/08/april-jobs-report-us-unemployment-rate"">Jobs figures: April worst month since Great Depression</a></li></ul>",Business,News,article,Dominic Rushe and Lauren Aratani,"US economy, Business, Economics, Coronavirus, US news, US politics, US unemployment and employment data",business/2020/may/08/us-jobless-figures-unemployment-report
Leaders mark heroics of war generation in shadow of pandemic,2020-05-08T16:50:27Z,"<p>Quiet commemorations held to mark 75 years since end of war on continent</p><ul><li><a href=""https://www.theguardian.com/world/live/2020/may/08/ve-day-2020-75th-anniversary-two-minute-silence-red-arrows-flypast-live"">VE Day – latest updates</a></li></ul>",https://www.theguardian.com/world/2020/may/08/european-leaders-mark-heroics-of-war-generation-after-75-years,916,"<p>Quiet commemorations held to mark 75 years since end of war on continent</p><ul><li><a href=""https://www.theguardian.com/world/live/2020/may/08/ve-day-2020-75th-anniversary-two-minute-silence-red-arrows-flypast-live"">VE Day – latest updates</a></li></ul>",World news,News,article,Daniel Boffey,"VE Day, Europe, Coronavirus, Germany, France, Poland, Czech Republic, Russia, Second world war, World news, Angela Merkel, Emmanuel Macron",world/2020/may/08/european-leaders-mark-heroics-of-war-generation-after-75-years
Lisa Nandy: UK faces 'serious reckoning' about global role,2020-05-08T16:49:02Z,"<p>Labour’s shadow foreign secretary says coronavirus crisis exposes ‘myth of exceptionalism’ </p><ul><li><a href=""https://www.theguardian.com/world/series/coronavirus-live/latest"">Coronavirus – latest updates</a></li><li><a href=""https://www.theguardian.com/world/coronavirus-outbreak"">See all our coronavirus coverage</a></li></ul>",https://www.theguardian.com/politics/2020/may/08/lisa-nandy-uk-faces-serious-reckoning-about-global-role,1146,"<p>Labour’s shadow foreign secretary says coronavirus crisis exposes ‘myth of exceptionalism’ </p><ul><li><a href=""https://www.theguardian.com/world/series/coronavirus-live/latest"">Coronavirus – latest updates</a></li><li><a href=""https://www.theguardian.com/world/coronavirus-outbreak"">See all our coronavirus coverage</a></li></ul>",Politics,News,article,Heather Stewart Political editor,"Labour, Coronavirus, Foreign policy, Politics, UK news",politics/2020/may/08/lisa-nandy-uk-faces-serious-reckoning-about-global-role
Global stock markets rise as China-US trade tensions ease,2020-05-08T16:42:04Z,<p>Oil price rises and shares end week on a high despite growing economic damage from coronavirus pandemic</p>,https://www.theguardian.com/business/2020/may/08/global-stock-markets-rise-as-china-us-trade-tensions-ease,389,<p>Oil price rises and shares end week on a high despite growing economic damage from coronavirus pandemic</p>,Business,News,article,Richard Partington,"Stock markets, US economy, Business, Economics, International trade, Global economy, Global recession, Emerging markets",business/2020/may/08/global-stock-markets-rise-as-china-us-trade-tensions-ease
"Welcome to William Barr's America, where the truth makes way for the president",2020-05-08T13:38:43Z,"<p>The justice department has announced it will drop its case against Michael Flynn, who pleaded guilty to lying to the FBI – we know why</p>",https://www.theguardian.com/commentisfree/2020/may/08/trump-attorney-general-william-barr-flynn-case,812,"<p>The justice department has announced it will drop its case against Michael Flynn, who pleaded guilty to lying to the FBI – we know why</p>",Opinion,Opinion,article,Lloyd Green,"Trump administration, William Barr, Michael Flynn, US politics, US news",commentisfree/2020/may/08/trump-attorney-general-william-barr-flynn-case
Mothers will be hardest hit if the economy reopens too fast,2020-05-08T13:33:35Z,"<p>With nine in 10 children out of school, it is moms who will likely be forced to stay home even if, and when, their jobs resume</p><ul><li><a href=""https://viewer.gutools.co.uk/world/series/coronavirus-live/latest"">Coronavirus – latest updates</a></li><li><a href=""https://viewer.gutools.co.uk/world/coronavirus-outbreak"">See all our coronavirus coverage</a></li></ul>",https://www.theguardian.com/commentisfree/2020/may/08/coronavirus-mothers-economy-schools-shut,840,"<p>With nine in 10 children out of school, it is moms who will likely be forced to stay home even if, and when, their jobs resume</p><ul><li><a href=""https://viewer.gutools.co.uk/world/series/coronavirus-live/latest"">Coronavirus – latest updates</a></li><li><a href=""https://viewer.gutools.co.uk/world/coronavirus-outbreak"">See all our coronavirus coverage</a></li></ul>",Opinion,Opinion,article,Jessica Zucker,"Coronavirus, Gender, US politics, Donald Trump, World news, US news",commentisfree/2020/may/08/coronavirus-mothers-economy-schools-shut
Coronavirus 8 May: at a glance,2020-05-08T11:26:51Z,"<p>A summary of the biggest developments in the global coronavirus outbreak</p><ul><li><a href=""https://www.theguardian.com/world/series/coronavirus-live/latest"">Follow our latest coronavirus blog for live news and updates</a></li></ul>",https://www.theguardian.com/world/2020/may/08/coronavirus-latest-at-a-glance-8-may,410,"<p>A summary of the biggest developments in the global coronavirus outbreak</p><ul><li><a href=""https://www.theguardian.com/world/series/coronavirus-live/latest"">Follow our latest coronavirus blog for live news and updates</a></li></ul>",World news,News,article,Alexandra Topping,"Coronavirus, World news, Infectious diseases, Science",world/2020/may/08/coronavirus-latest-at-a-glance-8-may
The US recovery from the pandemic lags way behind Europe – even as states reopen,2020-05-08T11:19:56Z,"<p>While countries such as Spain and Italy that are lifting restrictions have forced the trend of infections down, in the US cases are rising</p><ul><li><a href=""https://www.theguardian.com/us-news/series/us-politics-live/latest"">Coronavirus – latest US updates</a></li><li><a href=""https://www.theguardian.com/world/series/coronavirus-live/latest"">C</a><a href=""https://www.theguardian.com/world/series/coronavirus-live/latest"">oronavirus – latest global updates</a></li></ul>",https://www.theguardian.com/world/2020/may/08/us-reopening-coronavirus-trends,378,"<p>While countries such as Spain and Italy that are lifting restrictions have forced the trend of infections down, in the US cases are rising</p><ul><li><a href=""https://www.theguardian.com/us-news/series/us-politics-live/latest"">Coronavirus – latest US updates</a></li><li><a href=""https://www.theguardian.com/world/series/coronavirus-live/latest"">C</a><a href=""https://www.theguardian.com/world/series/coronavirus-live/latest"">oronavirus – latest global updates</a></li></ul>",World news,News,article,Oliver Milman and Juweek Adolphe in New York,"Coronavirus, US news",world/2020/may/08/us-reopening-coronavirus-trends
Being Asian-American in the time of Covid-19,2020-05-08T10:36:25Z,<p>Anti-Asian hate crimes are on the rise. It’s a scary time – but we must fight for diversity</p>,https://www.theguardian.com/commentisfree/2020/may/08/asian-american-coronavirus-geoffrey-mak,806,<p>Anti-Asian hate crimes are on the rise. It’s a scary time – but we must fight for diversity</p>,Opinion,Opinion,article,Geoffrey Mak,"Coronavirus, Race, World news, US news",commentisfree/2020/may/08/asian-american-coronavirus-geoffrey-mak
First thing: states are reopening without CDC's step-by-step roadmap,2020-05-08T10:20:16Z,"<p>Trump administration shelved advice from nation’s top disease specialists. Plus, why it’s a golden era for women in rap</p>",https://www.theguardian.com/us-news/2020/may/08/first-thing-states-are-reopening-without-the-cdcs-step-by-step-roadmap,1019,"<p>Trump administration shelved advice from nation’s top disease specialists. Plus, why it’s a golden era for women in rap</p>",US news,News,article,Tim Walker,US news,us-news/2020/may/08/first-thing-states-are-reopening-without-the-cdcs-step-by-step-roadmap
'No one should feel completely safe': what experts think of California's reopening plan,2020-05-08T10:00:24Z,"<p>As businesses slowly reopen, experts warn that social distancing may need to be dialed back up: ‘It’s not an on-off switch’</p><ul><li><a href=""https://www.theguardian.com/us-news/series/us-politics-live/latest"">Coronavirus – latest US updates</a></li><li><a href=""https://www.theguardian.com/world/series/coronavirus-live/latest"">C</a><a href=""https://www.theguardian.com/world/series/coronavirus-live/latest"">oronavirus – latest global updates</a></li></ul>",https://www.theguardian.com/us-news/2020/may/08/california-reopening-businesses-coronavirus-phase-two,1009,"<p>As businesses slowly reopen, experts warn that social distancing may need to be dialed back up: ‘It’s not an on-off switch’</p><ul><li><a href=""https://www.theguardian.com/us-news/series/us-politics-live/latest"">Coronavirus – latest US updates</a></li><li><a href=""https://www.theguardian.com/world/series/coronavirus-live/latest"">C</a><a href=""https://www.theguardian.com/world/series/coronavirus-live/latest"">oronavirus – latest global updates</a></li></ul>",US news,News,article,Maanvi Singh in Oakland,"California, Coronavirus, US news",us-news/2020/may/08/california-reopening-businesses-coronavirus-phase-two
"Global report: virus has unleashed a 'tsunami of hate' across world, says UN chief",2020-05-08T05:54:01Z,"<p>António Guterres pleads for an end to ‘hate speech’; Beijing says it will cooperate with WHO on Covid-19 origin; global deaths near 270,000</p><ul><li><a href=""https://www.theguardian.com/world/series/coronavirus-live/latest"">Coronavirus – latest updates</a></li><li><a href=""https://www.theguardian.com/world/coronavirus-outbreak"">See all our coronavirus coverage</a></li></ul>",https://www.theguardian.com/world/2020/may/08/global-report-china-open-to-cooperate-with-who-on-virus-origin-as-trump-repeats-lab-claim,879,"<p>António Guterres pleads for an end to ‘hate speech’; Beijing says it will cooperate with WHO on Covid-19 origin; global deaths near 270,000</p><ul><li><a href=""https://www.theguardian.com/world/series/coronavirus-live/latest"">Coronavirus – latest updates</a></li><li><a href=""https://www.theguardian.com/world/coronavirus-outbreak"">See all our coronavirus coverage</a></li></ul>",World news,News,article,Helen Davidson and agencies,"China, World Health Organization, Coronavirus, Asia Pacific, Health, Society, Infectious diseases",world/2020/may/08/global-report-china-open-to-cooperate-with-who-on-virus-origin-as-trump-repeats-lab-claim
Friday briefing: Lockdown leaks 'risk free-for-all over weekend',2020-05-08T05:28:38Z,<p>‘Mixed messages’ from No 10 give impression of widespread easing … more evacuations after India gas leak … VE Day 75 commemorations begin</p>,https://www.theguardian.com/world/2020/may/08/friday-briefing-lockdown-leaks-risk-free-for-all-over-weekend,1481,<p>‘Mixed messages’ from No 10 give impression of widespread easing … more evacuations after India gas leak … VE Day 75 commemorations begin</p>,World news,News,article,Warren Murray,,world/2020/may/08/friday-briefing-lockdown-leaks-risk-free-for-all-over-weekend
Coronavirus latest 8 May: at a glance,2020-05-08T05:10:14Z,"<p>A summary of the biggest developments in the global coronavirus outbreak</p><ul><li><a href=""https://www.theguardian.com/world/series/coronavirus-live/latest"">Follow our latest coronavirus blog for live news and updates</a></li></ul>",https://www.theguardian.com/world/2020/may/08/coronavirus-latest-at-a-glance,419,"<p>A summary of the biggest developments in the global coronavirus outbreak</p><ul><li><a href=""https://www.theguardian.com/world/series/coronavirus-live/latest"">Follow our latest coronavirus blog for live news and updates</a></li></ul>",World news,News,article,Helen Sullivan,"World news, Coronavirus",world/2020/may/08/coronavirus-latest-at-a-glance
Democrats demand details of Trump Organization requests for UK coronavirus aid,2020-05-08T04:07:39Z,"<p>Head of oversight and reform committee suggests move to seek overseas funding was potentially a violation of the US constitution</p><ul><li><a href=""https://www.theguardian.com/world/series/coronavirus-live/latest"">Coronavirus – latest updates</a></li><li><a href=""https://www.theguardian.com/world/coronavirus-outbreak"">See all our coronavirus coverage</a></li></ul>",https://www.theguardian.com/us-news/2020/may/08/democrats-demand-details-of-trump-organization-requests-for-uk-coronavirus-aid,497,"<p>Head of oversight and reform committee suggests move to seek overseas funding was potentially a violation of the US constitution</p><ul><li><a href=""https://www.theguardian.com/world/series/coronavirus-live/latest"">Coronavirus – latest updates</a></li><li><a href=""https://www.theguardian.com/world/coronavirus-outbreak"">See all our coronavirus coverage</a></li></ul>",US news,News,article,Stephanie Kirchgaessner in Washington,"Donald Trump, US news, Coronavirus, World news, Infectious diseases, Science",us-news/2020/may/08/democrats-demand-details-of-trump-organization-requests-for-uk-coronavirus-aid
The Murdoch media’s China coronavirus conspiracy has one aim: get Trump re-elected,2020-05-08T03:41:08Z,"<p>News Corp is campaigning full-bore for the US president, with reports of a Wuhan lab ‘intelligence’ dossier being seeded across its empire</p>",https://www.theguardian.com/media/2020/may/08/murdoch-media-china-coronavirus-conspiracy-trump-kevin-rudd,1600,"<p>News Corp is campaigning full-bore for the US president, with reports of a Wuhan lab ‘intelligence’ dossier being seeded across its empire</p>",Media,News,article,Kevin Rudd,"News Corporation, Rupert Murdoch, Fox News, Australian media, Australian politics, Espionage, US elections 2020, Donald Trump, Iraq, Middle East and north Africa, Media, US news, Coronavirus, China, Saddam Hussein, World Health Organization, Australia news, Infectious diseases, Mike Pompeo, Australian security and counter-terrorism",media/2020/may/08/murdoch-media-china-coronavirus-conspiracy-trump-kevin-rudd
Sharri Markson's coronavirus 'bombshell' impresses Fox's Tucker Carlson,2020-05-08T03:12:18Z,<p>Those less convinced in Australia cast doubt on source of Wuhan lab ‘intelligence’. Plus: Trump and Jennifer Hawkins</p>,https://www.theguardian.com/media/2020/may/08/sharri-marksons-coronavirus-bombshell-impresses-foxs-tucker-carlson,1555,<p>Those less convinced in Australia cast doubt on source of Wuhan lab ‘intelligence’. Plus: Trump and Jennifer Hawkins</p>,Media,News,article,Amanda Meade,"News Corporation, Australian media, Australian Broadcasting Corporation, Coronavirus, Fox News",media/2020/may/08/sharri-marksons-coronavirus-bombshell-impresses-foxs-tucker-carlson
Ahmaud Arbery killing: man called 911 to report 'black male running' prior to shooting,2020-05-08T00:17:17Z,<p>Recordings of 911 calls obtained by the Guardian provide details on the moments before a man was shot while jogging in Georgia</p>,https://www.theguardian.com/us-news/2020/may/07/ahmaud-arbery-killing-man-called-911-report-black-male-running-shooting,992,<p>Recordings of 911 calls obtained by the Guardian provide details on the moments before a man was shot while jogging in Georgia</p>,US news,News,article,Khushbu Shah in Atlanta,"Ahmaud Arbery, Georgia, US crime, US news, Gun crime",us-news/2020/may/07/ahmaud-arbery-killing-man-called-911-report-black-male-running-shooting
