headline,pub_date,snippet,web_url,word_count,abstract,section_name,pillar_name,type,byline,keywords,article_id
US security officials 'considered return to nuclear testing' after 28-year hiatus,2020-05-23T06:35:25Z,"<p>Discussion held this month as way to press Russia and China into agreeing arms control deal, officials say</p>",https://www.theguardian.com/world/2020/may/23/us-security-officials-considered-return-to-nuclear-testing-after-28-year-hiatus,799,"<p>Discussion held this month as way to press Russia and China into agreeing arms control deal, officials say</p>",World news,News,article,Julian Borger in Washington,"Nuclear weapons, US news, Russia, China, Asia Pacific, Europe",world/2020/may/23/us-security-officials-considered-return-to-nuclear-testing-after-28-year-hiatus
Coronavirus latest: 23 May at a glance,2020-05-23T05:26:31Z,"<p>A summary of the biggest developments in the global coronavirus outbreak</p><ul><li><a href=""https://www.theguardian.com/world/series/coronavirus-live/latest"">Follow our latest coronavirus blog for live news and updates</a></li></ul>",https://www.theguardian.com/world/2020/may/23/coronavirus-latest-23-may-at-a-glance,525,"<p>A summary of the biggest developments in the global coronavirus outbreak</p><ul><li><a href=""https://www.theguardian.com/world/series/coronavirus-live/latest"">Follow our latest coronavirus blog for live news and updates</a></li></ul>",World news,News,article,Christine Kearney,"Coronavirus, World news, Infectious diseases, Science",world/2020/may/23/coronavirus-latest-23-may-at-a-glance
Global report: China records no new Covid-19 cases for first time as Hertz files for bankruptcy,2020-05-23T05:11:24Z,"<p>No confirmed new cases for China; major car rental firm files for US bankruptcy; fears thousands will breach Eid travel ban in Indonesia </p><ul><li><a href=""https://www.theguardian.com/world/series/coronavirus-live/latest"">Coronavirus – latest updates</a></li><li><a href=""https://www.theguardian.com/world/coronavirus-outbreak"">See all our coronavirus coverage</a></li></ul>",https://www.theguardian.com/world/2020/may/23/global-report-china-no-new-covid-19-cases-hertz-bankruptcy,788,"<p>No confirmed new cases for China; major car rental firm files for US bankruptcy; fears thousands will breach Eid travel ban in Indonesia </p><ul><li><a href=""https://www.theguardian.com/world/series/coronavirus-live/latest"">Coronavirus – latest updates</a></li><li><a href=""https://www.theguardian.com/world/coronavirus-outbreak"">See all our coronavirus coverage</a></li></ul>",World news,News,article,Guardian staff,"Coronavirus, World news, Infectious diseases, Ramadan, Islam, China, Donald Trump, US news, Asia Pacific, Religion",world/2020/may/23/global-report-china-no-new-covid-19-cases-hertz-bankruptcy
Donald Trump press secretary inadvertently reveals president's bank details,2020-05-23T02:45:04Z,"<p>Kayleigh McEnany appears to accidentally show private details while displaying Trump donation to fight coronavirus pandemic</p><ul><li><a href=""https://www.theguardian.com/world/series/coronavirus-live/latest"">Coronavirus – latest updates</a></li><li><a href=""https://www.theguardian.com/world/coronavirus-outbreak"">See all our coronavirus coverage</a></li></ul>",https://www.theguardian.com/us-news/2020/may/23/donald-trump-press-secretary-inadvertently-reveals-presidents-bank-details,268,"<p>Kayleigh McEnany appears to accidentally show private details while displaying Trump donation to fight coronavirus pandemic</p><ul><li><a href=""https://www.theguardian.com/world/series/coronavirus-live/latest"">Coronavirus – latest updates</a></li><li><a href=""https://www.theguardian.com/world/coronavirus-outbreak"">See all our coronavirus coverage</a></li></ul>",US news,News,article,Melissa Davey,"Donald Trump, US news, Coronavirus",us-news/2020/may/23/donald-trump-press-secretary-inadvertently-reveals-presidents-bank-details
"South America at centre of pandemic, says WHO – as it happened",2020-05-23T00:18:40Z,"<p>Madrid and Barcelona to ease lockdown as Spain’s death toll stays under 100 again; 660,000 people forced to flee homes during crisis despite UN global ceasefire call</p>",https://www.theguardian.com/world/live/2020/may/22/coronavirus-live-news-trump-pushes-to-open-churches-as-brazil-death-toll-passes-20000-covid-19-latest-updates,17525,"<p>Madrid and Barcelona to ease lockdown as Spain’s death toll stays under 100 again; 660,000 people forced to flee homes during crisis despite UN global ceasefire call</p>",World news,News,liveblog,"Melissa Davey (now); Kevin Rawlinson, Damien Gayle, Amy Walker and Alison Rourke (earlier)","Coronavirus, World news, Trump administration, Donald Trump, Brazil, Indonesia, Italy, Russia, China, Asia Pacific, Infectious diseases",world/live/2020/may/22/coronavirus-live-news-trump-pushes-to-open-churches-as-brazil-death-toll-passes-20000-covid-19-latest-updates
"Trump demands churches, synagogues and mosques reopen 'right now' – as it happened",2020-05-23T00:17:57Z,"<ul><li><a href=""https://www.theguardian.com/world/live/2020/may/22/coronavirus-us-live-trump-holiday-weekend-latest-news-updates?page=with:block-5ec811498f0864e579f161be#block-5ec811498f0864e579f161be"">President threatens to override governors if they don’t comply</a></li><li><a href=""https://www.theguardian.com/world/live/2020/may/22/coronavirus-us-live-trump-holiday-weekend-latest-news-updates?page=with:block-5ec80deb8f08a1782fa7fea1#block-5ec80deb8f08a1782fa7fea1"">Man seen jumping the fence at the White House</a></li><li><a href=""https://www.theguardian.com/us-news/2020/may/22/joe-biden-draws-criticism-americans-who-back-trump-aint-black"">Biden draws criticism for saying voters who back Trump ‘ain’t black’</a></li><li><a href=""https://www.theguardian.com/us-news/2020/may/22/pictures-show-donald-trump-wearing-mask-after-ford-factory-row"">Pictures show Trump wearing mask after Ford factory row</a></li><li><a href=""https://www.theguardian.com/world/series/coronavirus-live/latest"">Coronavirus – latest global updates</a><br></li><li>Get a fresh perspective on America – sign up to our <a href=""https://www.theguardian.com/info/2018/sep/17/guardian-us-morning-briefing-sign-up-to-stay-informed"">First Thing newsletter</a></li></ul>",https://www.theguardian.com/world/live/2020/may/22/coronavirus-us-live-trump-holiday-weekend-latest-news-updates,6506,"<ul><li><a href=""https://www.theguardian.com/world/live/2020/may/22/coronavirus-us-live-trump-holiday-weekend-latest-news-updates?page=with:block-5ec811498f0864e579f161be#block-5ec811498f0864e579f161be"">President threatens to override governors if they don’t comply</a></li><li><a href=""https://www.theguardian.com/world/live/2020/may/22/coronavirus-us-live-trump-holiday-weekend-latest-news-updates?page=with:block-5ec80deb8f08a1782fa7fea1#block-5ec80deb8f08a1782fa7fea1"">Man seen jumping the fence at the White House</a></li><li><a href=""https://www.theguardian.com/us-news/2020/may/22/joe-biden-draws-criticism-americans-who-back-trump-aint-black"">Biden draws criticism for saying voters who back Trump ‘ain’t black’</a></li><li><a href=""https://www.theguardian.com/us-news/2020/may/22/pictures-show-donald-trump-wearing-mask-after-ford-factory-row"">Pictures show Trump wearing mask after Ford factory row</a></li><li><a href=""https://www.theguardian.com/world/series/coronavirus-live/latest"">Coronavirus – latest global updates</a><br></li><li>Get a fresh perspective on America – sign up to our <a href=""https://www.theguardian.com/info/2018/sep/17/guardian-us-morning-briefing-sign-up-to-stay-informed"">First Thing newsletter</a></li></ul>",World news,News,liveblog,"Sam Levin, and Martin Pengelly, Mark Oliver, Joanna Walters and Joan E Greve","Coronavirus, US politics, Donald Trump, Nancy Pelosi, Chuck Schumer, New York, California, Michigan, US news",world/live/2020/may/22/coronavirus-us-live-trump-holiday-weekend-latest-news-updates
Boris Johnson forced to reduce Huawei’s role in UK’s 5G networks,2020-05-22T22:36:32Z,<p>PM set to shrink Chinese firm’s involvement to zero by 2023 after caving to backbench pressure</p>,https://www.theguardian.com/technology/2020/may/22/boris-johnson-forced-to-reduce-huaweis-role-in-uks-5g-networks,424,<p>PM set to shrink Chinese firm’s involvement to zero by 2023 after caving to backbench pressure</p>,Technology,News,article,Dan Sabbagh,"Huawei, UK news, Boris Johnson, Coronavirus, Politics, China",technology/2020/may/22/boris-johnson-forced-to-reduce-huaweis-role-in-uks-5g-networks
Black Americans are in an abusive relationship with the Democratic party,2020-05-22T20:02:50Z,<p>An offensive comment by the Democratic presidential candidate is a reminder that black people – all people – deserve better than Joe Biden</p>,https://www.theguardian.com/commentisfree/2020/may/22/black-americans-joe-biden-democratic-party-relationship,1385,<p>An offensive comment by the Democratic presidential candidate is a reminder that black people – all people – deserve better than Joe Biden</p>,Opinion,Opinion,article,Derecka Purnell,"Joe Biden, US politics, Race, US news",commentisfree/2020/may/22/black-americans-joe-biden-democratic-party-relationship
Donald Trump orders governors to allow places of worship to reopen,2020-05-22T20:01:34Z,"<p>President declares churches, mosques and synagogues ‘essential services’ but has no authority to order a reopening</p><ul><li><a href=""https://www.theguardian.com/us-news/series/us-politics-live/latest"">Coronavirus – latest US updates</a></li><li><a href=""https://www.theguardian.com/world/series/coronavirus-live/latest"">C</a><a href=""https://www.theguardian.com/world/series/coronavirus-live/latest"">oronavirus – latest global updates</a></li></ul>",https://www.theguardian.com/us-news/2020/may/22/donald-trump-churches-mosques-synagogues-reopen,337,"<p>President declares churches, mosques and synagogues ‘essential services’ but has no authority to order a reopening</p><ul><li><a href=""https://www.theguardian.com/us-news/series/us-politics-live/latest"">Coronavirus – latest US updates</a></li><li><a href=""https://www.theguardian.com/world/series/coronavirus-live/latest"">C</a><a href=""https://www.theguardian.com/world/series/coronavirus-live/latest"">oronavirus – latest global updates</a></li></ul>",US news,News,article,David Smith in Washington,"Donald Trump, US news, Religion, Coronavirus",us-news/2020/may/22/donald-trump-churches-mosques-synagogues-reopen
Morrison could muzzle his China hawks – but he wants to be all things to all people,2020-05-22T20:00:34Z,"<p>Bubbling grievances are validated by the George Christensens of the Coalition, while the grown-ups keep the relationship on the rails<br></p>",https://www.theguardian.com/australia-news/2020/may/23/morrison-could-muzzle-his-china-hawks-but-he-wants-to-be-all-things-to-all-people,1659,"<p>Bubbling grievances are validated by the George Christensens of the Coalition, while the grown-ups keep the relationship on the rails<br></p>",Australia news,News,article,Katharine Murphy,"Australian politics, Coronavirus, Scott Morrison, Australia news, China, George Christensen, Asia Pacific, Malcolm Turnbull, Julie Bishop, Liberal party, Labor party, Australian Greens, Cory Bernardi, Coalition",australia-news/2020/may/23/morrison-could-muzzle-his-china-hawks-but-he-wants-to-be-all-things-to-all-people
No masks allowed: stores turn customers away in US culture war,2020-05-22T18:35:53Z,"<p>Shops around the US make headlines for denying entry to those wearing masks as protesters argue against preventative measures in the name of freedom</p><ul><li><a href=""https://www.theguardian.com/us-news/series/us-politics-live/latest"">Coronavirus – live US updates</a></li><li><a href=""https://www.theguardian.com/world/series/coronavirus-live/latest"">Live global updates</a></li></ul>",https://www.theguardian.com/us-news/2020/may/22/us-stores-against-face-masks,427,"<p>Shops around the US make headlines for denying entry to those wearing masks as protesters argue against preventative measures in the name of freedom</p><ul><li><a href=""https://www.theguardian.com/us-news/series/us-politics-live/latest"">Coronavirus – live US updates</a></li><li><a href=""https://www.theguardian.com/world/series/coronavirus-live/latest"">Live global updates</a></li></ul>",US news,News,article,Poppy Noor,"US news, Coronavirus, Protest",us-news/2020/may/22/us-stores-against-face-masks
Global report: India and Indonesia announce record daily infection figures,2020-05-22T18:10:30Z,"<p>China sets no growth target for first time in decades; Madrid and Barcelona lockdowns to ease</p><ul><li><a href=""https://www.theguardian.com/world/series/coronavirus-live/latest"">Coronavirus – latest updates</a></li><li><a href=""https://www.theguardian.com/world/coronavirus-outbreak"">See all our coronavirus coverage</a></li></ul>",https://www.theguardian.com/world/2020/may/22/global-report-india-and-indonesia-announce-record-daily-infection-figures,847,"<p>China sets no growth target for first time in decades; Madrid and Barcelona lockdowns to ease</p><ul><li><a href=""https://www.theguardian.com/world/series/coronavirus-live/latest"">Coronavirus – latest updates</a></li><li><a href=""https://www.theguardian.com/world/coronavirus-outbreak"">See all our coronavirus coverage</a></li></ul>",World news,News,article,Jon Henley,"Coronavirus, India, China, Indonesia, Spain, Asia Pacific, Europe, South and central Asia, World news",world/2020/may/22/global-report-india-and-indonesia-announce-record-daily-infection-figures
UK coronavirus: travellers arriving from 8 June must self-isolate for 14 days – as it happened,2020-05-22T18:03:33Z,"<p>Epidemic is now flat or declining, says Patrick Vallance; UK death toll rises by 351 to 36,393; low-risk options for reopening schools revealed in Sage advice to government</p><ul><li><a href=""https://www.theguardian.com/world/2020/may/22/uk-quarantine-plan-what-will-it-mean-for-travellers"">What will quarantine plan mean for travellers?</a></li><li><a href=""https://www.theguardian.com/education/2020/may/22/ministers-rejected-school-reopening-plan-recommended-by-sage-experts"">Ministers rejected Sage’s school reopening plan</a></li><li><a href=""https://www.theguardian.com/world/2020/may/22/distancing-advice-in-england-could-change-to-allow-closer-contact-2-metre"">England may allow closer contact</a><br></li><li><a href=""https://www.theguardian.com/world/2020/may/22/uk-coronavirus-r-number-stays-the-same-for-two-weeks-in-a-row"">R number stays same for two weeks</a></li><li><a href=""https://www.theguardian.com/world/live/2020/may/22/coronavirus-live-news-trump-pushes-to-open-churches-as-brazil-death-toll-passes-20000-covid-19-latest-updates"">Global coronavirus updates – live</a></li></ul>",https://www.theguardian.com/world/live/2020/may/22/uk-coronavirus-live-news-update-covid-19-travel-quarantine-plan,13707,"<p>Epidemic is now flat or declining, says Patrick Vallance; UK death toll rises by 351 to 36,393; low-risk options for reopening schools revealed in Sage advice to government</p><ul><li><a href=""https://www.theguardian.com/world/2020/may/22/uk-quarantine-plan-what-will-it-mean-for-travellers"">What will quarantine plan mean for travellers?</a></li><li><a href=""https://www.theguardian.com/education/2020/may/22/ministers-rejected-school-reopening-plan-recommended-by-sage-experts"">Ministers rejected Sage’s school reopening plan</a></li><li><a href=""https://www.theguardian.com/world/2020/may/22/distancing-advice-in-england-could-change-to-allow-closer-contact-2-metre"">England may allow closer contact</a><br></li><li><a href=""https://www.theguardian.com/world/2020/may/22/uk-coronavirus-r-number-stays-the-same-for-two-weeks-in-a-row"">R number stays same for two weeks</a></li><li><a href=""https://www.theguardian.com/world/live/2020/may/22/coronavirus-live-news-trump-pushes-to-open-churches-as-brazil-death-toll-passes-20000-covid-19-latest-updates"">Global coronavirus updates – live</a></li></ul>",Politics,News,liveblog,Sarah Marsh (now); Alexandra Topping and Matthew Weaver(earlier),"Coronavirus, Infectious diseases, Politics, UK news, Health, Priti Patel, Boris Johnson, NHS, Social care, Scotland, Patrick Vallance",world/live/2020/may/22/uk-coronavirus-live-news-update-covid-19-travel-quarantine-plan
The Guardian view on climate and Covid: time to make different choices,2020-05-22T17:07:11Z,"<p>Despite some fine words about the environmental crisis, ministers are pushing ahead with a trade bill that threatens to damage the planet </p>",https://www.theguardian.com/commentisfree/2020/may/22/the-guardian-view-on-climate-and-covid-time-to-make-different-choices,693,"<p>Despite some fine words about the environmental crisis, ministers are pushing ahead with a trade bill that threatens to damage the planet </p>",Opinion,Opinion,article,Editorial,"Environment, Coronavirus, Infectious diseases, Medical research, Microbiology, Science, World news, Biology, Climate science, Climate crisis, US news, Economics, Politics, Trade policy, Brexit, UK news, Foreign policy, Food safety",commentisfree/2020/may/22/the-guardian-view-on-climate-and-covid-time-to-make-different-choices
The Guardian view on Hong Kong: a broken promise,2020-05-22T17:06:46Z,<p>The city is not the only place that should take heed of China reneging on its agreement</p>,https://www.theguardian.com/commentisfree/2020/may/22/the-guardian-view-on-hong-kong-a-broken-promise,511,<p>The city is not the only place that should take heed of China reneging on its agreement</p>,Opinion,Opinion,article,Editorial,"Hong Kong, China, Foreign policy, Human rights, Politics, US politics, Donald Trump, Mike Pompeo, Coronavirus, Asia Pacific, UK news, US news, World news",commentisfree/2020/may/22/the-guardian-view-on-hong-kong-a-broken-promise
"Hydroxychloroquine: Trump's Covid-19 'cure' increases deaths, global study finds",2020-05-22T16:32:35Z,"<p>Malaria drug should not be used to treat coronavirus, scientists say, after study shows high death rate</p><ul><li><a href=""https://www.theguardian.com/world/series/coronavirus-live/latest"">Coronavirus – latest updates</a></li><li><a href=""https://www.theguardian.com/world/coronavirus-outbreak"">See all our coronavirus coverage</a></li></ul>",https://www.theguardian.com/science/2020/may/22/hydroxychloroquine-trumps-covid-19-cure-increases-deaths-global-study-finds,806,"<p>Malaria drug should not be used to treat coronavirus, scientists say, after study shows high death rate</p><ul><li><a href=""https://www.theguardian.com/world/series/coronavirus-live/latest"">Coronavirus – latest updates</a></li><li><a href=""https://www.theguardian.com/world/coronavirus-outbreak"">See all our coronavirus coverage</a></li></ul>",Science,News,article,Sarah Boseley Health editor,"Medical research, Drugs, Health, Coronavirus, Science, Society, World news, Donald Trump, Infectious diseases",science/2020/may/22/hydroxychloroquine-trumps-covid-19-cure-increases-deaths-global-study-finds
Global markets fall as China moves to tighten control over Hong Kong,2020-05-22T16:28:54Z,<p>Investors fear move will further heighten tensions between Beijing and Washington</p>,https://www.theguardian.com/business/2020/may/22/global-markets-fall-as-china-moves-to-tighten-control-over-hong-kong,403,<p>Investors fear move will further heighten tensions between Beijing and Washington</p>,Business,News,article,Larry Elliott Economics editor,"Chinese economy, Stock markets, Business, China, Hong Kong, Asia Pacific, World news, US foreign policy, US news, Economics",business/2020/may/22/global-markets-fall-as-china-moves-to-tighten-control-over-hong-kong
Ramzan Kadyrov not seen publicly since reports he has coronavirus,2020-05-22T16:11:15Z,"<p>‘Irreplaceable’ Chechen leader not seen in public for 24 hours but Russian media says he is in Moscow hospital</p><ul><li><a href=""https://www.theguardian.com/world/live/2020/may/22/coronavirus-live-news-trump-pushes-to-open-churches-as-brazil-death-toll-passes-20000-covid-19-latest-updates"">Coronavirus – latest updates</a></li><li><a href=""https://www.theguardian.com/world/coronavirus-outbreak"">See all our coronavirus coverage</a></li></ul>",https://www.theguardian.com/world/2020/may/22/ramzan-kadyrov-vanishes-amid-reports-he-has-coronavirus,698,"<p>‘Irreplaceable’ Chechen leader not seen in public for 24 hours but Russian media says he is in Moscow hospital</p><ul><li><a href=""https://www.theguardian.com/world/live/2020/may/22/coronavirus-live-news-trump-pushes-to-open-churches-as-brazil-death-toll-passes-20000-covid-19-latest-updates"">Coronavirus – latest updates</a></li><li><a href=""https://www.theguardian.com/world/coronavirus-outbreak"">See all our coronavirus coverage</a></li></ul>",World news,News,article,Andrew Roth in Moscow,"Ramzan Kadyrov, Chechnya, Coronavirus, Russia, Europe, World news",world/2020/may/22/ramzan-kadyrov-vanishes-amid-reports-he-has-coronavirus
UK government borrowing hits record high in April and retail sales slump - as it happened,2020-05-22T15:49:05Z,"<p>UK public borrowing soars to £62bn in a single month and retail sales slump by 18%</p><ul><li><a href=""https://www.theguardian.com/business/live/2020/may/22/uk-government-borrowing-record-high-april-retail-sales-slump-covid-19-coronavirus-business-live?page=with:block-5ec7c9ab8f08a1782fa7fa43#block-5ec7c9ab8f08a1782fa7fa43"">Latest: Marston’s and Carlsberg merge brewing ops</a></li><li><a href=""https://www.theguardian.com/business/live/2020/may/22/uk-government-borrowing-record-high-april-retail-sales-slump-covid-19-coronavirus-business-live?page=with:block-5ec7c1be8f08a1782fa7f9f2#block-5ec7c1be8f08a1782fa7f9f2"">OBR says borrowing is ‘initial taste’</a></li><li><a href=""https://www.theguardian.com/business/live/2020/may/22/uk-government-borrowing-record-high-april-retail-sales-slump-covid-19-coronavirus-business-live?page=with:block-5ec767ce8f08a1782fa7f6b7#block-5ec767ce8f08a1782fa7f6b7"">UK borrowed £62bn last month to fight Covid-19 crisis</a></li><li><a href=""https://www.theguardian.com/world/series/coronavirus-live/latest"">Coronavirus – latest updates</a><br></li><li><a href=""https://www.theguardian.com/world/coronavirus-outbreak"">See all our coronavirus coverage</a></li></ul>",https://www.theguardian.com/business/live/2020/may/22/uk-government-borrowing-record-high-april-retail-sales-slump-covid-19-coronavirus-business-live,4668,"<p>UK public borrowing soars to £62bn in a single month and retail sales slump by 18%</p><ul><li><a href=""https://www.theguardian.com/business/live/2020/may/22/uk-government-borrowing-record-high-april-retail-sales-slump-covid-19-coronavirus-business-live?page=with:block-5ec7c9ab8f08a1782fa7fa43#block-5ec7c9ab8f08a1782fa7fa43"">Latest: Marston’s and Carlsberg merge brewing ops</a></li><li><a href=""https://www.theguardian.com/business/live/2020/may/22/uk-government-borrowing-record-high-april-retail-sales-slump-covid-19-coronavirus-business-live?page=with:block-5ec7c1be8f08a1782fa7f9f2#block-5ec7c1be8f08a1782fa7f9f2"">OBR says borrowing is ‘initial taste’</a></li><li><a href=""https://www.theguardian.com/business/live/2020/may/22/uk-government-borrowing-record-high-april-retail-sales-slump-covid-19-coronavirus-business-live?page=with:block-5ec767ce8f08a1782fa7f6b7#block-5ec767ce8f08a1782fa7f6b7"">UK borrowed £62bn last month to fight Covid-19 crisis</a></li><li><a href=""https://www.theguardian.com/world/series/coronavirus-live/latest"">Coronavirus – latest updates</a><br></li><li><a href=""https://www.theguardian.com/world/coronavirus-outbreak"">See all our coronavirus coverage</a></li></ul>",Business,News,liveblog,Graeme Wearden,"Business, Stock markets, Economics, Retail industry",business/live/2020/may/22/uk-government-borrowing-record-high-april-retail-sales-slump-covid-19-coronavirus-business-live
Colbert on Trump and masks: ‘There would be enormous pleasure in seeing less of his face’,2020-05-22T15:34:03Z,"<p>Late-night hosts recap Trump’s Michigan factory visit, Republican efforts to suppress voting and Lori Loughlin’s guilty plea</p><ul><li><a href=""https://www.theguardian.com/us-news/series/us-politics-live/latest"">Coronavirus – live US updates</a></li><li><a href=""https://www.theguardian.com/world/series/coronavirus-live/latest"">Live global updates</a></li></ul>",https://www.theguardian.com/culture/2020/may/22/stephen-colbert-trump-masks-late-show-recap,951,"<p>Late-night hosts recap Trump’s Michigan factory visit, Republican efforts to suppress voting and Lori Loughlin’s guilty plea</p><ul><li><a href=""https://www.theguardian.com/us-news/series/us-politics-live/latest"">Coronavirus – live US updates</a></li><li><a href=""https://www.theguardian.com/world/series/coronavirus-live/latest"">Live global updates</a></li></ul>",Culture,Arts,article,Adrian Horton,"Late-night TV roundup, Stephen Colbert, Trevor Noah, Seth Meyers, Jimmy Kimmel, TV comedy, Comedy, US television, Television & radio, Television, Culture",culture/2020/may/22/stephen-colbert-trump-masks-late-show-recap
