headline,pub_date,snippet,web_url,word_count,abstract,section_name,pillar_name,type,byline,keywords,article_id
Brazil records 287 new Covid deaths – as it happened,2020-11-30T23:58:48Z,<p>This blog is now closed. We’ve launched a new blog at the link below: </p><ul><li>Coronavirus news – live</li></ul>,https://www.theguardian.com/world/live/2020/nov/30/coronavirus-live-news-dr-fauci-warns-of-surge-upon-surge-in-us-cases-after-thanksgiving,15448,<p>This blog is now closed. We’ve launched a new blog at the link below: </p><ul><li>Coronavirus news – live</li></ul>,World news,News,liveblog,"Harry Taylor (now), Jessica Murray, Haroon Siddique and Helen Sullivan (earlier)","Coronavirus, World news, Infectious diseases, Science, US news, Europe, Middle East and north Africa, UK news, Asia Pacific, Microbiology, Medical research",world/live/2020/nov/30/coronavirus-live-news-dr-fauci-warns-of-surge-upon-surge-in-us-cases-after-thanksgiving
Amazon deforestation surges to 12-year high under Bolsonaro,2020-11-30T23:43:59Z,<p>An area seven times larger than Greater London has been lost in what one activist called a ‘humiliating and shameful’ destruction</p>,https://www.theguardian.com/environment/2020/dec/01/amazon-deforestation-surges-to-12-year-high-under-bolsonaro,744,<p>An area seven times larger than Greater London has been lost in what one activist called a ‘humiliating and shameful’ destruction</p>,Environment,News,article,Tom Phillips in Rio de Janeiro,"Amazon rainforest, Brazil, Deforestation, Environment, Trees and forests",environment/2020/dec/01/amazon-deforestation-surges-to-12-year-high-under-bolsonaro
Chef David Chang is first celebrity to win Who Wants to Be a Millionaire?,2020-11-30T23:13:08Z,<p>Momofuku restaurant group founder will donate winnings to restaurant workers affected by pandemic</p>,https://www.theguardian.com/tv-and-radio/2020/nov/30/chef-david-chang-wins-who-wants-to-be-millionaire,244,<p>Momofuku restaurant group founder will donate winnings to restaurant workers affected by pandemic</p>,Television & radio,Arts,article,Guardian staff,"US television, Television, Television & radio, Food, Restaurants",tv-and-radio/2020/nov/30/chef-david-chang-wins-who-wants-to-be-millionaire
Joe Biden names diverse economic team with first female secretary of treasury,2020-11-30T22:09:17Z,"<p>Official nominations came after president-elect announces all-female communications team and are likely to draw Republican opposition</p><ul><li><a href=""https://www.theguardian.com/us-news/live/2020/nov/30/us-election-joe-biden-donald-trump-coronavirus-covid-19-live-updates"">US politics – live coverage</a></li></ul>",https://www.theguardian.com/us-news/2020/nov/30/joe-biden-diverse-economic-team-first-female-secretary-of-treasury,755,"<p>Official nominations came after president-elect announces all-female communications team and are likely to draw Republican opposition</p><ul><li><a href=""https://www.theguardian.com/us-news/live/2020/nov/30/us-election-joe-biden-donald-trump-coronavirus-covid-19-live-updates"">US politics – live coverage</a></li></ul>",US news,News,article,Adam Gabbatt in New York,"US politics, US news, Joe Biden, Donald Trump",us-news/2020/nov/30/joe-biden-diverse-economic-team-first-female-secretary-of-treasury
How Hillbilly Elegy tries and fails to show the 'real' America,2020-11-30T21:25:51Z,<p>Ron Howard’s misjudged adaptation of JD Vance’s bestselling memoir is both histrionic and boring – and too shallow to act as social commentary</p>,https://www.theguardian.com/film/2020/nov/30/how-hillbilly-elegy-tries-and-fails-to-show-the-real-america,1061,<p>Ron Howard’s misjudged adaptation of JD Vance’s bestselling memoir is both histrionic and boring – and too shallow to act as social commentary</p>,Film,Arts,article,Adrian Horton,"Ron Howard, Amy Adams, Glenn Close, Film, Netflix, Drama films, Culture",film/2020/nov/30/how-hillbilly-elegy-tries-and-fails-to-show-the-real-america
Experts warn of coronavirus surge after widespread Thanksgiving travel,2020-11-30T20:03:51Z,"<ul><li>More than 100,000 Covid cases a day over holiday weekend</li><li><a href=""https://www.theguardian.com/world/2020/nov/30/moderna-covid-vaccine-has-94-efficacy-final-results-confirm"">Moderna Covid vaccine has 94% efficacy, final results confirm</a></li><li><a href=""https://www.theguardian.com/us-news/live/2020/nov/30/us-election-joe-biden-donald-trump-coronavirus-covid-19-live-updates"">US politics – live coverage</a></li><li><a href=""https://www.theguardian.com/world/series/coronavirus-live/latest"">Coronavirus – latest updates</a></li></ul>",https://www.theguardian.com/world/2020/nov/30/coronavirus-surge-thanksgiving-travel-experts-warn,1065,"<ul><li>More than 100,000 Covid cases a day over holiday weekend</li><li><a href=""https://www.theguardian.com/world/2020/nov/30/moderna-covid-vaccine-has-94-efficacy-final-results-confirm"">Moderna Covid vaccine has 94% efficacy, final results confirm</a></li><li><a href=""https://www.theguardian.com/us-news/live/2020/nov/30/us-election-joe-biden-donald-trump-coronavirus-covid-19-live-updates"">US politics – live coverage</a></li><li><a href=""https://www.theguardian.com/world/series/coronavirus-live/latest"">Coronavirus – latest updates</a></li></ul>",World news,News,article,Adam Gabbatt in New York and agencies,"Coronavirus, Thanksgiving, US news, Travel, Infectious diseases",world/2020/nov/30/coronavirus-surge-thanksgiving-travel-experts-warn
Supreme court questions Trump bid to bar undocumented immigrants from census,2020-11-30T19:44:36Z,"<p>But justices seem hesitant to immediately stop policy, which could affect distribution of congressional seats</p>",https://www.theguardian.com/us-news/2020/nov/30/supreme-court-us-census-undocumented-immigrants-trump,810,"<p>But justices seem hesitant to immediately stop policy, which could affect distribution of congressional seats</p>",US news,News,article,Sam Levine in New York,"Census, US supreme court, US immigration, Trump administration, Donald Trump, Law (US), Law, US news",us-news/2020/nov/30/supreme-court-us-census-undocumented-immigrants-trump
FTSE 100 records best month since 1989 after Covid vaccine hopes,2020-11-30T18:59:54Z,"<p>Index of leading UK company shares rose by more than £180bn in November</p><ul><li><a href=""https://www.theguardian.com/world/series/coronavirus-live/latest"">Coronavirus – latest updates</a></li><li><a href=""https://www.theguardian.com/world/coronavirus-outbreak"">See all our coronavirus coverage</a></li></ul>",https://www.theguardian.com/business/2020/nov/30/ftse-on-course-for-best-month-on-record-after-covid-vaccine-hopes,579,"<p>Index of leading UK company shares rose by more than £180bn in November</p><ul><li><a href=""https://www.theguardian.com/world/series/coronavirus-live/latest"">Coronavirus – latest updates</a></li><li><a href=""https://www.theguardian.com/world/coronavirus-outbreak"">See all our coronavirus coverage</a></li></ul>",Business,News,article,Richard Partington Economics correspondent,"FTSE, Stock markets, Business, Coronavirus, UK news, World news, Dow Jones, US news, Europe, Economic recovery, Economics",business/2020/nov/30/ftse-on-course-for-best-month-on-record-after-covid-vaccine-hopes
Trump losing Twitter followers – as Biden gains them,2020-11-30T17:44:43Z,"<p>President has lost 133,902 followers since 17 November as president-elect has gained 1,156,610</p>",https://www.theguardian.com/us-news/2020/nov/30/trump-losing-twitter-followers-biden-gains-them,245,"<p>President has lost 133,902 followers since 17 November as president-elect has gained 1,156,610</p>",US news,News,article,Martin Pengelly in New York,"Donald Trump, Joe Biden, X, US elections 2020, US news, US politics",us-news/2020/nov/30/trump-losing-twitter-followers-biden-gains-them
Has political consensus become a pipe dream?,2020-11-30T17:11:27Z,"<p><strong>Doug Simpson, </strong><strong>Dr Nicholas Falk </strong>and<strong> </strong><strong>Susan Zagor </strong>respond to an article by Martin Kettle on the polarisation of politics. Plus <strong>Terry Ward </strong>on Labour’s source of inspiration</p>",https://www.theguardian.com/politics/2020/nov/30/has-political-consensus-become-a-pipe-dream,544,"<p><strong>Doug Simpson, </strong><strong>Dr Nicholas Falk </strong>and<strong> </strong><strong>Susan Zagor </strong>respond to an article by Martin Kettle on the polarisation of politics. Plus <strong>Terry Ward </strong>on Labour’s source of inspiration</p>",Politics,News,article,Letters,"Politics, US politics, Economic policy, Donald Trump, Economics, Technology, Inequality, Social exclusion, Society, Business, Labour, Jeremy Corbyn",politics/2020/nov/30/has-political-consensus-become-a-pipe-dream
"Trump's fraud claims undermine democracy, ex-US election security chief says",2020-11-30T15:51:29Z,"<p>Chris Krebs, who was fired from Department of Homeland Security two weeks after the election, calls Trump’s actions dangerous</p>",https://www.theguardian.com/us-news/2020/nov/30/trump-election-fraud-claims-aim-chris-krebs,532,"<p>Chris Krebs, who was fired from Department of Homeland Security two weeks after the election, calls Trump’s actions dangerous</p>",US news,News,article,Martin Pengelly in New York,"US elections 2020, US politics, Donald Trump, US news, Joe Biden",us-news/2020/nov/30/trump-election-fraud-claims-aim-chris-krebs
Lennon the fall guy for Celtic's failure to build on domestic dominance,2020-11-30T13:37:05Z,<p>Ugly scenes after the League Cup defeat to Ross County reflected a growing sense of frustration among fans <br></p>,https://www.theguardian.com/football/2020/nov/30/neil-lennon-the-fallguy-celtic-domestic-dominance-scottish-football,1059,<p>Ugly scenes after the League Cup defeat to Ross County reflected a growing sense of frustration among fans <br></p>,Football,Sport,article,Ewan Murray,"Celtic, Football, Sport, Neil Lennon",football/2020/nov/30/neil-lennon-the-fallguy-celtic-domestic-dominance-scottish-football
"Moderna Covid vaccine has 94% efficacy, final results confirm",2020-11-30T12:00:05Z,"<p>US company submits data to start approval process with regulators around the world</p><ul><li><a href=""https://www.theguardian.com/world/series/coronavirus-live/latest"">Coronavirus – latest updates</a></li><li><a href=""https://www.theguardian.com/world/coronavirus-outbreak"">See all our coronavirus coverage</a></li></ul>",https://www.theguardian.com/world/2020/nov/30/moderna-covid-vaccine-has-94-efficacy-final-results-confirm,890,"<p>US company submits data to start approval process with regulators around the world</p><ul><li><a href=""https://www.theguardian.com/world/series/coronavirus-live/latest"">Coronavirus – latest updates</a></li><li><a href=""https://www.theguardian.com/world/coronavirus-outbreak"">See all our coronavirus coverage</a></li></ul>",World news,News,article,Sarah Boseley Global health editor,"Coronavirus, Infectious diseases, Medical research, Microbiology, World news, Science, Biology, US news, UK news",world/2020/nov/30/moderna-covid-vaccine-has-94-efficacy-final-results-confirm
Biden says 'America is back'. But will his team of insiders repeat their old mistakes?,2020-11-30T11:36:42Z,<p>Those pining for a return to the status quo have forgotten that US foreign policy disasters helped pave the way for Trump in the first place</p>,https://www.theguardian.com/commentisfree/2020/nov/30/biden-america-is-back-team-insiders-repeat-mistakes-us-trump,1316,<p>Those pining for a return to the status quo have forgotten that US foreign policy disasters helped pave the way for Trump in the first place</p>,Opinion,Opinion,article,Samuel Moyn,"US foreign policy, US news, World news, US politics, Joe Biden, Donald Trump",commentisfree/2020/nov/30/biden-america-is-back-team-insiders-repeat-mistakes-us-trump
First Thing: Biden boosts diversity of top team while Trump continues election assault,2020-11-30T11:07:39Z,"<p>The president-elect has announced an all-female senior communications team, while Trump continues to rail against the election result. Plus, November’s coronavirus cases are double last month’s record</p>",https://www.theguardian.com/us-news/2020/nov/30/first-thing-biden-boosts-diversity-of-top-team-while-trump-continues-election-assault,1125,"<p>The president-elect has announced an all-female senior communications team, while Trump continues to rail against the election result. Plus, November’s coronavirus cases are double last month’s record</p>",US news,News,article,Molly Blackall,US news,us-news/2020/nov/30/first-thing-biden-boosts-diversity-of-top-team-while-trump-continues-election-assault
Iranian nuclear scientist Mohsen Fakhrizadeh given martyr status,2020-11-30T11:04:26Z,"<p>Tehran holds state funeral for Fakhrizadeh, who it says was killed remotely using ‘electronic devices’</p>",https://www.theguardian.com/world/2020/nov/30/iranian-nuclear-scientist-mohsen-fakhrizadeh-given-martyr-status,906,"<p>Tehran holds state funeral for Fakhrizadeh, who it says was killed remotely using ‘electronic devices’</p>",World news,News,article,Patrick Wintour and Oliver Holmes,"Iran, Israel, US foreign policy, Middle East and north Africa, World news, Hassan Rouhani, US news",world/2020/nov/30/iranian-nuclear-scientist-mohsen-fakhrizadeh-given-martyr-status
Five factors that helped US democracy resist Trump's election onslaught,2020-11-30T10:00:03Z,"<p>Analysis: Trump’s trashing of norms has been harmful but decentralization, turnout, transparency, the courts and the media played a key role</p>",https://www.theguardian.com/us-news/2020/nov/30/how-us-democracy-survived-trump-election-lies-misinformation,1133,"<p>Analysis: Trump’s trashing of norms has been harmful but decentralization, turnout, transparency, the courts and the media played a key role</p>",US news,News,article,Tom McCarthy,"US elections 2020, US politics, US news",us-news/2020/nov/30/how-us-democracy-survived-trump-election-lies-misinformation
Obama didn’t deliver for Africa. Can Biden show black lives matter everywhere?,2020-11-30T07:45:00Z,<p>There is reason to hope the president-elect will pivot from long-standing US policy of backing continent’s strongman leaders</p>,https://www.theguardian.com/global-development/2020/nov/30/obama-didnt-deliver-for-africa-can-biden-show-black-lives-matter-everywhere,782,<p>There is reason to hope the president-elect will pivot from long-standing US policy of backing continent’s strongman leaders</p>,Global development,News,article,Vava Tampa,"Global development, Joe Biden, Donald Trump, Barack Obama, Africa, World news, US news, Conflict and arms",global-development/2020/nov/30/obama-didnt-deliver-for-africa-can-biden-show-black-lives-matter-everywhere
"Monday briefing: 'Worst is over,' Johnson tells MPs",2020-11-30T06:18:46Z,<p>PM tries to stave off tier rebellion as NHS plans celebrity vaccine blitz … farming in England faces historic shake-up … and Joe Biden’s dog mishap </p>,https://www.theguardian.com/world/2020/nov/30/monday-briefing-worst-is-over-johnson-tells-mps,1516,<p>PM tries to stave off tier rebellion as NHS plans celebrity vaccine blitz … farming in England faces historic shake-up … and Joe Biden’s dog mishap </p>,World news,News,article,Martin Farrer,,world/2020/nov/30/monday-briefing-worst-is-over-johnson-tells-mps
Joe Biden fractures foot after slipping while playing with dog,2020-11-30T02:45:25Z,<p>President-elect will probably have to wear a boot after accident while playing with German shepherd Major</p>,https://www.theguardian.com/us-news/2020/nov/29/joe-biden-twists-his-ankle-after-slipping-while-playing-with-dog,346,<p>President-elect will probably have to wear a boot after accident while playing with German shepherd Major</p>,US news,News,article,Guardian staff and agencies,"US politics, Joe Biden, US news, World news",us-news/2020/nov/29/joe-biden-twists-his-ankle-after-slipping-while-playing-with-dog
Corrections and clarifications,2020-11-29T21:00:37Z,<p>Overseas aid</p>,https://www.theguardian.com/news/2020/nov/29/corrections-and-clarifications,100,<p>Overseas aid</p>,News,News,article,Corrections and clarifications column editor,,news/2020/nov/29/corrections-and-clarifications
"Morning mail: federal corruption fears, Taylor isolated on coal, learning to love beige food",2020-11-29T20:04:16Z,<p><strong>Monday</strong>: new report finds Australians increasingly worry about corruption at federal level. Plus: the strange joy of custard creams and salad sandwiches</p>,https://www.theguardian.com/australia-news/2020/nov/30/morning-mail-federal-corruption-fears-taylor-isolated-on-coal-learning-to-love-beige-food,1387,<p><strong>Monday</strong>: new report finds Australians increasingly worry about corruption at federal level. Plus: the strange joy of custard creams and salad sandwiches</p>,Australia news,News,article,Imogen Dewey,,australia-news/2020/nov/30/morning-mail-federal-corruption-fears-taylor-isolated-on-coal-learning-to-love-beige-food
Reporting on wealth: ‘The virus isn't a leveller. It has made the rich richer’,2020-11-29T18:00:34Z,"<p>Four years in to the newly created role of wealth correspondent, Rupert Neate explains how the lives of millionaires affect us all</p>",https://www.theguardian.com/membership/2020/nov/29/wealth-inequality-rich-richer-pandemic,1042,"<p>Four years in to the newly created role of wealth correspondent, Rupert Neate explains how the lives of millionaires affect us all</p>",Membership,News,article,"Rupert Neate, as told to Sophie Zeldin-O'Neill","Investment funds, Membership, Money, Investments, Coronavirus, World news, Inequality",membership/2020/nov/29/wealth-inequality-rich-richer-pandemic
"The more the Tories' cronyism is indulged, the more their sense of entitlement grows",2020-11-29T16:53:22Z,"<p>Whether it’s the chumocracy or just incompetence, ‘we’re getting on with the job’ is the government’s cover for all its sins<br></p>",https://www.theguardian.com/commentisfree/2020/nov/29/covid-pandemic-tory-chumocracy-cronyism-spin,868,"<p>Whether it’s the chumocracy or just incompetence, ‘we’re getting on with the job’ is the government’s cover for all its sins<br></p>",Opinion,Opinion,article,Nesrine Malik,"Conservatives, Coronavirus, Brexit, UK news, Politics",commentisfree/2020/nov/29/covid-pandemic-tory-chumocracy-cronyism-spin
China hopes ‘vaccine diplomacy’ will restore its image and boost its influence,2020-11-29T11:00:26Z,"<p>Trading allies such as Brazil are at the head of the queue for Beijing’s huge drug distribution programme <br></p><ul><li><strong><a href=""https://www.theguardian.com/world/series/coronavirus-live/latest"">Coronavirus – latest updates</a></strong></li><li><strong><a href=""https://www.theguardian.com/world/coronavirus-outbreak"">See all our coronavirus coverage</a></strong></li></ul>",https://www.theguardian.com/world/2020/nov/29/china-hopes-vaccine-diplomacy-will-restore-its-image-and-boost-its-influence,1099,"<p>Trading allies such as Brazil are at the head of the queue for Beijing’s huge drug distribution programme <br></p><ul><li><strong><a href=""https://www.theguardian.com/world/series/coronavirus-live/latest"">Coronavirus – latest updates</a></strong></li><li><strong><a href=""https://www.theguardian.com/world/coronavirus-outbreak"">See all our coronavirus coverage</a></strong></li></ul>",World news,News,article,Emma Graham-Harrison and Tom Phillips in Rio de Janeiro,"China, Vaccines and immunisation, Asia Pacific, Society, Health, Coronavirus, Infectious diseases, World news, Brazil, Americas",world/2020/nov/29/china-hopes-vaccine-diplomacy-will-restore-its-image-and-boost-its-influence
'He understands Washington': Joe Scarborough finds echoes of Truman in Biden,2020-11-29T09:00:24Z,"<p>The Morning Joe host, author of a new book on Harry S Truman, sees parallels in the two presidents’ efforts to rebuild</p>",https://www.theguardian.com/media/2020/nov/29/morning-joe-scarborough-joe-biden-harry-truman-book,2017,"<p>The Morning Joe host, author of a new book on Harry S Truman, sees parallels in the two presidents’ efforts to rebuild</p>",Media,News,article,David Smith in Washington,"MSNBC, Joe Biden, Donald Trump, US news, Republicans, Books, TV news, Media",media/2020/nov/29/morning-joe-scarborough-joe-biden-harry-truman-book
The Observer view on Donald Trump and the murder of Iran’s leading nuclear scientist,2020-11-29T06:15:20Z,"As the president lashes out wilfully during his last days in office, it seems likely that he at least gave the nod to this killing",https://www.theguardian.com/commentisfree/2020/nov/29/observer-view-on-donald-trump-and-murder-of-iran-top-nuclear-scientist,633,"As the president lashes out wilfully during his last days in office, it seems likely that he at least gave the nod to this killing",Opinion,Opinion,article,Observer editorial,"Donald Trump, Iran, Middle East and north Africa, Iran's nuclear programme, Iran nuclear deal, Israel",commentisfree/2020/nov/29/observer-view-on-donald-trump-and-murder-of-iran-top-nuclear-scientist
Beware going 'back to normal' thoughts – normal gave us Trump,2020-11-29T06:00:20Z,"<p>Fatigued by the coronavirus and Trump, the idea of going back to normal is seductive – we must guard against it</p>",https://www.theguardian.com/commentisfree/2020/nov/29/beware-going-back-to-normal-thoughts-normal-gave-us-trump,779,"<p>Fatigued by the coronavirus and Trump, the idea of going back to normal is seductive – we must guard against it</p>",Opinion,Opinion,article,Robert Reich,"US politics, Biden administration",commentisfree/2020/nov/29/beware-going-back-to-normal-thoughts-normal-gave-us-trump
UK records 479 more deaths - as it happened,2020-11-29T00:50:40Z,"<ul><li><a href=""https://www.theguardian.com/world/live/2020/nov/29/coronavirus-live-news-brazil-records-nearly-600-deaths-victoria-goes-30-days-without-new-cases"">Coronavirus live news: Brazil records nearly 600 deaths; Victoria goes 30 days without new cases</a> </li></ul>",https://www.theguardian.com/world/live/2020/nov/28/coronavirus-live-news-us-hospitalisations-at-record-level-as-victoria-passes-elimination-benchmark,10175,"<ul><li><a href=""https://www.theguardian.com/world/live/2020/nov/29/coronavirus-live-news-brazil-records-nearly-600-deaths-victoria-goes-30-days-without-new-cases"">Coronavirus live news: Brazil records nearly 600 deaths; Victoria goes 30 days without new cases</a> </li></ul>",World news,News,liveblog,"Rebecca Ratcliffe (now), Yohannes Lowe (earlier), Molly Blackall and Matilda Boseley","World news, Coronavirus, Infectious diseases, Science",world/live/2020/nov/28/coronavirus-live-news-us-hospitalisations-at-record-level-as-victoria-passes-elimination-benchmark
Trump supporter who gave $2.5m to fight election fraud wants money back,2020-11-28T21:33:19Z,<p>Businessman Fredric Eshelman sues pro-Trump ‘election ethics’ group citing ‘disappointing results’ of effort to expose cheating</p>,https://www.theguardian.com/us-news/2020/nov/28/trump-donor-election-fraud-sues-money-back,440,<p>Businessman Fredric Eshelman sues pro-Trump ‘election ethics’ group citing ‘disappointing results’ of effort to expose cheating</p>,US news,News,article,Richard Luscombe,"US political financing, US politics, US news, Donald Trump, US elections 2020",us-news/2020/nov/28/trump-donor-election-fraud-sues-money-back
Welcome to the Biden administration: what do the key picks mean for Australia?,2020-11-28T19:00:08Z,"<p>From China tensions to climate change to economic recovery, Australia and the US have a rocky road to travel together in 2021</p>",https://www.theguardian.com/australia-news/2020/nov/29/welcome-to-the-biden-administration-what-do-the-key-picks-mean-for-australia,1088,"<p>From China tensions to climate change to economic recovery, Australia and the US have a rocky road to travel together in 2021</p>",Australia news,News,article,Daniel Hurst,"Australian foreign policy, US foreign policy, Joe Biden, Australia news, China, Australian politics, Climate crisis, Asia Pacific, Environment, Jake Sullivan, Antony Blinken",australia-news/2020/nov/29/welcome-to-the-biden-administration-what-do-the-key-picks-mean-for-australia
'Trying to invert reality': Mathias Cormann's climate credentials will be a hard sell at the OECD,2020-11-28T19:00:07Z,"<p>Australia’s ex-finance minister is jetting across Europe on his leadership push, but will his government’s record fly?</p>",https://www.theguardian.com/australia-news/2020/nov/29/trying-to-invert-reality-mathias-cormanns-climate-credentials-will-be-a-hard-sell-at-the-oecd,1387,"<p>Australia’s ex-finance minister is jetting across Europe on his leadership push, but will his government’s record fly?</p>",Australia news,News,article,Daniel Hurst,"Mathias Cormann, OECD, Climate crisis, Australia news, Australian politics, Europe, Greenhouse gas emissions",australia-news/2020/nov/29/trying-to-invert-reality-mathias-cormanns-climate-credentials-will-be-a-hard-sell-at-the-oecd
