headline,pub_date,snippet,web_url,word_count,abstract,section_name,pillar_name,type,byline,keywords,article_id
"CDC releases reopening guidelines for businesses, schools and transit – as it happened",2020-05-14T23:50:32Z,"<ul><li><a href=""https://www.theguardian.com/world/live/2020/may/14/coronavirus-us-live-rick-bright-whistleblower-testify-darkest-winter-trump-latest-news-updates?page=with:block-5ebd6d878f08d99d46a17015#block-5ebd6d878f08d99d46a17015"">Republican senator to step down as intelligence committee head amid insider trading scandal</a></li><li><a href=""https://www.theguardian.com/world/live/2020/may/14/coronavirus-us-live-rick-bright-whistleblower-testify-darkest-winter-trump-latest-news-updates?page=with:block-5ebd58ce8f08a55ecde59fd7#block-5ebd58ce8f08a55ecde59fd7"">Whistleblower warns ‘time is running out’ as virus continues to spread</a><br></li><li><a href=""https://www.theguardian.com/business/2020/may/14/unemployment-us-data-coronavirus"">36m Americans now unemployed as another 3m file for benefits</a></li><li><a href=""https://www.theguardian.com/world/2020/may/14/where-is-the-cdc-trump-covid-19-pandemic"">Where is the CDC? How Trump sidelined the agency</a></li><li><a href=""https://www.theguardian.com/world/series/coronavirus-live/latest"">Coronavirus – latest global updates</a><br></li><li>Get a fresh perspective on America – sign up to our <a href=""https://viewer.gutools.co.uk/info/2018/sep/17/guardian-us-morning-briefing-sign-up-to-stay-informed"">First Thing newsletter</a></li></ul>",https://www.theguardian.com/world/live/2020/may/14/coronavirus-us-live-rick-bright-whistleblower-testify-darkest-winter-trump-latest-news-updates,6549,"<ul><li><a href=""https://www.theguardian.com/world/live/2020/may/14/coronavirus-us-live-rick-bright-whistleblower-testify-darkest-winter-trump-latest-news-updates?page=with:block-5ebd6d878f08d99d46a17015#block-5ebd6d878f08d99d46a17015"">Republican senator to step down as intelligence committee head amid insider trading scandal</a></li><li><a href=""https://www.theguardian.com/world/live/2020/may/14/coronavirus-us-live-rick-bright-whistleblower-testify-darkest-winter-trump-latest-news-updates?page=with:block-5ebd58ce8f08a55ecde59fd7#block-5ebd58ce8f08a55ecde59fd7"">Whistleblower warns ‘time is running out’ as virus continues to spread</a><br></li><li><a href=""https://www.theguardian.com/business/2020/may/14/unemployment-us-data-coronavirus"">36m Americans now unemployed as another 3m file for benefits</a></li><li><a href=""https://www.theguardian.com/world/2020/may/14/where-is-the-cdc-trump-covid-19-pandemic"">Where is the CDC? How Trump sidelined the agency</a></li><li><a href=""https://www.theguardian.com/world/series/coronavirus-live/latest"">Coronavirus – latest global updates</a><br></li><li>Get a fresh perspective on America – sign up to our <a href=""https://viewer.gutools.co.uk/info/2018/sep/17/guardian-us-morning-briefing-sign-up-to-stay-informed"">First Thing newsletter</a></li></ul>",World news,News,liveblog,Maanvi Singh in San Francisco (now) and Daniel Strauss in Washington and Joanna Walters in New York (earlier),"Coronavirus, US politics, Donald Trump, Andrew Cuomo, North Carolina, New York, Michigan, Wisconsin, US news",world/live/2020/may/14/coronavirus-us-live-rick-bright-whistleblower-testify-darkest-winter-trump-latest-news-updates
36 million Americans unemployed – as it happened,2020-05-14T23:38:00Z,"<p>Infections near 4.5m; Europe halts delivery of faulty Chinese face masks; WHO says Covid-19 may never go; this blog is now closed.</p><ul><li><a href=""https://www.theguardian.com/world/live/2020/may/15/coronavirus-live-news-trump-says-he-could-cut-china-ties-as-global-deaths-pass-300000-latest-updates"">Follow the latest global coronavirus blog here for live news and updates</a></li></ul>",https://www.theguardian.com/world/live/2020/may/14/coronavirus-live-news-trump-surprised-by-faucis-reopening-warnings-as-who-says-covid-19-may-never-go,19892,"<p>Infections near 4.5m; Europe halts delivery of faulty Chinese face masks; WHO says Covid-19 may never go; this blog is now closed.</p><ul><li><a href=""https://www.theguardian.com/world/live/2020/may/15/coronavirus-live-news-trump-says-he-could-cut-china-ties-as-global-deaths-pass-300000-latest-updates"">Follow the latest global coronavirus blog here for live news and updates</a></li></ul>",World news,News,liveblog,"Nicola Slawson (now); Damien Gayle, Jessica Murray, Simon Burnton and Helen Sullivan (earlier)","Coronavirus, World news, UK news, Australia news, US news, Asia Pacific, Middle East and north Africa, Africa, Science, Infectious diseases, Americas, China, Russia, Microbiology, Medical research",world/live/2020/may/14/coronavirus-live-news-trump-surprised-by-faucis-reopening-warnings-as-who-says-covid-19-may-never-go
Coronavirus 14 May: at a glance,2020-05-14T23:11:14Z,"<p>A summary of the biggest developments in the global coronavirus outbreak</p><ul><li><a href=""https://www.theguardian.com/world/series/coronavirus-live/latest"">Follow our latest coronavirus blog for live news and updates</a></li></ul>",https://www.theguardian.com/world/2020/may/15/coronavirus-latest-at-a-glance-15-may,703,"<p>A summary of the biggest developments in the global coronavirus outbreak</p><ul><li><a href=""https://www.theguardian.com/world/series/coronavirus-live/latest"">Follow our latest coronavirus blog for live news and updates</a></li></ul>",World news,News,article,Nicola Slawson,"World news, Coronavirus",world/2020/may/15/coronavirus-latest-at-a-glance-15-may
Call for free school meals during half-term and summer in England,2020-05-14T23:01:23Z,"<p>Councillors say Easter holiday extension should be repeated as coronavirus crisis continues</p><ul><li><a href=""https://www.theguardian.com/world/live/2020/may/14/coronavirus-live-news-trump-surprised-by-faucis-reopening-warnings-as-who-says-covid-19-may-never-go"">Coronavirus - latest updates</a></li><li><a href=""https://www.theguardian.com/world/coronavirus-outbreak"">See all our coronavirus coverage</a></li></ul>",https://www.theguardian.com/education/2020/may/15/call-for-free-school-meals-during-half-term-summer-england,674,"<p>Councillors say Easter holiday extension should be repeated as coronavirus crisis continues</p><ul><li><a href=""https://www.theguardian.com/world/live/2020/may/14/coronavirus-live-news-trump-surprised-by-faucis-reopening-warnings-as-who-says-covid-19-may-never-go"">Coronavirus - latest updates</a></li><li><a href=""https://www.theguardian.com/world/coronavirus-outbreak"">See all our coronavirus coverage</a></li></ul>",Education,News,article,Sally Weale Education correspondent,"School meals, Schools, Education, Children, Coronavirus, Society, UK news",education/2020/may/15/call-for-free-school-meals-during-half-term-summer-england
"Teachers can legally refuse to return over health risk, says union",2020-05-14T23:00:18Z,"<p><strong>Exclusive: </strong>NASUWT threatens legal action to defend teachers against forced restart on 1 June </p><ul><li><a href=""https://www.theguardian.com/world/live/2020/may/14/coronavirus-live-news-trump-surprised-by-faucis-reopening-warnings-as-who-says-covid-19-may-never-go"">Coronavirus – latest updates</a></li><li><a href=""https://www.theguardian.com/world/coronavirus-outbreak"">See all our coronavirus coverage</a></li></ul>",https://www.theguardian.com/education/2020/may/14/teachers-can-legally-refuse-to-return-over-risk-to-health-union-warns,805,"<p><strong>Exclusive: </strong>NASUWT threatens legal action to defend teachers against forced restart on 1 June </p><ul><li><a href=""https://www.theguardian.com/world/live/2020/may/14/coronavirus-live-news-trump-surprised-by-faucis-reopening-warnings-as-who-says-covid-19-may-never-go"">Coronavirus – latest updates</a></li><li><a href=""https://www.theguardian.com/world/coronavirus-outbreak"">See all our coronavirus coverage</a></li></ul>",Education,News,article,Richard Adams and Sally Weale,"Schools, Coronavirus, Local government, Primary schools, Teacher Network, Education, UK news, Teaching",education/2020/may/14/teachers-can-legally-refuse-to-return-over-risk-to-health-union-warns
Donald Trump goes maskless to tour medical equipment facility,2020-05-14T21:55:13Z,<ul><li>President and chief of staff were only ones without covering</li><li>Trump vows to replenish federal stockpile</li></ul>,https://www.theguardian.com/us-news/2020/may/14/donald-trump-mask-medical-equipment-facility-pennsylvania,397,<ul><li>President and chief of staff were only ones without covering</li><li>Trump vows to replenish federal stockpile</li></ul>,US news,News,article,Lauren Gambino,"Donald Trump, Coronavirus, US news, Pennsylvania, US politics",us-news/2020/may/14/donald-trump-mask-medical-equipment-facility-pennsylvania
"Morning mail: US whistleblower's stark warning, RBA's renewables push, the show must go on",2020-05-14T20:54:11Z,"<p><strong>Friday:</strong> Ousted public health official warns country faces its ‘darkest winter in modern history’. Plus, how theatres plan to reopen post-pandemic</p>",https://www.theguardian.com/australia-news/2020/may/15/morning-mail-us-whistleblowers-stark-warning-rbas-renewables-push-the-show-must-go-on,1225,"<p><strong>Friday:</strong> Ousted public health official warns country faces its ‘darkest winter in modern history’. Plus, how theatres plan to reopen post-pandemic</p>",Australia news,News,article,Richard Parkin,,australia-news/2020/may/15/morning-mail-us-whistleblowers-stark-warning-rbas-renewables-push-the-show-must-go-on
'They threw us into chaos': Wisconsin lockdown ruling is latest in partisan war,2020-05-14T19:39:55Z,<p>Wisconsin supreme court ruling striking down Democratic governor’s stay-at-home order underscores division in the state</p>,https://www.theguardian.com/us-news/2020/may/14/wisconsin-lockdown-ruling-supreme-court-republicans,670,<p>Wisconsin supreme court ruling striking down Democratic governor’s stay-at-home order underscores division in the state</p>,US news,News,article,Sam Levine in New York,"Wisconsin, Republicans, Coronavirus, US politics, US news",us-news/2020/may/14/wisconsin-lockdown-ruling-supreme-court-republicans
UK coronavirus live: Britain claps for carers on the Covid frontline - as it happened,2020-05-14T19:32:57Z,"<p>Official UK death toll rises by 428 to 33,614; cost of furlough scheme estimated to reach £83bn by October; transport secretary announces £1.7bn fund to improve transport infrastructure<br></p><ul><li><a href=""https://www.theguardian.com/world/2020/may/14/148000-in-england-infected-with-coronavirus-in-last-two-weeks"">148,000 in England infected with coronavirus in last two weeks</a></li><li><a href=""https://www.theguardian.com/uk-news/2020/may/14/police-vow-to-break-up-planned-anti-lockdown-protests-in-uk-cities"">Police vow to break up planned anti-lockdown protests</a></li><li><a href=""https://www.theguardian.com/world/2020/may/14/is-the-coronavirus-antibody-test-approved-by-public-health-england-a-game-changer"">Is the new antibody test a ‘game changer’?</a><br></li><li><a href=""https://www.theguardian.com/world/live/2020/may/14/coronavirus-live-news-trump-surprised-by-faucis-reopening-warnings-as-who-says-covid-19-may-never-go"">Global coronavirus updates - live</a><br></li><li><a href=""https://www.theguardian.com/world/coronavirus-outbreak"">Full coverage of the coronavirus outbreak</a></li></ul>",https://www.theguardian.com/world/live/2020/may/14/uk-coronavirus-live-antibody-test-approved-for-use-latest-updates,12134,"<p>Official UK death toll rises by 428 to 33,614; cost of furlough scheme estimated to reach £83bn by October; transport secretary announces £1.7bn fund to improve transport infrastructure<br></p><ul><li><a href=""https://www.theguardian.com/world/2020/may/14/148000-in-england-infected-with-coronavirus-in-last-two-weeks"">148,000 in England infected with coronavirus in last two weeks</a></li><li><a href=""https://www.theguardian.com/uk-news/2020/may/14/police-vow-to-break-up-planned-anti-lockdown-protests-in-uk-cities"">Police vow to break up planned anti-lockdown protests</a></li><li><a href=""https://www.theguardian.com/world/2020/may/14/is-the-coronavirus-antibody-test-approved-by-public-health-england-a-game-changer"">Is the new antibody test a ‘game changer’?</a><br></li><li><a href=""https://www.theguardian.com/world/live/2020/may/14/coronavirus-live-news-trump-surprised-by-faucis-reopening-warnings-as-who-says-covid-19-may-never-go"">Global coronavirus updates - live</a><br></li><li><a href=""https://www.theguardian.com/world/coronavirus-outbreak"">Full coverage of the coronavirus outbreak</a></li></ul>",Politics,News,liveblog,"Nicola Slawson (now); Andrew Sparrow, Frances Perraudin and Simon Murphy (earlier)","Coronavirus, Politics, UK news, Health, Science, Jeremy Hunt, Nadine Dorries, Keir Starmer, Office for National Statistics, London, Transport policy, Transport",world/live/2020/may/14/uk-coronavirus-live-antibody-test-approved-for-use-latest-updates
Investors can return to obsessing over relations between US and China,2020-05-14T18:39:19Z,<p>Trump’s anti-China stance is intensifying and this week produced an unusual piece of policy-making in Washington</p>,https://www.theguardian.com/business/nils-pratley-on-finance/2020/may/14/investors-can-return-to-obsessing-over-relations-between-us-and-china,712,<p>Trump’s anti-China stance is intensifying and this week produced an unusual piece of policy-making in Washington</p>,Business,News,article,Nils Pratley,"Business, Donald Trump, US news, China, Stock markets, Asia Pacific, World news",business/nils-pratley-on-finance/2020/may/14/investors-can-return-to-obsessing-over-relations-between-us-and-china
Ousted whistleblower warns US facing ‘darkest winter in modern history’,2020-05-14T18:31:34Z,"<p>Rick Bright testified before congressional committee that as virus spreads in US the ‘window is closing to address this pandemic’</p><ul><li><a href=""https://www.theguardian.com/us-news/series/us-politics-live/latest"">Coronavirus – live US updates</a></li><li><a href=""https://www.theguardian.com/world/series/coronavirus-live/latest"">Live global updates</a></li></ul>",https://www.theguardian.com/us-news/2020/may/14/rick-bright-testimony-coronavirus-trump-ousted-whistleblower,903,"<p>Rick Bright testified before congressional committee that as virus spreads in US the ‘window is closing to address this pandemic’</p><ul><li><a href=""https://www.theguardian.com/us-news/series/us-politics-live/latest"">Coronavirus – live US updates</a></li><li><a href=""https://www.theguardian.com/world/series/coronavirus-live/latest"">Live global updates</a></li></ul>",US news,News,article,Oliver Milman in New York,"US news, Coronavirus, Trump administration, Donald Trump, US Congress",us-news/2020/may/14/rick-bright-testimony-coronavirus-trump-ousted-whistleblower
Richard Burr steps down as Senate committee chair over FBI investigation,2020-05-14T18:26:48Z,<p>Burr’s cellphone seized overnight in inquiry into claims he used private coronavirus briefing to sell stocks before market plunge</p>,https://www.theguardian.com/us-news/2020/may/14/richard-burr-insider-trading-fbi-investigation-steps-down-intelligence-committee,491,<p>Burr’s cellphone seized overnight in inquiry into claims he used private coronavirus briefing to sell stocks before market plunge</p>,US news,News,article,Daniel Strauss in Washington and Joanna Walters in New York,"US Senate, US news, Stock markets, US politics",us-news/2020/may/14/richard-burr-insider-trading-fbi-investigation-steps-down-intelligence-committee
Global report: leaders urge free vaccines as France allows staycations,2020-05-14T18:22:20Z,"<p>French drugmaker criticised for giving US priority; Gordon Brown says Covid-19 solution is global</p><ul><li><a href=""https://www.theguardian.com/world/series/coronavirus-live/latest"">Coronavirus – latest updates</a></li><li><a href=""https://www.theguardian.com/world/coronavirus-outbreak"">See all our coronavirus coverage</a></li></ul>",https://www.theguardian.com/world/2020/may/14/global-report-leaders-urge-free-vaccines-as-france-allows-staycations,879,"<p>French drugmaker criticised for giving US priority; Gordon Brown says Covid-19 solution is global</p><ul><li><a href=""https://www.theguardian.com/world/series/coronavirus-live/latest"">Coronavirus – latest updates</a></li><li><a href=""https://www.theguardian.com/world/coronavirus-outbreak"">See all our coronavirus coverage</a></li></ul>",World news,News,article,Luke Harding and Kim Willsher,"Coronavirus, Pharmaceuticals industry, Vaccines and immunisation, France, Japan, Qatar, Afghanistan, Tanzania, Africa, Asia Pacific, Europe, Middle East and north Africa, South and central Asia, World news, Business",world/2020/may/14/global-report-leaders-urge-free-vaccines-as-france-allows-staycations
Why shouldn't Greta Thunberg speak at CNN's coronavirus town hall?,2020-05-14T18:08:02Z,"<p>Thunberg isn’t a Covid-19 expert, but she’s world-renowned activist using her platform to inform people about the pandemic</p><ul><li><a href=""https://www.theguardian.com/us-news/series/us-politics-live/latest"">Coronavirus – latest US updates</a></li><li><a href=""https://www.theguardian.com/world/series/coronavirus-live/latest"">C</a><a href=""https://www.theguardian.com/world/series/coronavirus-live/latest"">oronavirus – latest global updates</a></li></ul>",https://www.theguardian.com/environment/2020/may/14/greta-thunberg-cnn-coronavirus-town-hall-climate-change,528,"<p>Thunberg isn’t a Covid-19 expert, but she’s world-renowned activist using her platform to inform people about the pandemic</p><ul><li><a href=""https://www.theguardian.com/us-news/series/us-politics-live/latest"">Coronavirus – latest US updates</a></li><li><a href=""https://www.theguardian.com/world/series/coronavirus-live/latest"">C</a><a href=""https://www.theguardian.com/world/series/coronavirus-live/latest"">oronavirus – latest global updates</a></li></ul>",Environment,News,article,Poppy Noor,"Greta Thunberg, CNN, Climate crisis, US news, Environment, TV news, Television industry, World news, Media",environment/2020/may/14/greta-thunberg-cnn-coronavirus-town-hall-climate-change
Stock markets slump as hopes fade for swift economic recovery,2020-05-14T18:03:45Z,"<p>Optimism fizzles out following sombre prognosis and soaring US unemployment figures</p><ul><li><a href=""https://www.theguardian.com/world/series/coronavirus-live/latest"">Coronavirus – latest updates</a></li><li><a href=""https://www.theguardian.com/world/coronavirus-outbreak"">See all our coronavirus coverage</a></li></ul>",https://www.theguardian.com/business/2020/may/14/stock-markets-slump-as-hopes-fade-for-swift-economic-recovery,574,"<p>Optimism fizzles out following sombre prognosis and soaring US unemployment figures</p><ul><li><a href=""https://www.theguardian.com/world/series/coronavirus-live/latest"">Coronavirus – latest updates</a></li><li><a href=""https://www.theguardian.com/world/coronavirus-outbreak"">See all our coronavirus coverage</a></li></ul>",Business,News,article,Rob Davies,"Stock markets, Economics, Business, UK news, World news, Coronavirus, US economic growth and recession, US news, Federal Reserve, US economy",business/2020/may/14/stock-markets-slump-as-hopes-fade-for-swift-economic-recovery
'Obamagate': Fox News focuses on conspiracy theory rather than Covid-19,2020-05-14T17:29:48Z,<p>Trump has dubbed the brouhaha ‘the greatest political crime’ in US history despite being unable to say what it is</p>,https://www.theguardian.com/media/2020/may/14/fox-news-obama-trump-obamagate,909,<p>Trump has dubbed the brouhaha ‘the greatest political crime’ in US history despite being unable to say what it is</p>,Media,News,article,Martin Pengelly,"Fox News, Donald Trump, Republicans, US news, US politics, Michael Flynn, Media",media/2020/may/14/fox-news-obama-trump-obamagate
Wanted ads posted in drive to hire Covid-19 contact tracer 'army',2020-05-14T17:19:55Z,"<p>Recruiters seek home-based workers as health secretary’s mid-May deadline looms</p><ul><li><a href=""https://www.theguardian.com/world/live/2020/may/14/coronavirus-live-news-trump-surprised-by-faucis-reopening-warnings-as-who-says-covid-19-may-never-go"">Coronavirus – latest updates</a></li><li><a href=""https://www.theguardian.com/world/coronavirus-outbreak"">See all our coronavirus coverage</a></li></ul>",https://www.theguardian.com/world/2020/may/14/wanted-ads-posted-in-drive-to-hire-covid-19-contact-tracer-army,797,"<p>Recruiters seek home-based workers as health secretary’s mid-May deadline looms</p><ul><li><a href=""https://www.theguardian.com/world/live/2020/may/14/coronavirus-live-news-trump-surprised-by-faucis-reopening-warnings-as-who-says-covid-19-may-never-go"">Coronavirus – latest updates</a></li><li><a href=""https://www.theguardian.com/world/coronavirus-outbreak"">See all our coronavirus coverage</a></li></ul>",World news,News,article,Sarah Boseley Health editor,"Coronavirus, Infectious diseases, World news, UK news, Matt Hancock, Health",world/2020/may/14/wanted-ads-posted-in-drive-to-hire-covid-19-contact-tracer-army
Markets slide amid Covid-19 recession and trade war fears - as it happened,2020-05-14T17:15:51Z,"<p>Shares have fallen across Europe, Asia and the US, as another 2.9m Americans file initial jobless claims </p><ul><li>5pm: FTSE 100 closes down 162 points at 5741</li><li><a href=""https://www.theguardian.com/business/2020/may/14/unemployment-us-data-coronavirus"">Another grim week for US unemployment</a></li><li><a href=""https://www.theguardian.com/business/live/2020/may/14/markets-fall-investors-economic-harm-covid-19-ftse-dow-us-unemployment-coronavirus-business-live?page=with:block-5ebcde098f08d99d46a169aa#block-5ebcde098f08d99d46a169aa"">Fed chair and WHO worry markets</a></li><li><a href=""https://www.theguardian.com/world/series/coronavirus-live/latest"">Coronavirus – latest updates</a></li><li><a href=""https://www.theguardian.com/world/coronavirus-outbreak"">See all our coronavirus coverage</a></li></ul>",https://www.theguardian.com/business/live/2020/may/14/markets-fall-investors-economic-harm-covid-19-ftse-dow-us-unemployment-coronavirus-business-live,4184,"<p>Shares have fallen across Europe, Asia and the US, as another 2.9m Americans file initial jobless claims </p><ul><li>5pm: FTSE 100 closes down 162 points at 5741</li><li><a href=""https://www.theguardian.com/business/2020/may/14/unemployment-us-data-coronavirus"">Another grim week for US unemployment</a></li><li><a href=""https://www.theguardian.com/business/live/2020/may/14/markets-fall-investors-economic-harm-covid-19-ftse-dow-us-unemployment-coronavirus-business-live?page=with:block-5ebcde098f08d99d46a169aa#block-5ebcde098f08d99d46a169aa"">Fed chair and WHO worry markets</a></li><li><a href=""https://www.theguardian.com/world/series/coronavirus-live/latest"">Coronavirus – latest updates</a></li><li><a href=""https://www.theguardian.com/world/coronavirus-outbreak"">See all our coronavirus coverage</a></li></ul>",Business,News,liveblog,Graeme Wearden,"Business, Stock markets, FTSE, Coronavirus, Economics",business/live/2020/may/14/markets-fall-investors-economic-harm-covid-19-ftse-dow-us-unemployment-coronavirus-business-live
UK spent £20m buying up stocks of HIV and malaria drugs,2020-05-14T17:14:13Z,"<p>Government spent £2m on hydroxychloroquine, touted by Trump as a Covid-19 cure</p><ul><li><a href=""https://www.theguardian.com/world/series/coronavirus-live/latest"">Coronavirus – latest updates</a></li><li><a href=""https://www.theguardian.com/world/coronavirus-outbreak"">See all our coronavirus coverage</a></li></ul>",https://www.theguardian.com/world/2020/may/14/uk-spent-20m-buying-up-stocks-of-hiv-and-malaria-drugs,720,"<p>Government spent £2m on hydroxychloroquine, touted by Trump as a Covid-19 cure</p><ul><li><a href=""https://www.theguardian.com/world/series/coronavirus-live/latest"">Coronavirus – latest updates</a></li><li><a href=""https://www.theguardian.com/world/coronavirus-outbreak"">See all our coronavirus coverage</a></li></ul>",World news,News,article,Lisa O'Carroll,"Coronavirus, Health policy, Health, Politics, Society, UK news, NHS, Medical research, Pharmaceuticals industry, Public services policy",world/2020/may/14/uk-spent-20m-buying-up-stocks-of-hiv-and-malaria-drugs
"Thanks for Marina Hyde, George Monbiot and Guardian letters",2020-05-14T17:01:01Z,<p>Cheering content at a difficult time | EE Cummings | Tennis etiquette | Uses for tights</p>,https://www.theguardian.com/commentisfree/2020/may/14/thanks-for-marina-hyde-george-monbiot-and-guardian-letters,279,<p>Cheering content at a difficult time | EE Cummings | Tennis etiquette | Uses for tights</p>,Opinion,Opinion,article,Letters,"The Guardian, Poetry, Tennis",commentisfree/2020/may/14/thanks-for-marina-hyde-george-monbiot-and-guardian-letters
