headline,pub_date,snippet,web_url,word_count,abstract,section_name,pillar_name,type,byline,keywords,article_id
Networks cut Trump speech as some Republicans chastise president over election lies,2020-11-06T13:34:08Z,"<p>Chris Christie was among those condemning the speech after TV news opted to cut away to factcheck the false claims</p><ul><li><a href=""https://www.theguardian.com/us-news/live/2020/nov/05/us-election-joe-biden-donald-trump-result-latest-who-is-winning-live-2020-updates"">US politics live – follow the latest in our live blog</a></li><li><a href=""https://www.theguardian.com/us-news/ng-interactive/2020/nov/05/us-election-2020-live-results-donald-trump-joe-biden-presidential-votes-arizona-nevada-pennsylvania-georgia"">Trump v Biden – full results as they come in</a></li></ul>",https://www.theguardian.com/us-news/2020/nov/05/tv-news-cut-away-trump-election-lies,556,"<p>Chris Christie was among those condemning the speech after TV news opted to cut away to factcheck the false claims</p><ul><li><a href=""https://www.theguardian.com/us-news/live/2020/nov/05/us-election-joe-biden-donald-trump-result-latest-who-is-winning-live-2020-updates"">US politics live – follow the latest in our live blog</a></li><li><a href=""https://www.theguardian.com/us-news/ng-interactive/2020/nov/05/us-election-2020-live-results-donald-trump-joe-biden-presidential-votes-arizona-nevada-pennsylvania-georgia"">Trump v Biden – full results as they come in</a></li></ul>",US news,News,article,Maanvi Singh and Max Benwell,"Donald Trump, US elections 2020, US news, US politics, The news on TV, Media, News agencies, Republicans, Democrats, Joe Biden",us-news/2020/nov/05/tv-news-cut-away-trump-election-lies
‘The risks are now off the table’: Wall Street looks forward to Biden presidency,2020-11-06T13:00:46Z,"<p>Without control of both the House and Senate, Biden’s high spending proposals are less likely to get through legislature<br></p><ul><li><a href=""https://www.theguardian.com/us-news/live/2020/nov/06/us-election-joe-biden-donald-trump-result-latest-who-is-winning-live-2020-updates"">US election 2020 live: follow the latest news, results and reaction</a></li><li><a href=""https://www.theguardian.com/us-news/ng-interactive/2020/nov/03/us-election-2020-live-results-donald-trump-joe-biden-who-won-presidential-republican-democrat"">Trump v Biden – full results as they come in</a></li></ul>",https://www.theguardian.com/business/2020/nov/06/the-risks-are-now-off-the-table-wall-street-looks-forward-to-biden-presidency,612,"<p>Without control of both the House and Senate, Biden’s high spending proposals are less likely to get through legislature<br></p><ul><li><a href=""https://www.theguardian.com/us-news/live/2020/nov/06/us-election-joe-biden-donald-trump-result-latest-who-is-winning-live-2020-updates"">US election 2020 live: follow the latest news, results and reaction</a></li><li><a href=""https://www.theguardian.com/us-news/ng-interactive/2020/nov/03/us-election-2020-live-results-donald-trump-joe-biden-who-won-presidential-republican-democrat"">Trump v Biden – full results as they come in</a></li></ul>",Business,News,article,Edward Helmore,"Stock markets, US politics, Business, US news, Donald Trump, Joe Biden, US elections 2020",business/2020/nov/06/the-risks-are-now-off-the-table-wall-street-looks-forward-to-biden-presidency
CNN’s John King and his ‘magic wall’ keep viewers entranced,2020-11-06T12:36:05Z,<p>US network’s indefatigable analyst has been one of the stars of this year’s TV election coverage</p>,https://www.theguardian.com/media/2020/nov/06/cnns-john-king-and-his-magic-wall-keep-viewers-entranced,518,<p>US network’s indefatigable analyst has been one of the stars of this year’s TV election coverage</p>,Media,News,article,Mark Sweney,"CNN, Media, TV news, Television industry, US elections 2020, US news, US politics, World news",media/2020/nov/06/cnns-john-king-and-his-magic-wall-keep-viewers-entranced
First Thing election special: Trump rages as power slips from his grasp,2020-11-06T11:15:31Z,"<p>The president continues to make false and dangerous claims of election theft, even as Biden edges ahead in Georgia. Plus, America’s rivals watch with glee</p>",https://www.theguardian.com/us-news/2020/nov/06/first-thing-election-special-trump-rages-as-power-slips-from-his-grasp,951,"<p>The president continues to make false and dangerous claims of election theft, even as Biden edges ahead in Georgia. Plus, America’s rivals watch with glee</p>",US news,News,article,Tim Walker,,us-news/2020/nov/06/first-thing-election-special-trump-rages-as-power-slips-from-his-grasp
What to do when your president has a temper tantrum,2020-11-06T10:42:37Z,"<p>For parents of small children, Donald Trump’s latest meltdown is extremely, totally, instantly recognisable</p>",https://www.theguardian.com/commentisfree/2020/nov/06/president-donald-trump-temper-tantrum-meltdown,870,"<p>For parents of small children, Donald Trump’s latest meltdown is extremely, totally, instantly recognisable</p>",Opinion,Opinion,article,Marina Hyde,"Donald Trump, US elections 2000, US news, US politics",commentisfree/2020/nov/06/president-donald-trump-temper-tantrum-meltdown
Trump repeats false claim of election win as Biden calls for 'patience',2020-11-06T10:13:03Z,"<ul><li>President rails against ‘election interference’ as Biden says ‘each ballot must be counted’</li><li><a href=""https://www.theguardian.com/us-news/live/2020/nov/05/us-election-joe-biden-donald-trump-result-latest-who-is-winning-live-2020-updates"">US politics live – follow the latest in our live blog</a></li><li><a href=""https://www.theguardian.com/us-news/ng-interactive/2020/nov/03/us-election-2020-live-results-donald-trump-joe-biden-who-won-presidential-republican-democrat"">Trump v Biden – full results as they come in</a></li></ul>",https://www.theguardian.com/us-news/2020/nov/05/biden-trump-us-election-2020-votes-count,1576,"<ul><li>President rails against ‘election interference’ as Biden says ‘each ballot must be counted’</li><li><a href=""https://www.theguardian.com/us-news/live/2020/nov/05/us-election-joe-biden-donald-trump-result-latest-who-is-winning-live-2020-updates"">US politics live – follow the latest in our live blog</a></li><li><a href=""https://www.theguardian.com/us-news/ng-interactive/2020/nov/03/us-election-2020-live-results-donald-trump-joe-biden-who-won-presidential-republican-democrat"">Trump v Biden – full results as they come in</a></li></ul>",US news,News,article,"Julian Borger, David Smith and Joan E Greve in Washington","Joe Biden, Donald Trump, US elections 2020, US politics, US news, Democrats, Republicans, World news, Election interference",us-news/2020/nov/05/biden-trump-us-election-2020-votes-count
Steven Berkoff’s teenage obsessions: ‘I became very adept at jive',2020-11-06T10:00:50Z,"<p>The actor and playwright on the magic of Italian, French and American cinema, dressing up to go dancing and falling in love with mime</p>",https://www.theguardian.com/film/2020/nov/06/steven-berkoffs-teenage-obsessions-i-became-very-adept-at-jive,1030,"<p>The actor and playwright on the magic of Italian, French and American cinema, dressing up to go dancing and falling in love with mime</p>",Film,Arts,article,Interview by Rich Pelley,"Film, Steven Berkoff, Classical music, Theatre, Stage, Art, Culture, Music, Art and design",film/2020/nov/06/steven-berkoffs-teenage-obsessions-i-became-very-adept-at-jive
Victoria's hotel quarantine program revealed to cost $195m – as it happened,2020-11-06T09:27:12Z,"<p>Four new coronavirus cases recorded in NSW southern highlands as Victoria quarantine inquiry delivers interim report. This blog is now closed</p><ul><li><a href=""https://www.theguardian.com/australia-news/live/2020/nov/06/australia-coronavirus-news-live-daniel-andrews-victoria-restrictions-hotel-quarantine-inquiry-report-high-court-borders-nsw-queensland-latest-updates?page=with:block-5fa4ae878f08d628a0b1d05c#block-5fa4ae878f08d628a0b1d05c"">Victoria’s hotel quarantine scheme cost $195m</a></li><li><a href=""https://www.theguardian.com/world/live/2020/nov/06/coronavirus-live-news-us-records-global-record-102000-new-cases-as-world-suffers-highest-daily-deaths"">Coronavirus global news – live updates</a><br></li></ul>",https://www.theguardian.com/australia-news/live/2020/nov/06/australia-coronavirus-news-live-daniel-andrews-victoria-restrictions-hotel-quarantine-inquiry-report-high-court-borders-nsw-queensland-latest-updates,7468,"<p>Four new coronavirus cases recorded in NSW southern highlands as Victoria quarantine inquiry delivers interim report. This blog is now closed</p><ul><li><a href=""https://www.theguardian.com/australia-news/live/2020/nov/06/australia-coronavirus-news-live-daniel-andrews-victoria-restrictions-hotel-quarantine-inquiry-report-high-court-borders-nsw-queensland-latest-updates?page=with:block-5fa4ae878f08d628a0b1d05c#block-5fa4ae878f08d628a0b1d05c"">Victoria’s hotel quarantine scheme cost $195m</a></li><li><a href=""https://www.theguardian.com/world/live/2020/nov/06/coronavirus-live-news-us-records-global-record-102000-new-cases-as-world-suffers-highest-daily-deaths"">Coronavirus global news – live updates</a><br></li></ul>",Australia news,News,liveblog,Elias Visontay and Josh Taylor,"Australia news, Coronavirus, Health, Business, Australian economy, Australian politics, New South Wales, Victoria, Queensland, Northern Territory, Western Australia, South Australia, Australian Capital Territory (ACT), Tasmania, Gladys Berejiklian",australia-news/live/2020/nov/06/australia-coronavirus-news-live-daniel-andrews-victoria-restrictions-hotel-quarantine-inquiry-report-high-court-borders-nsw-queensland-latest-updates
Donald Trump's election results speech: all the false claims,2020-11-06T09:08:55Z,"<p>As Joe Biden closes in on the presidency, the incumbent unleashed a torrent of misinformation from the White House press podium</p><ul><li><a href=""https://www.theguardian.com/us-news/live/2020/nov/05/us-election-joe-biden-donald-trump-result-latest-who-is-winning-live-2020-updates"">US politics live – follow the latest in our live blog</a></li><li><a href=""https://www.theguardian.com/us-news/ng-interactive/2020/nov/05/us-election-2020-live-results-donald-trump-joe-biden-presidential-votes-arizona-nevada-pennsylvania-georgia"">Trump v Biden – full results as they come in</a></li></ul>",https://www.theguardian.com/us-news/2020/nov/06/donald-trumps-speech-all-the-false-claims,907,"<p>As Joe Biden closes in on the presidency, the incumbent unleashed a torrent of misinformation from the White House press podium</p><ul><li><a href=""https://www.theguardian.com/us-news/live/2020/nov/05/us-election-joe-biden-donald-trump-result-latest-who-is-winning-live-2020-updates"">US politics live – follow the latest in our live blog</a></li><li><a href=""https://www.theguardian.com/us-news/ng-interactive/2020/nov/05/us-election-2020-live-results-donald-trump-joe-biden-presidential-votes-arizona-nevada-pennsylvania-georgia"">Trump v Biden – full results as they come in</a></li></ul>",US news,News,article,Staff and agencies,"US elections 2020, US news, US politics, Donald Trump, World news",us-news/2020/nov/06/donald-trumps-speech-all-the-false-claims
"From Supalonely to stadiums: meet Benee, a 'normal idiot from New Zealand'",2020-11-06T08:00:06Z,"<p>Playing proper shows in her post-pandemic homeland, making headlines for her politics and losing her privacy, the 20-year-old viral pop star is now learning to deal with real-life fame</p>",https://www.theguardian.com/music/2020/nov/06/benee-supalonely-star-new-zealand-post-covid-puppy-musician,1191,"<p>Playing proper shows in her post-pandemic homeland, making headlines for her politics and losing her privacy, the 20-year-old viral pop star is now learning to deal with real-life fame</p>",Music,Arts,article,Elle Hunt,"Pop and rock, Music, Culture, New Zealand",music/2020/nov/06/benee-supalonely-star-new-zealand-post-covid-puppy-musician
Friday briefing: Trump's hail of election lies from White House podium,2020-11-06T06:36:43Z,<p>Race still not called with Biden appealing for patience … president puts on extraordinary display … Republicans disown false claims about voting process</p>,https://www.theguardian.com/world/2020/nov/06/friday-briefing-trumps-hail-of-election-lies-from-white-house-podium,1613,<p>Race still not called with Biden appealing for patience … president puts on extraordinary display … Republicans disown false claims about voting process</p>,World news,News,article,Warren Murray,,world/2020/nov/06/friday-briefing-trumps-hail-of-election-lies-from-white-house-podium
"Trump falsely claims victory again, testing American democracy",2020-11-06T06:00:03Z,"<p>TV networks cut away as president continues to baselessly claim he’s won presidential election </p><ul><li><a href=""https://www.theguardian.com/australia-news/2020/oct/02/us-election-briefing-for-australia-sign-up-for-our-daily-email-newsletter?CMP=cvau_sfl"">Sign up to get this US election briefing for Australia delivered to your email inbox every weekday at 5pm</a></li><li><a href=""https://www.theguardian.com/us-news/live/2020/nov/05/us-election-joe-biden-donald-trump-result-latest-who-is-winning-live-2020-updates"">US election live updates: follow the latest news, results and reaction</a></li></ul>",https://www.theguardian.com/australia-news/2020/nov/06/trump-falsely-claims-victory-again-testing-american-democracy,821,"<p>TV networks cut away as president continues to baselessly claim he’s won presidential election </p><ul><li><a href=""https://www.theguardian.com/australia-news/2020/oct/02/us-election-briefing-for-australia-sign-up-for-our-daily-email-newsletter?CMP=cvau_sfl"">Sign up to get this US election briefing for Australia delivered to your email inbox every weekday at 5pm</a></li><li><a href=""https://www.theguardian.com/us-news/live/2020/nov/05/us-election-joe-biden-donald-trump-result-latest-who-is-winning-live-2020-updates"">US election live updates: follow the latest news, results and reaction</a></li></ul>",Australia news,News,article,Josephine Tovey,,australia-news/2020/nov/06/trump-falsely-claims-victory-again-testing-american-democracy
Trump may have broken his own record for most dangerous lies in one speech,2020-11-06T02:39:14Z,"<p>In 16 minutes, the liar-in-chief offered a downright dishonest take on the election that risked inciting violence</p><ul><li><a href=""https://www.theguardian.com/us-news/live/2020/nov/05/us-election-joe-biden-donald-trump-result-latest-who-is-winning-live-2020-updates"">US politics live – follow the latest in our live blog</a></li><li><a href=""https://www.theguardian.com/us-news/ng-interactive/2020/nov/03/us-election-2020-live-results-donald-trump-joe-biden-who-won-presidential-republican-democrat"">Trump v Biden – full results as they come in</a></li></ul>",https://www.theguardian.com/us-news/2020/nov/05/trump-record-lies-us-election,643,"<p>In 16 minutes, the liar-in-chief offered a downright dishonest take on the election that risked inciting violence</p><ul><li><a href=""https://www.theguardian.com/us-news/live/2020/nov/05/us-election-joe-biden-donald-trump-result-latest-who-is-winning-live-2020-updates"">US politics live – follow the latest in our live blog</a></li><li><a href=""https://www.theguardian.com/us-news/ng-interactive/2020/nov/03/us-election-2020-live-results-donald-trump-joe-biden-who-won-presidential-republican-democrat"">Trump v Biden – full results as they come in</a></li></ul>",US news,News,article,David Smith in Washington,"Donald Trump, US elections 2020, US news, US politics, Election interference",us-news/2020/nov/05/trump-record-lies-us-election
President reasserts false claims about electoral fraud – as it happened,2020-11-06T00:49:38Z,"<ul><li><strong>This live blog has now closed – <a href=""https://www.theguardian.com/us-news/live/2020/nov/05/us-election-joe-biden-donald-trump-result-latest-who-is-winning-live-2020-updates"">follow the US election live here instead</a></strong></li><li><a href=""https://www.theguardian.com/us-news/ng-interactive/2020/nov/03/us-election-2020-live-results-donald-trump-joe-biden-who-won-presidential-republican-democrat"">Trump v Biden – full results as they come in</a></li></ul>",https://www.theguardian.com/us-news/live/2020/nov/05/us-election-results-joe-biden-donald-trump-live-updates,11718,"<ul><li><strong>This live blog has now closed – <a href=""https://www.theguardian.com/us-news/live/2020/nov/05/us-election-joe-biden-donald-trump-result-latest-who-is-winning-live-2020-updates"">follow the US election live here instead</a></strong></li><li><a href=""https://www.theguardian.com/us-news/ng-interactive/2020/nov/03/us-election-2020-live-results-donald-trump-joe-biden-who-won-presidential-republican-democrat"">Trump v Biden – full results as they come in</a></li></ul>",US news,News,liveblog,"Maanvi Singh (now), Lauren Aratani, Joan E Greve and Martin Belam (earlier)","US elections 2020, Joe Biden, Donald Trump, Kamala Harris, Mike Pence, Coronavirus, US politics, US news",us-news/live/2020/nov/05/us-election-results-joe-biden-donald-trump-live-updates
Andrew Bolt's 'gloating' over US election result trumped by reality,2020-11-06T00:46:48Z,<p>Sky TV hosts celebrate Donald Trump’s re-election too early. Plus: Woolworths partnership with News Corp sparks backlash</p>,https://www.theguardian.com/media/2020/nov/06/andrew-bolts-gloating-over-us-election-result-trumped-by-reality,1386,<p>Sky TV hosts celebrate Donald Trump’s re-election too early. Plus: Woolworths partnership with News Corp sparks backlash</p>,Media,News,article,Amanda Meade,"Australian media, Media, Australian Broadcasting Corporation, News Corporation, Andrew Bolt, Sky News Australia, Woolworths, Australia news, Alan Jones, Nine Entertainment, Nine newspapers, Business",media/2020/nov/06/andrew-bolts-gloating-over-us-election-result-trumped-by-reality
A dysfunctional America helps China – but hurts Australia and our region,2020-11-05T23:31:59Z,<p>It doesn’t matter to Beijing who wins the presidential election. But a divided America may translate into an isolated Australia</p>,https://www.theguardian.com/commentisfree/2020/nov/06/a-dysfunctional-america-helps-china-but-hurts-australia-and-our-region,707,<p>It doesn’t matter to Beijing who wins the presidential election. But a divided America may translate into an isolated Australia</p>,Opinion,Opinion,article,Natasha Kassam,"China, Australian foreign policy, US elections 2020, Donald Trump, Joe Biden, Coronavirus, Asia Pacific, Australia news, US politics",commentisfree/2020/nov/06/a-dysfunctional-america-helps-china-but-hurts-australia-and-our-region
Facebook removes pro-Trump Stop the Steal group over 'calls for violence',2020-11-05T22:27:53Z,"<p>Hasty ban of political group raised questions about consistency and transparency of Facebook’s content moderation</p><ul><li><a href=""https://www.theguardian.com/us-news/live/2020/nov/05/us-election-results-joe-biden-donald-trump-live-updates"">US politics live – follow the latest in our live blog</a></li></ul>",https://www.theguardian.com/us-news/2020/nov/05/facebook-trump-stop-the-steal-group-removed,833,"<p>Hasty ban of political group raised questions about consistency and transparency of Facebook’s content moderation</p><ul><li><a href=""https://www.theguardian.com/us-news/live/2020/nov/05/us-election-results-joe-biden-donald-trump-live-updates"">US politics live – follow the latest in our live blog</a></li></ul>",US news,News,article,Julia Carrie Wong in San Francisco,"US elections 2020, Facebook, Republicans, Technology, Social networking, Media, US news, US politics",us-news/2020/nov/05/facebook-trump-stop-the-steal-group-removed
Trump lawyers petitioning supreme court have close ties to Brett Kavanaugh,2020-11-05T22:23:22Z,"<p>Justin Clark and William Consovoy, who are asking the court to intervene in the election, are, like Justice Kavanaugh, members of the conservative Federalist Society</p><ul><li><a href=""https://www.theguardian.com/us-news/live/2020/nov/05/us-election-joe-biden-donald-trump-result-latest-who-is-winning-live-2020-updates"">US politics live – follow the latest in our live blog</a></li><li><a href=""https://www.theguardian.com/us-news/ng-interactive/2020/nov/03/us-election-2020-live-results-donald-trump-joe-biden-who-won-presidential-republican-democrat"">Trump v Biden – full results as they come in</a></li></ul>",https://www.theguardian.com/law/2020/nov/05/trump-lawyers-supreme-court-brett-kavanaugh,938,"<p>Justin Clark and William Consovoy, who are asking the court to intervene in the election, are, like Justice Kavanaugh, members of the conservative Federalist Society</p><ul><li><a href=""https://www.theguardian.com/us-news/live/2020/nov/05/us-election-joe-biden-donald-trump-result-latest-who-is-winning-live-2020-updates"">US politics live – follow the latest in our live blog</a></li><li><a href=""https://www.theguardian.com/us-news/ng-interactive/2020/nov/03/us-election-2020-live-results-donald-trump-joe-biden-who-won-presidential-republican-democrat"">Trump v Biden – full results as they come in</a></li></ul>",US news,News,article,Stephanie Kirchgaessner in Washington,"US supreme court, Law (US), US news, US elections 2020, Republicans, Donald Trump, US politics",law/2020/nov/05/trump-lawyers-supreme-court-brett-kavanaugh
