headline,pub_date,snippet,web_url,word_count,abstract,section_name,pillar_name,type,byline,keywords,article_id
"The US has been silent on Honduras's drug problem, but that might be about to change",2021-03-24T09:00:34Z,<p><strong>Analysis: </strong>The Biden administration is expected to take a cooler approach to President Hernández than Donald Trump did</p>,https://www.theguardian.com/world/2021/mar/24/the-us-has-been-silent-on-hondurass-drug-problem-but-that-might-be-about-to-change,693,<p><strong>Analysis: </strong>The Biden administration is expected to take a cooler approach to President Hernández than Donald Trump did</p>,World news,News,article,Julian Borger in Washington,"Honduras, Joe Biden, US news, Americas",world/2021/mar/24/the-us-has-been-silent-on-hondurass-drug-problem-but-that-might-be-about-to-change
"Morning mail: Morrison apologises, vaccine rollout errors, Facebook leak",2021-03-23T19:45:26Z,<p><strong>Wednesday</strong>: Prime minister issues late-night statement over News Corp harassment comment. Plus: ‘Noah’s dinghy’ saves 400 animals in flood</p>,https://www.theguardian.com/australia-news/2021/mar/24/morning-mail-morrison-apologises-vaccine-rollout-errors-facebook-leak,1351,<p><strong>Wednesday</strong>: Prime minister issues late-night statement over News Corp harassment comment. Plus: ‘Noah’s dinghy’ saves 400 animals in flood</p>,Australia news,News,article,Tamara Howie,,australia-news/2021/mar/24/morning-mail-morrison-apologises-vaccine-rollout-errors-facebook-leak
Boulder shooting: suspect and 10 victims named by police,2021-03-23T16:53:16Z,"<ul><li>Police say 21-year-old man charged with 10 murder counts</li><li>Boulder police chief: ‘I feel numb and it’s heartbreaking’<br></li><li><a href=""https://www.theguardian.com/us-news/2021/mar/23/boulder-colorado-shooting-victims-officer-eric-talley"">Officer killed in Colorado shooting named as Eric Talley</a></li></ul>",https://www.theguardian.com/us-news/2021/mar/23/boulder-shooting-police-victims-suspect-grocery-store,881,"<ul><li>Police say 21-year-old man charged with 10 murder counts</li><li>Boulder police chief: ‘I feel numb and it’s heartbreaking’<br></li><li><a href=""https://www.theguardian.com/us-news/2021/mar/23/boulder-colorado-shooting-victims-officer-eric-talley"">Officer killed in Colorado shooting named as Eric Talley</a></li></ul>",US news,News,article,Amanda Holpuch in New York and Joan E Greve in Washington,"Boulder supermarket shooting, Colorado, US news, World news, Gun crime, US crime",us-news/2021/mar/23/boulder-shooting-police-victims-suspect-grocery-store
India beat England by 66 runs: first one-day international – as it happened,2021-03-23T16:26:20Z,<p>A barnstorming innings from Jonny Bairstow was followed by a dramatic collapse as India took a 1-0 lead in the ODI series</p>,https://www.theguardian.com/sport/live/2021/mar/23/india-v-england-first-one-day-international-live,9382,<p>A barnstorming innings from Jonny Bairstow was followed by a dramatic collapse as India took a 1-0 lead in the ODI series</p>,Sport,Sport,liveblog,Tim de Lisle (earlier) and Tanya Aldred (later),"England in India 2020-21, Cricket, Sport, India cricket team, England cricket team, Over by over reports",sport/live/2021/mar/23/india-v-england-first-one-day-international-live
Pro-Trump lawyer says ‘no reasonable person’ would believe her election lies,2021-03-23T15:51:14Z,"<p>Lawyers for Sidney Powell argued conspiracies she laid out constituted legally protected first amendment speech</p><ul><li><a href=""https://www.theguardian.com/us-news/series/us-politics-live/latest"">US politics – live coverage</a></li></ul>",https://www.theguardian.com/us-news/2021/mar/23/sidney-powell-trump-election-fraud-claims,744,"<p>Lawyers for Sidney Powell argued conspiracies she laid out constituted legally protected first amendment speech</p><ul><li><a href=""https://www.theguardian.com/us-news/series/us-politics-live/latest"">US politics – live coverage</a></li></ul>",US news,News,article,Tom McCarthy,"US news, Donald Trump, US elections 2020, US politics, World news",us-news/2021/mar/23/sidney-powell-trump-election-fraud-claims
"Boulder shooting: 10 killed, including police officer, at Colorado supermarket",2021-03-23T12:30:26Z,"<ul><li>Officer killed identified as Eric Talley, 51</li><li>One person of interest taken into custody</li></ul>",https://www.theguardian.com/us-news/2021/mar/22/boulder-colorado-active-shooter-supermarket,817,"<ul><li>Officer killed identified as Eric Talley, 51</li><li>One person of interest taken into custody</li></ul>",US news,News,article,Vivian Ho and agency,"Colorado, Gun crime, US news, World news, US crime, Boulder supermarket shooting",us-news/2021/mar/22/boulder-colorado-active-shooter-supermarket
'The EU did not rise to the challenge': UN special rapporteur on Europe's failure to fill human rights void,2021-03-23T12:00:32Z,"<p>Agnès Callamard, about to start as Amnesty International’s secretary general, paints dire global picture following disdain for human rights of Trump administration, China and Russia</p>",https://www.theguardian.com/law/2021/mar/23/agnes-callamard-human-rights-un-europe-amnesty-international,1209,"<p>Agnès Callamard, about to start as Amnesty International’s secretary general, paints dire global picture following disdain for human rights of Trump administration, China and Russia</p>",Law,News,article,Stephanie Kirchgaessner in Washington,"Human rights, United Nations, World news, Law, Europe, European Union",law/2021/mar/23/agnes-callamard-human-rights-un-europe-amnesty-international
Royal Portrush leading the race to host 2025 Open Championship,2021-03-23T11:48:40Z,<ul><li>Successful 2019 championship has put course in pole position</li><li>Plan was always for Portrush to host two Opens in a decade</li></ul>,https://www.theguardian.com/sport/2021/mar/23/royal-portrush-leading-the-race-to-host-2025-golf-open-championship,384,<ul><li>Successful 2019 championship has put course in pole position</li><li>Plan was always for Portrush to host two Opens in a decade</li></ul>,Sport,Sport,article,Ewan Murray,"The Open, European Tour, Golf, Sport",sport/2021/mar/23/royal-portrush-leading-the-race-to-host-2025-golf-open-championship
First thing: Boulder supermarket shooting leaves 10 dead,2021-03-23T11:05:38Z,"<p>A suspect has been arrested over the fatal shooting of 10 people including a police officer in a supermarket in Boulder, Colorado. Plus, the US sanctions China over alleged Uighur human rights abuses</p><ul><li><strong><a href=""https://www.theguardian.com/info/2018/sep/17/guardian-us-morning-briefing-sign-up-to-stay-informed"">Don’t already get First Thing in your inbox? Sign up here</a></strong></li></ul>",https://www.theguardian.com/us-news/2021/mar/23/first-thing-boulder-supermarket-shooting-leaves-10-dead,938,"<p>A suspect has been arrested over the fatal shooting of 10 people including a police officer in a supermarket in Boulder, Colorado. Plus, the US sanctions China over alleged Uighur human rights abuses</p><ul><li><strong><a href=""https://www.theguardian.com/info/2018/sep/17/guardian-us-morning-briefing-sign-up-to-stay-informed"">Don’t already get First Thing in your inbox? Sign up here</a></strong></li></ul>",US news,News,article,Molly Blackall,,us-news/2021/mar/23/first-thing-boulder-supermarket-shooting-leaves-10-dead
A Mexican mother tried to escape her abuser. She was one of 13 migrants to die on a California highway,2021-03-23T10:00:04Z,"<p>Carolina Ramírez Pérez was eligible for a US visa, but was forced to use dangerous methods to cross the border to safety, her family says</p>",https://www.theguardian.com/us-news/2021/mar/23/holtville-crash-migrant-deaths-carolina-ramirez-perez,1679,"<p>Carolina Ramírez Pérez was eligible for a US visa, but was forced to use dangerous methods to cross the border to safety, her family says</p>",US news,News,article,Vivian Ho,"US immigration, Domestic violence, US-Mexico border, California, Mexico, US news",us-news/2021/mar/23/holtville-crash-migrant-deaths-carolina-ramirez-perez
Can anyone become an NFT collector? I tried it to find out ,2021-03-23T09:00:01Z,<p>This year non-fungible tokens burst into the mainstream after several digital images and animations sold for absurd amounts – so I entered the world of NFTs myself</p>,https://www.theguardian.com/artanddesign/2021/mar/23/can-anyone-become-nft-collector-non-fungible-token,1236,<p>This year non-fungible tokens burst into the mainstream after several digital images and animations sold for absurd amounts – so I entered the world of NFTs myself</p>,Art and design,Arts,article,Oscar Schwartz,"Digital art, Non-fungible tokens (NFTs), Art, Cryptocurrencies, E-commerce, Technology, Bitcoin, Blockchain, Internet",artanddesign/2021/mar/23/can-anyone-become-nft-collector-non-fungible-token
Texas ramps up efforts to derail progressive policies,2021-03-23T05:00:52Z,"<p>The state filed the first major lawsuit against Biden’s administration, marking a return to a tried and true playbook of weaponizing the courts</p>",https://www.theguardian.com/us-news/2021/mar/23/texas-republican-party-ken-paxton-greg-abbott,1030,"<p>The state filed the first major lawsuit against Biden’s administration, marking a return to a tried and true playbook of weaponizing the courts</p>",US news,News,article,Alexandra Villarreal in Austin,"Texas, US politics, Republicans, Democrats, US news",us-news/2021/mar/23/texas-republican-party-ken-paxton-greg-abbott
Senate confirms Boston mayor Marty Walsh as Biden's labor secretary,2021-03-23T00:48:43Z,<p>Cabinet nearly assembled but president still must make hundreds of other federal appointments</p>,https://www.theguardian.com/us-news/2021/mar/22/biden-administration-marty-walsh-labor-secretary-confirmed,476,<p>Cabinet nearly assembled but president still must make hundreds of other federal appointments</p>,US news,News,article,Guardian staff and agencies,"Biden administration, US Senate, US news, US politics",us-news/2021/mar/22/biden-administration-marty-walsh-labor-secretary-confirmed
"UFO report details ‘difficult to explain’ sightings, says US ex-intelligence director",2021-03-22T13:43:54Z,"<p>US military pilots and satellites have recorded ‘a lot more’ UFO sightings than have been made public, John Ratcliffe says</p>",https://www.theguardian.com/us-news/2021/mar/22/us-government-ufo-report-sightings,451,"<p>US military pilots and satellites have recorded ‘a lot more’ UFO sightings than have been made public, John Ratcliffe says</p>",US news,News,article,Tom McCarthy,"US military, UFOs, US news, World news",us-news/2021/mar/22/us-government-ufo-report-sightings
"Trump still being investigated over Capitol riot, top prosecutor says",2021-03-22T11:53:20Z,"<ul><li>Attorney says there are now more than 400 cases against participants</li><li><a href=""https://www.theguardian.com/us-news/2021/mar/22/roger-stone-capitol-attack-investigation-far-right"">Roger Stone faces fresh scrutiny over Capitol attack</a></li></ul>",https://www.theguardian.com/us-news/2021/mar/22/donald-trump-capitol-riot-michael-sherwin,663,"<ul><li>Attorney says there are now more than 400 cases against participants</li><li><a href=""https://www.theguardian.com/us-news/2021/mar/22/roger-stone-capitol-attack-investigation-far-right"">Roger Stone faces fresh scrutiny over Capitol attack</a></li></ul>",US news,News,article,Martin Pengelly in New York,"Donald Trump, US news, US Capitol attack, US politics, US crime",us-news/2021/mar/22/donald-trump-capitol-riot-michael-sherwin
First Thing: lawmakers point fingers over US border issue,2021-03-22T10:46:17Z,"<p>With rising numbers of people attempting to cross, both parties are blaming the other for strain at the US border. Plus, why are so many Republican men set to refuse a Covid vaccine?</p>",https://www.theguardian.com/us-news/2021/mar/22/first-thing-lawmakers-point-fingers-over-us-border-issue,998,"<p>With rising numbers of people attempting to cross, both parties are blaming the other for strain at the US border. Plus, why are so many Republican men set to refuse a Covid vaccine?</p>",US news,News,article,Molly Blackall,US news,us-news/2021/mar/22/first-thing-lawmakers-point-fingers-over-us-border-issue
‘Wife No 5 is the last’: Back to the Future’s Christopher Lloyd on love and life,2021-03-22T06:00:17Z,"<p>In 1984, Lloyd was playing a Klingon in Star Trek; today he’s William Shatner’s friend in the romcom Senior Moment. Soon, he will be King Lear. Is there a logic to his apparently chaotic career? </p>",https://www.theguardian.com/film/2021/mar/22/wife-no-5-is-the-last-back-to-the-futures-christopher-lloyd-on-love-and-life,1904,"<p>In 1984, Lloyd was playing a Klingon in Star Trek; today he’s William Shatner’s friend in the romcom Senior Moment. Soon, he will be King Lear. Is there a logic to his apparently chaotic career? </p>",Film,Arts,article,Toby Moses,"Christopher Lloyd, Life and style, Film, Back To The Future",film/2021/mar/22/wife-no-5-is-the-last-back-to-the-futures-christopher-lloyd-on-love-and-life
Roger Stone faces fresh scrutiny as Capitol attack investigation expands,2021-03-22T06:00:16Z,<p>Trump ally was not part of the 6 January riot but he had numerous contacts with key far-right groups and figures involved</p>,https://www.theguardian.com/us-news/2021/mar/22/roger-stone-capitol-attack-investigation-far-right,1171,<p>Trump ally was not part of the 6 January riot but he had numerous contacts with key far-right groups and figures involved</p>,US news,News,article,Peter Stone in Washington,"Roger Stone, US Capitol attack, The far right, Law (US), US news",us-news/2021/mar/22/roger-stone-capitol-attack-investigation-far-right
Working from Home review – Johnny Vegas's chaotic pub quiz is a winner,2021-03-22T06:00:16Z,"<p><strong>Available online</strong><br>Just the Tonic’s three-hour standup sprawl comes close to the comedy club experience, featuring Matt Forde’s Boris tribute and Jason Byrne’s toilet trumpet alongside Vegas</p>",https://www.theguardian.com/stage/2021/mar/22/just-the-tonic-working-from-home-review-johnny-vegas-matt-forde-jason-byrne,381,"<p><strong>Available online</strong><br>Just the Tonic’s three-hour standup sprawl comes close to the comedy club experience, featuring Matt Forde’s Boris tribute and Jason Byrne’s toilet trumpet alongside Vegas</p>",Stage,Arts,article,Brian Logan,"Stage, Comedy, Comedy, Culture, Johnny Vegas, Hal Cruttenden",stage/2021/mar/22/just-the-tonic-working-from-home-review-johnny-vegas-matt-forde-jason-byrne
"Morning mail: NSW floods worsen, Australia exports 'negative climate policy', Trump returns",2021-03-21T20:00:14Z,<p><strong>Monday</strong>: Heavy rain and flooding is expected in NSW today with more evacuations expected. Plus: how green are your leggings? </p>,https://www.theguardian.com/australia-news/2021/mar/22/morning-mail-nsw-floods-worsen-australia-exports-negative-climate-policy-trump-returns,1287,<p><strong>Monday</strong>: Heavy rain and flooding is expected in NSW today with more evacuations expected. Plus: how green are your leggings? </p>,Australia news,News,article,Imogen Dewey,,australia-news/2021/mar/22/morning-mail-nsw-floods-worsen-australia-exports-negative-climate-policy-trump-returns
Mayorkas blames Trump for border woes as Republicans attack Biden,2021-03-21T17:30:59Z,"<ul><li>Homeland security secretary pressed in Sunday interviews</li><li>GOP sees chance to hammer new administration</li><li><a href=""https://www.theguardian.com/us-news/2021/mar/20/joe-biden-challenge-trump-border-legacy"">‘Blindsided’: Biden faces tough test on immigration</a></li></ul>",https://www.theguardian.com/us-news/2021/mar/21/mayorkas-trump-biden-border-republicans-migrant-children-immigration,920,"<ul><li>Homeland security secretary pressed in Sunday interviews</li><li>GOP sees chance to hammer new administration</li><li><a href=""https://www.theguardian.com/us-news/2021/mar/20/joe-biden-challenge-trump-border-legacy"">‘Blindsided’: Biden faces tough test on immigration</a></li></ul>",US news,News,article,Ed Pilkington in New York,"US-Mexico border, US immigration, US news, US politics, Biden administration, Republicans, Democrats, World news, US Congress, US Senate, US domestic policy, US foreign policy",us-news/2021/mar/21/mayorkas-trump-biden-border-republicans-migrant-children-immigration
'We all know hate when we see it': Warnock rejects FBI chief's view of Atlanta shootings,2021-03-21T15:52:39Z,"<ul><li>FBI director: ‘it does not appear motive was racially motivated’</li><li><a href=""https://www.theguardian.com/us-news/2021/mar/20/asian-americans-racism-atlanta-shootings"">What the Atlanta shootings reveal about the US</a></li></ul>",https://www.theguardian.com/us-news/2021/mar/21/atlanta-shootings-asian-americans-raphael-warnock-race-hate-crimes-georgia,718,"<ul><li>FBI director: ‘it does not appear motive was racially motivated’</li><li><a href=""https://www.theguardian.com/us-news/2021/mar/20/asian-americans-racism-atlanta-shootings"">What the Atlanta shootings reveal about the US</a></li></ul>",US news,News,article,Martin Pengelly,"Atlanta spa shootings, US news, Race, US politics, Georgia, Atlanta",us-news/2021/mar/21/atlanta-shootings-asian-americans-raphael-warnock-race-hate-crimes-georgia
Kamala Harris sidesteps question of her role to take Biden's message on the road,2021-03-21T09:00:51Z,<p>Aides and allies say it is too early to define the vice-president’s portfolio but she is unlikely to be confined to just one subject area</p>,https://www.theguardian.com/us-news/2021/mar/21/kamala-harris-vice-president-role-biden,863,<p>Aides and allies say it is too early to define the vice-president’s portfolio but she is unlikely to be confined to just one subject area</p>,US news,News,article,Daniel Strauss in Washington,"Kamala Harris, Biden administration, US politics, US news",us-news/2021/mar/21/kamala-harris-vice-president-role-biden
It makes no sense to think of London as another country. The capital is us,2021-03-21T08:30:50Z,"<p>Yes, we are too centralised as a nation. But a successful Britain will always need a thriving London</p>",https://www.theguardian.com/commentisfree/2021/mar/21/it-makes-no-sense-to-think-of-london-as-another-country-the-capital-is-us,944,"<p>Yes, we are too centralised as a nation. But a successful Britain will always need a thriving London</p>",Opinion,Opinion,article,Will Hutton,"London, BBC, Conservatives, UK news, Sadiq Khan, Politics, Media, Equality and Human Rights Commission (EHRC), Shaun Bailey, Society",commentisfree/2021/mar/21/it-makes-no-sense-to-think-of-london-as-another-country-the-capital-is-us
Downing Street’s £2.6m briefing room screams Worst Marketing Conference Ever,2021-03-21T07:15:48Z,"<p>The Tories might have been after Patriotism, Authority and Tradition, but all they got was blue, blue and more blue</p>",https://www.theguardian.com/commentisfree/2021/mar/21/downing-street-2m-briefing-room-screams-worsrt-marketing-conference-ever,644,"<p>The Tories might have been after Patriotism, Authority and Tradition, but all they got was blue, blue and more blue</p>",Opinion,Opinion,article,Rowan Moore,"Conservatives, Media, UK news, Politics, Architecture, Art and design, Culture",commentisfree/2021/mar/21/downing-street-2m-briefing-room-screams-worsrt-marketing-conference-ever
'A new chapter in an old story': what the Atlanta shootings reveal about the US,2021-03-21T06:00:47Z,"<p>After killings that followed a year of escalating hatred, Asian Americans ask why no one heeded the warnings<br></p>",https://www.theguardian.com/us-news/2021/mar/20/asian-americans-racism-atlanta-shootings,2035,"<p>After killings that followed a year of escalating hatred, Asian Americans ask why no one heeded the warnings<br></p>",US news,News,article,Ed Pilkington,"Atlanta spa shootings, Gun crime, Race, US news",us-news/2021/mar/20/asian-americans-racism-atlanta-shootings
'A similar challenge': how Joe Biden echoes Kennedys on US foreign policy,2021-03-21T06:00:47Z,"<p>The president does not just share Irish roots with John, Robert and Ted Kennedy – he also wants to lead America in the world</p>",https://www.theguardian.com/us-news/2021/mar/21/joe-biden-kennedys-us-foreign-policy,1685,"<p>The president does not just share Irish roots with John, Robert and Ted Kennedy – he also wants to lead America in the world</p>",US news,News,article,David Smith in Washington,"Joe Biden, Biden administration, US politics, US foreign policy, US national security, US news, World news, Democrats, John F Kennedy, Robert Kennedy, Edward Kennedy",us-news/2021/mar/21/joe-biden-kennedys-us-foreign-policy
Atlanta spa shootings: Georgia hate crimes law could see first big test,2021-03-20T21:08:30Z,"<ul><li>Law was passed after killing of Ahmaud Arbery in 2020</li><li><a href=""https://www.theguardian.com/us-news/datablog/2021/mar/20/asian-american-hate-crime-data-mona-chalabi"">Atlanta shootings: why US hate crime data is so lacking</a></li></ul>",https://www.theguardian.com/us-news/2021/mar/20/atlanta-spa-shootings-georgia-prosecutors-hate-crimes-law-ahmaud-arbery,958,"<ul><li>Law was passed after killing of Ahmaud Arbery in 2020</li><li><a href=""https://www.theguardian.com/us-news/datablog/2021/mar/20/asian-american-hate-crime-data-mona-chalabi"">Atlanta shootings: why US hate crime data is so lacking</a></li></ul>",US news,News,article,Lois Beckett and agencies,"Atlanta spa shootings, Atlanta, US news, Georgia, World news, Race, Protest, US crime, Gun crime, US politics",us-news/2021/mar/20/atlanta-spa-shootings-georgia-prosecutors-hate-crimes-law-ahmaud-arbery
"Capitol attack: more than 60 Proud Boys used encrypted channel to plan, indictment says",2021-03-20T18:58:21Z,"<ul><li>Indictment includes conspiracy charges against four alleged leaders</li><li><a href=""https://www.theguardian.com/us-news/2021/mar/19/us-capitol-attack-fbi-suspects-footage"">FBI releases attack footage as it seeks to identify 10 suspects</a></li></ul>",https://www.theguardian.com/us-news/2021/mar/20/four-proud-boys-leaders-indicted-capitol-riot-donald-trump,995,"<ul><li>Indictment includes conspiracy charges against four alleged leaders</li><li><a href=""https://www.theguardian.com/us-news/2021/mar/19/us-capitol-attack-fbi-suspects-footage"">FBI releases attack footage as it seeks to identify 10 suspects</a></li></ul>",US news,News,article,Lois Beckett and agencies,"US Capitol attack, US politics, US news, The far right, US crime, World news",us-news/2021/mar/20/four-proud-boys-leaders-indicted-capitol-riot-donald-trump
Unmasked: man behind cult set to replace QAnon,2021-03-20T18:00:32Z,<p>The creator of the rapidly growing ‘Sabmyk Network’ is said to be a Berlin art dealer with a record of media manipulation</p>,https://www.theguardian.com/us-news/2021/mar/20/revealed-man-behind-fast-growing-cult-becoming-the-new-qanon-sabmyk-network,661,<p>The creator of the rapidly growing ‘Sabmyk Network’ is said to be a Berlin art dealer with a record of media manipulation</p>,US news,News,article,Mark Townsend,"QAnon, The far right, World news, UK news, Donald Trump, US news, Social media, Digital media, Media, Internet, Technology",us-news/2021/mar/20/revealed-man-behind-fast-growing-cult-becoming-the-new-qanon-sabmyk-network
'Climate facts are back': EPA brings science back to website after Trump purge,2021-03-20T12:00:25Z,<p>Move reverses former president’s order to drop all references to the climate emergency on government websites</p>,https://www.theguardian.com/environment/2021/mar/20/epa-climate-facts-joe-biden-trump-purge,555,<p>Move reverses former president’s order to drop all references to the climate emergency on government websites</p>,Environment,News,article,Richard Luscombe in Miami,"US Environmental Protection Agency, Climate crisis, Biden administration, US politics, Environment, US news",environment/2021/mar/20/epa-climate-facts-joe-biden-trump-purge
'It's time for people to hear us': Georgia's Asian Americans vow to stand up against hate,2021-03-20T09:00:22Z,<p>The high-profile response from local leaders reflects a change in a state where Asian American voices have been historically unheard </p>,https://www.theguardian.com/us-news/2021/mar/20/georgia-asian-american-population-atlanta-shootings,1538,<p>The high-profile response from local leaders reflects a change in a state where Asian American voices have been historically unheard </p>,US news,News,article,Timothy Pratt  in Atlanta,"Georgia, Atlanta spa shootings, US news, World news",us-news/2021/mar/20/georgia-asian-american-population-atlanta-shootings
This is the Fire review: Don Lemon's audacious study of racism – and love,2021-03-20T05:00:16Z,<p>The CNN anchor’s thoughts on being a ‘double negative’ – Black and gay – show he has grown while his country largely has not</p>,https://www.theguardian.com/world/2021/mar/20/this-the-fire-review-don-lemon-cnn,995,<p>The CNN anchor’s thoughts on being a ‘double negative’ – Black and gay – show he has grown while his country largely has not</p>,World news,News,article,Michael Henry Adams,"Race, Autobiography and memoir, LGBTQ+ rights, Politics books, World news, Protest, US politics, Books, Culture, CNN, Media",world/2021/mar/20/this-the-fire-review-don-lemon-cnn
