headline,pub_date,snippet,web_url,word_count,abstract,section_name,pillar_name,type,byline,keywords,article_id
Colorado wildfires: tens of thousands evacuated as blazes destroy hundreds of homes,2021-12-31T18:15:51Z,<p>At least one first responder and six other people were injured in the fires after fires erupted Thursday outside Denver</p>,https://www.theguardian.com/us-news/2021/dec/31/colorado-wildfires-thousands-evacuate-blazes-destroy-homes,838,<p>At least one first responder and six other people were injured in the fires after fires erupted Thursday outside Denver</p>,US news,News,article,Maya Yang and agencies,"Colorado, Wildfires, US news, Denver",us-news/2021/dec/31/colorado-wildfires-thousands-evacuate-blazes-destroy-homes
Ghislaine Maxwell and Epstein thought they could get away with anything,2021-12-31T17:00:25Z,"<p>Maxwell had reason to believe she would get away with her crimes – she was a rich, well-connected member of the elite</p>",https://www.theguardian.com/commentisfree/2021/dec/31/ghislaine-maxwell-jeffrey-epstein-crimes-wealth-power,907,"<p>Maxwell had reason to believe she would get away with her crimes – she was a rich, well-connected member of the elite</p>",Opinion,Opinion,article,Nancy Jo Sales,"Ghislaine Maxwell, Jeffrey Epstein, US news, World news",commentisfree/2021/dec/31/ghislaine-maxwell-jeffrey-epstein-crimes-wealth-power
New York presses ahead with New Year’s Eve party despite record Covid cases ,2021-12-31T15:34:35Z,"<p>‘We’re fighting our way through this,’ says outgoing mayor Bill de Blasio, but decision is in contrast to public health messaging </p>",https://www.theguardian.com/us-news/2021/dec/31/new-york-times-square-new-years-eve-party-covid-surge,825,"<p>‘We’re fighting our way through this,’ says outgoing mayor Bill de Blasio, but decision is in contrast to public health messaging </p>",US news,News,article,Edward Helmore in New York,"New York, Bill de Blasio, US news, US politics, Coronavirus, Omicron variant",us-news/2021/dec/31/new-york-times-square-new-years-eve-party-covid-surge
First Thing: Biden and Putin exchange warnings amid Ukraine tensions,2021-12-31T10:54:41Z,<p>Presidents share 50-minute phone call – their second conversation this month – as Russia continues to amass troops along  Ukraine border</p>,https://www.theguardian.com/us-news/2021/dec/31/first-thing-biden-and-putin-exchange-warnings-amid-ukraine-tensions,934,<p>Presidents share 50-minute phone call – their second conversation this month – as Russia continues to amass troops along  Ukraine border</p>,US news,News,article,Vivian Ho,,us-news/2021/dec/31/first-thing-biden-and-putin-exchange-warnings-amid-ukraine-tensions
Americans seeking to renounce their citizenship are stuck with it for now,2021-12-31T07:00:13Z,"<p>As many as 30,000 citizens living abroad have been unable to secure a ‘loss of nationality’ interview during the pandemic</p>",https://www.theguardian.com/us-news/2021/dec/31/americans-seeking-renounce-citizenship-stuck,1123,"<p>As many as 30,000 citizens living abroad have been unable to secure a ‘loss of nationality’ interview during the pandemic</p>",US news,News,article,Ed Pilkington in New York,"US news, World news",us-news/2021/dec/31/americans-seeking-renounce-citizenship-stuck
The Guardian view on Yemen: the forgotten war,2021-12-30T18:25:03Z,<p>Years of brutal conflict have brought misery to an already impoverished country. There is no end in sight</p>,https://www.theguardian.com/commentisfree/2021/dec/30/the-guardian-view-on-yemen-the-forgotten-war,567,<p>Years of brutal conflict have brought misery to an already impoverished country. There is no end in sight</p>,Opinion,Opinion,article,Editorial,"Yemen, Middle East and north Africa, Saudi Arabia, United Nations, Iran, US foreign policy, Internally displaced people, Houthis",commentisfree/2021/dec/30/the-guardian-view-on-yemen-the-forgotten-war
‘Patriots’ are undermining American democracy,2021-12-30T11:00:03Z,<p>The people who stormed the US Capitol on 6 January don’t understand that nationalism is not the same as patriotism</p>,https://www.theguardian.com/us-news/2021/dec/30/patriots-are-undermining-american-democracy,992,<p>The people who stormed the US Capitol on 6 January don’t understand that nationalism is not the same as patriotism</p>,Opinion,Opinion,article,Michael Harriot,"US news, US politics, World news, US Capitol attack",us-news/2021/dec/30/patriots-are-undermining-american-democracy
"‘For me, it’s about the mission’: why Cori Bush is just getting started in Congress ",2021-12-30T09:00:46Z,<p>Missouri congresswoman says she was sent to Washington to disrupt the political order that had long stopped working for people like herself</p>,https://www.theguardian.com/us-news/2021/dec/30/cori-bush-congresswoman-missouri,1378,<p>Missouri congresswoman says she was sent to Washington to disrupt the political order that had long stopped working for people like herself</p>,US news,News,article,Lauren Gambino in Washington,"Cori Bush, US news, US politics, Democrats, Biden administration, World news",us-news/2021/dec/30/cori-bush-congresswoman-missouri
A Time Outside This Time by Amitava Kumar review – #fakenews onslaught,2021-12-30T09:00:46Z,<p>An erudite attempt to skewer our media overload amid the sound and fury of the Trump years – but character and heart are missing</p>,https://www.theguardian.com/books/2021/dec/30/a-time-outside-this-time-by-amitava-kumar-review-fakenews-onslaught,731,<p>An erudite attempt to skewer our media overload amid the sound and fury of the Trump years – but character and heart are missing</p>,Books,Arts,article,Matt Rowland Hill,"Fiction, Books, Culture",books/2021/dec/30/a-time-outside-this-time-by-amitava-kumar-review-fakenews-onslaught
 US cities scale back New Year’s Eve events and urge people to scrap parties,2021-12-30T07:00:43Z,<p>Americans face stay-at-home celebration again as some mayors scale back or cancel public events amid Covid surge</p>,https://www.theguardian.com/us-news/2021/dec/30/us-new-years-eve-stay-at-home-scale-back-events,664,<p>Americans face stay-at-home celebration again as some mayors scale back or cancel public events amid Covid surge</p>,US news,News,article,Edward Helmore,"US news, New York, Atlanta, San Francisco, Las Vegas, Seattle",us-news/2021/dec/30/us-new-years-eve-stay-at-home-scale-back-events
Prosecutors hail Maxwell guilty verdict for ‘one of the worst crimes imaginable’ – as it happened,2021-12-30T05:03:08Z,"<ul><li><a href=""https://www.theguardian.com/us-news/2021/dec/29/ghislaine-maxwell-sex-trafficking-trial-verdict"">British socialite found guilty in sex-trafficking trial on five of six charges</a></li><li><a href=""https://www.theguardian.com/us-news/2021/dec/29/ghislaine-maxwell-jeffrey-epstein-accusers-stories"">How Ghislaine Maxwell, 60, lured girls into Jeffrey Epstein’s orbit</a></li><li><a href=""https://www.theguardian.com/us-news/2021/dec/29/ghislaine-maxwell-social-circle-jeffrey-epstein"">Stage for trial set in 1991 after Ghislaine Maxwell met Jeffrey Epstein</a></li><li><a href=""https://www.theguardian.com/us-news/2021/dec/29/ghislaine-maxwell-trial-key-moments"">Wealth and power: key moments from the sex-trafficking trial</a></li></ul>",https://www.theguardian.com/us-news/live/2021/dec/29/ghislaine-maxwell-sex-trafficking-trial-live-blog-latest,4620,"<ul><li><a href=""https://www.theguardian.com/us-news/2021/dec/29/ghislaine-maxwell-sex-trafficking-trial-verdict"">British socialite found guilty in sex-trafficking trial on five of six charges</a></li><li><a href=""https://www.theguardian.com/us-news/2021/dec/29/ghislaine-maxwell-jeffrey-epstein-accusers-stories"">How Ghislaine Maxwell, 60, lured girls into Jeffrey Epstein’s orbit</a></li><li><a href=""https://www.theguardian.com/us-news/2021/dec/29/ghislaine-maxwell-social-circle-jeffrey-epstein"">Stage for trial set in 1991 after Ghislaine Maxwell met Jeffrey Epstein</a></li><li><a href=""https://www.theguardian.com/us-news/2021/dec/29/ghislaine-maxwell-trial-key-moments"">Wealth and power: key moments from the sex-trafficking trial</a></li></ul>",US news,News,liveblog,Samantha Lock (now) and Joanna Walters(earlier) in New York,"Ghislaine Maxwell, Jeffrey Epstein, US crime, US news, World news, New York",us-news/live/2021/dec/29/ghislaine-maxwell-sex-trafficking-trial-live-blog-latest
No 10 hired US lawyers to advise on Lewinsky scandal before Blair visit to US,2021-12-30T00:01:35Z,<p>Newly released papers show Downing Street got advice on Bill Clinton’s legal position before 1998 Washington trip</p>,https://www.theguardian.com/politics/2021/dec/30/no-10-hired-us-lawyers-to-advise-on-lewinsky-scandal-before-blair-visit-to-us,598,<p>Newly released papers show Downing Street got advice on Bill Clinton’s legal position before 1998 Washington trip</p>,Politics,News,article,Caroline Davies,"Politics past, Bill Clinton, Tony Blair, Monica Lewinsky, Politics, UK news, National Archives",politics/2021/dec/30/no-10-hired-us-lawyers-to-advise-on-lewinsky-scandal-before-blair-visit-to-us
"UK cases hit new daily record of 183,037; Spain cuts isolation period to seven days – as it happened",2021-12-29T23:58:51Z,"<p><a href=""https://www.theguardian.com/world/live/2021/dec/29/covid-news-live-infections-hit-record-highs-across-europe-south-africa-reinstates-contact-tracing-and-isolation?page=with:block-61cc93cb8f088fd750193858#block-61cc93cb8f088fd750193858"">Case figures include delayed data from Northern Ireland</a>; <a href=""https://www.theguardian.com/world/live/2021/dec/29/covid-news-live-infections-hit-record-highs-across-europe-south-africa-reinstates-contact-tracing-and-isolation?page=with:block-61cc94cb8f08df2f5b4e20c1#block-61cc94cb8f08df2f5b4e20c1"">Spain cuts quarantine despite record rise in cases</a></p><ul><li><a href=""https://www.theguardian.com/world/2021/dec/29/uk-reports-another-record-rise-in-covid-cases"">UK reports another record daily Covid case rise as figures exceed 183,000</a></li><li><a href=""https://www.theguardian.com/world/2021/dec/29/french-daily-covid-cases-above-200000-as-italy-considers-stricter-green-pass"">French daily Covid cases above 200,000 as Italy considers measures</a></li><li><a href=""https://www.theguardian.com/us-news/2021/dec/29/us-sets-record-daily-covid-cases-omicron-surge"">US sets record for new daily Covid cases amid Omicron surge</a></li><li><a href=""https://www.theguardian.com/world/2021/dec/29/how-can-we-measure-the-true-scale-of-uk-covid-hospital-admissions"">How can we measure the true scale of UK Covid hospital admissions?</a></li><li><a href=""https://www.theguardian.com/world/coronavirus-outbreak"">See all our coronavirus coverage</a></li></ul>",https://www.theguardian.com/world/live/2021/dec/29/covid-news-live-infections-hit-record-highs-across-europe-south-africa-reinstates-contact-tracing-and-isolation,14796,"<p><a href=""https://www.theguardian.com/world/live/2021/dec/29/covid-news-live-infections-hit-record-highs-across-europe-south-africa-reinstates-contact-tracing-and-isolation?page=with:block-61cc93cb8f088fd750193858#block-61cc93cb8f088fd750193858"">Case figures include delayed data from Northern Ireland</a>; <a href=""https://www.theguardian.com/world/live/2021/dec/29/covid-news-live-infections-hit-record-highs-across-europe-south-africa-reinstates-contact-tracing-and-isolation?page=with:block-61cc94cb8f08df2f5b4e20c1#block-61cc94cb8f08df2f5b4e20c1"">Spain cuts quarantine despite record rise in cases</a></p><ul><li><a href=""https://www.theguardian.com/world/2021/dec/29/uk-reports-another-record-rise-in-covid-cases"">UK reports another record daily Covid case rise as figures exceed 183,000</a></li><li><a href=""https://www.theguardian.com/world/2021/dec/29/french-daily-covid-cases-above-200000-as-italy-considers-stricter-green-pass"">French daily Covid cases above 200,000 as Italy considers measures</a></li><li><a href=""https://www.theguardian.com/us-news/2021/dec/29/us-sets-record-daily-covid-cases-omicron-surge"">US sets record for new daily Covid cases amid Omicron surge</a></li><li><a href=""https://www.theguardian.com/world/2021/dec/29/how-can-we-measure-the-true-scale-of-uk-covid-hospital-admissions"">How can we measure the true scale of UK Covid hospital admissions?</a></li><li><a href=""https://www.theguardian.com/world/coronavirus-outbreak"">See all our coronavirus coverage</a></li></ul>",World news,News,liveblog,"Samantha Lock (now); Léonie Chao-Fong, Lucy Campbell and Nicola Slawson (earlier)","Coronavirus, World news, Europe, Vaccines and immunisation, China, UK news, Australia news, South Africa, Omicron variant, World Health Organization, Scotland, France",world/live/2021/dec/29/covid-news-live-infections-hit-record-highs-across-europe-south-africa-reinstates-contact-tracing-and-isolation
Ghislaine Maxwell found guilty in sex-trafficking trial ,2021-12-29T23:29:45Z,"<p>Maxwell, 60, convicted on five of the six charges she faced as US prosecutors hail verdict and say ‘justice has been done’</p><ul><li><em>This article contains descriptions of sexual abuse</em></li></ul>",https://www.theguardian.com/us-news/2021/dec/29/ghislaine-maxwell-sex-trafficking-trial-verdict,1336,"<p>Maxwell, 60, convicted on five of the six charges she faced as US prosecutors hail verdict and say ‘justice has been done’</p><ul><li><em>This article contains descriptions of sexual abuse</em></li></ul>",US news,News,article,Victoria Bekiempis in New York,"Ghislaine Maxwell, US news, World news, Jeffrey Epstein, US crime, New York",us-news/2021/dec/29/ghislaine-maxwell-sex-trafficking-trial-verdict
Silverwood to miss fourth Ashes Test after new Covid case in England party,2021-12-29T21:43:03Z,<ul><li>Head coach named as close contact of positive family member</li><li>Graham Thorpe to take charge in Sydney as Silverwood isolates</li></ul>,https://www.theguardian.com/sport/2021/dec/29/silverwood-to-miss-fourth-ashes-test-after-new-covid-case-england-cricket-australia,358,<ul><li>Head coach named as close contact of positive family member</li><li>Graham Thorpe to take charge in Sydney as Silverwood isolates</li></ul>,Sport,Sport,article,Ali Martin in Melbourne,"Ashes 2021-22, England cricket team, The Ashes, Australia cricket team, Australia sport, Cricket, Sport",sport/2021/dec/29/silverwood-to-miss-fourth-ashes-test-after-new-covid-case-england-cricket-australia
Ghislaine Maxwell trial: jurors ask to see testimony from five witnesses,2021-12-29T19:57:13Z,<p>Judge Alison Nathan says note to jurors states deliberations will continue ‘as needed’ until verdict reached over Covid concerns</p>,https://www.theguardian.com/us-news/2021/dec/29/ghislaine-maxwell-jury-deliberations-covid,590,<p>Judge Alison Nathan says note to jurors states deliberations will continue ‘as needed’ until verdict reached over Covid concerns</p>,US news,News,article,Victoria Bekiempis in New York,"Ghislaine Maxwell, Coronavirus, Omicron variant, New York, Law (US), US news, Jeffrey Epstein",us-news/2021/dec/29/ghislaine-maxwell-jury-deliberations-covid
FTSE 100 hits 22-month high as shares recover Covid crisis losses – as it happened,2021-12-29T17:38:41Z,"<p>Rolling coverage of the latest economic and financial news</p><ul><li><a href=""https://www.theguardian.com/business/2021/dec/29/ftse-100-returns-to-pre-pandemic-level-as-investors-omicron-fears-ease"">Full story: FTSE 100 returns to pre-pandemic level as Omicron fears ease</a></li><li><a href=""https://www.theguardian.com/business/live/2021/dec/29/ftse-100-pandemic-omicron-high-stock-markets-wall-street-oil-sterling-business-live?filterKeyEvents=false&amp;page=with:block-61cc14b28f08b7d6158b639c#block-61cc14b28f08b7d6158b639c"">FTSE 100 has recovered losses since crash of 2020</a></li><li><a href=""https://www.theguardian.com/business/live/2021/dec/29/ftse-100-pandemic-omicron-high-stock-markets-wall-street-oil-sterling-business-live?filterKeyEvents=false&amp;page=with:block-61cc08a08f08df2f5b4e19e6#block-61cc08a08f08df2f5b4e19e6"">Introduction: Markets end 2021 on upbeat note</a></li><li>Oil rallies but gas prices fall back</li><li><a href=""https://www.theguardian.com/business/2021/dec/29/air-travel-in-and-out-of-uk-slumps-in-2021-amid-pandemic"">Air travel in and out of UK slumps by 71% in 2021 amid pandemic</a></li><li>US S&amp;P 500 hit 69th high of the year on Monday</li><li><a href=""https://www.theguardian.com/world/2021/dec/28/omicron-is-not-the-same-disease-as-earlier-covid-waves-says-uk-scientist"">Omicron is ‘not the same disease’ as earlier Covid waves, says UK scientist</a></li></ul><p><strong><br></strong></p>",https://www.theguardian.com/business/live/2021/dec/29/ftse-100-pandemic-omicron-high-stock-markets-wall-street-oil-sterling-business-live,4945,"<p>Rolling coverage of the latest economic and financial news</p><ul><li><a href=""https://www.theguardian.com/business/2021/dec/29/ftse-100-returns-to-pre-pandemic-level-as-investors-omicron-fears-ease"">Full story: FTSE 100 returns to pre-pandemic level as Omicron fears ease</a></li><li><a href=""https://www.theguardian.com/business/live/2021/dec/29/ftse-100-pandemic-omicron-high-stock-markets-wall-street-oil-sterling-business-live?filterKeyEvents=false&amp;page=with:block-61cc14b28f08b7d6158b639c#block-61cc14b28f08b7d6158b639c"">FTSE 100 has recovered losses since crash of 2020</a></li><li><a href=""https://www.theguardian.com/business/live/2021/dec/29/ftse-100-pandemic-omicron-high-stock-markets-wall-street-oil-sterling-business-live?filterKeyEvents=false&amp;page=with:block-61cc08a08f08df2f5b4e19e6#block-61cc08a08f08df2f5b4e19e6"">Introduction: Markets end 2021 on upbeat note</a></li><li>Oil rallies but gas prices fall back</li><li><a href=""https://www.theguardian.com/business/2021/dec/29/air-travel-in-and-out-of-uk-slumps-in-2021-amid-pandemic"">Air travel in and out of UK slumps by 71% in 2021 amid pandemic</a></li><li>US S&amp;P 500 hit 69th high of the year on Monday</li><li><a href=""https://www.theguardian.com/world/2021/dec/28/omicron-is-not-the-same-disease-as-earlier-covid-waves-says-uk-scientist"">Omicron is ‘not the same disease’ as earlier Covid waves, says UK scientist</a></li></ul><p><strong><br></strong></p>",Business,News,liveblog,Graeme Wearden,"Business, Economics, Stock markets, FTSE",business/live/2021/dec/29/ftse-100-pandemic-omicron-high-stock-markets-wall-street-oil-sterling-business-live
Indictment of alleged Proud Boys leaders over US Capitol attack upheld,2021-12-29T16:24:08Z,"<p>Federal judge rejects defence arguments, a development that could have potential implications for Donald Trump</p>",https://www.theguardian.com/us-news/2021/dec/29/indictment-of-proud-boys-leaders-charged-over-us-capitol-attack-upheld,439,"<p>Federal judge rejects defence arguments, a development that could have potential implications for Donald Trump</p>",US news,News,article,Miranda Bryant,"US Capitol attack, US news, US politics, Donald Trump",us-news/2021/dec/29/indictment-of-proud-boys-leaders-charged-over-us-capitol-attack-upheld
I’m a climate scientist. Don’t Look Up captures the madness I see every day,2021-12-29T14:08:23Z,<p>A film about a comet hurtling towards Earth and no one is doing anything about it? Sounds exactly like the climate crisis</p>,https://www.theguardian.com/commentisfree/2021/dec/29/climate-scientist-dont-look-up-madness,922,<p>A film about a comet hurtling towards Earth and no one is doing anything about it? Sounds exactly like the climate crisis</p>,Opinion,Opinion,article,Peter Kalmus,"Climate crisis, Don't Look Up, Climate science, Environment, Film",commentisfree/2021/dec/29/climate-scientist-dont-look-up-madness
America is facing a ballot-box coup – help us sound the alarm in 2022,2021-12-29T12:58:56Z,"<p>All over the country, free and fair elections are under threat. This will be one of the most important stories we tell in 2022.</p><ul><li>It’s not too late to give to help fund our journalism in the new year. If you can, <a href=""https://support.theguardian.com/contribute?acquisitionData=%7B%22source%22%3A%22GUARDIAN_WEB%22%2C%22componentType%22%3A%22ACQUISITIONS_STANDFIRST%22%2C%22componentId%22%3A%22USEOY2021_Standfirst_JohnM%22%2C%22campaignCode%22%3A%22USEOY2021%22%7D&amp;INTCMP=gdnwb_usmsp_editorial_mem_USEOY2021"">make a contribution today</a></li></ul>",https://www.theguardian.com/us-news/2021/dec/29/america-facing-ballot-box-coup-help-us-sound-alarm-2022,671,"<p>All over the country, free and fair elections are under threat. This will be one of the most important stories we tell in 2022.</p><ul><li>It’s not too late to give to help fund our journalism in the new year. If you can, <a href=""https://support.theguardian.com/contribute?acquisitionData=%7B%22source%22%3A%22GUARDIAN_WEB%22%2C%22componentType%22%3A%22ACQUISITIONS_STANDFIRST%22%2C%22componentId%22%3A%22USEOY2021_Standfirst_JohnM%22%2C%22campaignCode%22%3A%22USEOY2021%22%7D&amp;INTCMP=gdnwb_usmsp_editorial_mem_USEOY2021"">make a contribution today</a></li></ul>",US news,News,article,John Mulholland,"US news, The Guardian",us-news/2021/dec/29/america-facing-ballot-box-coup-help-us-sound-alarm-2022
From Kremlin leak to sperm counts: our readers’ favourite stories of 2021,2021-12-29T12:00:21Z,<p>Here are 20 articles that may have helped convince people to support the Guardian’s journalism</p>,https://www.theguardian.com/world/2021/dec/29/from-kremlin-leak-to-sperm-counts-readers-favourite-stories-of-2021-guardian,730,<p>Here are 20 articles that may have helped convince people to support the Guardian’s journalism</p>,World news,News,article,Guardian staff,"Russia, Donald Trump, Vladimir Putin, Coronavirus, India, US Capitol attack, Climate crisis, Afghanistan, Pollution, Amanda Gorman, Biden inauguration, Parkinson's disease, William Shatner, US news, China, Food, Surveillance, Espionage, Cold war, Immigration and asylum",world/2021/dec/29/from-kremlin-leak-to-sperm-counts-readers-favourite-stories-of-2021-guardian
The world in 2022: another year of living dangerously,2021-12-29T11:41:55Z,"<p>The climate, pandemic and tensions between states means the year ahead is likely to be as tumultuous as the last 12 months</p>",https://www.theguardian.com/world/2021/dec/29/the-world-in-2022-another-year-of-living-dangerously,3564,"<p>The climate, pandemic and tensions between states means the year ahead is likely to be as tumultuous as the last 12 months</p>",World news,News,article,Simon Tisdall,World news,world/2021/dec/29/the-world-in-2022-another-year-of-living-dangerously
Could strategic price controls help fight inflation? ,2021-12-29T11:20:19Z,"<p>To prevent inflation after World War II, America’s leading economists recommended strategic price controls. Is there a case for doing so today, too?</p>",https://www.theguardian.com/business/commentisfree/2021/dec/29/inflation-price-controls-time-we-use-it,859,"<p>To prevent inflation after World War II, America’s leading economists recommended strategic price controls. Is there a case for doing so today, too?</p>",Business,News,article,Isabella Weber,"Inflation, US economy, US news",business/commentisfree/2021/dec/29/inflation-price-controls-time-we-use-it
"Facebook’s very bad year. No, really, it might be the worst yet",2021-12-29T11:00:19Z,"<p>From repeated accusations of fostering misinformation to multiple whistleblowers, the company weathered some battles in 2021</p>",https://www.theguardian.com/technology/2021/dec/29/facebook-capitol-riot-frances-haugen-sophia-zhang-apple,1134,"<p>From repeated accusations of fostering misinformation to multiple whistleblowers, the company weathered some battles in 2021</p>",Technology,News,article,Kari Paul,"Facebook, Technology, Tim Cook, Mark Zuckerberg, US Congress, US Capitol attack, Apple, US news, US politics",technology/2021/dec/29/facebook-capitol-riot-frances-haugen-sophia-zhang-apple
"Harry Reid, who led Senate Democrats for 12 years, dies at 82",2021-12-29T01:36:24Z,<ul><li>Nevada senator helped to pass Obama’s Affordable Care Act</li><li>Reid called Trump ‘the worst president we’ve ever had’</li></ul>,https://www.theguardian.com/us-news/2021/dec/28/harry-reid-senate-democrats-nevada-dies,923,<ul><li>Nevada senator helped to pass Obama’s Affordable Care Act</li><li>Reid called Trump ‘the worst president we’ve ever had’</li></ul>,US news,News,article,Tom McCarthy,"Nevada, Democrats, US Senate, US Congress, US politics, US news",us-news/2021/dec/28/harry-reid-senate-democrats-nevada-dies
 Ghislaine Maxwell: jury weighs charges as judge warns Covid could derail trial,2021-12-28T23:15:04Z,<p>Judge Alison Nathan says they face ‘a high and escalating risk that jurors and trial participants may need to quarantine’ </p>,https://www.theguardian.com/us-news/2021/dec/28/ghislaine-maxwell-jury-deliberations-resume-sex-trafficking-trial,841,<p>Judge Alison Nathan says they face ‘a high and escalating risk that jurors and trial participants may need to quarantine’ </p>,US news,News,article,Victoria Bekiempis in New York,"Ghislaine Maxwell, Jeffrey Epstein, Coronavirus, US news, US crime",us-news/2021/dec/28/ghislaine-maxwell-jury-deliberations-resume-sex-trafficking-trial
