headline,pub_date,snippet,web_url,word_count,abstract,section_name,pillar_name,type,byline,keywords,article_id
Senate votes to confirm Deb Haaland as first Indigenous cabinet secretary – as it happened,2021-03-16T00:05:24Z,"<ul><li><a href=""https://www.theguardian.com/us-news/2021/mar/15/deb-haaland-interior-secretary-first-indigenous-native-american-cabinet"">Full report: Haaland confirmed as first Indigenous cabinet secretary</a></li><li><a href=""https://www.theguardian.com/us-news/2021/mar/15/brian-sicknick-death-arrests-capitol-attack-bear-spray"">Two men arrested for ‘bear spray’ assault on Capitol officer who later died</a></li><li><a href=""https://www.theguardian.com/us-news/live/2021/mar/15/joe-biden-kamala-harris-covid-coronavirus-relief-rescue-package-andrew-cuomo-live-updates?page=with:block-604f35d68f087fc7fb7f8e26#block-604f35d68f087fc7fb7f8e26"">Biden, Harris and spouses embark on cross-country tour</a></li><li><a href=""https://www.theguardian.com/us-news/live/2021/mar/15/joe-biden-kamala-harris-covid-coronavirus-relief-rescue-package-andrew-cuomo-live-updates?page=with:block-604f77738f083aee44b7b2ee#block-604f77738f083aee44b7b2ee"">US will cover 100% of cost for children to be vaccinated</a></li><li><a href=""https://www.theguardian.com/us-news/live/2021/mar/15/joe-biden-kamala-harris-covid-coronavirus-relief-rescue-package-andrew-cuomo-live-updates?page=with:block-604f66af8f083aee44b7b21e#block-604f66af8f083aee44b7b21e"">Romney wants ‘economic and diplomatic boycott’ of Olympics</a></li><li><a href=""https://www.theguardian.com/info/2018/sep/17/guardian-us-morning-briefing-sign-up-to-stay-informed"">Sign up to receive First Thing – our daily briefing by email</a><br></li></ul>",https://www.theguardian.com/us-news/live/2021/mar/15/joe-biden-kamala-harris-covid-coronavirus-relief-rescue-package-andrew-cuomo-live-updates,8831,"<ul><li><a href=""https://www.theguardian.com/us-news/2021/mar/15/deb-haaland-interior-secretary-first-indigenous-native-american-cabinet"">Full report: Haaland confirmed as first Indigenous cabinet secretary</a></li><li><a href=""https://www.theguardian.com/us-news/2021/mar/15/brian-sicknick-death-arrests-capitol-attack-bear-spray"">Two men arrested for ‘bear spray’ assault on Capitol officer who later died</a></li><li><a href=""https://www.theguardian.com/us-news/live/2021/mar/15/joe-biden-kamala-harris-covid-coronavirus-relief-rescue-package-andrew-cuomo-live-updates?page=with:block-604f35d68f087fc7fb7f8e26#block-604f35d68f087fc7fb7f8e26"">Biden, Harris and spouses embark on cross-country tour</a></li><li><a href=""https://www.theguardian.com/us-news/live/2021/mar/15/joe-biden-kamala-harris-covid-coronavirus-relief-rescue-package-andrew-cuomo-live-updates?page=with:block-604f77738f083aee44b7b2ee#block-604f77738f083aee44b7b2ee"">US will cover 100% of cost for children to be vaccinated</a></li><li><a href=""https://www.theguardian.com/us-news/live/2021/mar/15/joe-biden-kamala-harris-covid-coronavirus-relief-rescue-package-andrew-cuomo-live-updates?page=with:block-604f66af8f083aee44b7b21e#block-604f66af8f083aee44b7b21e"">Romney wants ‘economic and diplomatic boycott’ of Olympics</a></li><li><a href=""https://www.theguardian.com/info/2018/sep/17/guardian-us-morning-briefing-sign-up-to-stay-informed"">Sign up to receive First Thing – our daily briefing by email</a><br></li></ul>",US news,News,liveblog,"Vivian Ho, Kari Paul, Daniel Strauss and Martin Belam","Joe Biden, Biden administration, Coronavirus, US news, US politics",us-news/live/2021/mar/15/joe-biden-kamala-harris-covid-coronavirus-relief-rescue-package-andrew-cuomo-live-updates
Republicans try to derail Biden’s Covid aid publicity blitz by turning focus to border,2021-03-15T21:06:02Z,<p>President faces a messaging war with Republicans as he tries to promote the $1.9tn aid package</p>,https://www.theguardian.com/us-news/2021/mar/15/joe-biden-covid-aid-republicans-border,1199,<p>President faces a messaging war with Republicans as he tries to promote the $1.9tn aid package</p>,US news,News,article,David Smith in Washington,"Joe Biden, Biden administration, US politics, US news",us-news/2021/mar/15/joe-biden-covid-aid-republicans-border
"4,618 new cases and 52 more deaths in UK – as it happened",2021-03-14T23:38:46Z,"<p>This blog is now closed. We’ve launched a new blog at the link below: </p><ul><li><a href=""https://www.theguardian.com/world/live/2021/mar/15/coronavirus-live-news-astrazeneca-finds-no-evidence-of-blood-clot-risk-as-netherlands-suspends-vaccine"">Coronavirus news – live</a></li></ul>",https://www.theguardian.com/world/live/2021/mar/14/coronavirus-live-news-astrazeneca-reports-vaccine-shortfall-to-eu-sydney-hotel-quarantine-worker-tests-positive,12049,"<p>This blog is now closed. We’ve launched a new blog at the link below: </p><ul><li><a href=""https://www.theguardian.com/world/live/2021/mar/15/coronavirus-live-news-astrazeneca-finds-no-evidence-of-blood-clot-risk-as-netherlands-suspends-vaccine"">Coronavirus news – live</a></li></ul>",World news,News,liveblog,"Clea Skopeliti (now), Ben Quinn, Maya Wolfe-Robinson and Helen Davidson (earlier)","Coronavirus, AstraZeneca, Infectious diseases, Science, World news, Vaccines and immunisation",world/live/2021/mar/14/coronavirus-live-news-astrazeneca-reports-vaccine-shortfall-to-eu-sydney-hotel-quarantine-worker-tests-positive
'Covid is taking over': Brazil plunges into deadliest chapter of its epidemic,2021-03-13T10:30:00Z,"<p>Last year, Jair Bolsonaro declared Brazil had reached ‘the tail end’ of one of the world’s worst outbreaks. Three months later the country has lost almost 100,000 more lives</p>",https://www.theguardian.com/world/2021/mar/13/brazil-covid-coronavirus-deaths-cases-bolsonaro-lula,1364,"<p>Last year, Jair Bolsonaro declared Brazil had reached ‘the tail end’ of one of the world’s worst outbreaks. Three months later the country has lost almost 100,000 more lives</p>",World news,News,article,Tom Phillips in Rio de Janeiro,"Brazil, Coronavirus, Jair Bolsonaro, Luiz Inácio Lula da Silva, Americas, World news",world/2021/mar/13/brazil-covid-coronavirus-deaths-cases-bolsonaro-lula
Senators Schumer and Gillibrand urge Cuomo to resign amid sexual harassment allegations – as it happened,2021-03-13T01:22:47Z,"<ul><li>Senators say governor has ‘lost confidence’ with New Yorkers</li><li><a href=""https://www.theguardian.com/us-news/live/2021/mar/12/joe-biden-covid-coronanavirus-vaccine-relief-bill-andrew-cuomo-live-updates?page=with:block-604bb87f8f083aee44b78b9c#block-604bb87f8f083aee44b78b9c"">Minneapolis reaches $27m settlement with George Floyd’s family</a></li><li><a href=""https://www.theguardian.com/world/2021/mar/11/joe-biden-covid-vaccine-us-adults-1-may"">Biden tells states to make all adults vaccine eligible by 1 May</a></li><li>Politics Weekly Extra podcast: <a href=""https://www.theguardian.com/politics/audio/2021/mar/12/the-fight-for-voting-rights-in-the-us-politics-weekly-extra-podcast"">The fight for voting rights in the US</a></li><li><a href=""https://www.theguardian.com/info/2018/sep/17/guardian-us-morning-briefing-sign-up-to-stay-informed"">Sign up to receive First Thing – our daily briefing by email</a></li></ul>",https://www.theguardian.com/us-news/live/2021/mar/12/joe-biden-covid-coronanavirus-vaccine-relief-bill-andrew-cuomo-live-updates,9757,"<ul><li>Senators say governor has ‘lost confidence’ with New Yorkers</li><li><a href=""https://www.theguardian.com/us-news/live/2021/mar/12/joe-biden-covid-coronanavirus-vaccine-relief-bill-andrew-cuomo-live-updates?page=with:block-604bb87f8f083aee44b78b9c#block-604bb87f8f083aee44b78b9c"">Minneapolis reaches $27m settlement with George Floyd’s family</a></li><li><a href=""https://www.theguardian.com/world/2021/mar/11/joe-biden-covid-vaccine-us-adults-1-may"">Biden tells states to make all adults vaccine eligible by 1 May</a></li><li>Politics Weekly Extra podcast: <a href=""https://www.theguardian.com/politics/audio/2021/mar/12/the-fight-for-voting-rights-in-the-us-politics-weekly-extra-podcast"">The fight for voting rights in the US</a></li><li><a href=""https://www.theguardian.com/info/2018/sep/17/guardian-us-morning-briefing-sign-up-to-stay-informed"">Sign up to receive First Thing – our daily briefing by email</a></li></ul>",US news,News,liveblog,Gabrielle Canon (now) and Lauren Aratani  and Martin Belam (earlier),"Joe Biden, Andrew Cuomo, Biden administration, Coronavirus, US news, US politics, World news, Democrats, Republicans",us-news/live/2021/mar/12/joe-biden-covid-coronanavirus-vaccine-relief-bill-andrew-cuomo-live-updates
Friend of accuser says he has 'clear recollections of relevant discussions' with minister – as it happened,2021-03-12T07:49:09Z,"<p>News Corp photographer <a href=""https://www.theguardian.com/australia-news/live/2021/mar/12/australia-news-live-morrison-defends-tourism-package-wa-election-campaign-enters-final-day?page=with:block-604aa4518f0849a7378fd32a#block-604aa4518f0849a7378fd32a"">condemns ‘toxic’ sexism</a> at its newspapers; government <a href=""https://www.theguardian.com/australia-news/live/2021/mar/12/australia-news-live-morrison-defends-tourism-package-wa-election-campaign-enters-final-day?page=with:block-604aa0298f08089f0d4afafe#block-604aa0298f08089f0d4afafe"">won’t halt AstraZeneca rollout</a> despite EU concerns; no clear winner in OECD race. This blog is now closed </p><ul><li><a href=""https://www.theguardian.com/australia-news/live/2021/mar/12/australia-news-live-morrison-defends-tourism-package-wa-election-campaign-enters-final-day?page=with:block-604addae8f0849a7378fd582#block-604addae8f0849a7378fd582"">Friend of Christian Porter accuser clearly recalls ‘relevant discussions’ with attorney general, he says</a></li><li><a href=""https://www.theguardian.com/business/2021/mar/11/half-price-flights-on-offer-as-australia-aims-to-boost-regional-tourism-with-800000-travellers"">Labor questions government’s $1.2bn tourism package</a></li><li><a href=""https://www.theguardian.com/world/live/2021/mar/12/coronavirus-live-news-brazil-records-more-than-2000-deaths-for-second-day-eu-approves-jj-vaccine"">Follow our global coronavirus live blog</a></li></ul>",https://www.theguardian.com/australia-news/live/2021/mar/12/australia-news-live-morrison-defends-tourism-package-wa-election-campaign-enters-final-day,10662,"<p>News Corp photographer <a href=""https://www.theguardian.com/australia-news/live/2021/mar/12/australia-news-live-morrison-defends-tourism-package-wa-election-campaign-enters-final-day?page=with:block-604aa4518f0849a7378fd32a#block-604aa4518f0849a7378fd32a"">condemns ‘toxic’ sexism</a> at its newspapers; government <a href=""https://www.theguardian.com/australia-news/live/2021/mar/12/australia-news-live-morrison-defends-tourism-package-wa-election-campaign-enters-final-day?page=with:block-604aa0298f08089f0d4afafe#block-604aa0298f08089f0d4afafe"">won’t halt AstraZeneca rollout</a> despite EU concerns; no clear winner in OECD race. This blog is now closed </p><ul><li><a href=""https://www.theguardian.com/australia-news/live/2021/mar/12/australia-news-live-morrison-defends-tourism-package-wa-election-campaign-enters-final-day?page=with:block-604addae8f0849a7378fd582#block-604addae8f0849a7378fd582"">Friend of Christian Porter accuser clearly recalls ‘relevant discussions’ with attorney general, he says</a></li><li><a href=""https://www.theguardian.com/business/2021/mar/11/half-price-flights-on-offer-as-australia-aims-to-boost-regional-tourism-with-800000-travellers"">Labor questions government’s $1.2bn tourism package</a></li><li><a href=""https://www.theguardian.com/world/live/2021/mar/12/coronavirus-live-news-brazil-records-more-than-2000-deaths-for-second-day-eu-approves-jj-vaccine"">Follow our global coronavirus live blog</a></li></ul>",Australia news,News,liveblog,Calla Wahlquist and (earlier) Elias Visontay and Matilda Boseley,"Australia news, Health, Vaccines and immunisation, Western Australia, Western Australia election 2021, Australian politics, Scott Morrison, Labor party, Coalition, Coronavirus, Victoria",australia-news/live/2021/mar/12/australia-news-live-morrison-defends-tourism-package-wa-election-campaign-enters-final-day
Australia pressed to show leadership on Indo-Pacific health ahead of Quad meeting,2021-03-12T04:29:04Z,<p>Access to Covid vaccines is set to be one of the main talking points when Scott Morrison meets with Joe Biden and the leaders of Japan and India</p>,https://www.theguardian.com/australia-news/2021/mar/12/australia-pressed-to-show-leadership-on-indo-pacific-health-ahead-of-quad-meeting,767,<p>Access to Covid vaccines is set to be one of the main talking points when Scott Morrison meets with Joe Biden and the leaders of Japan and India</p>,Australia news,News,article,Daniel Hurst,"Australian foreign policy, Australia news, Scott Morrison, Joe Biden, China, Russia, Asia Pacific, US news, Japan, India",australia-news/2021/mar/12/australia-pressed-to-show-leadership-on-indo-pacific-health-ahead-of-quad-meeting
Biden pledges all US adults will be eligible for vaccines by 1 May in pandemic anniversary address – as it happened,2021-03-12T03:00:28Z,"<ul><li><a href=""https://www.theguardian.com/us-news/live/2021/mar/11/joe-biden-covid-coronavirus-relief-bill-trillion-andrew-cuomo-live-updates?page=with:block-604abcd98f0849a7378fd440#block-604abcd98f0849a7378fd440"">President announces steps to speed up vaccine distribution</a></li><li><a href=""https://www.theguardian.com/us-news/live/2021/mar/11/joe-biden-covid-coronavirus-relief-bill-trillion-andrew-cuomo-live-updates?page=with:block-604a8c6c8f0849a7378fd237#block-604a8c6c8f0849a7378fd237"">Chris Miller says attack would not have happened without speech</a></li><li><a href=""https://www.theguardian.com/us-news/live/2021/mar/11/joe-biden-covid-coronavirus-relief-bill-trillion-andrew-cuomo-live-updates?page=with:block-604a6aba8f081f2101760a4a#block-604a6aba8f081f2101760a4a"">Biden signs ‘historic’ $1.9tn coronavirus relief bill into law</a> </li><li><a href=""https://www.theguardian.com/us-news/2021/mar/10/us-covid-stimulus-relief-bill-biden-package"">$1,400 checks and vaccine funds: what’s in the stimulus bill</a></li><li><a href=""https://www.theguardian.com/us-news/live/2021/mar/11/joe-biden-covid-coronavirus-relief-bill-trillion-andrew-cuomo-live-updates?page=with:block-604a4f528f08089f0d4af6b0#block-604a4f528f08089f0d4af6b0"">Senate advances Xavier Becerra’s health secretary nomination</a></li></ul>",https://www.theguardian.com/us-news/live/2021/mar/11/joe-biden-covid-coronavirus-relief-bill-trillion-andrew-cuomo-live-updates,11199,"<ul><li><a href=""https://www.theguardian.com/us-news/live/2021/mar/11/joe-biden-covid-coronavirus-relief-bill-trillion-andrew-cuomo-live-updates?page=with:block-604abcd98f0849a7378fd440#block-604abcd98f0849a7378fd440"">President announces steps to speed up vaccine distribution</a></li><li><a href=""https://www.theguardian.com/us-news/live/2021/mar/11/joe-biden-covid-coronavirus-relief-bill-trillion-andrew-cuomo-live-updates?page=with:block-604a8c6c8f0849a7378fd237#block-604a8c6c8f0849a7378fd237"">Chris Miller says attack would not have happened without speech</a></li><li><a href=""https://www.theguardian.com/us-news/live/2021/mar/11/joe-biden-covid-coronavirus-relief-bill-trillion-andrew-cuomo-live-updates?page=with:block-604a6aba8f081f2101760a4a#block-604a6aba8f081f2101760a4a"">Biden signs ‘historic’ $1.9tn coronavirus relief bill into law</a> </li><li><a href=""https://www.theguardian.com/us-news/2021/mar/10/us-covid-stimulus-relief-bill-biden-package"">$1,400 checks and vaccine funds: what’s in the stimulus bill</a></li><li><a href=""https://www.theguardian.com/us-news/live/2021/mar/11/joe-biden-covid-coronavirus-relief-bill-trillion-andrew-cuomo-live-updates?page=with:block-604a4f528f08089f0d4af6b0#block-604a4f528f08089f0d4af6b0"">Senate advances Xavier Becerra’s health secretary nomination</a></li></ul>",US news,News,liveblog,"Maanvi Singh (now), Lauren Gambino, Joanna Walters and Martin Belam (earlier)","Joe Biden, Biden administration, Coronavirus, US news, US politics, World news, Minnesota, Minneapolis, US Senate, US Congress, Republicans, Democrats, Donald Trump",us-news/live/2021/mar/11/joe-biden-covid-coronavirus-relief-bill-trillion-andrew-cuomo-live-updates
The day the turf stood still: looking back at sport's sudden shutdown ,2021-03-12T00:01:39Z,"<p>Lando Norris, Lucy Bronze, Coco Gauff and other leading players and officials on how they felt when the pandemic closed down sport and stopped them in their tracks </p>",https://www.theguardian.com/sport/2021/mar/12/the-day-the-turf-stood-still-looking-back-at-sports-sudden-shutdown,3037,"<p>Lando Norris, Lucy Bronze, Coco Gauff and other leading players and officials on how they felt when the pandemic closed down sport and stopped them in their tracks </p>",Sport,Sport,article,Guardian sport,"Sport, Tennis, Formula One, Rugby union, Horse racing, Golf, London Marathon, Football, Coronavirus, Motor sport",sport/2021/mar/12/the-day-the-turf-stood-still-looking-back-at-sports-sudden-shutdown
Biden signs $1.9tn Covid relief ahead of first primetime address as president,2021-03-11T19:41:13Z,"<p>President will mark one year since coronavirus triggered shutdowns across US in televised speech on Thursday night</p><ul><li><a href=""https://www.theguardian.com/us-news/series/us-politics-live/latest"">US politics – live updates</a></li></ul>",https://www.theguardian.com/us-news/2021/mar/11/joe-biden-covid-relief-bill-sign-primetime-address,896,"<p>President will mark one year since coronavirus triggered shutdowns across US in televised speech on Thursday night</p><ul><li><a href=""https://www.theguardian.com/us-news/series/us-politics-live/latest"">US politics – live updates</a></li></ul>",US news,News,article,Oliver Milman,"Joe Biden, Coronavirus, US politics, US news, World news",us-news/2021/mar/11/joe-biden-covid-relief-bill-sign-primetime-address
House passes Biden's $1.9tn Covid relief bill projected to slash US poverty in 2021 – as it happened,2021-03-11T01:40:48Z,"<ul><li><a href=""https://www.theguardian.com/us-news/live/2021/mar/10/joe-biden-covid-coronavirus-relief-bill-congress-george-floyd-derek-chauvin-trial-live-updates?page=with:block-6049125b8f08168521f61f66#block-6049125b8f08168521f61f66"">Biden will sign coronavirus relief bill on Friday</a></li><li><a href=""https://www.theguardian.com/us-news/live/2021/mar/10/joe-biden-covid-coronavirus-relief-bill-congress-george-floyd-derek-chauvin-trial-live-updates?page=with:block-604927088f08a73fb523aae5#block-604927088f08a73fb523aae5"">‘Help is on the way,’ Democratic leaders say after House passes bill</a></li><li><a href=""https://www.theguardian.com/us-news/live/2021/mar/10/joe-biden-covid-coronavirus-relief-bill-congress-george-floyd-derek-chauvin-trial-live-updates?page=with:block-604923ca8f08ad2e040849c0#block-604923ca8f08ad2e040849c0"">Merrick Garland confirmed as attorney general</a></li><li><a href=""https://www.theguardian.com/us-news/live/2021/mar/10/joe-biden-covid-coronavirus-relief-bill-congress-george-floyd-derek-chauvin-trial-live-updates?page=with:block-604904c78f08168521f61e2e#block-604904c78f08168521f61e2e"">Marcia Fudge confirmed as HUD secretary</a></li><li><a href=""https://www.theguardian.com/us-news/live/2021/mar/10/joe-biden-covid-coronavirus-relief-bill-congress-george-floyd-derek-chauvin-trial-live-updates?page=with:block-6048fd128f08ad2e040846b8#block-6048fd128f08ad2e040846b8"">CDC director: US is ‘at a critical point’ in pandemic</a><br></li><li><a href=""https://www.theguardian.com/us-news/live/2021/mar/10/joe-biden-covid-coronavirus-relief-bill-congress-george-floyd-derek-chauvin-trial-live-updates?page=with:block-6048cf558f08ad2e0408437f#block-6048cf558f08ad2e0408437f"">Reports: US to double order of Johnson &amp; Johnson vaccine</a><br></li><li><a href=""https://www.theguardian.com/info/2018/sep/17/guardian-us-morning-briefing-sign-up-to-stay-informed"">Sign up to receive First Thing – our daily briefing by email</a><br></li></ul>",https://www.theguardian.com/us-news/live/2021/mar/10/joe-biden-covid-coronavirus-relief-bill-congress-george-floyd-derek-chauvin-trial-live-updates,11614,"<ul><li><a href=""https://www.theguardian.com/us-news/live/2021/mar/10/joe-biden-covid-coronavirus-relief-bill-congress-george-floyd-derek-chauvin-trial-live-updates?page=with:block-6049125b8f08168521f61f66#block-6049125b8f08168521f61f66"">Biden will sign coronavirus relief bill on Friday</a></li><li><a href=""https://www.theguardian.com/us-news/live/2021/mar/10/joe-biden-covid-coronavirus-relief-bill-congress-george-floyd-derek-chauvin-trial-live-updates?page=with:block-604927088f08a73fb523aae5#block-604927088f08a73fb523aae5"">‘Help is on the way,’ Democratic leaders say after House passes bill</a></li><li><a href=""https://www.theguardian.com/us-news/live/2021/mar/10/joe-biden-covid-coronavirus-relief-bill-congress-george-floyd-derek-chauvin-trial-live-updates?page=with:block-604923ca8f08ad2e040849c0#block-604923ca8f08ad2e040849c0"">Merrick Garland confirmed as attorney general</a></li><li><a href=""https://www.theguardian.com/us-news/live/2021/mar/10/joe-biden-covid-coronavirus-relief-bill-congress-george-floyd-derek-chauvin-trial-live-updates?page=with:block-604904c78f08168521f61e2e#block-604904c78f08168521f61e2e"">Marcia Fudge confirmed as HUD secretary</a></li><li><a href=""https://www.theguardian.com/us-news/live/2021/mar/10/joe-biden-covid-coronavirus-relief-bill-congress-george-floyd-derek-chauvin-trial-live-updates?page=with:block-6048fd128f08ad2e040846b8#block-6048fd128f08ad2e040846b8"">CDC director: US is ‘at a critical point’ in pandemic</a><br></li><li><a href=""https://www.theguardian.com/us-news/live/2021/mar/10/joe-biden-covid-coronavirus-relief-bill-congress-george-floyd-derek-chauvin-trial-live-updates?page=with:block-6048cf558f08ad2e0408437f#block-6048cf558f08ad2e0408437f"">Reports: US to double order of Johnson &amp; Johnson vaccine</a><br></li><li><a href=""https://www.theguardian.com/info/2018/sep/17/guardian-us-morning-briefing-sign-up-to-stay-informed"">Sign up to receive First Thing – our daily briefing by email</a><br></li></ul>",US news,News,liveblog,"Maanvi Singh (now), Joan E Greve and Martin Belam (earlier)","US politics, Joe Biden, Biden administration, Coronavirus, US news, George Floyd",us-news/live/2021/mar/10/joe-biden-covid-coronavirus-relief-bill-congress-george-floyd-derek-chauvin-trial-live-updates
Blues festival cancelled as Queensland records two cases and NSW one – as it happened,2021-03-31T07:30:22Z,"<p>Australia joins 13 countries to express concerns about China’s cooperation with WHO investigators. This blog is now closed</p><ul><li><a href=""https://www.theguardian.com/australia-news/live/2021/apr/01/australia-news-live-easter-holidays-queensland-lockdown-bluesfest-2021-nsw-byron-bay"">Follow Thursday’s live blog here – Easter holiday plans in chaos with Queensland Covid lockdown</a></li></ul>",https://www.theguardian.com/australia-news/live/2021/mar/31/australia-news-live-queensland-hospital-lockdown-covid-outbreak-nsw-victoria-coronavirus,14293,"<p>Australia joins 13 countries to express concerns about China’s cooperation with WHO investigators. This blog is now closed</p><ul><li><a href=""https://www.theguardian.com/australia-news/live/2021/apr/01/australia-news-live-easter-holidays-queensland-lockdown-bluesfest-2021-nsw-byron-bay"">Follow Thursday’s live blog here – Easter holiday plans in chaos with Queensland Covid lockdown</a></li></ul>",Australia news,News,liveblog,Luke Henriques-Gomes and Matilda Boseley (earlier),"Australia news, Brisbane, Queensland, Coronavirus, Infectious diseases, World Health Organization, China, Health",australia-news/live/2021/mar/31/australia-news-live-queensland-hospital-lockdown-covid-outbreak-nsw-victoria-coronavirus
