headline,pub_date,snippet,web_url,word_count,abstract,section_name,pillar_name,type,byline,keywords,article_id
Nancy Pelosi hails 'historic' Covid relief bill as House prepares to vote,2021-03-10T00:51:04Z,"<p>Lawmakers poised to approve $1.9tn measure on Wednesday, sending it to Biden for his signature</p>",https://www.theguardian.com/us-news/2021/mar/09/biden-coronavirus-relief-bill-pelosi-congress,523,"<p>Lawmakers poised to approve $1.9tn measure on Wednesday, sending it to Biden for his signature</p>",US news,News,article,Guardian staff and agencies,"US Congress, US news, Nancy Pelosi, Joe Biden, House of Representatives, US politics, Coronavirus",us-news/2021/mar/09/biden-coronavirus-relief-bill-pelosi-congress
"Greece to allow tourists with vaccines, antibodies or negative tests – as it happened",2021-03-10T00:00:29Z,"<p>This blog is now closed. We’ve launched a new blog at the link below: </p><ul><li><a href=""https://www.theguardian.com/world/live/2021/mar/10/coronavirus-live-news-brazil-sees-record-deaths-japan-may-stage-olympics-without-overseas-spectators"">Coronavirus news – live</a></li></ul>",https://www.theguardian.com/world/live/2021/mar/09/coronavirus-live-news-pfizer-vaccine-works-on-brazil-variant-us-airlines-ask-biden-to-back-covid-travel-guidelines,12958,"<p>This blog is now closed. We’ve launched a new blog at the link below: </p><ul><li><a href=""https://www.theguardian.com/world/live/2021/mar/10/coronavirus-live-news-brazil-sees-record-deaths-japan-may-stage-olympics-without-overseas-spectators"">Coronavirus news – live</a></li></ul>",World news,News,liveblog,"Nadeem Badshah (now); Mattha Busby ; Ben Quinn,Damien Gayle and Helen Sullivan (earlier)","Coronavirus, World news",world/live/2021/mar/09/coronavirus-live-news-pfizer-vaccine-works-on-brazil-variant-us-airlines-ask-biden-to-back-covid-travel-guidelines
Dr Fauci praises Australia's Covid lockdowns: 'Viruses don't mutate unless they replicate' ,2021-03-09T22:41:28Z,<p>White House medical adviser discusses challenge of variants in online chat with Paul Kelly</p>,https://www.theguardian.com/australia-news/2021/mar/10/dr-fauci-praises-australias-covid-lockdowns-viruses-dont-mutate-unless-they-replicate,822,<p>White House medical adviser discusses challenge of variants in online chat with Paul Kelly</p>,Australia news,News,article,Melissa Davey,"Health, Coronavirus, US news, Vaccines and immunisation, Australia news, Infectious diseases, Health",australia-news/2021/mar/10/dr-fauci-praises-australias-covid-lockdowns-viruses-dont-mutate-unless-they-replicate
"Joe Biden's dog caused injury to 'unfamiliar person', White House says",2021-03-09T20:33:33Z,"<p>Jen Psaki says Major, one of two German shepherds, left person with minor injuries after being startled in encounter last week</p>",https://www.theguardian.com/us-news/2021/mar/09/joe-biden-dog-major-white-house,274,"<p>Jen Psaki says Major, one of two German shepherds, left person with minor injuries after being startled in encounter last week</p>",US news,News,article,Joan E Greve in Washington,"Joe Biden, US news, World news",us-news/2021/mar/09/joe-biden-dog-major-white-house
"Morning mail: Queen breaks silence, Greg Hunt in hospital, can water be enhanced?",2021-03-09T19:54:39Z,<p><strong>Wednesday</strong>: Palace says issues of race raised by Harry and Meghan are ‘concerning’. Plus: study finds one in four women assaulted by male partner</p>,https://www.theguardian.com/australia-news/2021/mar/10/morning-mail-queen-breaks-silence-greg-hunt-in-hospital-can-water-be-enhanced,1216,<p><strong>Wednesday</strong>: Palace says issues of race raised by Harry and Meghan are ‘concerning’. Plus: study finds one in four women assaulted by male partner</p>,Australia news,News,article,Tamara Howie,,australia-news/2021/mar/10/morning-mail-queen-breaks-silence-greg-hunt-in-hospital-can-water-be-enhanced
The Guardian view on voting rights: don't import US-style suppression,2021-03-09T18:52:21Z,"<p>Governments should promote elections, not undermine them. Tory plans for compulsory ID must be resisted</p>",https://www.theguardian.com/commentisfree/2021/mar/09/the-guardian-view-on-voting-rights-dont-import-us-style-suppression,596,"<p>Governments should promote elections, not undermine them. Tory plans for compulsory ID must be resisted</p>",Opinion,Opinion,article,Editorial,"Politics, Electoral reform, Conservatives, Boris Johnson, Eric Pickles, Race, Identity cards, Voter apathy, Local elections",commentisfree/2021/mar/09/the-guardian-view-on-voting-rights-dont-import-us-style-suppression
Teen Vogue employees protest new editor-in-chief over anti-Asian tweets,2021-03-09T17:48:07Z,<p>Staffers sent letter to Condé Nast after racist tweets written by Alexi McCammond 10 years ago resurfaced</p>,https://www.theguardian.com/fashion/2021/mar/09/teen-vogue-alexi-mccammond-tweets-employees-letter,662,<p>Staffers sent letter to Condé Nast after racist tweets written by Alexi McCammond 10 years ago resurfaced</p>,Fashion,Lifestyle,article,Priya Elan,"Fashion, Condé Nast, US news, Race, Media, US press and publishing, Newspapers & magazines, World news",fashion/2021/mar/09/teen-vogue-alexi-mccammond-tweets-employees-letter
UK Covid news: Nicola Sturgeon eases some restrictions on outdoor mixing in Scotland – as it happened,2021-03-09T16:56:21Z,"<p>Scottish first minister announces <a href=""https://www.theguardian.com/politics/live/2021/mar/09/uk-covid-live-news-coronavirus-nhs-staff-pay-rise-vaccine-latest-updates?page=with:block-60478ac28f08ad2e0408335f#block-60478ac28f08ad2e0408335f"">limited changes to mixing, in particular for teenagers</a>. This live blog has now closed – <a href=""https://www.theguardian.com/world/series/coronavirus-live/latest"">please follow the global coronavirus live blog for updates</a></p><ul><li><a href=""https://www.theguardian.com/politics/live/2021/mar/09/uk-covid-live-news-coronavirus-nhs-staff-pay-rise-vaccine-latest-updates?page=with:block-604748128f08ad2e04082f0d#block-604748128f08ad2e04082f0d"">Whitty says Covid could ‘turn bad very fast’ if lockdown easing rushed</a></li><li><a href=""https://www.theguardian.com/politics/live/2021/mar/09/uk-covid-live-news-coronavirus-nhs-staff-pay-rise-vaccine-latest-updates?page=with:block-604745228f08ad2e04082ef3#block-604745228f08ad2e04082ef3"">Whitty says lifting lockdown will lead to ‘further surge’ and more deaths</a></li><li><a href=""https://www.theguardian.com/politics/live/2021/mar/09/uk-covid-live-news-coronavirus-nhs-staff-pay-rise-vaccine-latest-updates?page=with:block-604754068f08ad2e04082fbb#block-604754068f08ad2e04082fbb"">NHS pay originally meant to be rising by 2.1% this year, not 1%, MPs told</a></li><li><a href=""https://www.theguardian.com/uk-news/2021/mar/09/sturgeon-eases-some-covid-rules-on-outdoor-mixing-in-scotland"">Sturgeon eases some Covid rules on outdoor mixing in Scotland</a></li><li><a href=""https://www.theguardian.com/world/2021/mar/09/nhs-nightingale-hospitals-to-close-from-next-month"">NHS Nightingale hospitals to close from next month</a></li><li><a href=""https://www.theguardian.com/politics/2021/mar/09/labour-calls-for-audit-of-uks-preparedness-for-next-pandemic"">Labour calls for audit of UK’s preparedness for next pandemic</a></li></ul>",https://www.theguardian.com/politics/live/2021/mar/09/uk-covid-live-news-coronavirus-nhs-staff-pay-rise-vaccine-latest-updates,7376,"<p>Scottish first minister announces <a href=""https://www.theguardian.com/politics/live/2021/mar/09/uk-covid-live-news-coronavirus-nhs-staff-pay-rise-vaccine-latest-updates?page=with:block-60478ac28f08ad2e0408335f#block-60478ac28f08ad2e0408335f"">limited changes to mixing, in particular for teenagers</a>. This live blog has now closed – <a href=""https://www.theguardian.com/world/series/coronavirus-live/latest"">please follow the global coronavirus live blog for updates</a></p><ul><li><a href=""https://www.theguardian.com/politics/live/2021/mar/09/uk-covid-live-news-coronavirus-nhs-staff-pay-rise-vaccine-latest-updates?page=with:block-604748128f08ad2e04082f0d#block-604748128f08ad2e04082f0d"">Whitty says Covid could ‘turn bad very fast’ if lockdown easing rushed</a></li><li><a href=""https://www.theguardian.com/politics/live/2021/mar/09/uk-covid-live-news-coronavirus-nhs-staff-pay-rise-vaccine-latest-updates?page=with:block-604745228f08ad2e04082ef3#block-604745228f08ad2e04082ef3"">Whitty says lifting lockdown will lead to ‘further surge’ and more deaths</a></li><li><a href=""https://www.theguardian.com/politics/live/2021/mar/09/uk-covid-live-news-coronavirus-nhs-staff-pay-rise-vaccine-latest-updates?page=with:block-604754068f08ad2e04082fbb#block-604754068f08ad2e04082fbb"">NHS pay originally meant to be rising by 2.1% this year, not 1%, MPs told</a></li><li><a href=""https://www.theguardian.com/uk-news/2021/mar/09/sturgeon-eases-some-covid-rules-on-outdoor-mixing-in-scotland"">Sturgeon eases some Covid rules on outdoor mixing in Scotland</a></li><li><a href=""https://www.theguardian.com/world/2021/mar/09/nhs-nightingale-hospitals-to-close-from-next-month"">NHS Nightingale hospitals to close from next month</a></li><li><a href=""https://www.theguardian.com/politics/2021/mar/09/labour-calls-for-audit-of-uks-preparedness-for-next-pandemic"">Labour calls for audit of UK’s preparedness for next pandemic</a></li></ul>",Politics,News,liveblog,Andrew Sparrow,"Coronavirus, Politics, UK news, Health policy, Infectious diseases, Chris Whitty, Patrick Vallance, Health, Simon Stevens, Science, Scotland, Nicola Sturgeon, George Osborne, Spring budget 2021",politics/live/2021/mar/09/uk-covid-live-news-coronavirus-nhs-staff-pay-rise-vaccine-latest-updates
Stephen Colbert on the royals: 'This medieval selective breeding program might be racist',2021-03-09T15:51:54Z,<p>Late-night hosts discussed the much-discussed interview with Harry and Meghan and the $1.9tn Covid relief bill</p>,https://www.theguardian.com/culture/2021/mar/09/stephen-colbert-royal-family-late-night-tv,651,<p>Late-night hosts discussed the much-discussed interview with Harry and Meghan and the $1.9tn Covid relief bill</p>,Culture,Arts,article,Guardian staff,"Late-night TV roundup, Stephen Colbert, Culture, TV comedy, Jimmy Kimmel, Prince Harry, Monarchy, Comedy, Television, Television & radio, UK news",culture/2021/mar/09/stephen-colbert-royal-family-late-night-tv
Tom Cotton attacks relief payments to prisoners but backed them under Trump,2021-03-09T15:01:30Z,"<p>Republican senator condemns Democrats for giving money to ‘murderers and rapists’ and cites Boston Marathon bomber</p><ul><li><a href=""https://www.theguardian.com/us-news/series/us-politics-live/latest"">US politics – live coverage</a></li></ul>",https://www.theguardian.com/us-news/2021/mar/09/tom-cotton-payments-prisoners-vote-under-trump,437,"<p>Republican senator condemns Democrats for giving money to ‘murderers and rapists’ and cites Boston Marathon bomber</p><ul><li><a href=""https://www.theguardian.com/us-news/series/us-politics-live/latest"">US politics – live coverage</a></li></ul>",US news,News,article,Oliver Milman,"Republicans, US news, World news",us-news/2021/mar/09/tom-cotton-payments-prisoners-vote-under-trump
Publisher ceases promotion of Cuomo's Covid book amid nursing home inquiry,2021-03-09T12:44:18Z,<p>New York governor has been accused of conspiring to cover up Covid-19 deaths in nursing homes </p>,https://www.theguardian.com/us-news/2021/mar/09/cuomo-book-covid-publisher-halts-promotional-efforts,508,<p>New York governor has been accused of conspiring to cover up Covid-19 deaths in nursing homes </p>,US news,News,article,Martin Pengelly in New York,"Andrew Cuomo, US news, New York, Coronavirus, Sexual harassment",us-news/2021/mar/09/cuomo-book-covid-publisher-halts-promotional-efforts
The best way for Democrats to weaken the far right? Build up the labor movement,2021-03-09T11:14:54Z,<p>An organized working class in America is the best hope for defeating an increasingly militant far right </p>,https://www.theguardian.com/commentisfree/2021/mar/09/labor-movement-working-class-america-politics,1050,<p>An organized working class in America is the best hope for defeating an increasingly militant far right </p>,Opinion,Opinion,article,Brendan O’Connor,"US politics, The far right, Democrats, US Capitol attack, US news, World news",commentisfree/2021/mar/09/labor-movement-working-class-america-politics
First Thing: outcry in Georgia over attack on voting access,2021-03-09T11:09:40Z,"<p>Republican lawmakers advanced a bill to end mail-in voting without an excuse, after record election turnout. Plus, royal family remain tight-lipped over explosive Meghan and Harry interview</p><ul><li><strong><a href=""https://www.theguardian.com/info/2018/sep/17/guardian-us-morning-briefing-sign-up-to-stay-informed"">Don’t already get First Thing in your inbox? Sign up here</a></strong></li></ul>",https://www.theguardian.com/us-news/2021/mar/09/first-thing-outcry-in-georgia-over-attack-on-voting-access,1124,"<p>Republican lawmakers advanced a bill to end mail-in voting without an excuse, after record election turnout. Plus, royal family remain tight-lipped over explosive Meghan and Harry interview</p><ul><li><strong><a href=""https://www.theguardian.com/info/2018/sep/17/guardian-us-morning-briefing-sign-up-to-stay-informed"">Don’t already get First Thing in your inbox? Sign up here</a></strong></li></ul>",US news,News,article,Molly Blackall,US news,us-news/2021/mar/09/first-thing-outcry-in-georgia-over-attack-on-voting-access
Naomi Klein: 'We shouldn’t be surprised that kids are radicalised',2021-03-09T10:00:52Z,"<p>With How to Change Everything, the activist has written her first book for young people. She explains how she has been inspired by a new, very young generation of protesters<br></p>",https://www.theguardian.com/books/2021/mar/09/naomi-klein-we-shouldnt-be-surprised-that-kids-are-radicalised-how-to-change-everything,1500,"<p>With How to Change Everything, the activist has written her first book for young people. She explains how she has been inspired by a new, very young generation of protesters<br></p>",Books,Arts,article,Patrick Barkham,"Naomi Klein, Books, Culture, Children, Environment, Children and teenagers, Greta Thunberg, Climate crisis",books/2021/mar/09/naomi-klein-we-shouldnt-be-surprised-that-kids-are-radicalised-how-to-change-everything
Undocumented Texans are reeling from last month’s storm – and they’re cut off from federal aid,2021-03-09T08:00:50Z,"<p>After four years of family separations and deportations, many are reluctant to seek help after the natural disaster</p>",https://www.theguardian.com/us-news/2021/mar/09/texas-storm-undocumented-federal-aid,960,"<p>After four years of family separations and deportations, many are reluctant to seek help after the natural disaster</p>",US news,News,article,Alexandra Villarreal in Austin,"Texas, US immigration, US news, Coronavirus",us-news/2021/mar/09/texas-storm-undocumented-federal-aid
Flying cats and a burning Banksy: why are digital art prices suddenly rocketing?,2021-03-09T06:00:49Z,"<p>A Banksy just fetched $382,000 despite going up in smoke, while a cat cartoon bagged twice that. And it’s all thanks to NFTs, an offshoot of crypto currency bitcoin. But is this a bubble about to burst?</p>",https://www.theguardian.com/artanddesign/2021/mar/09/nfts-flying-cats-burning-banksy-digital-art-crypto-art-bitcoin-rocketing,1987,"<p>A Banksy just fetched $382,000 despite going up in smoke, while a cat cartoon bagged twice that. And it’s all thanks to NFTs, an offshoot of crypto currency bitcoin. But is this a bubble about to burst?</p>",Art and design,Arts,article,Stuart Jeffries,"Art, Digital art, Art and design, Culture, Technology, Collecting, Life and style, Banksy, NBA, US sports, Blockchain, Non-fungible tokens (NFTs)",artanddesign/2021/mar/09/nfts-flying-cats-burning-banksy-digital-art-crypto-art-bitcoin-rocketing
'What have they done?': What the papers say about fallout from the Meghan and Harry interview,2021-03-09T01:49:54Z,"<p>Palace crisis is splashed across the front pages, with several papers asking what racism accusations will mean for the royal family</p>",https://www.theguardian.com/uk-news/2021/mar/09/what-have-they-done-what-the-papers-say-about-fallout-from-the-meghan-and-harry-interview,396,"<p>Palace crisis is splashed across the front pages, with several papers asking what racism accusations will mean for the royal family</p>",UK news,News,article,Helen Sullivan,"Meghan, the Duchess of Sussex, Prince Harry, UK news, Media, Newspapers, Monarchy, Newspapers & magazines",uk-news/2021/mar/09/what-have-they-done-what-the-papers-say-about-fallout-from-the-meghan-and-harry-interview
Georgia Republicans advance sweeping new restrictions on voting – as it happened,2021-03-09T01:02:17Z,"<ul><li><a href=""https://www.theguardian.com/us-news/live/2021/mar/08/george-floyd-derek-chauvin-black-lives-matter-trial-joe-biden-covid-coronavirus-live?page=with:block-60469bac8f08ad2e040828da#block-60469bac8f08ad2e040828da"">Bill passed in senate is slap in the face to Black voters, say Democrats</a></li><li><a href=""https://www.theguardian.com/us-news/2021/mar/08/george-floyd-trial-delayed-for-decision-on-extra-charge"">George Floyd: trial of police officer Derek Chauvin delayed </a></li><li><a href=""https://www.theguardian.com/us-news/live/2021/mar/08/george-floyd-derek-chauvin-black-lives-matter-trial-joe-biden-covid-coronavirus-live?page=with:block-60463ea28f08a73fb5238411#block-60463ea28f08a73fb5238411"">Republican senator of Missouri will not seek re-election</a><br></li><li><a href=""https://www.theguardian.com/info/2018/sep/17/guardian-us-morning-briefing-sign-up-to-stay-informed"">Sign up to receive First Thing – our daily briefing by email</a><br></li></ul>",https://www.theguardian.com/us-news/live/2021/mar/08/george-floyd-derek-chauvin-black-lives-matter-trial-joe-biden-covid-coronavirus-live,10545,"<ul><li><a href=""https://www.theguardian.com/us-news/live/2021/mar/08/george-floyd-derek-chauvin-black-lives-matter-trial-joe-biden-covid-coronavirus-live?page=with:block-60469bac8f08ad2e040828da#block-60469bac8f08ad2e040828da"">Bill passed in senate is slap in the face to Black voters, say Democrats</a></li><li><a href=""https://www.theguardian.com/us-news/2021/mar/08/george-floyd-trial-delayed-for-decision-on-extra-charge"">George Floyd: trial of police officer Derek Chauvin delayed </a></li><li><a href=""https://www.theguardian.com/us-news/live/2021/mar/08/george-floyd-derek-chauvin-black-lives-matter-trial-joe-biden-covid-coronavirus-live?page=with:block-60463ea28f08a73fb5238411#block-60463ea28f08a73fb5238411"">Republican senator of Missouri will not seek re-election</a><br></li><li><a href=""https://www.theguardian.com/info/2018/sep/17/guardian-us-morning-briefing-sign-up-to-stay-informed"">Sign up to receive First Thing – our daily briefing by email</a><br></li></ul>",US news,News,liveblog,"Lois Beckett, Joan E Greve and Martin Belam","Joe Biden, Biden administration, US news",us-news/live/2021/mar/08/george-floyd-derek-chauvin-black-lives-matter-trial-joe-biden-covid-coronavirus-live
"Vaccinated people can meet indoors, says US – as it happened",2021-03-08T23:51:01Z,"<p>This blog is now closed. We’ve launched a new blog at the link below: </p><ul><li><a href=""https://www.theguardian.com/world/live/2021/mar/09/coronavirus-live-news-pfizer-vaccine-works-on-brazil-variant-us-airlines-ask-biden-to-back-covid-travel-guidelines"">Coronavirus news – live</a></li></ul>",https://www.theguardian.com/world/live/2021/mar/08/coronavirus-live-news-us-passes-90m-vaccinations-uk-daily-deaths-drop-to-82,11142,"<p>This blog is now closed. We’ve launched a new blog at the link below: </p><ul><li><a href=""https://www.theguardian.com/world/live/2021/mar/09/coronavirus-live-news-pfizer-vaccine-works-on-brazil-variant-us-airlines-ask-biden-to-back-covid-travel-guidelines"">Coronavirus news – live</a></li></ul>",World news,News,liveblog,"Jedidajah Otte (now); Rachel Hall, Alex Mistlin and Alison Rourke (earlier)","Coronavirus, US news, Infectious diseases, Science, World news, UK news, Norway, Israel",world/live/2021/mar/08/coronavirus-live-news-us-passes-90m-vaccinations-uk-daily-deaths-drop-to-82
Biden pledges to tackle 'scourge' of sexual assault in US military,2021-03-08T23:16:57Z,<p>President speaks on International Women’s Day and orders review of Trump-era rules on how to respond to sexual assault on campus</p>,https://www.theguardian.com/us-news/2021/mar/08/biden-us-white-house-us-military,397,<p>President speaks on International Women’s Day and orders review of Trump-era rules on how to respond to sexual assault on campus</p>,US news,News,article,Guardian staff and agencies,"US military, Joe Biden, Biden administration, US news, World news",us-news/2021/mar/08/biden-us-white-house-us-military
Microsoft hack: Biden launches emergency taskforce to address cyber-attack,2021-03-08T23:11:50Z,"<p>The ‘unusually aggressive’ attack allowed hackers to access email accounts of at least 30,000 organizations in the US</p>",https://www.theguardian.com/us-news/2021/mar/08/microsoft-cyber-attack-biden-emergency-task-force,786,"<p>The ‘unusually aggressive’ attack allowed hackers to access email accounts of at least 30,000 organizations in the US</p>",US news,News,article,Kari Paul,"US news, Microsoft, Cybercrime, Hacking, Biden administration, Technology",us-news/2021/mar/08/microsoft-cyber-attack-biden-emergency-task-force
Palace under pressure to respond to Harry and Meghan racism claims ,2021-03-08T22:20:57Z,"<p>‘Hand grenade’ Oprah interview shakes royal family to its foundations and leaves members open to suspicion</p><ul><li><a href=""https://www.theguardian.com/uk-news/live/2021/mar/08/harry-meghan-oprah-interview-duke-duchess-sussex-toxic-environment-live-news"">Meghan and Harry Oprah interview live updates</a></li></ul>",https://www.theguardian.com/uk-news/2021/mar/08/palace-under-pressure-to-respond-to-harry-and-meghan-racism-claims,1329,"<p>‘Hand grenade’ Oprah interview shakes royal family to its foundations and leaves members open to suspicion</p><ul><li><a href=""https://www.theguardian.com/uk-news/live/2021/mar/08/harry-meghan-oprah-interview-duke-duchess-sussex-toxic-environment-live-news"">Meghan and Harry Oprah interview live updates</a></li></ul>",UK news,News,article,Caroline Davies,"Monarchy, Meghan, the Duchess of Sussex, Prince Harry, UK news, Oprah Winfrey, Television & radio, Culture",uk-news/2021/mar/08/palace-under-pressure-to-respond-to-harry-and-meghan-racism-claims
"Brazil: Lula has convictions quashed, leaving him free to challenge Bolsonaro",2021-03-08T20:56:51Z,<ul><li>Leftwing former president has political rights restored by judge</li><li>Workers’ party leader was jailed on corruption charges in 2018</li></ul>,https://www.theguardian.com/world/2021/mar/08/lula-convictions-annulled-by-brazil-judge-bolsonaro-election-2022,621,<ul><li>Leftwing former president has political rights restored by judge</li><li>Workers’ party leader was jailed on corruption charges in 2018</li></ul>,World news,News,article,Tom Phillips in Rio de Janeiro,"Luiz Inácio Lula da Silva, Brazil, Americas, World news",world/2021/mar/08/lula-convictions-annulled-by-brazil-judge-bolsonaro-election-2022
Every executive action Joe Biden has signed — and what they do,2021-03-08T18:55:09Z,"<p>The president has signed a number of executive orders during his first weeks in office, ranging from the pandemic to immigration </p>",https://www.theguardian.com/us-news/2021/feb/08/joe-biden-executive-orders,2604,"<p>The president has signed a number of executive orders during his first weeks in office, ranging from the pandemic to immigration </p>",US news,News,article,"Alvin Chang, Francisco Navas, Daniel Strauss and Guardian staff","Joe Biden, US domestic policy, US foreign policy, US politics, Biden administration, US news, World news",us-news/2021/feb/08/joe-biden-executive-orders
CDC says fully vaccinated Americans can gather indoors without masks,2021-03-08T17:13:38Z,"<p>Guidelines say fully vaccinated can visit indoors with others who are vaccinated, and with unvaccinated from a single household</p>",https://www.theguardian.com/us-news/2021/mar/08/covid-guidelines-new-rules-vaccine-cdc,432,"<p>Guidelines say fully vaccinated can visit indoors with others who are vaccinated, and with unvaccinated from a single household</p>",US news,News,article,Joan E Greve in Washington and agencies,"US news, Coronavirus, Vaccines and immunisation, World news",us-news/2021/mar/08/covid-guidelines-new-rules-vaccine-cdc
How Daca helped athletes live their dreams in America,2021-03-08T11:00:25Z,"<p>The US government program helps protect more than 650,000 immigrants, providing security for some of them to pursue their athletic goals</p>",https://www.theguardian.com/sport/2021/mar/08/how-daca-helped-athletes-live-their-dreams-in-america,1475,"<p>The US government program helps protect more than 650,000 immigrants, providing security for some of them to pursue their athletic goals</p>",Sport,Sport,article,Rich Tenorio,"US sports, Dream Act, US news, Sport",sport/2021/mar/08/how-daca-helped-athletes-live-their-dreams-in-america
