headline,pub_date,snippet,web_url,word_count,abstract,section_name,pillar_name,type,byline,keywords,article_id
"New cases top 11,000 nationwide amid stoush over ‘tourism testing’ – as it happened",2021-12-28T07:47:08Z,"<p><a href=""https://www.theguardian.com/australia-news/live/2021/dec/28/australia-covid-live-updates-testing-chaos-delays-results-case-numbers-nsw-vic-qld-morrison-vaccines-omicron?page=with:block-61ca98f38f08efd5f0de65b3#block-61ca98f38f08efd5f0de65b3"">Daily cases in Australia top 11,000 for first time</a>; more positive cases after Sydney lab <a href=""https://www.theguardian.com/australia-news/live/2021/dec/28/australia-covid-live-updates-testing-chaos-delays-results-case-numbers-nsw-vic-qld-morrison-vaccines-omicron?page=with:block-61ca651c8f086332f3d10218#block-61ca651c8f086332f3d10218"">testing error</a>; ‘sacred’ <a href=""https://www.theguardian.com/australia-news/live/2021/dec/28/australia-covid-live-updates-testing-chaos-delays-results-case-numbers-nsw-vic-qld-morrison-vaccines-omicron?filterKeyEvents=false&amp;page=with:block-61ca53738f08efd5f0de62fa#block-61ca53738f08efd5f0de62fa"">SCG Ashes Test</a> to go ahead, NSW minister says; Queensland reports 1,158 cases, scraps day <a href=""https://www.theguardian.com/australia-news/live/2021/dec/28/australia-covid-live-updates-testing-chaos-delays-results-case-numbers-nsw-vic-qld-morrison-vaccines-omicron?page=with:block-61ca54b88f086332f3d10166#block-61ca54b88f086332f3d10166"">five testing requirement</a> after <a href=""https://www.theguardian.com/australia-news/live/2021/dec/28/australia-covid-live-updates-testing-chaos-delays-results-case-numbers-nsw-vic-qld-morrison-vaccines-omicron?page=with:block-61ca43148f086332f3d100a8#block-61ca43148f086332f3d100a8"">Brad Hazzard</a> criticises ‘tourism testing’. This blog is now closed</p><ul><li><a href=""https://www.theguardian.com/australia-news/2021/dec/28/nsw-demands-queensland-change-stupid-covid-test-rules-as-queues-and-delays-grow"">NSW demands Queensland change ‘stupid’ Covid test rules as queues and delays grow</a></li><li><a href=""https://www.theguardian.com/australia-news/2021/dec/28/nsw-health-staff-pressured-to-return-from-leave-as-covid-cripples-hospitals"">NSW health staff pressured to return from Christmas leave as Covid cripples hospitals</a></li><li><a href=""https://www.theguardian.com/australia-news/2021/dec/28/lack-of-free-covid-rapid-antigen-tests-forces-australian-small-businesses-to-close"">Lack of free Covid rapid antigen tests forces small businesses to close</a></li><li><a href=""https://www.theguardian.com/australia-news/2021/dec/28/covid-positive-test-rate-in-nsw-jumps-to-65-highest-since-start-of-pandemic"">Covid positive test rate in NSW jumps to 6.5%, highest since start of pandemic</a></li><li><a href=""https://www.theguardian.com/news/datablog/2021/dec/22/covid-hospitalisation-rates-how-is-australias-health-system-coping-with-the-spread-of-omicron"">Covid hospitalisation rates: how is Australia’s health system coping with the spread of Omicron?</a></li><li><a href=""https://www.theguardian.com/australia-news/datablog/ng-interactive/2021/nov/08/covid-19-vaccine-rollout-australia-vaccination-rate-progress-how-many-people-vaccinated-percent-tracker-australian-states-number-total-daily-live-data-stats-updates-news-schedule-tracking-chart-percentage-new-cases-today"">Vaccine rollout tracker</a>;<a href=""https://www.theguardian.com/australia-news/datablog/ng-interactive/2021/nov/08/covid-19-data-tracker-map-australia-cases-today-coronavirus-tracking-stats-live-data-update-by-state-melbourne-regional-victoria-vic-sydney-nsw-how-many-new-active-case-numbers-statistics-deaths-death-toll""> Cases and data tracker</a></li><li><a href=""https://www.theguardian.com/technology/ng-interactive/2018/may/15/the-guardian-app?CMP=cvau_sfl"">Get our free news app</a>; <a href=""https://www.theguardian.com/world/guardian-australia-morning-mail/2014/jun/24/-sp-guardian-australias-morning-mail-subscribe-by-email?CMP=cvau_sfl"">get our morning email briefing</a></li><li><a href=""https://www.theguardian.com/world/live/2021/dec/27/covid-news-live-australia-case-rise-continues-omicron-grounds-1000-more-us-flights"">Follow our global Covid live blog</a></li><li><a href=""https://www.theguardian.com/world/coronavirus-outbreak"">See all our coronavirus coverage</a></li></ul>",https://www.theguardian.com/australia-news/live/2021/dec/28/australia-covid-live-updates-testing-chaos-delays-results-case-numbers-nsw-vic-qld-morrison-vaccines-omicron,3776,"<p><a href=""https://www.theguardian.com/australia-news/live/2021/dec/28/australia-covid-live-updates-testing-chaos-delays-results-case-numbers-nsw-vic-qld-morrison-vaccines-omicron?page=with:block-61ca98f38f08efd5f0de65b3#block-61ca98f38f08efd5f0de65b3"">Daily cases in Australia top 11,000 for first time</a>; more positive cases after Sydney lab <a href=""https://www.theguardian.com/australia-news/live/2021/dec/28/australia-covid-live-updates-testing-chaos-delays-results-case-numbers-nsw-vic-qld-morrison-vaccines-omicron?page=with:block-61ca651c8f086332f3d10218#block-61ca651c8f086332f3d10218"">testing error</a>; ‘sacred’ <a href=""https://www.theguardian.com/australia-news/live/2021/dec/28/australia-covid-live-updates-testing-chaos-delays-results-case-numbers-nsw-vic-qld-morrison-vaccines-omicron?filterKeyEvents=false&amp;page=with:block-61ca53738f08efd5f0de62fa#block-61ca53738f08efd5f0de62fa"">SCG Ashes Test</a> to go ahead, NSW minister says; Queensland reports 1,158 cases, scraps day <a href=""https://www.theguardian.com/australia-news/live/2021/dec/28/australia-covid-live-updates-testing-chaos-delays-results-case-numbers-nsw-vic-qld-morrison-vaccines-omicron?page=with:block-61ca54b88f086332f3d10166#block-61ca54b88f086332f3d10166"">five testing requirement</a> after <a href=""https://www.theguardian.com/australia-news/live/2021/dec/28/australia-covid-live-updates-testing-chaos-delays-results-case-numbers-nsw-vic-qld-morrison-vaccines-omicron?page=with:block-61ca43148f086332f3d100a8#block-61ca43148f086332f3d100a8"">Brad Hazzard</a> criticises ‘tourism testing’. This blog is now closed</p><ul><li><a href=""https://www.theguardian.com/australia-news/2021/dec/28/nsw-demands-queensland-change-stupid-covid-test-rules-as-queues-and-delays-grow"">NSW demands Queensland change ‘stupid’ Covid test rules as queues and delays grow</a></li><li><a href=""https://www.theguardian.com/australia-news/2021/dec/28/nsw-health-staff-pressured-to-return-from-leave-as-covid-cripples-hospitals"">NSW health staff pressured to return from Christmas leave as Covid cripples hospitals</a></li><li><a href=""https://www.theguardian.com/australia-news/2021/dec/28/lack-of-free-covid-rapid-antigen-tests-forces-australian-small-businesses-to-close"">Lack of free Covid rapid antigen tests forces small businesses to close</a></li><li><a href=""https://www.theguardian.com/australia-news/2021/dec/28/covid-positive-test-rate-in-nsw-jumps-to-65-highest-since-start-of-pandemic"">Covid positive test rate in NSW jumps to 6.5%, highest since start of pandemic</a></li><li><a href=""https://www.theguardian.com/news/datablog/2021/dec/22/covid-hospitalisation-rates-how-is-australias-health-system-coping-with-the-spread-of-omicron"">Covid hospitalisation rates: how is Australia’s health system coping with the spread of Omicron?</a></li><li><a href=""https://www.theguardian.com/australia-news/datablog/ng-interactive/2021/nov/08/covid-19-vaccine-rollout-australia-vaccination-rate-progress-how-many-people-vaccinated-percent-tracker-australian-states-number-total-daily-live-data-stats-updates-news-schedule-tracking-chart-percentage-new-cases-today"">Vaccine rollout tracker</a>;<a href=""https://www.theguardian.com/australia-news/datablog/ng-interactive/2021/nov/08/covid-19-data-tracker-map-australia-cases-today-coronavirus-tracking-stats-live-data-update-by-state-melbourne-regional-victoria-vic-sydney-nsw-how-many-new-active-case-numbers-statistics-deaths-death-toll""> Cases and data tracker</a></li><li><a href=""https://www.theguardian.com/technology/ng-interactive/2018/may/15/the-guardian-app?CMP=cvau_sfl"">Get our free news app</a>; <a href=""https://www.theguardian.com/world/guardian-australia-morning-mail/2014/jun/24/-sp-guardian-australias-morning-mail-subscribe-by-email?CMP=cvau_sfl"">get our morning email briefing</a></li><li><a href=""https://www.theguardian.com/world/live/2021/dec/27/covid-news-live-australia-case-rise-continues-omicron-grounds-1000-more-us-flights"">Follow our global Covid live blog</a></li><li><a href=""https://www.theguardian.com/world/coronavirus-outbreak"">See all our coronavirus coverage</a></li></ul>",Australia news,News,liveblog,Donna Lu (now) and Tory Shepherd (earlier),"Australia news, Health, Vaccines and immunisation, New South Wales, Victoria, Australian politics",australia-news/live/2021/dec/28/australia-covid-live-updates-testing-chaos-delays-results-case-numbers-nsw-vic-qld-morrison-vaccines-omicron
Lack of free Covid rapid antigen tests forces Australian small businesses to close,2021-12-28T06:20:31Z,"<p>Many hospitality and tourism operators have shut during the crucial summer holiday period due to a lack of staff</p><ul><li><a href=""https://www.theguardian.com/australia-news/series/australian-news-live/latest"">Follow our Covid live blog for the latest updates</a></li><li><a href=""https://www.theguardian.com/australia-news/datablog/ng-interactive/2021/nov/08/covid-19-vaccine-rollout-australia-vaccination-rate-progress-how-many-people-vaccinated-percent-tracker-australian-states-number-total-daily-live-data-stats-updates-news-schedule-tracking-chart-percentage-new-cases-today"">Vaccine rollout tracker</a>;<a href=""https://www.theguardian.com/australia-news/datablog/ng-interactive/2021/nov/08/covid-19-data-tracker-map-australia-cases-today-coronavirus-tracking-stats-live-data-update-by-state-melbourne-regional-victoria-vic-sydney-nsw-how-many-new-active-case-numbers-statistics-deaths-death-toll""> Cases and data tracker</a></li><li><a href=""https://www.theguardian.com/technology/ng-interactive/2018/may/15/the-guardian-app?CMP=cvau_sfl"">Get our free news app</a>; <a href=""https://www.theguardian.com/world/guardian-australia-morning-mail/2014/jun/24/-sp-guardian-australias-morning-mail-subscribe-by-email?CMP=cvau_sfl"">get our morning email briefing</a></li></ul>",https://www.theguardian.com/australia-news/2021/dec/28/lack-of-free-covid-rapid-antigen-tests-forces-australian-small-businesses-to-close,673,"<p>Many hospitality and tourism operators have shut during the crucial summer holiday period due to a lack of staff</p><ul><li><a href=""https://www.theguardian.com/australia-news/series/australian-news-live/latest"">Follow our Covid live blog for the latest updates</a></li><li><a href=""https://www.theguardian.com/australia-news/datablog/ng-interactive/2021/nov/08/covid-19-vaccine-rollout-australia-vaccination-rate-progress-how-many-people-vaccinated-percent-tracker-australian-states-number-total-daily-live-data-stats-updates-news-schedule-tracking-chart-percentage-new-cases-today"">Vaccine rollout tracker</a>;<a href=""https://www.theguardian.com/australia-news/datablog/ng-interactive/2021/nov/08/covid-19-data-tracker-map-australia-cases-today-coronavirus-tracking-stats-live-data-update-by-state-melbourne-regional-victoria-vic-sydney-nsw-how-many-new-active-case-numbers-statistics-deaths-death-toll""> Cases and data tracker</a></li><li><a href=""https://www.theguardian.com/technology/ng-interactive/2018/may/15/the-guardian-app?CMP=cvau_sfl"">Get our free news app</a>; <a href=""https://www.theguardian.com/world/guardian-australia-morning-mail/2014/jun/24/-sp-guardian-australias-morning-mail-subscribe-by-email?CMP=cvau_sfl"">get our morning email briefing</a></li></ul>",Australia news,News,article,Ben Butler,"Business, Coronavirus, Australia news, New South Wales, Dominic Perrottet",australia-news/2021/dec/28/lack-of-free-covid-rapid-antigen-tests-forces-australian-small-businesses-to-close
Joe Biden says US Covid surge should be ‘a source of concern but not panic’,2021-12-27T19:18:26Z,"<p>President says Americans with boosters are ‘highly protected’ as CDC reduces isolation time for those with asymptomatic cases</p><ul><li><a href=""https://www.theguardian.com/world/2021/dec/27/us-child-covid-omicron-infections-school-closures"">Alarm spreads over rise in US child Covid infections</a></li></ul>",https://www.theguardian.com/world/2021/dec/27/fauci-covid-coronavirus-omicron-new-years-eve,1125,"<p>President says Americans with boosters are ‘highly protected’ as CDC reduces isolation time for those with asymptomatic cases</p><ul><li><a href=""https://www.theguardian.com/world/2021/dec/27/us-child-covid-omicron-infections-school-closures"">Alarm spreads over rise in US child Covid infections</a></li></ul>",World news,News,article,"Edward Helmore, Maya Yang and agencies","Coronavirus, World news, US news",world/2021/dec/27/fauci-covid-coronavirus-omicron-new-years-eve
Unfinished business: eight things on Scott Morrison’s to-do list as election nears,2021-12-27T16:30:04Z,"<p>From an integrity commission to climate, there are still many question marks facing the federal government</p><ul><li><a href=""https://www.theguardian.com/technology/ng-interactive/2018/may/15/the-guardian-app?CMP=cvau_sfl"">Get our free news app</a>; <a href=""https://www.theguardian.com/world/guardian-australia-morning-mail/2014/jun/24/-sp-guardian-australias-morning-mail-subscribe-by-email?CMP=cvau_sfl"">get our morning email briefing</a></li></ul>",https://www.theguardian.com/australia-news/2021/dec/28/unfinished-business-eight-things-on-scott-morrisons-to-do-list-as-election-nears,1697,"<p>From an integrity commission to climate, there are still many question marks facing the federal government</p><ul><li><a href=""https://www.theguardian.com/technology/ng-interactive/2018/may/15/the-guardian-app?CMP=cvau_sfl"">Get our free news app</a>; <a href=""https://www.theguardian.com/world/guardian-australia-morning-mail/2014/jun/24/-sp-guardian-australias-morning-mail-subscribe-by-email?CMP=cvau_sfl"">get our morning email briefing</a></li></ul>",Australia news,News,article,Katharine Murphy Political editor,"Scott Morrison, Australian politics, Australia news, Coalition, Australian election 2022",australia-news/2021/dec/28/unfinished-business-eight-things-on-scott-morrisons-to-do-list-as-election-nears
Questions over data transparency around Australian doctor’s $1m GoFundMe Covid-19 vaccine ,2021-12-27T16:30:03Z,"<p>Professor Nikolai Petrovsky has been criticised for advocating for Covax-19 vaccine to be approved for use in Australia without making publicly available substantial peer-reviewed clinical evidence to support its efficacy</p><ul><li><a href=""https://www.theguardian.com/technology/ng-interactive/2018/may/15/the-guardian-app?CMP=cvau_sfl"">Download the free Guardian app</a>; <a href=""https://www.theguardian.com/world/guardian-australia-morning-mail/2014/jun/24/-sp-guardian-australias-morning-mail-subscribe-by-email?CMP=cvau_sfl"">get our morning email briefing</a><br></li></ul>",https://www.theguardian.com/world/2021/dec/28/questions-over-data-transparency-around-australian-doctors-1m-gofundme-covid-19-vaccine,2298,"<p>Professor Nikolai Petrovsky has been criticised for advocating for Covax-19 vaccine to be approved for use in Australia without making publicly available substantial peer-reviewed clinical evidence to support its efficacy</p><ul><li><a href=""https://www.theguardian.com/technology/ng-interactive/2018/may/15/the-guardian-app?CMP=cvau_sfl"">Download the free Guardian app</a>; <a href=""https://www.theguardian.com/world/guardian-australia-morning-mail/2014/jun/24/-sp-guardian-australias-morning-mail-subscribe-by-email?CMP=cvau_sfl"">get our morning email briefing</a><br></li></ul>",World news,News,article,Donna Lu and Royce Kurmelovs,"Coronavirus, South Australia, Australia news, Medical research, Vaccines and immunisation",world/2021/dec/28/questions-over-data-transparency-around-australian-doctors-1m-gofundme-covid-19-vaccine
"‘We’re all going to get Omicron’: NSW health minister’s warning as Australia records 9,618 cases",2021-12-26T05:43:36Z,"<p>Covid case numbers continue to grow across Australia with 6394 cases in NSW, 1,608 in Victoria, 774 in South Australia, 714 in Queensland, 71 in the ACT, 44 in Tasmania, 12 in the Northern Territory and one in Western Australia</p><ul><li><a href=""https://www.theguardian.com/australia-news/2021/dec/24/millions-more-australians-to-be-eligible-for-covid-booster-as-interval-reduced-to-four-months"">Millions more Australians to be eligible for Covid booster</a></li><li><a href=""https://www.theguardian.com/world/live/2021/dec/26/covid-live-news-france-and-italy-see-record-daily-cases-australias-omicron-outbreak-spreads"">Follow the live blog for the latest updates</a></li><li><a href=""https://www.theguardian.com/technology/ng-interactive/2018/may/15/the-guardian-app?CMP=cvau_sfl"">Get our free news app</a>; <a href=""https://www.theguardian.com/world/guardian-australia-morning-mail/2014/jun/24/-sp-guardian-australias-morning-mail-subscribe-by-email?CMP=cvau_sfl"">get our morning email briefing</a></li></ul>",https://www.theguardian.com/australia-news/2021/dec/26/australia-covid-update-nsw-records-6394-cases-and-victoria-reports-1608-new-cases,968,"<p>Covid case numbers continue to grow across Australia with 6394 cases in NSW, 1,608 in Victoria, 774 in South Australia, 714 in Queensland, 71 in the ACT, 44 in Tasmania, 12 in the Northern Territory and one in Western Australia</p><ul><li><a href=""https://www.theguardian.com/australia-news/2021/dec/24/millions-more-australians-to-be-eligible-for-covid-booster-as-interval-reduced-to-four-months"">Millions more Australians to be eligible for Covid booster</a></li><li><a href=""https://www.theguardian.com/world/live/2021/dec/26/covid-live-news-france-and-italy-see-record-daily-cases-australias-omicron-outbreak-spreads"">Follow the live blog for the latest updates</a></li><li><a href=""https://www.theguardian.com/technology/ng-interactive/2018/may/15/the-guardian-app?CMP=cvau_sfl"">Get our free news app</a>; <a href=""https://www.theguardian.com/world/guardian-australia-morning-mail/2014/jun/24/-sp-guardian-australias-morning-mail-subscribe-by-email?CMP=cvau_sfl"">get our morning email briefing</a></li></ul>",Australia news,News,article,Caitlin Cassidy,"Australia news, Coronavirus, Omicron variant, New South Wales, Victoria",australia-news/2021/dec/26/australia-covid-update-nsw-records-6394-cases-and-victoria-reports-1608-new-cases
"Head of US FDA’s advisory group: ‘We never expected Covid vaccines to be so good, so effective’",2021-12-25T07:00:47Z,<p>Dr Arnold Monto says he watched as a vaccine was developed both faster and more effectively than any dared to hope – but says it’s unlikely to give ‘permanent protection’</p>,https://www.theguardian.com/society/2021/dec/25/us-fda-vaccine-advisory-group-covid-vaccines-flu,974,<p>Dr Arnold Monto says he watched as a vaccine was developed both faster and more effectively than any dared to hope – but says it’s unlikely to give ‘permanent protection’</p>,Society,News,article,Jessica Glenza,"Vaccines and immunisation, Health, Coronavirus, Flu",society/2021/dec/25/us-fda-vaccine-advisory-group-covid-vaccines-flu
Putting the ‘national’ in the National Gallery: Kaywin Feldman wants the museum to serve the people,2021-12-25T07:00:47Z,<p>The director of America’s art museum aims to ‘listen to people whom museum directors don’t always hear’</p>,https://www.theguardian.com/culture/2021/dec/25/national-gallery-kaywin-feldman-serve-american-people,1739,<p>The director of America’s art museum aims to ‘listen to people whom museum directors don’t always hear’</p>,Culture,Arts,article,David Smith in Washington,"Museums, Art, Culture, Race",culture/2021/dec/25/national-gallery-kaywin-feldman-serve-american-people
1.7 million people in UK had coronavirus last week; thousands of Christmas flights cancelled – as it happened,2021-12-24T23:01:34Z,"<p><a href=""https://www.theguardian.com/world/live/2021/dec/24/covid-news-live-new-york-scales-back-new-years-eve-celebrations-astrazeneca-booster-protects-against-omicron-study-finds?page=with:block-61c5c2738f086332f3d0d5d0#block-61c5c2738f086332f3d0d5d0"">ONS figures</a> are highest on record so far; Christmas for many in disarray as <a href=""https://www.theguardian.com/world/live/2021/dec/24/covid-news-live-new-york-scales-back-new-years-eve-celebrations-astrazeneca-booster-protects-against-omicron-study-finds?page=with:block-61c530678f08efd5f0de3193#block-61c530678f08efd5f0de3193"">US</a> and<a href=""https://www.theguardian.com/australia-news/2021/dec/24/more-than-100-flights-cut-between-sydney-and-melbourne-as-staff-are-sidelined-over-covid""> Australian airlines say flight crews hit by Covid</a></p><ul><li><a href=""https://www.theguardian.com/world/2021/dec/24/uk-hits-new-covid-record-again-more-than-120000-cases-recorded"">UK hits new Covid record again with more than 120,000 daily cases</a></li><li><a href=""https://www.theguardian.com/world/2021/dec/24/christmas-eve-travel-chaos-as-airlines-cancel-more-than-2000-flights"">Christmas Eve travel chaos as airlines cancel more than 2,000 flights</a></li><li><a href=""https://www.theguardian.com/world/2021/dec/24/omicron-covid-symptoms-uk-guidance-zoe-study"">Omicron’s cold-like symptoms mean UK guidance ‘needs urgent update’</a></li><li><a href=""https://www.theguardian.com/us-news/2021/dec/24/us-to-lift-omicron-travel-ban-on-eight-african-countries"">US to lift Omicron travel ban on eight African countries</a></li></ul>",https://www.theguardian.com/world/live/2021/dec/24/covid-news-live-new-york-scales-back-new-years-eve-celebrations-astrazeneca-booster-protects-against-omicron-study-finds,8875,"<p><a href=""https://www.theguardian.com/world/live/2021/dec/24/covid-news-live-new-york-scales-back-new-years-eve-celebrations-astrazeneca-booster-protects-against-omicron-study-finds?page=with:block-61c5c2738f086332f3d0d5d0#block-61c5c2738f086332f3d0d5d0"">ONS figures</a> are highest on record so far; Christmas for many in disarray as <a href=""https://www.theguardian.com/world/live/2021/dec/24/covid-news-live-new-york-scales-back-new-years-eve-celebrations-astrazeneca-booster-protects-against-omicron-study-finds?page=with:block-61c530678f08efd5f0de3193#block-61c530678f08efd5f0de3193"">US</a> and<a href=""https://www.theguardian.com/australia-news/2021/dec/24/more-than-100-flights-cut-between-sydney-and-melbourne-as-staff-are-sidelined-over-covid""> Australian airlines say flight crews hit by Covid</a></p><ul><li><a href=""https://www.theguardian.com/world/2021/dec/24/uk-hits-new-covid-record-again-more-than-120000-cases-recorded"">UK hits new Covid record again with more than 120,000 daily cases</a></li><li><a href=""https://www.theguardian.com/world/2021/dec/24/christmas-eve-travel-chaos-as-airlines-cancel-more-than-2000-flights"">Christmas Eve travel chaos as airlines cancel more than 2,000 flights</a></li><li><a href=""https://www.theguardian.com/world/2021/dec/24/omicron-covid-symptoms-uk-guidance-zoe-study"">Omicron’s cold-like symptoms mean UK guidance ‘needs urgent update’</a></li><li><a href=""https://www.theguardian.com/us-news/2021/dec/24/us-to-lift-omicron-travel-ban-on-eight-african-countries"">US to lift Omicron travel ban on eight African countries</a></li></ul>",World news,News,liveblog,"Nadeem Badshah, Clea Skopeliti and  Samantha Lock","Coronavirus, World news, China, UK news, Europe, Asia Pacific, US news, New York, Vaccines and immunisation, Travel",world/live/2021/dec/24/covid-news-live-new-york-scales-back-new-years-eve-celebrations-astrazeneca-booster-protects-against-omicron-study-finds
More options for Covid treatments in January as FDA approves two antiviral pills,2021-12-24T11:00:22Z,<p>The approval comes as reports of shortages in monoclonal antibody treatment arise and cases spike</p>,https://www.theguardian.com/world/2021/dec/24/covid-treatment-antiviral-fda-monoclonal-shortage,866,<p>The approval comes as reports of shortages in monoclonal antibody treatment arise and cases spike</p>,World news,News,article,Eric Berger,"Coronavirus, Vaccines and immunisation, Infectious diseases, US news, Pfizer, Pharmaceuticals industry, Medical research",world/2021/dec/24/covid-treatment-antiviral-fda-monoclonal-shortage
