headline,pub_date,snippet,web_url,word_count,abstract,section_name,pillar_name,type,byline,keywords,article_id
"The climate crisis is killing migrants trying to cross the US border, study finds",2021-12-16T19:00:07Z,<p>Many undocumented migrants trying to cross the Sonoran desert into the US from Mexico are dying of dehydration and organ failure</p>,https://www.theguardian.com/world/2021/dec/16/climate-crisis-sonoran-desert-killing-migrants-cross-us-border,816,<p>Many undocumented migrants trying to cross the Sonoran desert into the US from Mexico are dying of dehydration and organ failure</p>,World news,News,article,Oliver Milman,"Migration, Mexico, US news",world/2021/dec/16/climate-crisis-sonoran-desert-killing-migrants-cross-us-border
"Elizabeth Holmes chose ‘fraud over failure’, prosecutors say in Theranos closing arguments",2021-12-16T18:46:40Z,<p>Fallen Silicon Valley star faces up to 20 years in prison for 11 charges of defrauding investors and consumers</p>,https://www.theguardian.com/technology/2021/dec/16/elizabeth-holmes-trial-closing-arguments,819,<p>Fallen Silicon Valley star faces up to 20 years in prison for 11 charges of defrauding investors and consumers</p>,Technology,News,article,Kari Paul in San Jose,"Theranos, California, Technology, US news",technology/2021/dec/16/elizabeth-holmes-trial-closing-arguments
 ‘Unlike anything we’ve seen’: the unprecedented risks facing US democracy,2021-12-16T15:00:01Z,"<p>From attacks on election officials to politicizing election boards, threats to the voting system are deeply worrying</p>",https://www.theguardian.com/us-news/2021/dec/16/unprecedented-risks-facing-us-democracy,783,"<p>From attacks on election officials to politicizing election boards, threats to the voting system are deeply worrying</p>",US news,News,article,Sam Levine in New York,"Republicans, US politics, US voting rights, US news",us-news/2021/dec/16/unprecedented-risks-facing-us-democracy
"The lawyer who tried faking his death, and the writer exposing his crime dynasty",2021-12-16T10:00:03Z,<p>Mandy Matney kept a harsh spotlight trained on South Carolina’s Murdaugh family until they became impossible for anyone to ignore</p>,https://www.theguardian.com/us-news/2021/dec/16/mandy-matney-alex-murdaugh-writer-crime-story,2343,<p>Mandy Matney kept a harsh spotlight trained on South Carolina’s Murdaugh family until they became impossible for anyone to ignore</p>,US news,News,article,"Andrew Lawrence in Beaufort, South Carolina","South Carolina, US crime, US news, Media, Alex Murdaugh",us-news/2021/dec/16/mandy-matney-alex-murdaugh-writer-crime-story
"America’s death penalty divide: why capital punishment is getting better, and worse",2021-12-16T05:01:34Z,"<p>This year the US saw the fewest executions since 1988, but those states sticking with judicial killings are displaying grotesque aberrations</p>",https://www.theguardian.com/world/2021/dec/15/us-death-penalty-abolish-executions,877,"<p>This year the US saw the fewest executions since 1988, but those states sticking with judicial killings are displaying grotesque aberrations</p>",World news,News,article,Ed Pilkington in New York,"Capital punishment, Law (US), US politics, US news",world/2021/dec/15/us-death-penalty-abolish-executions
Biden pledges aid on Kentucky trip: ‘I’ve not seen this much damage from a tornado’,2021-12-15T20:47:14Z,<p>US president surveyed damage after more than 30 tornadoes tore through Kentucky and seven other states</p>,https://www.theguardian.com/us-news/2021/dec/15/biden-kentucky-pledges-federal-aid-tornadoes,912,<p>US president surveyed damage after more than 30 tornadoes tore through Kentucky and seven other states</p>,US news,News,article,Joanna Walters and agency,"Kentucky, Tornadoes, Joe Biden, US news",us-news/2021/dec/15/biden-kentucky-pledges-federal-aid-tornadoes
UK inflation soars to 10-year high of 5.1%; Federal Reserve speeds up tapering – as it happened,2021-12-15T19:37:17Z,"<p>Rolling coverage of the latest economic and financial news</p><ul><li>Latest: Fed to wrap up asset purchases by March</li><li><a href=""https://www.theguardian.com/business/live/2021/dec/15/uk-inflation-soars-cost-of-living-squeeze-energy-housing-clothing-footwear-federal-reserve-business-live?filterKeyEvents=false&amp;page=with:block-61ba1ed98f084998b54852ba#block-61ba1ed98f084998b54852ba"">FTSE 100 falls amid Omicron worries</a></li><li><a href=""https://www.theguardian.com/business/2021/dec/15/uk-inflation-jumps-to-10-year-high-as-petrol-prices-soar"">Full story: UK inflation jumps to 10-year high as petrol prices soar</a></li><li><a href=""https://www.theguardian.com/business/live/2021/dec/15/uk-inflation-soars-cost-of-living-squeeze-energy-housing-clothing-footwear-federal-reserve-business-live?filterKeyEvents=false&amp;page=with:block-61b9b1f98f0848fb65d95a59#block-61b9b1f98f0848fb65d95a59"">In detail: how prices have risen across economy</a></li><li><a href=""https://www.theguardian.com/business/live/2021/dec/15/uk-inflation-soars-cost-of-living-squeeze-energy-housing-clothing-footwear-federal-reserve-business-live?filterKeyEvents=false&amp;page=with:block-61b9897a8f0848fb65d958da#block-61b9897a8f0848fb65d958da"">Breaking: UK inflation hit 5.1% last month</a></li><li>Prices rising faster than wages; factory gate prices surge nearly 10%</li></ul>",https://www.theguardian.com/business/live/2021/dec/15/uk-inflation-soars-cost-of-living-squeeze-energy-housing-clothing-footwear-federal-reserve-business-live,7581,"<p>Rolling coverage of the latest economic and financial news</p><ul><li>Latest: Fed to wrap up asset purchases by March</li><li><a href=""https://www.theguardian.com/business/live/2021/dec/15/uk-inflation-soars-cost-of-living-squeeze-energy-housing-clothing-footwear-federal-reserve-business-live?filterKeyEvents=false&amp;page=with:block-61ba1ed98f084998b54852ba#block-61ba1ed98f084998b54852ba"">FTSE 100 falls amid Omicron worries</a></li><li><a href=""https://www.theguardian.com/business/2021/dec/15/uk-inflation-jumps-to-10-year-high-as-petrol-prices-soar"">Full story: UK inflation jumps to 10-year high as petrol prices soar</a></li><li><a href=""https://www.theguardian.com/business/live/2021/dec/15/uk-inflation-soars-cost-of-living-squeeze-energy-housing-clothing-footwear-federal-reserve-business-live?filterKeyEvents=false&amp;page=with:block-61b9b1f98f0848fb65d95a59#block-61b9b1f98f0848fb65d95a59"">In detail: how prices have risen across economy</a></li><li><a href=""https://www.theguardian.com/business/live/2021/dec/15/uk-inflation-soars-cost-of-living-squeeze-energy-housing-clothing-footwear-federal-reserve-business-live?filterKeyEvents=false&amp;page=with:block-61b9897a8f0848fb65d958da#block-61b9897a8f0848fb65d958da"">Breaking: UK inflation hit 5.1% last month</a></li><li>Prices rising faster than wages; factory gate prices surge nearly 10%</li></ul>",Business,News,liveblog,Graeme Wearden,"Business, Economics, Stock markets, FTSE, Inflation",business/live/2021/dec/15/uk-inflation-soars-cost-of-living-squeeze-energy-housing-clothing-footwear-federal-reserve-business-live
UK energy suppliers to face new stress tests after dozens collapse,2021-12-15T17:01:06Z,<p>Ofgem will set improvement plan for firms showing signs of financial weakness as market prices soar</p>,https://www.theguardian.com/business/2021/dec/15/uk-energy-suppliers-to-face-new-stress-tests-after-dozens-collapse,683,<p>Ofgem will set improvement plan for firms showing signs of financial weakness as market prices soar</p>,Business,News,article,Jillian Ambrose Energy correspondent,"Energy industry, Ofgem, Business, UK news, Gas",business/2021/dec/15/uk-energy-suppliers-to-face-new-stress-tests-after-dozens-collapse
Trump’s lackeys would rather defy US Congress than anger their old boss. Sad!,2021-12-15T16:17:20Z,<p>Bannon and Meadows are trying to become heroes for Trump’s base – and secure seats at the table in the event of a second Trump presidency</p>,https://www.theguardian.com/commentisfree/2021/dec/15/mark-meadows-steve-bannon-contempt-congress,899,<p>Bannon and Meadows are trying to become heroes for Trump’s base – and secure seats at the table in the event of a second Trump presidency</p>,Opinion,Opinion,article,Lloyd Green,"US politics, US Capitol attack, US Congress, Mark Meadows, Steve Bannon, Donald Trump, Donald Trump Jr, US news",commentisfree/2021/dec/15/mark-meadows-steve-bannon-contempt-congress
First Thing: US House votes to hold Trump ex-aide Meadows in contempt,2021-12-15T11:20:24Z,"<p>Move comes after Trump’s former chief of staff ceased cooperating with panel investigating Capitol attack. Plus, Nasa spacecraft ‘touches’ the sun</p>",https://www.theguardian.com/us-news/2021/dec/15/first-thing-us-house-votes-to-hold-trump-ex-aide-meadows-in-contempt,1104,"<p>Move comes after Trump’s former chief of staff ceased cooperating with panel investigating Capitol attack. Plus, Nasa spacecraft ‘touches’ the sun</p>",US news,News,article,Nicola Slawson,US news,us-news/2021/dec/15/first-thing-us-house-votes-to-hold-trump-ex-aide-meadows-in-contempt
Proud Boys and Oath Keepers sued over Capitol attack,2021-12-14T20:40:20Z,"<p>Lawsuit seeks to inflict maximum financial damage on groups responsible, says Washington DC attorney general</p>",https://www.theguardian.com/us-news/2021/dec/14/proud-boys-oath-keepers-sued-capitol-attack,773,"<p>Lawsuit seeks to inflict maximum financial damage on groups responsible, says Washington DC attorney general</p>",US news,News,article,Joanna Walters in New York and agencies,"US Capitol attack, The far right, US news, US politics",us-news/2021/dec/14/proud-boys-oath-keepers-sued-capitol-attack
Israel warns diplomacy proving fruitless in Iran nuclear talks,2021-12-14T20:36:05Z,<p>Officials hopeful that US and European nations will agree Tehran is in breach of its obligations</p>,https://www.theguardian.com/world/2021/dec/14/israel-warns-diplomacy-proving-fruitless-in-iran-nuclear-talks,621,<p>Officials hopeful that US and European nations will agree Tehran is in breach of its obligations</p>,World news,News,article,Patrick Wintour Diplomatic editor,"Iran's nuclear programme, Israel, Iran nuclear deal, Iran, Middle East and north Africa, World news",world/2021/dec/14/israel-warns-diplomacy-proving-fruitless-in-iran-nuclear-talks
"Morning mail: Tasmanian borders reopen, Naplan results, Indigenous vampire hunters",2021-12-14T19:58:21Z,<p><strong>Wednesday</strong>: Australia’s island state opens to the mainland as NSW further eases restrictions. Plus: Christine Anu’s beloved items</p>,https://www.theguardian.com/australia-news/2021/dec/15/morning-mail-tasmanian-borders-reopen-naplan-results-indigenous-vampire-hunters,1321,<p><strong>Wednesday</strong>: Australia’s island state opens to the mainland as NSW further eases restrictions. Plus: Christine Anu’s beloved items</p>,Australia news,News,article,Tamara Howie,,australia-news/2021/dec/15/morning-mail-tasmanian-borders-reopen-naplan-results-indigenous-vampire-hunters
"Trump Jr and Fox News hosts begged Meadows to help stop Capitol attack, texts show",2021-12-14T17:23:42Z,<p>Three of the network’s presenters urged Meadows to push Trump to act while Trump Jr said ‘He has to lead now’</p>,https://www.theguardian.com/us-news/2021/dec/14/mark-meadows-texts-fox-news-donald-trump-jr-capitol-attack,893,<p>Three of the network’s presenters urged Meadows to push Trump to act while Trump Jr said ‘He has to lead now’</p>,US news,News,article,David Smith in Washington,"US Capitol attack, Donald Trump, Donald Trump Jr, Fox News, Trump administration, US politics, US news, World news, Mark Meadows",us-news/2021/dec/14/mark-meadows-texts-fox-news-donald-trump-jr-capitol-attack
Pushing Buttons: gaming is culture – even Fortnite has something to say about society,2021-12-14T12:45:02Z,"<p>In the first edition of our gaming newsletter: why games, like all art, have the power to connect, entertain and cause change</p><ul><li><strong><a href=""https://www.theguardian.com/info/ng-interactive/2021/nov/24/sign-up-for-pushing-buttons-keza-macdonalds-weekly-look-at-the-world-of-gaming"">Don’t get Pushing Buttons delivered to your inbox? Sign up here</a></strong></li></ul>",https://www.theguardian.com/games/2021/dec/14/pushing-buttons-video-game-newsletter,1136,"<p>In the first edition of our gaming newsletter: why games, like all art, have the power to connect, entertain and cause change</p><ul><li><strong><a href=""https://www.theguardian.com/info/ng-interactive/2021/nov/24/sign-up-for-pushing-buttons-keza-macdonalds-weekly-look-at-the-world-of-gaming"">Don’t get Pushing Buttons delivered to your inbox? Sign up here</a></strong></li></ul>",Games,Arts,article,Keza MacDonald,"Games, Culture, Fortnite, Gamergate, Halo",games/2021/dec/14/pushing-buttons-video-game-newsletter
First Thing: More than 100 still unaccounted for after Kentucky tornadoes,2021-12-14T11:04:51Z,"<p>Governor says death toll expected to grow<strong> </strong>after Friday’s disaster. Plus, Elon Musk named Time person of the year</p><ul><li><strong><a href=""https://www.theguardian.com/info/2018/sep/17/guardian-us-morning-briefing-sign-up-to-stay-informed"">Don’t already get First Thing in your inbox? Sign up here</a></strong></li></ul>",https://www.theguardian.com/us-news/2021/dec/14/first-thing-more-than-100-still-unaccounted-for-after-kentucky-tornadoes,1099,"<p>Governor says death toll expected to grow<strong> </strong>after Friday’s disaster. Plus, Elon Musk named Time person of the year</p><ul><li><strong><a href=""https://www.theguardian.com/info/2018/sep/17/guardian-us-morning-briefing-sign-up-to-stay-informed"">Don’t already get First Thing in your inbox? Sign up here</a></strong></li></ul>",US news,News,article,Nicola Slawson,"US news, World news",us-news/2021/dec/14/first-thing-more-than-100-still-unaccounted-for-after-kentucky-tornadoes
Tuesday briefing: Raab rewrites your rights,2021-12-14T06:31:23Z,<p>Justice secretary to unveil overhaul of human rights law … gas prices set for record highs … China’s troll king</p>,https://www.theguardian.com/world/2021/dec/14/tuesday-briefing-raab-rewrites-your-rights,1496,<p>Justice secretary to unveil overhaul of human rights law … gas prices set for record highs … China’s troll king</p>,World news,News,article,Warren Murray,,world/2021/dec/14/tuesday-briefing-raab-rewrites-your-rights
Your niece is suddenly vegan! How to survive the 12 disasters of Christmas,2021-12-14T06:00:40Z,"<p>One guest is an antivaxxer, another is allergic to your cats, the turkey is still raw and your best friends are splitting up in the sitting room. Here is how to face down festive fiascos</p>",https://www.theguardian.com/lifeandstyle/2021/dec/14/how-survive-12-disasters-of-christmas-vegan-guest-antivaxxwer-allergic-turkey-raw-festive,2404,"<p>One guest is an antivaxxer, another is allergic to your cats, the turkey is still raw and your best friends are splitting up in the sitting room. Here is how to face down festive fiascos</p>",Life and style,Lifestyle,article,Zoe Williams,"Christmas, Family, Friendship, Life and style, Psychology, Christmas food and drink, Food, Parents and parenting",lifeandstyle/2021/dec/14/how-survive-12-disasters-of-christmas-vegan-guest-antivaxxwer-allergic-turkey-raw-festive
Protesting voting rights activists arrested as Biden meets with Manchin,2021-12-14T06:00:39Z,<p>Sixty were detained as the president met with the key Democrat who has become a roadblock to his agenda</p>,https://www.theguardian.com/us-news/2021/dec/13/voting-rights-activists-arrested-biden-manchin,582,<p>Sixty were detained as the president met with the key Democrat who has become a roadblock to his agenda</p>,US news,News,article,Lauren Burke in Washington DC,"US voting rights, Joe Manchin, Biden administration, US politics, Joe Biden, US news",us-news/2021/dec/13/voting-rights-activists-arrested-biden-manchin
Putin tells Boris Johnson urgent talks needed over Nato’s plans for Ukraine,2021-12-13T20:48:36Z,<p>Kremlin wants legal agreement that alliance will not expand into disputed territory</p>,https://www.theguardian.com/world/2021/dec/13/putin-demands-talks-over-natos-plans-for-eastern-ukraine,824,<p>Kremlin wants legal agreement that alliance will not expand into disputed territory</p>,World news,News,article,"Patrick Wintour, diplomatic editor, and Julian Borger in Washington","Nato, Ukraine, Boris Johnson, Vladimir Putin, Europe, UK news, Russia, World news",world/2021/dec/13/putin-demands-talks-over-natos-plans-for-eastern-ukraine
Anne Sacoolas to face UK court over death of Harry Dunn,2021-12-13T19:05:10Z,<p>US citizen is accused of killing 19-year-old in a road crash outside RAF Croughton on 27 August 2019</p>,https://www.theguardian.com/uk-news/2021/dec/13/harry-dunn-anne-sacoolas-to-face-criminal-trial-in-the-uk-over-teenagers-death,648,<p>US citizen is accused of killing 19-year-old in a road crash outside RAF Croughton on 27 August 2019</p>,UK news,News,article,Patrick Wintour Diplomatic editor,UK news,uk-news/2021/dec/13/harry-dunn-anne-sacoolas-to-face-criminal-trial-in-the-uk-over-teenagers-death
Judges weigh social media posts in criminal sentences for US Capitol attack,2021-12-13T14:07:07Z,"<p>Much of the evidence has come from rioters’ own words and videos, as many used social media to celebrate the violence</p>",https://www.theguardian.com/us-news/2021/dec/13/judges-weigh-social-media-posts-criminal-sentences-us-capitol-attack,737,"<p>Much of the evidence has come from rioters’ own words and videos, as many used social media to celebrate the violence</p>",US news,News,article,Guardian staff and agencies,"US Capitol attack, US news, US politics, US crime, Law (US), Social media",us-news/2021/dec/13/judges-weigh-social-media-posts-criminal-sentences-us-capitol-attack
Real Madrid 2-0 Atlético Madrid: La Liga – as it happened,2021-12-12T21:57:17Z,<p>Karim Benzema and Marco Asensio scored as Real Madrid moved eight points clear at the top of La Liga with a ruthless victory in the derby</p>,https://www.theguardian.com/football/live/2021/dec/12/real-madrid-v-atletico-madrid-la-liga-live,2335,<p>Karim Benzema and Marco Asensio scored as Real Madrid moved eight points clear at the top of La Liga with a ruthless victory in the derby</p>,Football,Sport,liveblog,Rob Smyth,"La Liga, Real Madrid, Atlético Madrid, Football, European club football, Sport",football/live/2021/dec/12/real-madrid-v-atletico-madrid-la-liga-live
Chris Wallace announces he is leaving Fox News to join CNN streaming service,2021-12-12T18:46:22Z,<p>Departure after 18 years deals blow to Fox’s news operation at a time when its opinion side has become preeminent</p>,https://www.theguardian.com/media/2021/dec/12/chris-wallace-fox-news-cnn-streaming-service,345,<p>Departure after 18 years deals blow to Fox’s news operation at a time when its opinion side has become preeminent</p>,Media,News,article,Guardian staff and agencies,"Fox News, CNN, Fox, Media, TV news, US television industry",media/2021/dec/12/chris-wallace-fox-news-cnn-streaming-service
Tame US inflation carefully or risk some nasty side-effects,2021-12-12T11:50:17Z,<p>Paul Volcker’s shock therapy in the 80s hollowed out American manufacturing and permanently boosted both Beijing and Wall Street</p>,https://www.theguardian.com/business/2021/dec/12/us-inflation-must-be-tamed-carefully-or-risk-the-nasty-side-effects-of-80s-monetarism,953,<p>Paul Volcker’s shock therapy in the 80s hollowed out American manufacturing and permanently boosted both Beijing and Wall Street</p>,Business,News,article,Larry Elliott,"US economy, Business, Inflation, Economics, Global economy, Manufacturing sector, Federal Reserve, Jerome Powell",business/2021/dec/12/us-inflation-must-be-tamed-carefully-or-risk-the-nasty-side-effects-of-80s-monetarism
Obama gives tips to Starmer and Lammy on how Labour can regain ‘winning ways’,2021-12-12T08:45:33Z,"<p>Opposition leader and shadow foreign secretary talk strategy with key Washington figures, saying US election holds ‘stark lessons’</p>",https://www.theguardian.com/politics/2021/dec/12/barack-obama-gives-tips-to-keir-starmer-and-david-lammy-on-how-labour-can-regain-winning-ways,964,"<p>Opposition leader and shadow foreign secretary talk strategy with key Washington figures, saying US election holds ‘stark lessons’</p>",Politics,News,article,Toby Helm,"Labour, Keir Starmer, David Lammy, Barack Obama, UK news, Politics, US news, World news",politics/2021/dec/12/barack-obama-gives-tips-to-keir-starmer-and-david-lammy-on-how-labour-can-regain-winning-ways
‘Women are capable of doing this’: the doctor defying local laws to provide safe abortions by sea or mail,2021-12-12T07:00:33Z,<p>Dr Rebecca Gomperts made waves providing abortion in international waters around the world. Now she’s prepared to help American women</p>,https://www.theguardian.com/world/2021/dec/12/rebecca-gomperts-doctor-defying-laws-abortions,1779,<p>Dr Rebecca Gomperts made waves providing abortion in international waters around the world. Now she’s prepared to help American women</p>,World news,News,article,Moira Donegan,"Abortion, Women, World news",world/2021/dec/12/rebecca-gomperts-doctor-defying-laws-abortions
‘It’s having its moment’: Georgia to offer litmus test for Trump and Democrats,2021-12-12T07:00:32Z,"<p>Florida 2000, Ohio 2004, Pennsylvania 2020 – now Georgia, with its changing demographics and fight over voting rights, looks set to be the bellwether</p>",https://www.theguardian.com/us-news/2021/dec/12/georgia-republicans-democrats-trump-midterms,1479,"<p>Florida 2000, Ohio 2004, Pennsylvania 2020 – now Georgia, with its changing demographics and fight over voting rights, looks set to be the bellwether</p>",US news,News,article,Sam Levine in New York and David Smith in Washington,"Georgia, Republicans, US news, World news",us-news/2021/dec/12/georgia-republicans-democrats-trump-midterms
CNN mess over Cuomo shows dangers of news-as-entertainment,2021-12-12T07:00:32Z,<p>The cable news giant spent lavishly on its primetime star until it emerged he had helped his brother respond to a billowing scandal</p>,https://www.theguardian.com/media/2021/dec/12/cnn-chris-cuomo-news-media-infotainment,1210,<p>The cable news giant spent lavishly on its primetime star until it emerged he had helped his brother respond to a billowing scandal</p>,Media,News,article,Edward Helmore in New York,"CNN, Andrew Cuomo, Media, US news, World news",media/2021/dec/12/cnn-chris-cuomo-news-media-infotainment
March of the Trump memoirs: Mark Meadows and other Republican reads,2021-12-12T07:00:32Z,"<p>The former chief of staff has written the most consequential Trump book – if not, thanks to the revelation of the great Covid cover-up, in quite the way he planned. In contrast, McEnany, Navarro and Atlas just play fast and loose with the truth</p>",https://www.theguardian.com/books/2021/dec/12/trump-memoirs-mark-meadows-kayleigh-mcenany-peter-navarro-scott-atlas,1631,"<p>The former chief of staff has written the most consequential Trump book – if not, thanks to the revelation of the great Covid cover-up, in quite the way he planned. In contrast, McEnany, Navarro and Atlas just play fast and loose with the truth</p>",Books,Arts,article,Lloyd Green,"Books, Republicans, Donald Trump, Trump administration, US politics, US news, Politics books, Culture, World news, Coronavirus, US domestic policy, Mark Meadows",books/2021/dec/12/trump-memoirs-mark-meadows-kayleigh-mcenany-peter-navarro-scott-atlas
