headline,pub_date,snippet,web_url,word_count,abstract,section_name,pillar_name,type,byline,keywords,article_id
Biden's big infrastructure bet could define his legacy – for better or worse,2021-03-31T23:45:42Z,<p>The president has proven he has his eye on posterity. But his $2tn package will face a hard-fought political battle</p>,https://www.theguardian.com/us-news/2021/mar/31/joe-biden-infrastructure-politics-legacy,817,<p>The president has proven he has his eye on posterity. But his $2tn package will face a hard-fought political battle</p>,US news,News,article,David Smith in Washington,"Joe Biden, US news, Biden administration, US politics",us-news/2021/mar/31/joe-biden-infrastructure-politics-legacy
"Brazil records almost 58,000 deaths in a month; French schools to close for three weeks - as it happened",2021-03-31T23:05:30Z,"<p><a href=""https://www.theguardian.com/world/live/2021/mar/31/coronavirus-live-news-who-lab-leak-theory-investigation-quito-hospitals-overwhelmed?page=with:block-6064df0f8f08ce55ed8edf92#block-6064df0f8f08ce55ed8edf92"">P1 variant said to be partly driving cases in Brazil</a>; <a href=""https://www.theguardian.com/world/live/2021/mar/31/coronavirus-live-news-who-lab-leak-theory-investigation-quito-hospitals-overwhelmed?page=with:block-6064bb058f0843c50f0ea2eb#block-6064bb058f0843c50f0ea2eb"">French president extends measures in 19 French departments to rest of country</a></p><ul><li><a href=""https://www.theguardian.com/world/2021/mar/31/macron-to-unveil-tough-measures-as-covid-cases-surge-in-france"">France to close schools and stop domestic travel after Covid surge</a></li><li><a href=""https://www.theguardian.com/world/2021/mar/31/pfizer-covid-biontech-vaccine-safe-effective-children"">Pfizer/BioNTech finds vaccine safe and effective for children 12 to 15</a></li><li><a href=""https://www.theguardian.com/world/2021/mar/31/spain-covid-outdoor-mask-decree-beaches-met-with-dismay-tourism-industry"">Outdoor mask decree met with dismay by Spain’s tourism industry</a></li><li><a href=""https://www.theguardian.com/world/2021/mar/31/germany-restricts-use-of-astrazeneca-jab-to-over-60s"">Germany restricts use of AstraZeneca jab to over-60s</a></li><li>This blog is now closed: <a href=""https://www.theguardian.com/world/coronavirus-outbreak"">see all our coronavirus coverage</a><br></li></ul>",https://www.theguardian.com/world/live/2021/mar/31/coronavirus-live-news-who-lab-leak-theory-investigation-quito-hospitals-overwhelmed,14224,"<p><a href=""https://www.theguardian.com/world/live/2021/mar/31/coronavirus-live-news-who-lab-leak-theory-investigation-quito-hospitals-overwhelmed?page=with:block-6064df0f8f08ce55ed8edf92#block-6064df0f8f08ce55ed8edf92"">P1 variant said to be partly driving cases in Brazil</a>; <a href=""https://www.theguardian.com/world/live/2021/mar/31/coronavirus-live-news-who-lab-leak-theory-investigation-quito-hospitals-overwhelmed?page=with:block-6064bb058f0843c50f0ea2eb#block-6064bb058f0843c50f0ea2eb"">French president extends measures in 19 French departments to rest of country</a></p><ul><li><a href=""https://www.theguardian.com/world/2021/mar/31/macron-to-unveil-tough-measures-as-covid-cases-surge-in-france"">France to close schools and stop domestic travel after Covid surge</a></li><li><a href=""https://www.theguardian.com/world/2021/mar/31/pfizer-covid-biontech-vaccine-safe-effective-children"">Pfizer/BioNTech finds vaccine safe and effective for children 12 to 15</a></li><li><a href=""https://www.theguardian.com/world/2021/mar/31/spain-covid-outdoor-mask-decree-beaches-met-with-dismay-tourism-industry"">Outdoor mask decree met with dismay by Spain’s tourism industry</a></li><li><a href=""https://www.theguardian.com/world/2021/mar/31/germany-restricts-use-of-astrazeneca-jab-to-over-60s"">Germany restricts use of AstraZeneca jab to over-60s</a></li><li>This blog is now closed: <a href=""https://www.theguardian.com/world/coronavirus-outbreak"">see all our coronavirus coverage</a><br></li></ul>",World news,News,liveblog,"Ben Doherty (now);  Lucy Campbell, Yohannes Lowe, Damien Gayle, Martin Belam, Helen Sullivan (earlier)","Coronavirus, World news, Vaccines and immunisation",world/live/2021/mar/31/coronavirus-live-news-who-lab-leak-theory-investigation-quito-hospitals-overwhelmed
Biden’s $2tn infrastructure plan aims to ‘finally address climate crisis as a nation',2021-03-31T21:45:06Z,<p>President says new plan will allow ‘transformational progress’ by bolstering investments in clean energy and electric vehicles</p>,https://www.theguardian.com/us-news/2021/mar/31/biden-infrastructure-plan-address-climate-crisis,879,<p>President says new plan will allow ‘transformational progress’ by bolstering investments in clean energy and electric vehicles</p>,Environment,News,article,Oliver Milman,"Climate crisis, Joe Biden, Infrastructure, Biden administration, US news, US politics, US domestic policy",us-news/2021/mar/31/biden-infrastructure-plan-address-climate-crisis
"Morning mail: aged care vaccine fail, Bolsonaro under fire, France locks down",2021-03-31T19:52:23Z,<p><strong>Thursday</strong>: Morrison government criticised for lack of ‘clear strategy’ on vaccinating aged care workers. Plus: Why do people discard me when I am no longer of use to them?</p>,https://www.theguardian.com/australia-news/2021/apr/01/morning-mail-aged-care-vaccine-fail-bolsonaro-under-fire-france-locks-down,1393,<p><strong>Thursday</strong>: Morrison government criticised for lack of ‘clear strategy’ on vaccinating aged care workers. Plus: Why do people discard me when I am no longer of use to them?</p>,Australia news,News,article,Richard Parkin,,australia-news/2021/apr/01/morning-mail-aged-care-vaccine-fail-bolsonaro-under-fire-france-locks-down
Donald Trump video clip removed from Facebook ‘in line with block’,2021-03-31T19:22:04Z,<p>Former US president has been banned from the platform since early January after the violent insurrection of the Capitol</p>,https://www.theguardian.com/technology/2021/mar/31/facebook-donald-trump-video-clip-removed,348,<p>Former US president has been banned from the platform since early January after the violent insurrection of the Capitol</p>,Technology,News,article,Kari Paul,"Facebook, Donald Trump, Instagram, Social media, US news",technology/2021/mar/31/facebook-donald-trump-video-clip-removed
Deliveroo shares plunge in disastrous market debut - as it happened,2021-03-31T17:57:02Z,"<p>Rolling coverage of the latest economic and financial news</p><ul><li><a href=""https://www.theguardian.com/business/live/2021/mar/31/uk-economy-gdp-2020-house-prices-lloyds-deliveroo-markets-ftse-gold-business-live?page=with:block-606494628f08e507cd807346#block-606494628f08e507cd807346"">Latest: Deliveroo closes down 26% on opening day</a></li><li>Shares sold at 390p in IPO, close at 287.45p</li><li><a href=""https://www.theguardian.com/business/live/2021/mar/31/uk-economy-gdp-2020-house-prices-lloyds-deliveroo-markets-ftse-gold-business-live?page=with:block-606489ef8f0872a785d5298d#block-606489ef8f0872a785d5298d"">Rishi Sunak: Shares prices go up, and share prices go down</a></li><li><a href=""https://www.theguardian.com/business/live/2021/mar/31/uk-economy-gdp-2020-house-prices-lloyds-deliveroo-markets-ftse-gold-business-live?page=with:block-606423b68f0807bf71ddf41e#block-606423b68f0807bf71ddf41e"">Deliveroo shares tumble after IPO</a></li><li><a href=""https://www.theguardian.com/business/live/2021/mar/31/uk-economy-gdp-2020-house-prices-lloyds-deliveroo-markets-ftse-gold-business-live?page=with:block-606451018f0872a785d525b4#block-606451018f0872a785d525b4"">Keir Starmer: I wouldn’t buy shares in Deliveroo</a></li><li><a href=""https://www.theguardian.com/business/live/2021/mar/31/uk-economy-gdp-2020-house-prices-lloyds-deliveroo-markets-ftse-gold-business-live?page=with:block-6064469c8f083326474485a9#block-6064469c8f083326474485a9"">TUC: Workers need better treatment</a></li><li><a href=""https://www.theguardian.com/business/live/2021/mar/31/uk-economy-gdp-2020-house-prices-lloyds-deliveroo-markets-ftse-gold-business-live?page=with:block-60642b0e8f0867d27365a2d7#block-60642b0e8f0867d27365a2d7"">Analyst: Horrible start to trading</a></li></ul>",https://www.theguardian.com/business/live/2021/mar/31/uk-economy-gdp-2020-house-prices-lloyds-deliveroo-markets-ftse-gold-business-live,7213,"<p>Rolling coverage of the latest economic and financial news</p><ul><li><a href=""https://www.theguardian.com/business/live/2021/mar/31/uk-economy-gdp-2020-house-prices-lloyds-deliveroo-markets-ftse-gold-business-live?page=with:block-606494628f08e507cd807346#block-606494628f08e507cd807346"">Latest: Deliveroo closes down 26% on opening day</a></li><li>Shares sold at 390p in IPO, close at 287.45p</li><li><a href=""https://www.theguardian.com/business/live/2021/mar/31/uk-economy-gdp-2020-house-prices-lloyds-deliveroo-markets-ftse-gold-business-live?page=with:block-606489ef8f0872a785d5298d#block-606489ef8f0872a785d5298d"">Rishi Sunak: Shares prices go up, and share prices go down</a></li><li><a href=""https://www.theguardian.com/business/live/2021/mar/31/uk-economy-gdp-2020-house-prices-lloyds-deliveroo-markets-ftse-gold-business-live?page=with:block-606423b68f0807bf71ddf41e#block-606423b68f0807bf71ddf41e"">Deliveroo shares tumble after IPO</a></li><li><a href=""https://www.theguardian.com/business/live/2021/mar/31/uk-economy-gdp-2020-house-prices-lloyds-deliveroo-markets-ftse-gold-business-live?page=with:block-606451018f0872a785d525b4#block-606451018f0872a785d525b4"">Keir Starmer: I wouldn’t buy shares in Deliveroo</a></li><li><a href=""https://www.theguardian.com/business/live/2021/mar/31/uk-economy-gdp-2020-house-prices-lloyds-deliveroo-markets-ftse-gold-business-live?page=with:block-6064469c8f083326474485a9#block-6064469c8f083326474485a9"">TUC: Workers need better treatment</a></li><li><a href=""https://www.theguardian.com/business/live/2021/mar/31/uk-economy-gdp-2020-house-prices-lloyds-deliveroo-markets-ftse-gold-business-live?page=with:block-60642b0e8f0867d27365a2d7#block-60642b0e8f0867d27365a2d7"">Analyst: Horrible start to trading</a></li></ul>",Business,News,liveblog,Graeme Wearden,"Business, Economics, Stock markets, FTSE, Deliveroo",business/live/2021/mar/31/uk-economy-gdp-2020-house-prices-lloyds-deliveroo-markets-ftse-gold-business-live
US has 'enormous respect' for how Australia is standing up to China's 'economic coercion',2021-03-31T16:30:07Z,<p>Washington’s top diplomat in Canberra says the countries are discussing how they would respond to a range of scenarios including conflict in the Taiwan Strait</p>,https://www.theguardian.com/australia-news/2021/apr/01/us-has-enormous-respect-for-how-australia-is-standing-up-to-chinas-economic-coercion,903,<p>Washington’s top diplomat in Canberra says the countries are discussing how they would respond to a range of scenarios including conflict in the Taiwan Strait</p>,Australia news,News,article,Daniel Hurst,"Australian foreign policy, China, Taiwan, Asia Pacific, Australia news, South China Sea, US news",australia-news/2021/apr/01/us-has-enormous-respect-for-how-australia-is-standing-up-to-chinas-economic-coercion
"'I don't want to fake the funk' – Henry Taylor, the painter of black American life",2021-03-31T16:12:29Z,"<p>Adored by Rihanna and Jay-Z, he finds his subjects in supermarket queues – and on the streets of LA’s toughest neighbourhoods. How has the artist found lockdown in a tiny Somerset village?</p>",https://www.theguardian.com/artanddesign/2021/mar/31/fake-funk-henry-taylor-rihanna-jay-z-black-american-life-somerset,1281,"<p>Adored by Rihanna and Jay-Z, he finds his subjects in supermarket queues – and on the streets of LA’s toughest neighbourhoods. How has the artist found lockdown in a tiny Somerset village?</p>",Art and design,Arts,article,Lanre Bakare,"Painting, Art and design, Art, Culture, Los Angeles, Exhibitions, Miles Davis",artanddesign/2021/mar/31/fake-funk-henry-taylor-rihanna-jay-z-black-american-life-somerset
Jimmy Kimmel on 'Klan mom' Marjorie Taylor Greene: 'There should be a test to get into Congress',2021-03-31T15:00:29Z,"<p>With most late-night hosts on holiday, Kimmel discussed the Republican congresswoman and Trump’s new website</p>",https://www.theguardian.com/culture/2021/mar/31/jimmy-kimmel-marjorie-taylor-greene-congress-republican-late-night,362,"<p>With most late-night hosts on holiday, Kimmel discussed the Republican congresswoman and Trump’s new website</p>",Culture,Arts,article,Adrian Horton,"Late-night TV roundup, Jimmy Kimmel, TV comedy, Comedy, Television & radio, Television, Culture",culture/2021/mar/31/jimmy-kimmel-marjorie-taylor-greene-congress-republican-late-night
What's next for Brazil as Jair Bolsonaro's troubles deepen?,2021-03-31T14:00:28Z,<p>The president has stacked his government with military men. Now that blurring of institutional lines may backfire</p>,https://www.theguardian.com/commentisfree/2021/mar/31/brazil-jair-bolsonaros-troubles-president-military,1093,<p>The president has stacked his government with military men. Now that blurring of institutional lines may backfire</p>,Opinion,Opinion,article,Andre Pagliarini,"Jair Bolsonaro, Brazil, Americas, World news",commentisfree/2021/mar/31/brazil-jair-bolsonaros-troubles-president-military
Police officers sue Donald Trump for injuries resulting from Capitol riot,2021-03-31T13:57:18Z,<p>Lawsuit seeks damages for ‘physical and emotional injuries caused by Trump’s wrongful conduct inciting a riot’ on 6 January</p>,https://www.theguardian.com/us-news/2021/mar/31/police-officers-sue-donald-trump-injuries-capitol-riot,593,<p>Lawsuit seeks damages for ‘physical and emotional injuries caused by Trump’s wrongful conduct inciting a riot’ on 6 January</p>,US news,News,article,Guardian staff and agency,"Donald Trump, US Capitol attack, US news, Washington DC, US politics, US policing",us-news/2021/mar/31/police-officers-sue-donald-trump-injuries-capitol-riot
"First Thing: police did not let bystanders help George Floyd, court hears",2021-03-31T10:38:15Z,"<p>Derek Chauvin also resisted calls to remove his knee from Floyd’s neck, witnesses said on the second day of the murder trial. Plus, the US orders non-essential diplomats to leave Myanmar</p><ul><li><strong><a href=""https://www.theguardian.com/info/2018/sep/17/guardian-us-morning-briefing-sign-up-to-stay-informed"">Don’t already get First Thing in your inbox? Sign up here</a></strong></li></ul>",https://www.theguardian.com/us-news/2021/mar/31/first-thing-police-did-not-let-bystanders-help-george-floyd-court-hears,959,"<p>Derek Chauvin also resisted calls to remove his knee from Floyd’s neck, witnesses said on the second day of the murder trial. Plus, the US orders non-essential diplomats to leave Myanmar</p><ul><li><strong><a href=""https://www.theguardian.com/info/2018/sep/17/guardian-us-morning-briefing-sign-up-to-stay-informed"">Don’t already get First Thing in your inbox? Sign up here</a></strong></li></ul>",US news,News,article,Molly Blackall,US news,us-news/2021/mar/31/first-thing-police-did-not-let-bystanders-help-george-floyd-court-hears
"We sampled tap water across the US – and found arsenic, lead and toxic chemicals",2021-03-31T10:00:24Z,"<p>A nine-month investigation by the Guardian and Consumer Reports found alarming levels of forever chemicals, arsenic and lead in samples taken across the US</p><p>• <a href=""https://www.theguardian.com/us-news/2021/mar/31/us-drinking-water-contaminated-how-to-test"">How to test your drinking water</a></p>",https://www.theguardian.com/us-news/2021/mar/31/americas-tap-water-samples-forever-chemicals,3004,"<p>A nine-month investigation by the Guardian and Consumer Reports found alarming levels of forever chemicals, arsenic and lead in samples taken across the US</p><p>• <a href=""https://www.theguardian.com/us-news/2021/mar/31/us-drinking-water-contaminated-how-to-test"">How to test your drinking water</a></p>",US news,News,article,Ryan Felton and Lisa Gill of Consumer Reports and Lewis Kendall for the Guardian,"US news, Water, Environment, World news, Pollution, Pfas",us-news/2021/mar/31/americas-tap-water-samples-forever-chemicals
"The father, the son and the racist spirit: being raised by a white supremacist",2021-03-31T09:00:23Z,"<p>Kelvin Pierce was brought up by one of America’s most prominent white nationalists. With hate surging across the US, he’s ready to tell his story</p>",https://www.theguardian.com/world/2021/mar/31/william-luther-pierce-white-supremacist-son-kelvin-pierce,3716,"<p>Kelvin Pierce was brought up by one of America’s most prominent white nationalists. With hate surging across the US, he’s ready to tell his story</p>",World news,News,article,Johnathon Kelso (photography) and Seyward Darby (words),"Race, US news, World news, US politics, The far right",world/2021/mar/31/william-luther-pierce-white-supremacist-son-kelvin-pierce
"Wednesday briefing: UK a multiracial 'model' for others, says No 10 report",2021-03-31T05:34:18Z,<p>Race equality experts question official response to racial justice movement … 2020 a devastating year for forests … and bonkbusters are back</p>,https://www.theguardian.com/world/2021/mar/31/wednesday-briefing-uk-racial-equality-report,1951,<p>Race equality experts question official response to racial justice movement … 2020 a devastating year for forests … and bonkbusters are back</p>,World news,News,article,,,world/2021/mar/31/wednesday-briefing-uk-racial-equality-report
States lift mask mandates despite Biden's warnings and rise in Covid cases - as it happened,2021-03-31T00:38:06Z,"<ul><li>At least four states plan to lift restrictions</li><li><a href=""https://www.theguardian.com/us-news/live/2021/mar/30/joe-biden-us-politics-live-covid-coronavirus-infrastructure-latest?page=with:block-60631e3d8f0807bf71dde7c8#block-60631e3d8f0807bf71dde7c8"">President to launch next phase of Build Back Better program</a></li><li><a href=""https://www.theguardian.com/us-news/live/2021/mar/30/joe-biden-us-politics-live-covid-coronavirus-infrastructure-latest?page=with:block-60634ebd8f0807bf71ddeaef#block-60634ebd8f0807bf71ddeaef"">Biden announces plans to tackle rising anti-Asian violence</a></li><li><a href=""https://www.theguardian.com/us-news/live/2021/mar/30/joe-biden-us-politics-live-covid-coronavirus-infrastructure-latest?page=with:block-6063341b8f0867d2736597b5#block-6063341b8f0867d2736597b5"">Witness at Chauvin trial: ‘I believed I witnessed a murder’</a></li><li><a href=""https://www.theguardian.com/us-news/2021/mar/30/biden-federal-judicial-nominees-judges"">‘Trailblazing’ slate of judicial nominees announced by Biden</a></li></ul>",https://www.theguardian.com/us-news/live/2021/mar/30/joe-biden-us-politics-live-covid-coronavirus-infrastructure-latest,6104,"<ul><li>At least four states plan to lift restrictions</li><li><a href=""https://www.theguardian.com/us-news/live/2021/mar/30/joe-biden-us-politics-live-covid-coronavirus-infrastructure-latest?page=with:block-60631e3d8f0807bf71dde7c8#block-60631e3d8f0807bf71dde7c8"">President to launch next phase of Build Back Better program</a></li><li><a href=""https://www.theguardian.com/us-news/live/2021/mar/30/joe-biden-us-politics-live-covid-coronavirus-infrastructure-latest?page=with:block-60634ebd8f0807bf71ddeaef#block-60634ebd8f0807bf71ddeaef"">Biden announces plans to tackle rising anti-Asian violence</a></li><li><a href=""https://www.theguardian.com/us-news/live/2021/mar/30/joe-biden-us-politics-live-covid-coronavirus-infrastructure-latest?page=with:block-6063341b8f0867d2736597b5#block-6063341b8f0867d2736597b5"">Witness at Chauvin trial: ‘I believed I witnessed a murder’</a></li><li><a href=""https://www.theguardian.com/us-news/2021/mar/30/biden-federal-judicial-nominees-judges"">‘Trailblazing’ slate of judicial nominees announced by Biden</a></li></ul>",US news,News,liveblog,Maanvi Singh (now) and Joan E Greve (earlier),"US politics, US news, World news, Joe Biden, Coronavirus, Republicans, Democrats",us-news/live/2021/mar/30/joe-biden-us-politics-live-covid-coronavirus-infrastructure-latest
Turkey reports record daily Covid cases – as it happened,2021-03-31T00:06:50Z,"<p>This blog is now closed. For up to date coverage of the coronavirus pandemic, head to the link below:</p><ul><li><a href=""https://www.theguardian.com/world/coronavirus-outbreak"">See all our coronavirus coverage</a></li></ul>",https://www.theguardian.com/world/live/2021/mar/30/coronavirus-live-news-who-to-present-china-mission-findings-canada-pauses-astrazeneca-vaccine-for-under-55s,13634,"<p>This blog is now closed. For up to date coverage of the coronavirus pandemic, head to the link below:</p><ul><li><a href=""https://www.theguardian.com/world/coronavirus-outbreak"">See all our coronavirus coverage</a></li></ul>",World news,News,liveblog,"Lucy Campbell (now); Yohannes Lowe, Damien Gayle; Martin Belam and Helen Sullivan (earlier)","Coronavirus, World news",world/live/2021/mar/30/coronavirus-live-news-who-to-present-china-mission-findings-canada-pauses-astrazeneca-vaccine-for-under-55s
Hunter Biden calls Trump 'vile' in new book and denies Ukraine allegations,2021-03-30T19:59:06Z,"<ul><li>Joe Biden’s son will publish memoir next week</li><li>‘I became a proxy for his fear he wouldn’t be re-elected’</li><li><a href=""https://www.theguardian.com/us-news/series/us-politics-live/latest"">US politics – live coverage</a></li></ul>",https://www.theguardian.com/us-news/2021/mar/30/hunter-biden-book-donald-trump-vile-beautiful-things-ukraine,711,"<ul><li>Joe Biden’s son will publish memoir next week</li><li>‘I became a proxy for his fear he wouldn’t be re-elected’</li><li><a href=""https://www.theguardian.com/us-news/series/us-politics-live/latest"">US politics – live coverage</a></li></ul>",US news,News,article,David Smith in Washington,"US politics, US news, Joe Biden, World news, Democrats, Republicans, Donald Trump",us-news/2021/mar/30/hunter-biden-book-donald-trump-vile-beautiful-things-ukraine
UK and US criticise WHO's Covid report and accuse China of withholding data,2021-03-30T18:08:50Z,"<p>Statement signed by 12 other nations says investigation into virus origins not extensive enough</p><ul><li><a href=""https://www.theguardian.com/world/series/coronavirus-live/latest"">Coronavirus – latest updates</a></li><li><a href=""https://www.theguardian.com/world/coronavirus-outbreak"">See all our coronavirus coverage</a></li></ul>",https://www.theguardian.com/world/2021/mar/30/who-criticises-chinas-data-sharing-as-it-releases-covid-origins-report,971,"<p>Statement signed by 12 other nations says investigation into virus origins not extensive enough</p><ul><li><a href=""https://www.theguardian.com/world/series/coronavirus-live/latest"">Coronavirus – latest updates</a></li><li><a href=""https://www.theguardian.com/world/coronavirus-outbreak"">See all our coronavirus coverage</a></li></ul>",World news,News,article,Peter Beaumont,"World news, China, Coronavirus, World Health Organization, Infectious diseases",world/2021/mar/30/who-criticises-chinas-data-sharing-as-it-releases-covid-origins-report
Brazil on edge as three military chiefs resign after Bolsonaro fires defense minister,2021-03-30T16:19:59Z,<p>Political earthquake rattles country already grappling with one of the world’s worst coronavirus outbreaks</p>,https://www.theguardian.com/world/2021/mar/30/brazil-military-chiefs-resign-bolsonaro-fires-defense-minister,1004,<p>Political earthquake rattles country already grappling with one of the world’s worst coronavirus outbreaks</p>,World news,News,article,Tom Phillips in Rio de Janeiro,"Brazil, Jair Bolsonaro, Americas, World news, Coronavirus",world/2021/mar/30/brazil-military-chiefs-resign-bolsonaro-fires-defense-minister
'Best and brightest': Biden announces 'trailblazing' slate of judicial nominees,2021-03-30T15:35:27Z,"<p>Ketanji Brown Jackson nominated to replace Merrick Garland on US appeals court, as part of president’s 11 diverse selections</p>",https://www.theguardian.com/us-news/2021/mar/30/biden-federal-judicial-nominees-judges,946,"<p>Ketanji Brown Jackson nominated to replace Merrick Garland on US appeals court, as part of president’s 11 diverse selections</p>",US news,News,article,Martin Pengelly and Richard Luscombe,"US news, US politics, Law, Law (US), World news, Joe Biden",us-news/2021/mar/30/biden-federal-judicial-nominees-judges
Capitol attack suspect’s ‘I Was There’ shirt helps confirm his role – prosecutors,2021-03-30T14:24:57Z,"<p>Garret Miller’s attire on day of his arrest appears to be only part of the self-incriminating evidence</p><ul><li><a href=""https://www.theguardian.com/us-news/series/us-politics-live/latest"">US politics – live coverage</a></li></ul>",https://www.theguardian.com/us-news/2021/mar/30/capitol-riot-suspect-garret-miller,507,"<p>Garret Miller’s attire on day of his arrest appears to be only part of the self-incriminating evidence</p><ul><li><a href=""https://www.theguardian.com/us-news/series/us-politics-live/latest"">US politics – live coverage</a></li></ul>",US news,News,article,Richard Luscombe and agencies,"US Capitol attack, US news, US politics",us-news/2021/mar/30/capitol-riot-suspect-garret-miller
