headline,pub_date,snippet,web_url,word_count,abstract,section_name,pillar_name,type,byline,keywords,article_id
Biden intelligence adviser previously vetted deals for Israeli NSO Group,2022-10-18T14:13:47Z,<p>Jeremy Bash served on committee advising on sales of company’s Pegasus spyware to foreign agencies</p>,https://www.theguardian.com/news/2022/oct/18/biden-intelligence-adviser-previously-vetted-deals-for-israeli-nso-group,1344,<p>Jeremy Bash served on committee advising on sales of company’s Pegasus spyware to foreign agencies</p>,US news,News,article,Stephanie Kirchgaessner in Washington,"US news, Israel, Joe Biden, Hacking, CIA, World news",news/2022/oct/18/biden-intelligence-adviser-previously-vetted-deals-for-israeli-nso-group
Why pro-Israel lobby group Aipac is backing election deniers and extremist Republicans,2022-10-18T06:00:46Z,"<p>The group places support for Israel over all over considerations, endorsing extreme rightwing candidates in the midterm elections</p>",https://www.theguardian.com/us-news/2022/oct/18/pro-israel-lobby-group-aipac-midterms-election-deniers-and-extremist-republicans,1491,"<p>The group places support for Israel over all over considerations, endorsing extreme rightwing candidates in the midterm elections</p>",US news,News,article,Chris McGreal,"US political lobbying, US midterm elections 2022, Lobbying, US politics, Republicans, Israel",us-news/2022/oct/18/pro-israel-lobby-group-aipac-midterms-election-deniers-and-extremist-republicans
Liz Truss apologises for going ‘too far and too fast’ with economic changes – as it happened,2022-10-17T21:43:07Z,"<p>Latest updates: In BBC interview, Liz Truss refuses say if her vision is ‘dead’ and vows to fight next election </p>",https://www.theguardian.com/politics/live/2022/oct/17/jeremy-hunt-mini-budget-liz-truss-conservatives-labour-tax-uk-politics-live,12999,"<p>Latest updates: In BBC interview, Liz Truss refuses say if her vision is ‘dead’ and vows to fight next election </p>",Politics,News,liveblog,Harry Taylor  and Andrew Sparrow,"Politics, UK news, Jeremy Hunt, Liz Truss, Conservatives, Conservative leadership, Economics, Economic policy, Tax and spending, Mini-budget 2022, Business, UK cost of living crisis, Labour, Energy, Energy bills, Income tax, Household bills, Keir Starmer, Penny Mordaunt, Damian Green, Rachel Reeves, Benefits, Consumer affairs, Environment, Society, Tax",politics/live/2022/oct/17/jeremy-hunt-mini-budget-liz-truss-conservatives-labour-tax-uk-politics-live
White House calls Trump’s remarks on American Jews ‘antisemitic and insulting’ – as it happened,2022-10-17T20:06:37Z,"<ul><li>Ex-president criticizes US Jews for not backing Israel enough</li><li><a href=""https://www.theguardian.com/info/2018/sep/17/guardian-us-morning-briefing-sign-up-to-stay-informed"">Sign up to receive First Thing – our daily briefing by email</a></li></ul>",https://www.theguardian.com/us-news/live/2022/oct/17/midterm-debates-georgia-utah-ohio-biden-trump-jan-6-politics-latest,3346,"<ul><li>Ex-president criticizes US Jews for not backing Israel enough</li><li><a href=""https://www.theguardian.com/info/2018/sep/17/guardian-us-morning-briefing-sign-up-to-stay-informed"">Sign up to receive First Thing – our daily briefing by email</a></li></ul>",US news,News,liveblog,Lauren Gambino in Washington,"US politics, US news, World news, US midterm elections 2022, Democrats, Republicans, Georgia, Donald Trump, Joe Biden",us-news/live/2022/oct/17/midterm-debates-georgia-utah-ohio-biden-trump-jan-6-politics-latest
"Bernie Sanders: Democrats should not court far-right ‘racist, sexist’ voters",2022-10-17T13:36:42Z,<p>Senator says nonetheless Democrats should appeal to ‘millions of … working-class people’ who can’t afford healthcare or tuition</p>,https://www.theguardian.com/us-news/2022/oct/17/sanders-democrats-don-t-court-far-right-racist-sexist-homophobic-voters,482,<p>Senator says nonetheless Democrats should appeal to ‘millions of … working-class people’ who can’t afford healthcare or tuition</p>,US news,News,article,Ramon Antonio Vargas,"US midterm elections 2022, Bernie Sanders, US news, US politics",us-news/2022/oct/17/sanders-democrats-don-t-court-far-right-racist-sexist-homophobic-voters
Steve Bannon: justice department urges six-month prison term in contempt case,2022-10-17T13:06:54Z,<p>Former Trump strategist found guilty of criminal contempt of Congress for ignoring subpoena from Capitol attack committee</p>,https://www.theguardian.com/us-news/2022/oct/17/steve-bannon-contempt-case-jan-6-justice-dept,637,<p>Former Trump strategist found guilty of criminal contempt of Congress for ignoring subpoena from Capitol attack committee</p>,US news,News,article,Sam Levine in New York,"Steve Bannon, Donald Trump, US politics, US news, World news, US Capitol attack, January 6 hearings",us-news/2022/oct/17/steve-bannon-contempt-case-jan-6-justice-dept
‘Virtuous globalization mastermind’: Scott Morrison lauded by international speaking circuit agency ,2022-10-17T01:40:44Z,"<p>Former Australian prime minister also credited with ‘controlling natural disasters’ by the agency that says it now ‘exclusively’ represents him</p><ul><li><a href=""https://www.theguardian.com/australia-news/live/2022/oct/17/floods-weather-victoria-qld-nsw-budget-economy-housing-climate"">Follow our Australia news live blog for the latest updates</a></li><li>Get our <a href=""https://www.theguardian.com/australia-news/2022/sep/23/morning-mail-newsletter-best-daily-news-email-guardian-australia-free-sign-up-inbox-subscribe?CMP=cvau_sfl"">morning</a> and <a href=""https://www.theguardian.com/australia-news/2022/oct/13/afternoon-update-newsletter-best-daily-news-email-guardian-australia-free-sign-up?CMP=cvau_sfl"">afternoon</a> news emails, <a href=""https://www.theguardian.com/technology/ng-interactive/2018/may/15/the-guardian-app?CMP=cvau_sfl"">free app</a> or <a href=""https://www.theguardian.com/australia-news/series/full-story?CMP=cvau_sfl"">daily news podcast</a></li></ul>",https://www.theguardian.com/australia-news/2022/oct/17/virtuous-globalization-mastermind-former-australia-prime-minister-scott-morrison-lauded-by-worldwide-speakers-group,619,"<p>Former Australian prime minister also credited with ‘controlling natural disasters’ by the agency that says it now ‘exclusively’ represents him</p><ul><li><a href=""https://www.theguardian.com/australia-news/live/2022/oct/17/floods-weather-victoria-qld-nsw-budget-economy-housing-climate"">Follow our Australia news live blog for the latest updates</a></li><li>Get our <a href=""https://www.theguardian.com/australia-news/2022/sep/23/morning-mail-newsletter-best-daily-news-email-guardian-australia-free-sign-up-inbox-subscribe?CMP=cvau_sfl"">morning</a> and <a href=""https://www.theguardian.com/australia-news/2022/oct/13/afternoon-update-newsletter-best-daily-news-email-guardian-australia-free-sign-up?CMP=cvau_sfl"">afternoon</a> news emails, <a href=""https://www.theguardian.com/technology/ng-interactive/2018/may/15/the-guardian-app?CMP=cvau_sfl"">free app</a> or <a href=""https://www.theguardian.com/australia-news/series/full-story?CMP=cvau_sfl"">daily news podcast</a></li></ul>",Australia news,News,article,Tory Shepherd,"Scott Morrison, Australia news, Australian politics, Coalition",australia-news/2022/oct/17/virtuous-globalization-mastermind-former-australia-prime-minister-scott-morrison-lauded-by-worldwide-speakers-group
"Russia-Ukraine war, as it happened: nearly 9,000 Russian troops to be stationed in Belarus; Putin’s forces continuing ‘forced deportations’",2022-10-16T18:53:30Z,"<p>Russian servicemen begin to arrive in Belarus; US thinktank says Putin engaging in ‘ethnic cleansing’ in Ukraine</p><ul><li><a href=""https://www.theguardian.com/world/2022/oct/16/russia-ukraine-war-latest-what-we-know-on-day-235-of-the-invasion"">What we know on day 235 of Russia’s invasion</a></li></ul>",https://www.theguardian.com/world/live/2022/oct/16/russia-ukraine-war-live-deadly-shootout-between-russian-troops-followed-argument-over-religion-says-zelenskiy-adviser,5035,"<p>Russian servicemen begin to arrive in Belarus; US thinktank says Putin engaging in ‘ethnic cleansing’ in Ukraine</p><ul><li><a href=""https://www.theguardian.com/world/2022/oct/16/russia-ukraine-war-latest-what-we-know-on-day-235-of-the-invasion"">What we know on day 235 of Russia’s invasion</a></li></ul>",World news,News,liveblog,Nadeem Badshah (now) and Christy Cooney (earlier),"Ukraine, Russia, Europe, World news, Volodymyr Zelenskyy, Vladimir Putin",world/live/2022/oct/16/russia-ukraine-war-live-deadly-shootout-between-russian-troops-followed-argument-over-religion-says-zelenskiy-adviser
Republican Adam Kinzinger: election deniers won’t ‘go away organically’,2022-10-16T16:26:17Z,<p>January 6 committee member speaks days after panel voted to subpoena Trump and says ex-president ‘required by law to come in’</p>,https://www.theguardian.com/us-news/2022/oct/16/adam-kinzinger-republican-january-6-panel-trump,758,<p>January 6 committee member speaks days after panel voted to subpoena Trump and says ex-president ‘required by law to come in’</p>,US news,News,article,Ramon Antonio Vargas,"US Capitol attack, US news, US politics, Republicans, Donald Trump",us-news/2022/oct/16/adam-kinzinger-republican-january-6-panel-trump
‘The game is up’: senior Tory MP becomes first to publicly call for Liz Truss to go as Jeremy Hunt insists PM is still ​​in ​charge – as it happened,2022-10-16T14:57:51Z,<p>Former Tory minister to call for Truss to go in interview after new chancellor warns of difficult spending decisions. This live blog is now closed</p>,https://www.theguardian.com/politics/live/2022/oct/16/liz-truss-tax-conservatives-tories-jeremy-hunt-kwasi-kwarteng-chancellor-latest-updates,7206,<p>Former Tory minister to call for Truss to go in interview after new chancellor warns of difficult spending decisions. This live blog is now closed</p>,Politics,News,liveblog,Ben Quinn and Josh Halliday,"Liz Truss, Politics, Mini-budget 2022, UK news, Economics, Conservatives, Labour",politics/live/2022/oct/16/liz-truss-tax-conservatives-tories-jeremy-hunt-kwasi-kwarteng-chancellor-latest-updates
"‘I decided to share my voice’: Estela Juarez on her mother, who Trump deported, and her new book",2022-10-16T06:00:30Z,"<p>Just nine when zero-tolerance policy saw her mother sent to Mexico, now a teen, the Floridian has written a book for children</p>",https://www.theguardian.com/books/2022/oct/16/estela-juarez-book-immigration-mother-deported,821,"<p>Just nine when zero-tolerance policy saw her mother sent to Mexico, now a teen, the Floridian has written a book for children</p>",Books,Arts,article,Richard Luscombe,"Books, US immigration, US domestic policy, US politics, Trump administration, Biden administration, US news, Culture, Politics books, World news, Florida, Mexico, Americas",books/2022/oct/16/estela-juarez-book-immigration-mother-deported
Russia’s genocidal propaganda must not be passed off as freedom of speech,2022-10-16T06:00:29Z,"As cases of war crimes pile up against Russia, can peddlers of hate be held to account?",https://www.theguardian.com/commentisfree/2022/oct/16/propaganda-russia-ukraine-war-crimes-accountability,1093,"As cases of war crimes pile up against Russia, can peddlers of hate be held to account?",Opinion,Opinion,article,Peter Pomerantsev,"Ukraine, Russia, War crimes, Law, Censorship, Social media, Digital media, Europe, Media, World news",commentisfree/2022/oct/16/propaganda-russia-ukraine-war-crimes-accountability
‘Devoid of shame’: January 6 cop Michael Fanone on Trump’s Republican party,2022-10-16T06:00:28Z,<p>A pro-Trump mob almost killed him – and some politicians want to pretend it never happened </p>,https://www.theguardian.com/books/2022/oct/16/devoid-of-shame-january-6-cop-michael-fanone-on-trumps-republican-party,1989,<p>A pro-Trump mob almost killed him – and some politicians want to pretend it never happened </p>,Books,Arts,article,J Oliver Conroy,"Books, US Capitol attack, US news, US politics, US policing, World news, Republicans, US Congress, Politics books, Autobiography and memoir, Biography books, Culture",books/2022/oct/16/devoid-of-shame-january-6-cop-michael-fanone-on-trumps-republican-party
Giuliani names Trump election deniers as witnesses in legal ethics case,2022-10-16T05:00:26Z,"<p>Doug Mastriano, Jenna Ellis and Peter Navarro among those named in case related to attempt to overturn Pennsylvania result</p>",https://www.theguardian.com/us-news/2022/oct/16/giuliani-trump-election-deniers-witnesses-legal-ethics-dc-pennsylvania,532,"<p>Doug Mastriano, Jenna Ellis and Peter Navarro among those named in case related to attempt to overturn Pennsylvania result</p>",US news,News,article,Martin Pengelly in New York,"Rudy Giuliani, Donald Trump, US elections 2020, US politics, US news, Republicans, World news, Law (US)",us-news/2022/oct/16/giuliani-trump-election-deniers-witnesses-legal-ethics-dc-pennsylvania
Documents reveal Australia’s efforts to stay neutral as Donald Trump claimed electoral fraud,2022-10-15T19:00:14Z,"<p>US political insider admits there are ‘reasons to worry’ for its democracy as allies wonder at damage done to the west’s credibility</p><ul><li><a href=""https://www.theguardian.com/australia-news/live/2022/oct/16/australia-news-live-flooding-victoria-shepparton-rain-albanese-politics#maincontent"">Follow our live blog for the latest updates</a></li><li>Get our<a href=""https://www.theguardian.com/australia-news/2022/sep/23/morning-mail-newsletter-best-daily-news-email-guardian-australia-free-sign-up-inbox-subscribe?CMP=cvau_sfl""> morning</a> and<a href=""https://www.theguardian.com/australia-news/2022/oct/13/afternoon-update-newsletter-best-daily-news-email-guardian-australia-free-sign-up?CMP=cvau_sfl""> afternoon</a> news emails,<a href=""https://www.theguardian.com/technology/ng-interactive/2018/may/15/the-guardian-app?CMP=cvau_sfl""> free app</a> or<a href=""https://www.theguardian.com/australia-news/series/full-story?CMP=cvau_sfl""> daily news podcast</a></li></ul>",https://www.theguardian.com/us-news/2022/oct/16/documents-reveal-australias-efforts-to-stay-neutral-as-donald-trump-claimed-electoral,1290,"<p>US political insider admits there are ‘reasons to worry’ for its democracy as allies wonder at damage done to the west’s credibility</p><ul><li><a href=""https://www.theguardian.com/australia-news/live/2022/oct/16/australia-news-live-flooding-victoria-shepparton-rain-albanese-politics#maincontent"">Follow our live blog for the latest updates</a></li><li>Get our<a href=""https://www.theguardian.com/australia-news/2022/sep/23/morning-mail-newsletter-best-daily-news-email-guardian-australia-free-sign-up-inbox-subscribe?CMP=cvau_sfl""> morning</a> and<a href=""https://www.theguardian.com/australia-news/2022/oct/13/afternoon-update-newsletter-best-daily-news-email-guardian-australia-free-sign-up?CMP=cvau_sfl""> afternoon</a> news emails,<a href=""https://www.theguardian.com/technology/ng-interactive/2018/may/15/the-guardian-app?CMP=cvau_sfl""> free app</a> or<a href=""https://www.theguardian.com/australia-news/series/full-story?CMP=cvau_sfl""> daily news podcast</a></li></ul>",US news,News,article,Daniel Hurst Foreign affairs and defence correspondent,"US politics, Donald Trump, Joe Biden, Paul Keating, Peter Dutton, Australian politics, Marise Payne, Australia news",us-news/2022/oct/16/documents-reveal-australias-efforts-to-stay-neutral-as-donald-trump-claimed-electoral
IMF meetings have exposed the fragmentation of the global economy,2022-10-15T15:00:10Z,"<p>Countries have responded to a series of shocks by looking out for themselves, which could increase volatility and uncertainty</p>",https://www.theguardian.com/business/2022/oct/15/imf-meetings-have-exposed-the-fragmentation-of-the-global-economy,795,"<p>Countries have responded to a series of shocks by looking out for themselves, which could increase volatility and uncertainty</p>",Business,News,article,Larry Elliott in Washington,"International Monetary Fund (IMF), International trade, Kristalina Georgieva, Business, World news, Economics, Global economy",business/2022/oct/15/imf-meetings-have-exposed-the-fragmentation-of-the-global-economy
"Cheap, delicious - and only three years out of date: my week of eating food past its best-before",2022-10-15T08:00:01Z,<p>Some buy it to save money; others to save the planet. The market for ageing food is booming – but what’s it like and is it safe?</p>,https://www.theguardian.com/environment/2022/oct/15/cheap-delicious-and-only-three-years-out-of-date-my-week-of-eating-food-past-its-best-before,3426,<p>Some buy it to save money; others to save the planet. The market for ageing food is booming – but what’s it like and is it safe?</p>,Environment,News,article,Harry Wallop,"Food waste, Food, Society, UK cost of living crisis, Food safety, Fruit, Life and style, Vegetables, Supermarkets, Health & wellbeing",environment/2022/oct/15/cheap-delicious-and-only-three-years-out-of-date-my-week-of-eating-food-past-its-best-before
Unchecked review: how Trump dodged two impeachments … and the January 6 committee?,2022-10-15T06:01:00Z,<p>Rachael Bade and Karoun Demirjian’s account of how the Democrats failed to oust Trump is timely – and worrying</p>,https://www.theguardian.com/books/2022/oct/15/unchecked-review-trump-impeachments-january-6-committee,990,<p>Rachael Bade and Karoun Demirjian’s account of how the Democrats failed to oust Trump is timely – and worrying</p>,Books,Arts,article,Lloyd Green,"Books, Donald Trump, Trump administration, Trump impeachment (2019), Trump impeachment (2021), US politics, US news, US Capitol attack, US Congress, House of Representatives, US Senate, Democrats, Republicans, Nancy Pelosi, World news, Politics books",books/2022/oct/15/unchecked-review-trump-impeachments-january-6-committee
"Netanyahu used golf metaphor to turn Trump against Palestinians, book says",2022-10-15T06:01:00Z,"<p>In new memoir, former Israeli PM describes efforts to turn US president against Palestinian leader Abbas</p>",https://www.theguardian.com/world/2022/oct/14/benjamin-netanyahu-golf-donald-trump-palestinians-israel-peace-book,989,"<p>In new memoir, former Israeli PM describes efforts to turn US president against Palestinian leader Abbas</p>",Books,Arts,article,Martin Pengelly in New York,"Books, Benjamin Netanyahu, Donald Trump, Culture, US news, World news, US foreign policy, Middle East and north Africa, Middle East peace talks, Palestine, Mahmoud Abbas, Israel, Iran, Iran nuclear deal, Iran's nuclear programme, Politics books",world/2022/oct/14/benjamin-netanyahu-golf-donald-trump-palestinians-israel-peace-book
Kimmel: ‘The case against Trump is as obvious as an episode of Scooby-Doo’,2022-10-14T16:24:43Z,<p>Late-night hosts discuss the 10th and potentially final House committee hearing on January 6 and look back on ‘season one’ of the investigation</p>,https://www.theguardian.com/culture/2022/oct/14/jimmy-kimmel-recap-trump-jan-6-hearing-late-night,895,<p>Late-night hosts discuss the 10th and potentially final House committee hearing on January 6 and look back on ‘season one’ of the investigation</p>,Culture,Arts,article,Guardian staff,"Late-night TV roundup, Stephen Colbert, Trevor Noah, Seth Meyers, Jimmy Kimmel, TV comedy, Comedy, Culture, Television, Television & radio, US television",culture/2022/oct/14/jimmy-kimmel-recap-trump-jan-6-hearing-late-night
Donald Trump considers testifying before January 6 panel,2022-10-14T15:44:57Z,<p>Sources tell Guardian ex-president may choose to appear before Capitol attack committee after Thursday vote to subpoena him</p>,https://www.theguardian.com/us-news/2022/oct/14/trump-testify-january-6-panel-capitol-attack-subpoena,862,<p>Sources tell Guardian ex-president may choose to appear before Capitol attack committee after Thursday vote to subpoena him</p>,US news,News,article,Martin Pengelly in New York,"Donald Trump, US news, World news, US politics, January 6 hearings, Election interference",us-news/2022/oct/14/trump-testify-january-6-panel-capitol-attack-subpoena
The vote to subpoena Trump shows Democrats have found their fighting spirit,2022-10-14T12:18:25Z,<p>Democrats finally seem to realize that accountability is more important than risk aversion</p>,https://www.theguardian.com/us-news/2022/oct/14/the-vote-to-subpoena-trump-shows-democrats-have-found-their-fighting-spirit,1027,<p>Democrats finally seem to realize that accountability is more important than risk aversion</p>,Opinion,Opinion,article,Moira Donegan,"January 6 hearings, Donald Trump, US news, US politics, US Capitol attack",us-news/2022/oct/14/the-vote-to-subpoena-trump-shows-democrats-have-found-their-fighting-spirit
First Thing: Capitol attack panel votes to subpoena Trump,2022-10-14T11:31:19Z,"<p>Committee says ex-president – ‘the central cause of January 6’ – led effort to overturn the election. Plus, $1bn Kushner deal investigated</p><ul><li><strong><a href=""https://www.theguardian.com/info/2018/sep/17/guardian-us-morning-briefing-sign-up-to-stay-informed"">Don’t already get First Thing in your inbox? Sign up here</a></strong></li></ul>",https://www.theguardian.com/us-news/2022/oct/14/first-thing-capitol-attack-panel-votes-subpoena-trump-january-6,1701,"<p>Committee says ex-president – ‘the central cause of January 6’ – led effort to overturn the election. Plus, $1bn Kushner deal investigated</p><ul><li><strong><a href=""https://www.theguardian.com/info/2018/sep/17/guardian-us-morning-briefing-sign-up-to-stay-informed"">Don’t already get First Thing in your inbox? Sign up here</a></strong></li></ul>",US news,News,article,Mattha Busby,US news,us-news/2022/oct/14/first-thing-capitol-attack-panel-votes-subpoena-trump-january-6
Illuminations by Alan Moore review – a savaging of the superhero industry,2022-10-14T06:30:29Z,<p>A short-story collection from the Watchmen creator takes aim at the comics industry and populist fascism in America</p>,https://www.theguardian.com/books/2022/oct/14/illuminations-by-alan-moore-review-a-savaging-of-the-superhero-industry,973,<p>A short-story collection from the Watchmen creator takes aim at the comics industry and populist fascism in America</p>,Books,Arts,article,David M Higgins,"Alan Moore, Fiction, Books, Culture, Comics and graphic novels",books/2022/oct/14/illuminations-by-alan-moore-review-a-savaging-of-the-superhero-industry
January 6 panel’s case against Trump lays out roadmap for prosecution,2022-10-14T05:00:29Z,"<p>Devastating testimony, nearly all from Republicans, will have given attorney general Merrick Garland plenty of food for thought</p>",https://www.theguardian.com/us-news/2022/oct/14/january-6-hearing-trump-analysis,977,"<p>Devastating testimony, nearly all from Republicans, will have given attorney general Merrick Garland plenty of food for thought</p>",US news,News,article,Sam Levine in New York,"US Capitol attack, Donald Trump, US news, House of Representatives, Donald Trump trials",us-news/2022/oct/14/january-6-hearing-trump-analysis
‘Do you believe this?’: New video shows how Nancy Pelosi took charge in Capitol riot,2022-10-14T01:01:36Z,<p>House speaker continued to try to find a way for House and Senate to reconvene despite turmoil</p>,https://www.theguardian.com/us-news/2022/oct/14/do-you-believe-this-new-video-shows-how-nancy-pelosi-took-charge-in-capitol-riot,794,<p>House speaker continued to try to find a way for House and Senate to reconvene despite turmoil</p>,US news,News,article,Guardian staff and agencies,"January 6 hearings, US Capitol attack, US news, Donald Trump, Chuck Schumer, US politics, Nancy Pelosi",us-news/2022/oct/14/do-you-believe-this-new-video-shows-how-nancy-pelosi-took-charge-in-capitol-riot
Capitol attack panel votes to subpoena Trump – ‘the central cause of January 6’,2022-10-13T21:32:48Z,<p>The committee expressed it had ‘no doubt’ the ex-president led the effort to overturn the election</p>,https://www.theguardian.com/us-news/2022/oct/13/january-6-hearing-trump-state-of-mind-capitol-attack,1354,<p>The committee expressed it had ‘no doubt’ the ex-president led the effort to overturn the election</p>,US news,News,article,David Smith in Washington,"January 6 hearings, Donald Trump, Liz Cheney, US Capitol attack, US news, US politics",us-news/2022/oct/13/january-6-hearing-trump-state-of-mind-capitol-attack
Jan 6 hearing updates: panel votes to subpoena Donald Trump – as it happened,2022-10-13T20:35:26Z,"<ul><li>Vote represents effort to compel ex-president’s testimony</li><li><a href=""https://www.theguardian.com/info/2018/sep/17/guardian-us-morning-briefing-sign-up-to-stay-informed"">Sign up to receive First Thing – our daily briefing by email</a></li></ul>",https://www.theguardian.com/us-news/live/2022/oct/13/january-6-trump-capitol-attack-committee-us-politics-latest,4712,"<ul><li>Vote represents effort to compel ex-president’s testimony</li><li><a href=""https://www.theguardian.com/info/2018/sep/17/guardian-us-morning-briefing-sign-up-to-stay-informed"">Sign up to receive First Thing – our daily briefing by email</a></li></ul>",US news,News,liveblog,Chris Stein in Washington,"US Capitol attack, Donald Trump, US politics, US news, World news, Democrats, Republicans, US domestic policy, Joe Biden, Biden administration, US elections 2020, January 6 hearings",us-news/live/2022/oct/13/january-6-trump-capitol-attack-committee-us-politics-latest
