headline,pub_date,snippet,web_url,word_count,abstract,section_name,pillar_name,type,byline,keywords,article_id
Facebook fails to label 80% of posts promoting bioweapons conspiracy theory,2022-03-31T21:29:00Z,"<p>A study found that external articles shared on the bioweapons myth were not labeled as ‘false information’ or ‘missing context’</p><ul><li><a href=""https://www.theguardian.com/world/live/2022/mar/31/russia-ukraine-war-latest-news-ukraine-braces-for-attacks-in-east-us-says-putin-misled-by-advisers-live"">Russia-Ukraine war: latest updates</a></li></ul>",https://www.theguardian.com/technology/2022/mar/31/facebook-disinformation-war-ukraine-russia,538,"<p>A study found that external articles shared on the bioweapons myth were not labeled as ‘false information’ or ‘missing context’</p><ul><li><a href=""https://www.theguardian.com/world/live/2022/mar/31/russia-ukraine-war-latest-news-ukraine-braces-for-attacks-in-east-us-says-putin-misled-by-advisers-live"">Russia-Ukraine war: latest updates</a></li></ul>",Technology,News,article,Kari Paul,"Facebook, Ukraine, Meta, Social media, Technology, Digital media, US news",technology/2022/mar/31/facebook-disinformation-war-ukraine-russia
‘I know how much it hurts’: Biden to release US oil in bid to lower gas prices – as it happened,2022-03-31T20:23:54Z,"<ul><li>President lays out plan to free 1m daily barrels from US oil reserve</li><li>Biden suggests Putin may be in isolation and may have fired advisers</li><li><a href=""https://www.theguardian.com/us-news/2022/mar/30/title-42-us-mexico-border-asylum-seekers-plans-end"">US plans to end Covid-era order blocking asylum seekers at border</a></li><li><a href=""https://www.theguardian.com/world/live/2022/mar/31/russia-ukraine-war-latest-news-ukraine-braces-for-attacks-in-east-us-says-putin-misled-by-advisers-live"">Russia-Ukraine war – follow the latest updates</a></li><li><a href=""https://www.theguardian.com/info/2018/sep/17/guardian-us-morning-briefing-sign-up-to-stay-informed"">Sign up to receive First Thing – our daily briefing by email</a></li></ul>",https://www.theguardian.com/us-news/live/2022/mar/31/biden-oil-strategic-reserves-release-ukraine-russia-pence-us-politics-latest-updates,3054,"<ul><li>President lays out plan to free 1m daily barrels from US oil reserve</li><li>Biden suggests Putin may be in isolation and may have fired advisers</li><li><a href=""https://www.theguardian.com/us-news/2022/mar/30/title-42-us-mexico-border-asylum-seekers-plans-end"">US plans to end Covid-era order blocking asylum seekers at border</a></li><li><a href=""https://www.theguardian.com/world/live/2022/mar/31/russia-ukraine-war-latest-news-ukraine-braces-for-attacks-in-east-us-says-putin-misled-by-advisers-live"">Russia-Ukraine war – follow the latest updates</a></li><li><a href=""https://www.theguardian.com/info/2018/sep/17/guardian-us-morning-briefing-sign-up-to-stay-informed"">Sign up to receive First Thing – our daily briefing by email</a></li></ul>",US news,News,liveblog,Richard Luscombe,"US news, US politics, Joe Biden, Oil, Energy, Fossil fuels, Ukraine, US immigration, Mike Pence, Nancy Pelosi, World news, US economy, Economics, Business, Environment, Europe",us-news/live/2022/mar/31/biden-oil-strategic-reserves-release-ukraine-russia-pence-us-politics-latest-updates
Don’t kick the president! Irish dancers Cairde go from TikTok to the White House,2022-03-31T19:41:41Z,"<p>The seven-strong group are a huge social media success, leading to shows right in front of Joe Biden and at the Stade de France</p>",https://www.theguardian.com/stage/2022/mar/31/cairde-irish-dancing-tiktok-president-biden,846,"<p>The seven-strong group are a huge social media success, leading to shows right in front of Joe Biden and at the Stade de France</p>",Stage,Arts,article,Hollie Geraghty,"Dance, Stage, Culture, Joe Biden, Ireland",stage/2022/mar/31/cairde-irish-dancing-tiktok-president-biden
Bat out of belfry most likely a bird,2022-03-31T16:37:12Z,<p>Bat droppings | Notable Rothschild women | Simple Minds | Boris Johnson | Winning strategy</p>,https://www.theguardian.com/environment/2022/mar/31/bat-out-of-belfry-most-likely-a-bird,257,<p>Bat droppings | Notable Rothschild women | Simple Minds | Boris Johnson | Winning strategy</p>,Environment,News,article,Letters,"Wildlife, Animals, Birds, Simple Minds, Boris Johnson, Politics",environment/2022/mar/31/bat-out-of-belfry-most-likely-a-bird
"Gaslit, Devs and Better Call Saul: what’s new to streaming in Australia this April",2022-03-31T16:30:06Z,"<p>Plus A Very British Scandal, a series about surfing entrepreneurs and Volodymyr Zelenskiy’s comedy about being a fictional president of Ukraine</p>",https://www.theguardian.com/tv-and-radio/2022/apr/01/gaslit-devs-and-better-call-saul-whats-new-to-streaming-in-australia-this-april,2036,"<p>Plus A Very British Scandal, a series about surfing entrepreneurs and Volodymyr Zelenskiy’s comedy about being a fictional president of Ukraine</p>",Television & radio,Arts,article,Luke Buckmaster,"Television & radio, Better Call Saul, Culture, Television, Netflix, Stan, Australian television, SBS, Documentary films, Film",tv-and-radio/2022/apr/01/gaslit-devs-and-better-call-saul-whats-new-to-streaming-in-australia-this-april
Biden announces ‘largest release of oil reserves’ in effort to curb gasoline prices,2022-03-31T15:14:30Z,<p>President to release up to 1m barrels of oil a day from the strategic reserve for the next six months</p>,https://www.theguardian.com/business/2022/mar/31/us-release-oil-strategic-reserve-gas-price,946,<p>President to release up to 1m barrels of oil a day from the strategic reserve for the next six months</p>,Business,News,article,Ed Pilkington and Chris Michael,"Gas, Ukraine, Joe Biden, Inflation",business/2022/mar/31/us-release-oil-strategic-reserve-gas-price
Turkish prosecutor asks to halt trial for the murder of Saudi critic Jamal Khashoggi,2022-03-31T15:10:29Z,<p>Istanbul is seeking to mend ties with Saudi Arabia to bolster a struggling economy as it looks for foreign trade</p>,https://www.theguardian.com/world/2022/mar/31/turkish-prosecutor-asks-to-halt-trial-for-the-of-saudi-critic-jamal-khashoggi,682,<p>Istanbul is seeking to mend ties with Saudi Arabia to bolster a struggling economy as it looks for foreign trade</p>,World news,News,article,Martin Chulov Middle East correspondent,"Jamal Khashoggi, Turkey, World news, Saudi Arabia, Middle East and north Africa",world/2022/mar/31/turkish-prosecutor-asks-to-halt-trial-for-the-of-saudi-critic-jamal-khashoggi
UK economy grows faster than expected; prices drop as US mulls big oil reserve release – as it happened,2022-03-31T14:29:15Z,"<ul><li><a href=""https://www.theguardian.com/business/live/2022/mar/31/uk-economy-grows-faster-expected-oil-prices-drop--us-big-oil-reserve-release-business-live?page=with:block-624594b88f08224285c9dcf7#block-624594b88f08224285c9dcf7"">Joe Biden expected to announce release of up to 180m barrels from US strategic petroleum reserve to cool oil market</a></li><li><a href=""https://www.theguardian.com/business/live/2022/mar/31/uk-economy-grows-faster-expected-oil-prices-drop--us-big-oil-reserve-release-business-live?page=with:block-62459b878f081c355fe42cc2#block-62459b878f081c355fe42cc2"">Gas prices rise amid standoff over rouble payments</a></li><li><a href=""https://www.theguardian.com/world/2022/mar/31/jets-linked-to-russian-oligarchs-appear-to-have-kept-flying-despite-sanctions"">Jets linked to Russian oligarchs appear to have kept flying despite sanctions</a></li><li><a href=""https://www.theguardian.com/money/2022/mar/31/energy-supplier-websites-crash-as-uk-customers-rush-to-send-in-meter-readings"">Energy websites crash as customers rush to submit meter readings</a></li><li><a href=""https://www.theguardian.com/business/2022/mar/31/uk-house-prices-grow-at-fastest-rate-for-17-years"">UK house prices rise at fastest rate for 17 years</a></li><li><a href=""https://www.theguardian.com/business/live/2022/mar/31/uk-economy-grows-faster-expected-oil-prices-drop--us-big-oil-reserve-release-business-live?filterKeyEvents=false&amp;page=with:block-6245780f8f083888e9f4a3df#block-6245780f8f083888e9f4a3df"">Eurozone unemployment rate falls to record low of 6.8%</a></li><li><a href=""https://www.theguardian.com/business/live/2022/mar/31/uk-economy-grows-faster-expected-oil-prices-drop--us-big-oil-reserve-release-business-live?page=with:block-6245b65f8f08224285c9de8a#block-6245b65f8f08224285c9de8a"">Closing summary</a></li><li><a href=""https://www.theguardian.com/world/live/2022/mar/31/russia-ukraine-war-latest-news-ukraine-braces-for-attacks-in-east-us-says-putin-misled-by-advisers-live"">Ukraine live updates</a></li></ul>",https://www.theguardian.com/business/live/2022/mar/31/uk-economy-grows-faster-expected-oil-prices-drop--us-big-oil-reserve-release-business-live,3828,"<ul><li><a href=""https://www.theguardian.com/business/live/2022/mar/31/uk-economy-grows-faster-expected-oil-prices-drop--us-big-oil-reserve-release-business-live?page=with:block-624594b88f08224285c9dcf7#block-624594b88f08224285c9dcf7"">Joe Biden expected to announce release of up to 180m barrels from US strategic petroleum reserve to cool oil market</a></li><li><a href=""https://www.theguardian.com/business/live/2022/mar/31/uk-economy-grows-faster-expected-oil-prices-drop--us-big-oil-reserve-release-business-live?page=with:block-62459b878f081c355fe42cc2#block-62459b878f081c355fe42cc2"">Gas prices rise amid standoff over rouble payments</a></li><li><a href=""https://www.theguardian.com/world/2022/mar/31/jets-linked-to-russian-oligarchs-appear-to-have-kept-flying-despite-sanctions"">Jets linked to Russian oligarchs appear to have kept flying despite sanctions</a></li><li><a href=""https://www.theguardian.com/money/2022/mar/31/energy-supplier-websites-crash-as-uk-customers-rush-to-send-in-meter-readings"">Energy websites crash as customers rush to submit meter readings</a></li><li><a href=""https://www.theguardian.com/business/2022/mar/31/uk-house-prices-grow-at-fastest-rate-for-17-years"">UK house prices rise at fastest rate for 17 years</a></li><li><a href=""https://www.theguardian.com/business/live/2022/mar/31/uk-economy-grows-faster-expected-oil-prices-drop--us-big-oil-reserve-release-business-live?filterKeyEvents=false&amp;page=with:block-6245780f8f083888e9f4a3df#block-6245780f8f083888e9f4a3df"">Eurozone unemployment rate falls to record low of 6.8%</a></li><li><a href=""https://www.theguardian.com/business/live/2022/mar/31/uk-economy-grows-faster-expected-oil-prices-drop--us-big-oil-reserve-release-business-live?page=with:block-6245b65f8f08224285c9de8a#block-6245b65f8f08224285c9de8a"">Closing summary</a></li><li><a href=""https://www.theguardian.com/world/live/2022/mar/31/russia-ukraine-war-latest-news-ukraine-braces-for-attacks-in-east-us-says-putin-misled-by-advisers-live"">Ukraine live updates</a></li></ul>",Business,News,liveblog,Julia Kollewe,"Business, Ukraine, Russia, Europe, World news, Stock markets, Currencies, Commodities",business/live/2022/mar/31/uk-economy-grows-faster-expected-oil-prices-drop--us-big-oil-reserve-release-business-live
Egg farmers: UK supermarkets must raise price or we’ll go under,2022-03-31T13:59:13Z,<p>Rising costs threaten farms as NFU warns of huge drop in greenhouse crops such as cucumbers</p>,https://www.theguardian.com/environment/2022/mar/31/cost-of-farming-crisis-egg-producers-plea-to-uk-supermarkets-to-raise-price,713,<p>Rising costs threaten farms as NFU warns of huge drop in greenhouse crops such as cucumbers</p>,Environment,News,article,Sarah Butler,"Farming, Retail industry, Eggs, Bird flu, Food, Environment, UK news",environment/2022/mar/31/cost-of-farming-crisis-egg-producers-plea-to-uk-supermarkets-to-raise-price
Oil prices fall after US ponders record-breaking release of crude reserves,2022-03-31T13:24:35Z,"<p>Joe Biden seeks to allay fears of shortages over Russian invasion of Ukraine</p><ul><li><a href=""https://www.theguardian.com/world/live/2022/mar/31/russia-ukraine-war-latest-news-ukraine-braces-for-attacks-in-east-us-says-putin-misled-by-advisers-live"">Russia-Ukraine war: latest updates</a></li></ul>",https://www.theguardian.com/business/2022/mar/31/oil-prices-fall-us-ponders-release-crude-reserves,648,"<p>Joe Biden seeks to allay fears of shortages over Russian invasion of Ukraine</p><ul><li><a href=""https://www.theguardian.com/world/live/2022/mar/31/russia-ukraine-war-latest-news-ukraine-braces-for-attacks-in-east-us-says-putin-misled-by-advisers-live"">Russia-Ukraine war: latest updates</a></li></ul>",Business,News,article,Phillip Inman,"Oil, US news, Russia, Ukraine, Opec, Business, Commodities, Europe, World news, Joe Biden, UK news",business/2022/mar/31/oil-prices-fall-us-ponders-release-crude-reserves
Why is Biden boasting about drilling for oil? Our planet demands we stop now,2022-03-31T13:18:10Z,"<p>Tragically, the Biden administration is choosing to expand the fossil fuel industry at this critical moment</p>",https://www.theguardian.com/commentisfree/2022/mar/31/why-is-biden-boasting-about-drilling-for-oil-our-planet-demands-we-stop-now,795,"<p>Tragically, the Biden administration is choosing to expand the fossil fuel industry at this critical moment</p>",Opinion,Opinion,article,Peter Kalmus,"Fossil fuels, Climate crisis, Energy, Environment",commentisfree/2022/mar/31/why-is-biden-boasting-about-drilling-for-oil-our-planet-demands-we-stop-now
EU leaders urged to be tough on China if it backs Russia in Ukraine,2022-03-31T12:14:09Z,"<p>Bloc pressed to threaten sanctions at bilateral summit amid concerns about global authoritarian alliance</p><ul><li><a href=""https://www.theguardian.com/world/live/2022/mar/31/russia-ukraine-war-latest-news-ukraine-braces-for-attacks-in-east-us-says-putin-misled-by-advisers-live"">Russia-Ukraine war: latest updates</a></li></ul>",https://www.theguardian.com/world/2022/mar/31/eu-leaders-urged-to-be-tough-on-china-if-it-supports-russia-war-in-ukraine,858,"<p>Bloc pressed to threaten sanctions at bilateral summit amid concerns about global authoritarian alliance</p><ul><li><a href=""https://www.theguardian.com/world/live/2022/mar/31/russia-ukraine-war-latest-news-ukraine-braces-for-attacks-in-east-us-says-putin-misled-by-advisers-live"">Russia-Ukraine war: latest updates</a></li></ul>",World news,News,article,Jennifer Rankinin Brussels and Vincent Ni China affairs correspondent,"European Union, China, Russia, Ukraine, Asia Pacific, Europe, World news",world/2022/mar/31/eu-leaders-urged-to-be-tough-on-china-if-it-supports-russia-war-in-ukraine
First Thing: Ukraine prepares for new wave of attacks in east,2022-03-31T10:07:12Z,"<p>Russian forces continue to bombard Chernihiv and parts of Kyiv despite announcing their withdrawal. Plus, 500 ghost flights leave the UK monthly</p><ul><li><strong><a href=""https://www.theguardian.com/info/2018/sep/17/guardian-us-morning-briefing-sign-up-to-stay-informed"">Don’t already get First Thing in your inbox? Sign up here</a></strong></li></ul>",https://www.theguardian.com/us-news/2022/mar/31/first-thing-ukraine-prepares-for-new-wave-of-attacks-in-east,959,"<p>Russian forces continue to bombard Chernihiv and parts of Kyiv despite announcing their withdrawal. Plus, 500 ghost flights leave the UK monthly</p><ul><li><strong><a href=""https://www.theguardian.com/info/2018/sep/17/guardian-us-morning-briefing-sign-up-to-stay-informed"">Don’t already get First Thing in your inbox? Sign up here</a></strong></li></ul>",US news,News,article,Clea Skopeliti,US news,us-news/2022/mar/31/first-thing-ukraine-prepares-for-new-wave-of-attacks-in-east
Man on Westminster hunger strike fighting for MPs to get climate briefing,2022-03-31T06:00:40Z,"<p>Angus Rose, 52, has gone 17 days without food demanding meeting with minister Greg Hands</p>",https://www.theguardian.com/environment/2022/mar/31/man-on-westminster-hunger-strike-fighting-for-mps-to-get-climate-briefing,624,"<p>Angus Rose, 52, has gone 17 days without food demanding meeting with minister Greg Hands</p>",Environment,News,article,Damien Gayle,"Climate crisis, Environment, Boris Johnson, Politics, UK news, Protest, Green politics",environment/2022/mar/31/man-on-westminster-hunger-strike-fighting-for-mps-to-get-climate-briefing
Testing times: why North Korea’s missile launches should worry the west,2022-03-31T05:26:02Z,<p>The recent test of an ICBM is a show of strength by Kim Jong-un and a reminder that he will have to be treated as an equal by the US in future talks</p>,https://www.theguardian.com/world/2022/mar/31/testing-times-why-north-koreas-missile-launches-should-worry-the-west,819,<p>The recent test of an ICBM is a show of strength by Kim Jong-un and a reminder that he will have to be treated as an equal by the US in future talks</p>,World news,News,article,Justin McCurry in Tokyo,"North Korea, South Korea, Asia Pacific",world/2022/mar/31/testing-times-why-north-koreas-missile-launches-should-worry-the-west
Biden gets second Covid booster and says US at a ‘new moment in this pandemic’ – as it happened,2022-03-30T20:21:40Z,"<ul><li>Biden says Covid ‘no longer controls our lives’ as new website launched</li><li>US president and Ukrainian counterpart speak for 55 minutes</li><li><a href=""https://www.theguardian.com/us-news/2022/mar/30/ketanji-brown-jackson-susan-collins-supreme-court"">Susan Collins to become first Republican to support Jackson</a></li><li><a href=""https://www.theguardian.com/info/2018/sep/17/guardian-us-morning-briefing-sign-up-to-stay-informed"">Sign up to receive First Thing – our daily briefing by email</a></li></ul>",https://www.theguardian.com/us-news/live/2022/mar/30/joe-biden-ketanji-brown-jackson-ukraine-russia-us-politics-latest,3509,"<ul><li>Biden says Covid ‘no longer controls our lives’ as new website launched</li><li>US president and Ukrainian counterpart speak for 55 minutes</li><li><a href=""https://www.theguardian.com/us-news/2022/mar/30/ketanji-brown-jackson-susan-collins-supreme-court"">Susan Collins to become first Republican to support Jackson</a></li><li><a href=""https://www.theguardian.com/info/2018/sep/17/guardian-us-morning-briefing-sign-up-to-stay-informed"">Sign up to receive First Thing – our daily briefing by email</a></li></ul>",US news,News,liveblog,Richard Luscombe,"US politics, US supreme court, Ketanji Brown Jackson, Joe Biden, US news, Republicans, Democrats, World news, Ukraine, Russia, Coronavirus, Europe",us-news/live/2022/mar/30/joe-biden-ketanji-brown-jackson-ukraine-russia-us-politics-latest
"Morning mail: Joyce dissolves water advisory body, Zelenskiy to address MPs, Bruce Willis retires",2022-03-30T19:49:45Z,"<p><strong>Thursday</strong>: Deputy PM disbands group established to scrutinise major projects. Plus: action star’s aphasia diagnosis</p><ul><li><em>Want to get the morning mail to your email inbox every weekday? <a href=""https://www.theguardian.com/world/guardian-australia-morning-mail/2014/jun/24/-sp-guardian-australias-morning-mail-subscribe-by-email?CMP=cvau_sfl&amp;CMP=mm_sfl"">Sign up here</a></em></li></ul>",https://www.theguardian.com/australia-news/2022/mar/31/morning-mail-joyce-dissolves-water-advisory-body-zelenskiy-to-address-mps-bruce-willis-retires,1154,"<p><strong>Thursday</strong>: Deputy PM disbands group established to scrutinise major projects. Plus: action star’s aphasia diagnosis</p><ul><li><em>Want to get the morning mail to your email inbox every weekday? <a href=""https://www.theguardian.com/world/guardian-australia-morning-mail/2014/jun/24/-sp-guardian-australias-morning-mail-subscribe-by-email?CMP=cvau_sfl&amp;CMP=mm_sfl"">Sign up here</a></em></li></ul>",Australia news,News,article,Tamara Howie,,australia-news/2022/mar/31/morning-mail-joyce-dissolves-water-advisory-body-zelenskiy-to-address-mps-bruce-willis-retires
Trump claims ignorance of ‘burner phones’. Here’s how they work,2022-03-30T19:38:21Z,<p>Disposable phones may appeal to anyone trying to hide their identity – whether a criminal or an activist</p>,https://www.theguardian.com/us-news/2022/mar/30/donald-trump-burner-phones,837,<p>Disposable phones may appeal to anyone trying to hide their identity – whether a criminal or an activist</p>,US news,News,article,Wilfred Chan,"Donald Trump, US Capitol attack, US news, Technology",us-news/2022/mar/30/donald-trump-burner-phones
Biden receives second Covid booster as he pleads with Congress for funding,2022-03-30T19:30:32Z,<p>US president says ‘Covid-19 no longer controls our lives’ and asks Congress for more money to continue effort to fight the virus</p>,https://www.theguardian.com/us-news/2022/mar/30/joe-biden-second-covid-booster-congress-funding,440,<p>US president says ‘Covid-19 no longer controls our lives’ and asks Congress for more money to continue effort to fight the virus</p>,US news,News,article,Richard Luscombe,"Joe Biden, Coronavirus, Vaccines and immunisation, US news",us-news/2022/mar/30/joe-biden-second-covid-booster-congress-funding
US plans to end Covid-era order blocking asylum seekers at Mexico border,2022-03-30T18:34:15Z,"<p>Decision has not been finalized, official tells Reuters, but rule known as Title 42 would end by 23 May</p>",https://www.theguardian.com/us-news/2022/mar/30/title-42-us-mexico-border-asylum-seekers-plans-end,905,"<p>Decision has not been finalized, official tells Reuters, but rule known as Title 42 would end by 23 May</p>",US news,News,article,Guardian staff and agencies,"US immigration, US-Mexico border, US news, Biden administration",us-news/2022/mar/30/title-42-us-mexico-border-asylum-seekers-plans-end
Revealed: Trump used White House phone for call on January 6 that was not on official log,2022-03-30T18:16:35Z,<p>Trump’s call to Republican senator should have been reflected in presidential call log on day of Capitol attack but wasn’t</p>,https://www.theguardian.com/us-news/2022/mar/30/trump-used-white-house-phone-call-capitol-attack-jan-6-not-official-log,881,<p>Trump’s call to Republican senator should have been reflected in presidential call log on day of Capitol attack but wasn’t</p>,US news,News,article,Hugo Lowell in Washington DC,"Donald Trump, US Capitol attack, US news, US politics, House of Representatives",us-news/2022/mar/30/trump-used-white-house-phone-call-capitol-attack-jan-6-not-official-log
Ketanji Brown Jackson to receive rare Republican vote as Collins says yes,2022-03-30T17:59:23Z,<p>Maine senator says she will vote to confirm Joe Biden’s nominee: ‘There can be no question she is qualified’</p>,https://www.theguardian.com/us-news/2022/mar/30/ketanji-brown-jackson-susan-collins-supreme-court,666,<p>Maine senator says she will vote to confirm Joe Biden’s nominee: ‘There can be no question she is qualified’</p>,US news,News,article,Martin Pengelly in New York,"Ketanji Brown Jackson, US supreme court, US politics, US news, Law (US), Law, World news",us-news/2022/mar/30/ketanji-brown-jackson-susan-collins-supreme-court
Stephen Colbert on Trump’s missing phone logs: ‘A poorly executed cover-up’,2022-03-30T15:24:20Z,"<p>Late-night hosts discuss negotiations between Ukraine and Russia, Trump’s missing White House phone logs from 6 January and fallout from the Oscars</p>",https://www.theguardian.com/culture/2022/mar/30/stephen-colbert-jimmy-kimmel-trump-missing-phone-logs,605,"<p>Late-night hosts discuss negotiations between Ukraine and Russia, Trump’s missing White House phone logs from 6 January and fallout from the Oscars</p>",Culture,Arts,article,Adrian Horton,"Late-night TV roundup, Stephen Colbert, Jimmy Kimmel, TV comedy, Comedy, Culture, Television & radio, Television",culture/2022/mar/30/stephen-colbert-jimmy-kimmel-trump-missing-phone-logs
‘This massive undertaking was invisible’: film glimpses behind the curtain as Covid vaccine was made,2022-03-30T13:52:22Z,<p>Acclaimed film-maker David France’s How to Survive a Pandemic on HBO documents ‘a scientific undertaking unlike any in our lifetime’</p>,https://www.theguardian.com/tv-and-radio/2022/mar/30/david-france-covid-how-to-survive-a-pandemic-film-hbo,1351,<p>Acclaimed film-maker David France’s How to Survive a Pandemic on HBO documents ‘a scientific undertaking unlike any in our lifetime’</p>,Television & radio,Arts,article,Adrian Horton,"Documentary, US television, HBO, Coronavirus, Factual TV, Television, Television & radio, World news, US news, Culture",tv-and-radio/2022/mar/30/david-france-covid-how-to-survive-a-pandemic-film-hbo
‘Disgraceful neglect of Line of Duty’: the wrongs and rights of the Bafta TV nominations,2022-03-30T12:55:09Z,"<p>Jed Mercurio’s show is unfairly lacking in awards, and Bafta needs to give more weight to international shows from broadcasters like Netflix – or fail to reflect TV’s balance of power</p>",https://www.theguardian.com/tv-and-radio/2022/mar/30/disgraceful-neglect-of-line-of-duty-the-wrongs-and-rights-of-the-bafta-tv-nominations,1208,"<p>Jed Mercurio’s show is unfairly lacking in awards, and Bafta needs to give more weight to international shows from broadcasters like Netflix – or fail to reflect TV’s balance of power</p>",Television & radio,Arts,article,Mark Lawson,"Television, Culture, Television & radio",tv-and-radio/2022/mar/30/disgraceful-neglect-of-line-of-duty-the-wrongs-and-rights-of-the-bafta-tv-nominations
