headline,pub_date,snippet,web_url,word_count,abstract,section_name,pillar_name,type,byline,keywords,article_id
Joe Biden calls Vladimir Putin a ‘war criminal’ – as it happened,2022-03-16T20:28:30Z,"<ul><li>White House says president was ‘speaking from his heart’</li><li><a href=""https://www.theguardian.com/us-news/live/2022/mar/16/zelenskiy-congress-address-ukraine-russia-invasion-joe-biden-live-updates?page=with:block-6232182d8f0832c62addf3ad#block-6232182d8f0832c62addf3ad"">US is ‘going to do more in the coming days and weeks’ – Biden</a></li><li><a href=""https://www.theguardian.com/us-news/2022/mar/16/zelenskiy-address-us-congress-ukraine-russia"">Ukrainian president receives standing ovation from Congress</a></li><li><a href=""https://www.theguardian.com/world/live/2022/mar/16/ukraine-russia-war-latest-zelenskiy-says-peace-talks-are-more-realistic-three-eu-leaders-vow-support-on-kyiv-visit-live"">Ukraine-Russia war – follow all the latest updates</a></li><li><a href=""https://www.theguardian.com/info/2018/sep/17/guardian-us-morning-briefing-sign-up-to-stay-informed"">Sign up to receive First Thing – our daily briefing by email</a></li></ul>",https://www.theguardian.com/us-news/live/2022/mar/16/zelenskiy-congress-address-ukraine-russia-invasion-joe-biden-live-updates,7265,"<ul><li>White House says president was ‘speaking from his heart’</li><li><a href=""https://www.theguardian.com/us-news/live/2022/mar/16/zelenskiy-congress-address-ukraine-russia-invasion-joe-biden-live-updates?page=with:block-6232182d8f0832c62addf3ad#block-6232182d8f0832c62addf3ad"">US is ‘going to do more in the coming days and weeks’ – Biden</a></li><li><a href=""https://www.theguardian.com/us-news/2022/mar/16/zelenskiy-address-us-congress-ukraine-russia"">Ukrainian president receives standing ovation from Congress</a></li><li><a href=""https://www.theguardian.com/world/live/2022/mar/16/ukraine-russia-war-latest-zelenskiy-says-peace-talks-are-more-realistic-three-eu-leaders-vow-support-on-kyiv-visit-live"">Ukraine-Russia war – follow all the latest updates</a></li><li><a href=""https://www.theguardian.com/info/2018/sep/17/guardian-us-morning-briefing-sign-up-to-stay-informed"">Sign up to receive First Thing – our daily briefing by email</a></li></ul>",US news,News,liveblog,Joanna Walters and Richard Luscombe,"Joe Biden, US politics, Volodymyr Zelenskyy, Ukraine, Russia, US Congress, US news, World news, Europe, Vladimir Putin, US foreign policy",us-news/live/2022/mar/16/zelenskiy-congress-address-ukraine-russia-invasion-joe-biden-live-updates
Biden to visit Nato and EU in Brussels as pressure over Ukraine increases – as it happened,2022-03-15T21:09:06Z,"<ul><li>Congress pressures president to transfer jets from Poland to Ukraine</li><li>Sarah Bloom Raskin withdraws nomination from Federal Reserve Board</li><li><a href=""https://www.theguardian.com/us-news/2022/mar/13/jake-sullivan-biden-national-security-adviser-china-russia"">Ukraine crisis – live updates</a></li><li><a href=""https://www.theguardian.com/info/2018/sep/17/guardian-us-morning-briefing-sign-up-to-stay-informed"">Sign up to receive First Thing – our daily briefing by email</a></li></ul>",https://www.theguardian.com/us-news/live/2022/mar/15/biden-us-ukraine-european-trip-latest-updates-politics-live,4454,"<ul><li>Congress pressures president to transfer jets from Poland to Ukraine</li><li>Sarah Bloom Raskin withdraws nomination from Federal Reserve Board</li><li><a href=""https://www.theguardian.com/us-news/2022/mar/13/jake-sullivan-biden-national-security-adviser-china-russia"">Ukraine crisis – live updates</a></li><li><a href=""https://www.theguardian.com/info/2018/sep/17/guardian-us-morning-briefing-sign-up-to-stay-informed"">Sign up to receive First Thing – our daily briefing by email</a></li></ul>",US news,News,liveblog,Vivian Ho,"Biden administration, Joe Biden, US Congress, US news, US politics, Ukraine, Russia, Europe, World news",us-news/live/2022/mar/15/biden-us-ukraine-european-trip-latest-updates-politics-live
White House warns of ‘significant consequences’ if China aids Russia – as it happened,2022-03-14T21:10:52Z,"<ul><li><a href=""https://www.theguardian.com/world/2022/mar/14/us-will-try-to-convince-china-not-to-supply-arms-to-russia-at-key-rome-meeting"">US urged China not to supply arms to Russia at ‘intense’ Rome meeting</a></li><li><a href=""https://www.theguardian.com/us-news/live/2022/mar/14/biden-us-ukraine-latest-updates-zelensky-congress-putin-russia-invasion?page=with:block-622f93a28f080ca367918f9f#block-622f93a28f080ca367918f9f"">Fox News correspondent injured in Ukraine</a></li><li><a href=""https://www.theguardian.com/us-news/live/2022/mar/14/biden-us-ukraine-latest-updates-zelensky-congress-putin-russia-invasion?page=with:block-622f60218f08963051184971#block-622f60218f08963051184971"">Biden may travel to Europe for a Ukraine-focused trip – report</a></li><li><a href=""https://www.theguardian.com/world/2022/mar/14/volodymyr-zelenskiy-us-congress-address-mig-jets"">Zelenskiy expected to urge jet transfer in address to US Congress</a></li><li><a href=""https://www.theguardian.com/us-news/2022/mar/13/jake-sullivan-biden-national-security-adviser-china-russia"">Ukraine crisis – live updates</a></li><li><strong><a href=""https://www.theguardian.com/info/2018/sep/17/guardian-us-morning-briefing-sign-up-to-stay-informed"">Sign up to receive First Thing – our daily briefing by email</a></strong></li></ul>",https://www.theguardian.com/us-news/live/2022/mar/14/biden-us-ukraine-latest-updates-zelensky-congress-putin-russia-invasion,3764,"<ul><li><a href=""https://www.theguardian.com/world/2022/mar/14/us-will-try-to-convince-china-not-to-supply-arms-to-russia-at-key-rome-meeting"">US urged China not to supply arms to Russia at ‘intense’ Rome meeting</a></li><li><a href=""https://www.theguardian.com/us-news/live/2022/mar/14/biden-us-ukraine-latest-updates-zelensky-congress-putin-russia-invasion?page=with:block-622f93a28f080ca367918f9f#block-622f93a28f080ca367918f9f"">Fox News correspondent injured in Ukraine</a></li><li><a href=""https://www.theguardian.com/us-news/live/2022/mar/14/biden-us-ukraine-latest-updates-zelensky-congress-putin-russia-invasion?page=with:block-622f60218f08963051184971#block-622f60218f08963051184971"">Biden may travel to Europe for a Ukraine-focused trip – report</a></li><li><a href=""https://www.theguardian.com/world/2022/mar/14/volodymyr-zelenskiy-us-congress-address-mig-jets"">Zelenskiy expected to urge jet transfer in address to US Congress</a></li><li><a href=""https://www.theguardian.com/us-news/2022/mar/13/jake-sullivan-biden-national-security-adviser-china-russia"">Ukraine crisis – live updates</a></li><li><strong><a href=""https://www.theguardian.com/info/2018/sep/17/guardian-us-morning-briefing-sign-up-to-stay-informed"">Sign up to receive First Thing – our daily briefing by email</a></strong></li></ul>",US news,News,liveblog,Vivian Ho,"US Congress, US news, Ukraine, Joe Biden, Volodymyr Zelenskyy, Vladimir Putin, US politics, World news",us-news/live/2022/mar/14/biden-us-ukraine-latest-updates-zelensky-congress-putin-russia-invasion
‘It’s not 2018’: Matthew Guy learns to open up and unite his party,2022-03-14T16:30:28Z,"<p>Exclusive: War in Ukraine prompted Victoria’s opposition leader to speak from the heart. His colleagues are hoping to see more of it</p><ul><li><a href=""https://www.theguardian.com/australia-news/2022/mar/14/everything-you-need-to-know-about-guardian-australias-state-news-coverage"">Everything you need to know about Guardian Australia’s state news coverage</a></li><li><a href=""https://www.theguardian.com/technology/ng-interactive/2018/may/15/the-guardian-app?CMP=cvau_sfl"">Get our free news app</a>; <a href=""https://www.theguardian.com/world/guardian-australia-morning-mail/2014/jun/24/-sp-guardian-australias-morning-mail-subscribe-by-email?CMP=cvau_sfl"">get our morning email briefing</a></li></ul>",https://www.theguardian.com/australia-news/2022/mar/15/its-not-2018-matthew-guy-learns-to-open-up-and-unite-his-party,1320,"<p>Exclusive: War in Ukraine prompted Victoria’s opposition leader to speak from the heart. His colleagues are hoping to see more of it</p><ul><li><a href=""https://www.theguardian.com/australia-news/2022/mar/14/everything-you-need-to-know-about-guardian-australias-state-news-coverage"">Everything you need to know about Guardian Australia’s state news coverage</a></li><li><a href=""https://www.theguardian.com/technology/ng-interactive/2018/may/15/the-guardian-app?CMP=cvau_sfl"">Get our free news app</a>; <a href=""https://www.theguardian.com/world/guardian-australia-morning-mail/2014/jun/24/-sp-guardian-australias-morning-mail-subscribe-by-email?CMP=cvau_sfl"">get our morning email briefing</a></li></ul>",Australia news,News,article,Benita Kolovos,"Victorian politics, Victoria, Australia news, Daniel Andrews",australia-news/2022/mar/15/its-not-2018-matthew-guy-learns-to-open-up-and-unite-his-party
Andrew Cuomo resigned amid a wave of scandals. But don’t count him out,2022-03-13T09:00:25Z,<p>Can the New York governor accused of sexual harassment as well as a Covid cover-up succeed in his comeback campaign?</p><p></p>,https://www.theguardian.com/us-news/2022/mar/13/andrew-cuomo-resigned-amid-a-wave-of-scandals-but-dont-count-him-out,1194,<p>Can the New York governor accused of sexual harassment as well as a Covid cover-up succeed in his comeback campaign?</p><p></p>,US news,News,article,Edward Helmore in New York,"Andrew Cuomo, New York, US politics, US news",us-news/2022/mar/13/andrew-cuomo-resigned-amid-a-wave-of-scandals-but-dont-count-him-out
Clarence Thomas: supreme court could be ‘compromised’ by politics,2022-03-12T17:21:01Z,"<p>The court is set to rule this year on divisive issues including abortion, gun control, the climate crisis and voting rights</p><ul><li><a href=""https://www.theguardian.com/books/2021/apr/10/the-agenda-review-biden-expand-supreme-court-trump-republicans"">The Agenda: how the supreme court threatens US democracy</a></li></ul>",https://www.theguardian.com/us-news/2022/mar/12/clarence-thomas-supreme-court-conservative-politics,747,"<p>The court is set to rule this year on divisive issues including abortion, gun control, the climate crisis and voting rights</p><ul><li><a href=""https://www.theguardian.com/books/2021/apr/10/the-agenda-review-biden-expand-supreme-court-trump-republicans"">The Agenda: how the supreme court threatens US democracy</a></li></ul>",US news,News,article,Martin Pengelly and agencies,"Clarence Thomas, US supreme court, US constitution and civil liberties, Law (US), US news, US politics, Republicans, World news, US Congress, US Senate, Biden administration",us-news/2022/mar/12/clarence-thomas-supreme-court-conservative-politics
Lincoln and the fight for peace: John Avlon on a president in the shadow of new war,2022-03-12T11:00:04Z,<p>The CNN analyst says the 16th president’s example can guide America through dark times – at home as well as abroad</p>,https://www.theguardian.com/books/2022/mar/12/lincoln-and-the-fight-for-peace-john-avlon-interview,1119,<p>The CNN analyst says the 16th president’s example can guide America through dark times – at home as well as abroad</p>,Books,Arts,article,Martin Pengelly,"Books, History books, Abraham Lincoln, American civil war, Culture, US news, US politics, World news",books/2022/mar/12/lincoln-and-the-fight-for-peace-john-avlon-interview
"‘Cynical, craven’ Republicans out to bash Biden, not Putin, over gas prices",2022-03-12T10:00:03Z,<p>Critics say party has seized on price hikes to exploit war in Ukraine for its own benefit – ‘an unconscionable act of political cowardice’</p>,https://www.theguardian.com/us-news/2022/mar/12/republicans-joe-biden-russia-gas-prices,1272,<p>Critics say party has seized on price hikes to exploit war in Ukraine for its own benefit – ‘an unconscionable act of political cowardice’</p>,US news,News,article,David Smith in Washington,"Joe Biden, Republicans, Democrats, US news, World news, Russia, Europe, Ukraine, Vladimir Putin",us-news/2022/mar/12/republicans-joe-biden-russia-gas-prices
"US and allies set to revoke normal trade relations with Russia over Ukraine war, says Biden – as it happened",2022-03-11T22:13:52Z,"<ul><li>US ‘taking first steps’ to ban imports of Russian vodka and diamonds</li><li><a href=""https://www.theguardian.com/technology/2022/mar/10/us-russia-cyber-attack-prepared"">‘We are not ready’: a cyber expert on US vulnerability to a Russian attack</a></li><li><a href=""https://www.theguardian.com/world/live/2022/mar/11/russia-ukraine-war-latest-news-we-are-dealing-with-a-terrorist-state-says-zelenskiy-biden-plans-fresh-russian-trade-crackdown-live"">Live updates: Russia-Ukraine war</a></li><li><a href=""https://www.theguardian.com/world/2022/mar/11/russia-widens-attack-with-airstrikes-on-western-ukraine-cities"">Full report: Russia widens attack to more cities</a></li><li><a href=""https://www.theguardian.com/info/2018/sep/17/guardian-us-morning-briefing-sign-up-to-stay-informed"">Sign up to receive First Thing – our daily briefing by email</a></li></ul>",https://www.theguardian.com/us-news/live/2022/mar/11/joe-biden-suspension-normal-trade-russia-ukraine-us-politics-latest,5804,"<ul><li>US ‘taking first steps’ to ban imports of Russian vodka and diamonds</li><li><a href=""https://www.theguardian.com/technology/2022/mar/10/us-russia-cyber-attack-prepared"">‘We are not ready’: a cyber expert on US vulnerability to a Russian attack</a></li><li><a href=""https://www.theguardian.com/world/live/2022/mar/11/russia-ukraine-war-latest-news-we-are-dealing-with-a-terrorist-state-says-zelenskiy-biden-plans-fresh-russian-trade-crackdown-live"">Live updates: Russia-Ukraine war</a></li><li><a href=""https://www.theguardian.com/world/2022/mar/11/russia-widens-attack-with-airstrikes-on-western-ukraine-cities"">Full report: Russia widens attack to more cities</a></li><li><a href=""https://www.theguardian.com/info/2018/sep/17/guardian-us-morning-briefing-sign-up-to-stay-informed"">Sign up to receive First Thing – our daily briefing by email</a></li></ul>",US news,News,liveblog,Lauren Gambino,"US news, US politics, Joe Biden, Russia, Ukraine, Kamala Harris, Europe, World news, US foreign policy",us-news/live/2022/mar/11/joe-biden-suspension-normal-trade-russia-ukraine-us-politics-latest
US workers in new push for level playing field in unionization efforts,2022-03-11T11:00:29Z,<p>Workers are calling for the National Labor Relations Board to ban captive audience meetings and make organizing easier</p>,https://www.theguardian.com/us-news/2022/mar/11/us-workers-unionization-nlrb-level-playing-field,965,<p>Workers are calling for the National Labor Relations Board to ban captive audience meetings and make organizing easier</p>,US news,News,article,Michael Sainato,"US unions, US news, Amazon",us-news/2022/mar/11/us-workers-unionization-nlrb-level-playing-field
First Thing: Russian forces ‘have killed more civilians than soldiers’,2022-03-11T10:48:24Z,"<p>Zelenskiy calls Russia a ‘terrorist state’<strong> </strong>as bombs hit cities further west. Plus, the chefs cooking in solidarity with Ukraine</p>",https://www.theguardian.com/us-news/2022/mar/11/first-thing-russian-forces-have-killed-more-civilians-than-soldiers,1250,"<p>Zelenskiy calls Russia a ‘terrorist state’<strong> </strong>as bombs hit cities further west. Plus, the chefs cooking in solidarity with Ukraine</p>",US news,News,article,Nicola Slawson,US news,us-news/2022/mar/11/first-thing-russian-forces-have-killed-more-civilians-than-soldiers
US conducting ‘legal review’ of possible Russian war crimes in Ukraine – as it happened,2022-03-10T22:00:13Z,"<ul><li><a href=""https://www.theguardian.com/us-news/live/2022/mar/10/biden-ukraine-russia-war-latest-kamala-harris-war-crimes-investigation-news-updates?filterKeyEvents=false&amp;page=with:block-622a002d8f0806dde1f8bb5f#block-622a002d8f0806dde1f8bb5f"">‘Absolutely there should be an investigation’, Harris says in Warsaw</a></li><li><a href=""https://www.theguardian.com/world/2022/mar/10/ukraine-president-zelenskiy-decries-mariupol-childrens-maternity-hospital-bombing-genocide-as-us-13bn-aid-bill-passes-first-hurdle"">Zelenskiy describes Ukraine hospital bombing as ‘genocide’</a></li><li><a href=""https://www.theguardian.com/technology/2022/mar/09/twitter-tor-version-russia-block"">Twitter launches site on dark web to bypass Russia’s block</a></li><li><a href=""https://www.theguardian.com/info/2018/sep/17/guardian-us-morning-briefing-sign-up-to-stay-informed"">Sign up to receive First Thing – our daily briefing by email</a></li></ul>",https://www.theguardian.com/us-news/live/2022/mar/10/biden-ukraine-russia-war-latest-kamala-harris-war-crimes-investigation-news-updates,4154,"<ul><li><a href=""https://www.theguardian.com/us-news/live/2022/mar/10/biden-ukraine-russia-war-latest-kamala-harris-war-crimes-investigation-news-updates?filterKeyEvents=false&amp;page=with:block-622a002d8f0806dde1f8bb5f#block-622a002d8f0806dde1f8bb5f"">‘Absolutely there should be an investigation’, Harris says in Warsaw</a></li><li><a href=""https://www.theguardian.com/world/2022/mar/10/ukraine-president-zelenskiy-decries-mariupol-childrens-maternity-hospital-bombing-genocide-as-us-13bn-aid-bill-passes-first-hurdle"">Zelenskiy describes Ukraine hospital bombing as ‘genocide’</a></li><li><a href=""https://www.theguardian.com/technology/2022/mar/09/twitter-tor-version-russia-block"">Twitter launches site on dark web to bypass Russia’s block</a></li><li><a href=""https://www.theguardian.com/info/2018/sep/17/guardian-us-morning-briefing-sign-up-to-stay-informed"">Sign up to receive First Thing – our daily briefing by email</a></li></ul>",US news,News,liveblog,Lauren Aratani,"US news, Kamala Harris, Poland, Ukraine, Joe Biden, Coronavirus, Europe, World news, Russia, Vladimir Putin, Democrats, Republicans",us-news/live/2022/mar/10/biden-ukraine-russia-war-latest-kamala-harris-war-crimes-investigation-news-updates
First Thing: US’s $13bn Ukraine aid bill passes first hurdle ,2022-03-10T11:22:23Z,"<p>House passes huge aid package as Volodymyr Zelenskiy accuses Russia of carrying out ‘genocide’ against Ukrainians. Plus, how pipeline groups are posing as Indigenous champions</p><p>• <a href=""https://www.theguardian.com/info/2018/sep/17/guardian-us-morning-briefing-sign-up-to-stay-informed"">Don’t already get First Thing in your inbox? Sign up here</a></p>",https://www.theguardian.com/us-news/2022/mar/10/first-thing-us-13bn-ukraine-aid-bill-passes-first-hurdle,958,"<p>House passes huge aid package as Volodymyr Zelenskiy accuses Russia of carrying out ‘genocide’ against Ukrainians. Plus, how pipeline groups are posing as Indigenous champions</p><p>• <a href=""https://www.theguardian.com/info/2018/sep/17/guardian-us-morning-briefing-sign-up-to-stay-informed"">Don’t already get First Thing in your inbox? Sign up here</a></p>",US news,News,article,Clea Skopeliti,US news,us-news/2022/mar/10/first-thing-us-13bn-ukraine-aid-bill-passes-first-hurdle
"‘Putin will fail and Russia will suffer strategic defeat’ in Ukraine, says Blinken – as it happened",2022-03-09T22:20:59Z,"<ul><li><a href=""https://www.theguardian.com/us-news/live/2022/mar/09/kamala-harris-poland-jets-joe-biden-us-politics-latest-updates-russia-ukraine?page=with:block-6228dbaf8f087f6d099f4461#block-6228dbaf8f087f6d099f4461"">US secretary of state makes remark in press conference with Liz Truss</a></li><li><a href=""https://www.theguardian.com/us-news/live/2022/mar/09/kamala-harris-poland-jets-joe-biden-us-politics-latest-updates-russia-ukraine?page=with:block-6228b4bf8f08d38fbc42ad3d-pinned#block-6228b4bf8f08d38fbc42ad3d-pinned"">Kamala Harris heads to Poland amid clash over fighter jets</a></li><li><a href=""https://www.theguardian.com/world/2022/mar/09/clash-over-poland-and-us-missile-plans-reveals-tensions-in-escalating-war"">Clash between Poland and US over MiG-29s reveals tensions in war</a></li><li><a href=""https://www.theguardian.com/us-news/2022/mar/08/joe-biden-ukraine-russia"">Biden’s impossible bind: how should the US tackle Russia’s invasion?</a></li><li><a href=""https://www.theguardian.com/world/live/2022/mar/09/ukraine-news-russia-war-ceasefire-broken-humanitarian-corridors-kyiv-russian-invasion-live-vladimir-putin-volodymyr-zelenskiy-latest-updates"">Russia-Ukraine war – latest updates</a></li><li><a href=""https://www.theguardian.com/info/2018/sep/17/guardian-us-morning-briefing-sign-up-to-stay-informed"">Sign up to receive First Thing – our daily briefing by email</a></li></ul>",https://www.theguardian.com/us-news/live/2022/mar/09/kamala-harris-poland-jets-joe-biden-us-politics-latest-updates-russia-ukraine,6456,"<ul><li><a href=""https://www.theguardian.com/us-news/live/2022/mar/09/kamala-harris-poland-jets-joe-biden-us-politics-latest-updates-russia-ukraine?page=with:block-6228dbaf8f087f6d099f4461#block-6228dbaf8f087f6d099f4461"">US secretary of state makes remark in press conference with Liz Truss</a></li><li><a href=""https://www.theguardian.com/us-news/live/2022/mar/09/kamala-harris-poland-jets-joe-biden-us-politics-latest-updates-russia-ukraine?page=with:block-6228b4bf8f08d38fbc42ad3d-pinned#block-6228b4bf8f08d38fbc42ad3d-pinned"">Kamala Harris heads to Poland amid clash over fighter jets</a></li><li><a href=""https://www.theguardian.com/world/2022/mar/09/clash-over-poland-and-us-missile-plans-reveals-tensions-in-escalating-war"">Clash between Poland and US over MiG-29s reveals tensions in war</a></li><li><a href=""https://www.theguardian.com/us-news/2022/mar/08/joe-biden-ukraine-russia"">Biden’s impossible bind: how should the US tackle Russia’s invasion?</a></li><li><a href=""https://www.theguardian.com/world/live/2022/mar/09/ukraine-news-russia-war-ceasefire-broken-humanitarian-corridors-kyiv-russian-invasion-live-vladimir-putin-volodymyr-zelenskiy-latest-updates"">Russia-Ukraine war – latest updates</a></li><li><a href=""https://www.theguardian.com/info/2018/sep/17/guardian-us-morning-briefing-sign-up-to-stay-informed"">Sign up to receive First Thing – our daily briefing by email</a></li></ul>",US news,News,liveblog,Joanna Walters,"US politics, Kamala Harris, Joe Biden, Republicans, Democrats, Biden administration, House of Representatives, US Senate, US news, Poland, Russia, Ukraine, World news, Europe",us-news/live/2022/mar/09/kamala-harris-poland-jets-joe-biden-us-politics-latest-updates-russia-ukraine
Biden bans Russian oil imports in response to Ukraine invasion – as it happened,2022-03-08T22:01:56Z,"<ul><li><a href=""https://www.theguardian.com/us-news/live/2022/mar/08/biden-ukraine-russia-oil-ban-invasion-war-latest-us-news-updates?page=with:block-622783c98f087f6d099f3a8f#block-622783c98f087f6d099f3a8f"">President: ban deals ‘another powerful blow to Putin’s war machine’</a></li><li><a href=""https://www.theguardian.com/us-news/2022/mar/08/russian-oil-imports-ban-us-joe-biden"">Full story: Biden bans Russian oil imports over Ukraine invasion</a></li><li><a href=""https://www.theguardian.com/world/2022/mar/08/poland-mig-29-jets-us-ukraine"">Poland to give MiG-29 jets to US for expected donation to Ukraine</a></li><li><strong><a href=""https://www.theguardian.com/info/2018/sep/17/guardian-us-morning-briefing-sign-up-to-stay-informed"">Sign up to receive First Thing – our daily briefing by email</a></strong></li></ul>",https://www.theguardian.com/us-news/live/2022/mar/08/biden-ukraine-russia-oil-ban-invasion-war-latest-us-news-updates,3548,"<ul><li><a href=""https://www.theguardian.com/us-news/live/2022/mar/08/biden-ukraine-russia-oil-ban-invasion-war-latest-us-news-updates?page=with:block-622783c98f087f6d099f3a8f#block-622783c98f087f6d099f3a8f"">President: ban deals ‘another powerful blow to Putin’s war machine’</a></li><li><a href=""https://www.theguardian.com/us-news/2022/mar/08/russian-oil-imports-ban-us-joe-biden"">Full story: Biden bans Russian oil imports over Ukraine invasion</a></li><li><a href=""https://www.theguardian.com/world/2022/mar/08/poland-mig-29-jets-us-ukraine"">Poland to give MiG-29 jets to US for expected donation to Ukraine</a></li><li><strong><a href=""https://www.theguardian.com/info/2018/sep/17/guardian-us-morning-briefing-sign-up-to-stay-informed"">Sign up to receive First Thing – our daily briefing by email</a></strong></li></ul>",US news,News,liveblog,Vivian Ho,"US politics, US news, Joe Biden, Biden administration, Russia, Ukraine, Europe, World news, Oil",us-news/live/2022/mar/08/biden-ukraine-russia-oil-ban-invasion-war-latest-us-news-updates
"Once again, America is in denial about signs of a fresh Covid wave",2022-03-16T10:25:28Z,"<p>In the past couple of weeks, UK, Germany, France and others are experiencing a new wave. The US should get ready</p>",https://www.theguardian.com/commentisfree/2022/mar/16/once-again-america-is-in-denial-about-signs-of-a-fresh-covid-wave,919,"<p>In the past couple of weeks, UK, Germany, France and others are experiencing a new wave. The US should get ready</p>",Opinion,Opinion,article,Eric Topol,"Coronavirus, Infectious diseases, Science, US news, US politics, Vaccines and immunisation",commentisfree/2022/mar/16/once-again-america-is-in-denial-about-signs-of-a-fresh-covid-wave
