headline,pub_date,snippet,web_url,word_count,abstract,section_name,pillar_name,type,byline,keywords,article_id
Biden considers travel to Europe – as it happened,2022-03-15T04:16:47Z,"<p>This blog is now closed – for the latest updates, <a href=""https://www.theguardian.com/world/series/ukraine-live/latest"">please follow the latest live blog</a></p><ul><li><a href=""https://www.theguardian.com/world/2022/mar/15/china-has-already-decided-to-send-economic-aid-to-russia-in-ukraine-conflict-us-officials-fear"">US fears China has already agreed to send economic aid to Russia</a></li><li><a href=""https://www.theguardian.com/world/2022/mar/14/russia-ukraine-kyiv-air-strike-hostomel"">Residential building in Kyiv hit by airstrike as peace talks resume</a></li><li><a href=""https://www.theguardian.com/world/2022/mar/14/mariupol-ukraine-hospital-bombed-woman-baby-die"">Pregnant woman and baby die after attack on Mariupol hospital</a></li><li><a href=""https://www.theguardian.com/world/2022/jan/26/living-in-ukraine-how-have-you-been-affected-by-the-current-situation"">Tell us: how have you been affected?</a></li></ul>",https://www.theguardian.com/world/live/2022/mar/14/russia-ukraine-war-latest-news-talks-resume-blockade-black-sea-coast-zelenskiy-putin-live,19283,"<p>This blog is now closed – for the latest updates, <a href=""https://www.theguardian.com/world/series/ukraine-live/latest"">please follow the latest live blog</a></p><ul><li><a href=""https://www.theguardian.com/world/2022/mar/15/china-has-already-decided-to-send-economic-aid-to-russia-in-ukraine-conflict-us-officials-fear"">US fears China has already agreed to send economic aid to Russia</a></li><li><a href=""https://www.theguardian.com/world/2022/mar/14/russia-ukraine-kyiv-air-strike-hostomel"">Residential building in Kyiv hit by airstrike as peace talks resume</a></li><li><a href=""https://www.theguardian.com/world/2022/mar/14/mariupol-ukraine-hospital-bombed-woman-baby-die"">Pregnant woman and baby die after attack on Mariupol hospital</a></li><li><a href=""https://www.theguardian.com/world/2022/jan/26/living-in-ukraine-how-have-you-been-affected-by-the-current-situation"">Tell us: how have you been affected?</a></li></ul>",World news,News,liveblog,"Martin Farrer (now) Lois Beckett, Joanna Walters , Léonie Chao-Fong,  Tom Ambrose , and Samantha Lock (before)","World news, Ukraine, Russia, Vladimir Putin, Volodymyr Zelenskyy, China",world/live/2022/mar/14/russia-ukraine-war-latest-news-talks-resume-blockade-black-sea-coast-zelenskiy-putin-live
UK politics: Gove makes statement on homes for Ukrainian refugees as website for scheme opens – as it happened,2022-03-14T18:19:52Z,"<p>Latest updates: minister announces details of scheme to MPs as website for people interested to house refugees goes live</p><ul><li><a href=""https://www.theguardian.com/politics/live/2022/mar/14/uk-politics-live-boris-johnson-russia-ukraine-nato-sajid-javid-michael-gove#block-622f68658f08963051184a11"">Website opens for people interesting in hosting Ukrainian refugees</a></li><li><a href=""https://www.theguardian.com/politics/2022/mar/14/boris-johnson-saudi-arabia-visit-oil-supply-output"">Johnson plans Saudi Arabia visit to seek oil supply increase</a></li><li><a href=""https://www.theguardian.com/politics/live/2022/mar/14/uk-politics-live-boris-johnson-russia-ukraine-nato-sajid-javid-michael-gove#block-622f5b9b8f080ca367918c00"">PM and energy firms agree need to increase gas supply from North Sea</a></li><li><a href=""https://www.theguardian.com/politics/live/2022/mar/14/uk-politics-live-boris-johnson-russia-ukraine-nato-sajid-javid-michael-gove#block-622f410d8f08744dd43a40b5"">Summary of Downing Street lobby briefing</a></li><li><a href=""https://www.theguardian.com/politics/live/2022/mar/14/uk-politics-live-boris-johnson-russia-ukraine-nato-sajid-javid-michael-gove#block-622efd118f087f6d099f6a0c"">Javid warns ‘single Russian toecap’ on Nato territory would be act of war</a></li><li><a href=""https://www.theguardian.com/politics/live/2022/mar/14/uk-politics-live-boris-johnson-russia-ukraine-nato-sajid-javid-michael-gove#block-622f15138f0806dde1f8da7c"">Recent rise in Covid cases was expected, says Javid</a></li></ul>",https://www.theguardian.com/politics/live/2022/mar/14/uk-politics-live-boris-johnson-russia-ukraine-nato-sajid-javid-michael-gove,6276,"<p>Latest updates: minister announces details of scheme to MPs as website for people interested to house refugees goes live</p><ul><li><a href=""https://www.theguardian.com/politics/live/2022/mar/14/uk-politics-live-boris-johnson-russia-ukraine-nato-sajid-javid-michael-gove#block-622f68658f08963051184a11"">Website opens for people interesting in hosting Ukrainian refugees</a></li><li><a href=""https://www.theguardian.com/politics/2022/mar/14/boris-johnson-saudi-arabia-visit-oil-supply-output"">Johnson plans Saudi Arabia visit to seek oil supply increase</a></li><li><a href=""https://www.theguardian.com/politics/live/2022/mar/14/uk-politics-live-boris-johnson-russia-ukraine-nato-sajid-javid-michael-gove#block-622f5b9b8f080ca367918c00"">PM and energy firms agree need to increase gas supply from North Sea</a></li><li><a href=""https://www.theguardian.com/politics/live/2022/mar/14/uk-politics-live-boris-johnson-russia-ukraine-nato-sajid-javid-michael-gove#block-622f410d8f08744dd43a40b5"">Summary of Downing Street lobby briefing</a></li><li><a href=""https://www.theguardian.com/politics/live/2022/mar/14/uk-politics-live-boris-johnson-russia-ukraine-nato-sajid-javid-michael-gove#block-622efd118f087f6d099f6a0c"">Javid warns ‘single Russian toecap’ on Nato territory would be act of war</a></li><li><a href=""https://www.theguardian.com/politics/live/2022/mar/14/uk-politics-live-boris-johnson-russia-ukraine-nato-sajid-javid-michael-gove#block-622f15138f0806dde1f8da7c"">Recent rise in Covid cases was expected, says Javid</a></li></ul>",Politics,News,liveblog,Andrew Sparrow,"Politics, Ukraine, UK news, Boris Johnson, Michael Gove, Refugees, Immigration and asylum, Sajid Javid, Sadiq Khan, Coronavirus, Energy, Dominic Raab",politics/live/2022/mar/14/uk-politics-live-boris-johnson-russia-ukraine-nato-sajid-javid-michael-gove
"Ginni Thomas, wife of Clarence Thomas, attended rally preceding Capitol attack",2022-03-14T17:48:12Z,"<p>Conservative activist who runs a political lobbying firm, says she briefly attended rally but left before Trump addressed crowd</p>",https://www.theguardian.com/us-news/2022/mar/14/ginni-thomas-wife-justice-clarence-thomas-attended-january-6-rally,509,"<p>Conservative activist who runs a political lobbying firm, says she briefly attended rally but left before Trump addressed crowd</p>",US news,News,article,Joan E Greve in Washington,"Clarence Thomas, US news, US supreme court, Law (US), US politics, US Capitol attack",us-news/2022/mar/14/ginni-thomas-wife-justice-clarence-thomas-attended-january-6-rally
Can the west slaughter Putin’s sacred cash cow?,2022-03-14T09:28:50Z,"<p>Ukraine believes the only way the Russian president will back down is if his economic power base in fossil fuels is seriously threatened. Putin thinks Europe and the US are too weak to do it – but some believe there is a way</p><ul><li><strong><a href=""https://www.theguardian.com/world/live/2022/mar/14/russia-ukraine-war-latest-news-talks-resume-blockade-black-sea-coast-zelenskiy-putin-live"">Russia-Ukraine war: latest updates</a></strong></li></ul>",https://www.theguardian.com/world/2022/mar/14/west-putin-sacred-cash-cow-russia-ukraine-gas,2551,"<p>Ukraine believes the only way the Russian president will back down is if his economic power base in fossil fuels is seriously threatened. Putin thinks Europe and the US are too weak to do it – but some believe there is a way</p><ul><li><strong><a href=""https://www.theguardian.com/world/live/2022/mar/14/russia-ukraine-war-latest-news-talks-resume-blockade-black-sea-coast-zelenskiy-putin-live"">Russia-Ukraine war: latest updates</a></strong></li></ul>",World news,News,article,Patrick Wintour Diplomatic editor,"Russia, Ukraine, Vladimir Putin, Gas, Europe, Business, Commodities, Global economy, Germany, US news, Economics, World news",world/2022/mar/14/west-putin-sacred-cash-cow-russia-ukraine-gas
Barr: Trump should not be president but ‘lesser of two evils’ compared to US left,2022-03-13T18:10:27Z,"<p>Ex-attorney general excoriates old boss in book but refuses to budge from vow to vote for him if he is Republican nominee again</p><ul><li><a href=""https://www.theguardian.com/us-news/2022/mar/13/trump-tyrant-south-carolina-rally-tom-rice-nancy-mace-capitol-attack"">‘Would-be tyrant’: Republican hits back at Trump</a></li></ul>",https://www.theguardian.com/us-news/2022/mar/13/barr-trump-should-not-be-president-but-lesser-of-two-evils-compared-to-us-left,519,"<p>Ex-attorney general excoriates old boss in book but refuses to budge from vow to vote for him if he is Republican nominee again</p><ul><li><a href=""https://www.theguardian.com/us-news/2022/mar/13/trump-tyrant-south-carolina-rally-tom-rice-nancy-mace-capitol-attack"">‘Would-be tyrant’: Republican hits back at Trump</a></li></ul>",US news,News,article,Edward Helmore,"William Barr, US news, US politics, Donald Trump, US elections 2024, Republicans, World news",us-news/2022/mar/13/barr-trump-should-not-be-president-but-lesser-of-two-evils-compared-to-us-left
Saturday Night Live: Zoë Kravitz plays it straight in another uneven episode,2022-03-13T13:17:24Z,<p>The Batman star is forced into the straight role alongside her SNL co-stars in an episode that mostly proves how the show cannot handle social media satire</p>,https://www.theguardian.com/tv-and-radio/2022/mar/13/saturday-night-live-zoe-kravitz,1398,<p>The Batman star is forced into the straight role alongside her SNL co-stars in an episode that mostly proves how the show cannot handle social media satire</p>,Television & radio,Arts,article,Zach Vasquez,"Saturday Night Live, Television & radio, Zoe Kravitz, Culture, TV comedy, Comedy, Television, US television",tv-and-radio/2022/mar/13/saturday-night-live-zoe-kravitz
‘Would-be tyrant’: Republican targeted by Trump at rally hits back,2022-03-13T11:25:15Z,<p>Tom Rice faces Trumpist challenger because of vote to impeach over the deadly Capitol attack</p>,https://www.theguardian.com/us-news/2022/mar/13/trump-tyrant-south-carolina-rally-tom-rice-nancy-mace-capitol-attack,479,<p>Tom Rice faces Trumpist challenger because of vote to impeach over the deadly Capitol attack</p>,US news,News,article,Martin Pengelly in New York,"Donald Trump, Republicans, US midterm elections 2022, US news, US politics, US Congress, House of Representatives, South Carolina, World news",us-news/2022/mar/13/trump-tyrant-south-carolina-rally-tom-rice-nancy-mace-capitol-attack
Putin tied Boris Johnson up in his own trousers,2022-03-13T10:00:27Z,"<p>When it comes to allowing Russian oligarchs to pay their way into the upper echelons of society, Britain really does ‘lead the world’</p>",https://www.theguardian.com/commentisfree/2022/mar/13/putin-tied-boris-johnson-up-in-his-own-trousers,1012,"<p>When it comes to allowing Russian oligarchs to pay their way into the upper echelons of society, Britain really does ‘lead the world’</p>",Opinion,Opinion,article,Stewart Lee,"Boris Johnson, Russia, Ukraine, Vladimir Putin, Roman Abramovich, Politics",commentisfree/2022/mar/13/putin-tied-boris-johnson-up-in-his-own-trousers
"Invaders ‘cannot conquer us’, Zelenskiy says, as 13,000 flee besieged cities – as it happened",2022-03-13T04:59:07Z,"<p>Ukraine’s president says the capital <a href=""https://www.theguardian.com/world/live/2022/mar/12/ukraine-news-russia-war-ceasefire-broken-humanitarian-corridors-kyiv-russian-invasion-live-vladimir-putin-volodymyr-zelenskiy-latest-updates-live?page=with:block-622cbbd18f08d38fbc42c800#block-622cbbd18f08d38fbc42c800"">will only fall to Russian troops if it is completely destroyed</a>, while Moscow warns western <a href=""https://www.theguardian.com/world/live/2022/mar/12/ukraine-news-russia-war-ceasefire-broken-humanitarian-corridors-kyiv-russian-invasion-live-vladimir-putin-volodymyr-zelenskiy-latest-updates-live?page=with:block-622c9b2d8f0806dde1f8cc9d#block-622c9b2d8f0806dde1f8cc9d"">shipments of arms to Ukraine could be attacked</a></p><ul><li><a href=""https://www.theguardian.com/world/2022/mar/13/russia-ukraine-war-update-what-we-know-on-day-18-of-the-russian-invasion"">Russia-Ukraine war update: what we know on day 18  </a></li><li><a href=""https://www.theguardian.com/world/2022/mar/12/kyiv-ready-to-fight-as-russian-forces-close-in-ukraine-capital"">Full report: Kyiv ‘ready to fight’ as Russian forces close</a></li><li><a href=""https://www.theguardian.com/world/2022/mar/12/ukraine-lviv-residents-prepare-for-russian-advance"">Lviv residents prepare for Russian advance</a></li><li><a href=""https://www.theguardian.com/world/2022/mar/12/italian-authorities-seize-one-of-worlds-largest-superyachts-from-oligarch"">Italian authorities seize one of world’s largest superyachts</a></li><li><a href=""https://www.theguardian.com/world/2022/mar/12/ukraine-reveals-russian-warship-go-fuck-yourself-postage-stamp"">Ukraine reveals ‘Russian warship’ postage stamp</a></li><li><a href=""https://www.theguardian.com/world/2022/jan/26/living-in-ukraine-how-have-you-been-affected-by-the-current-situation"">Tell us: how have you been affected?</a></li></ul>",https://www.theguardian.com/world/live/2022/mar/12/ukraine-news-russia-war-ceasefire-broken-humanitarian-corridors-kyiv-russian-invasion-live-vladimir-putin-volodymyr-zelenskiy-latest-updates-live,11644,"<p>Ukraine’s president says the capital <a href=""https://www.theguardian.com/world/live/2022/mar/12/ukraine-news-russia-war-ceasefire-broken-humanitarian-corridors-kyiv-russian-invasion-live-vladimir-putin-volodymyr-zelenskiy-latest-updates-live?page=with:block-622cbbd18f08d38fbc42c800#block-622cbbd18f08d38fbc42c800"">will only fall to Russian troops if it is completely destroyed</a>, while Moscow warns western <a href=""https://www.theguardian.com/world/live/2022/mar/12/ukraine-news-russia-war-ceasefire-broken-humanitarian-corridors-kyiv-russian-invasion-live-vladimir-putin-volodymyr-zelenskiy-latest-updates-live?page=with:block-622c9b2d8f0806dde1f8cc9d#block-622c9b2d8f0806dde1f8cc9d"">shipments of arms to Ukraine could be attacked</a></p><ul><li><a href=""https://www.theguardian.com/world/2022/mar/13/russia-ukraine-war-update-what-we-know-on-day-18-of-the-russian-invasion"">Russia-Ukraine war update: what we know on day 18  </a></li><li><a href=""https://www.theguardian.com/world/2022/mar/12/kyiv-ready-to-fight-as-russian-forces-close-in-ukraine-capital"">Full report: Kyiv ‘ready to fight’ as Russian forces close</a></li><li><a href=""https://www.theguardian.com/world/2022/mar/12/ukraine-lviv-residents-prepare-for-russian-advance"">Lviv residents prepare for Russian advance</a></li><li><a href=""https://www.theguardian.com/world/2022/mar/12/italian-authorities-seize-one-of-worlds-largest-superyachts-from-oligarch"">Italian authorities seize one of world’s largest superyachts</a></li><li><a href=""https://www.theguardian.com/world/2022/mar/12/ukraine-reveals-russian-warship-go-fuck-yourself-postage-stamp"">Ukraine reveals ‘Russian warship’ postage stamp</a></li><li><a href=""https://www.theguardian.com/world/2022/jan/26/living-in-ukraine-how-have-you-been-affected-by-the-current-situation"">Tell us: how have you been affected?</a></li></ul>",World news,News,liveblog,"Samantha Lock (now); Vivian Ho, Miranda Bryant, Léonie Chao-Fong and Helen Livingstone (earlier)","Ukraine, Russia, US news, Europe, UK news",world/live/2022/mar/12/ukraine-news-russia-war-ceasefire-broken-humanitarian-corridors-kyiv-russian-invasion-live-vladimir-putin-volodymyr-zelenskiy-latest-updates-live
From a Thatcher nutcracker to a Trump toilet brush: my curious collection of political memorabilia ,2022-03-12T11:00:04Z,<p>As a foreign correspondent I used to report on dictators and democrats. Now I collect them</p>,https://www.theguardian.com/world/2022/mar/12/thatcher-nutcracker-trump-toilet-brush-political-memorabilia,2681,<p>As a foreign correspondent I used to report on dictators and democrats. Now I collect them</p>,World news,News,article,Ian Black,"World news, Collecting, Life and style, Hobbies, Media, Travel, Politics, UK news, Donald Trump, Mahatma Gandhi, Muammar Gaddafi, Osama bin Laden, Desmond Tutu, Sculpture, Art and design, Culture, US news, Art",world/2022/mar/12/thatcher-nutcracker-trump-toilet-brush-political-memorabilia
McDonald’s in Russia: departure is about a lot more than burgers,2022-03-12T05:00:02Z,"<p>Stung by its honeymoon with westernisation, Putin’s way of restoring Russian relevance has been to tear up global norms</p><ul><li><a href=""https://www.theguardian.com/world/series/ukraine-live/latest"">Russia-Ukraine war: latest updates</a></li></ul>",https://www.theguardian.com/world/2022/mar/12/mcdonalds-russia-departure-more-than-burgers-west-putin,1205,"<p>Stung by its honeymoon with westernisation, Putin’s way of restoring Russian relevance has been to tear up global norms</p><ul><li><a href=""https://www.theguardian.com/world/series/ukraine-live/latest"">Russia-Ukraine war: latest updates</a></li></ul>",World news,News,article,Julian Borger in Washington,"Russia, McDonald's, Vladimir Putin, Business, Food & drink industry, Europe, World news, US news, Global economy",world/2022/mar/12/mcdonalds-russia-departure-more-than-burgers-west-putin
"Russia has a history of using chemical weapons, US tells UN – as it happened ",2022-03-12T04:37:17Z,"<p>This live blog has now closed. For the latest updates on the Russia-Ukraine war, <a href=""https://www.theguardian.com/world/live/2022/mar/12/ukraine-news-russia-war-ceasefire-broken-humanitarian-corridors-kyiv-russian-invasion-live-vladimir-putin-volodymyr-zelenskiy-latest-updates-live"">visit our dedicated page.</a></p>",https://www.theguardian.com/world/live/2022/mar/11/russia-ukraine-war-latest-news-we-are-dealing-with-a-terrorist-state-says-zelenskiy-biden-plans-fresh-russian-trade-crackdown-live,16984,"<p>This live blog has now closed. For the latest updates on the Russia-Ukraine war, <a href=""https://www.theguardian.com/world/live/2022/mar/12/ukraine-news-russia-war-ceasefire-broken-humanitarian-corridors-kyiv-russian-invasion-live-vladimir-putin-volodymyr-zelenskiy-latest-updates-live"">visit our dedicated page.</a></p>",World news,News,liveblog,"Helen Livingstone (now); Johana Bhuiyan Léonie Chao-Fong, Miranda Bryant and Samantha Lock (earlier)","Ukraine, Russia, Europe, World news, Vladimir Putin, Volodymyr Zelenskyy, Chemical weapons",world/live/2022/mar/11/russia-ukraine-war-latest-news-we-are-dealing-with-a-terrorist-state-says-zelenskiy-biden-plans-fresh-russian-trade-crackdown-live
Mexican president lashes out at EU ‘lies’ over his media-bashing rhetoric,2022-03-11T17:46:39Z,<p>Andrés Manuel López Obrador was urged to tone down his rhetoric by MEPs after a spate of journalist murders – he did the opposite</p>,https://www.theguardian.com/world/2022/mar/11/mexico-lopez-obrador-european-parliament-journalists,608,<p>Andrés Manuel López Obrador was urged to tone down his rhetoric by MEPs after a spate of journalist murders – he did the opposite</p>,World news,News,article,Tom Phillips Latin America correspondent,"Andrés Manuel López Obrador, Mexico, European Union, Europe, Americas, World news",world/2022/mar/11/mexico-lopez-obrador-european-parliament-journalists
‘I was running naked with a fake penis’: how Simon Rex found redemption playing a washed-up porn star ,2022-03-11T06:00:23Z,"<p>From comedy rap with Charlie Sheen  to a sitcom with Meghan Markle, Rex has had a rollercoaster life. Now, Sean Baker’s film Red Rocket has bestowed one quality that eluded him – respect for his acting</p>",https://www.theguardian.com/film/2022/mar/11/i-was-running-naked-with-a-fake-penis-how-simon-rex-found-redemption-playing-a-washed-up-porn-star,2018,"<p>From comedy rap with Charlie Sheen  to a sitcom with Meghan Markle, Rex has had a rollercoaster life. Now, Sean Baker’s film Red Rocket has bestowed one quality that eluded him – respect for his acting</p>",Film,Arts,article,Ryan Gilbey,"Film, Sex, Pornography, Culture",film/2022/mar/11/i-was-running-naked-with-a-fake-penis-how-simon-rex-found-redemption-playing-a-washed-up-porn-star
 US Congress passes bill for $13.6bn in emergency aid to Ukraine– as it happened ,2022-03-11T05:28:27Z,"<p><a href=""https://www.theguardian.com/world/live/2022/mar/10/ukraine-news-russia-war-kyiv-vladimir-putin-volodymyr-zelenskiy-russian-invasion-hospital-bombing-latest-live-updates?filterKeyEvents=false&amp;page=with:block-622a178f8f08527b368546c6#block-622a178f8f08527b368546c6"">International Red Cross warning</a> comes as UN says <a href=""https://www.theguardian.com/world/live/2022/mar/10/ukraine-news-russia-war-kyiv-vladimir-putin-volodymyr-zelenskiy-russian-invasion-hospital-bombing-latest-live-updates?page=with:block-622a36368f08d64fa95e9d79#block-622a36368f08d64fa95e9d79"">Mariupol maternity hospital was third of its kind destroyed since invasion</a>; <a href=""https://www.theguardian.com/world/live/2022/mar/10/ukraine-news-russia-war-kyiv-vladimir-putin-volodymyr-zelenskiy-russian-invasion-hospital-bombing-latest-live-updates?filterKeyEvents=false&amp;page=with:block-6229f58f8f08ec6557dfae20#block-6229f58f8f08ec6557dfae20"">Vitali Klitschko says half of Kyiv’s population has left</a></p><ul><li><a href=""https://www.theguardian.com/world/2022/mar/10/russia-ukraine-war-update-what-we-know-on-day-15-of-the-russian-invasion"">Day 15: what we know</a></li><li><a href=""https://www.theguardian.com/world/2022/mar/09/ukraine-mariupol-civilians-russia-war"">Zelenskiy: bombing of maternity hospital ‘genocide’</a></li><li><a href=""https://www.theguardian.com/world/2022/mar/10/ukraine-talks-turkey-russia-fail-progress-ceasefire"">Ukraine says talks in Turkey with Russia fail to make progress</a></li><li><a href=""https://www.theguardian.com/world/2022/mar/10/ukraine-war-sparks-anti-russian-consumer-protests-and-action-worldwide"">Anti-Russian consumer protests and action spreads worldwide</a></li><li><a href=""https://www.theguardian.com/world/2022/jan/26/living-in-ukraine-how-have-you-been-affected-by-the-current-situation"">Tell us: how have you been affected?</a></li></ul>",https://www.theguardian.com/world/live/2022/mar/10/ukraine-news-russia-war-kyiv-vladimir-putin-volodymyr-zelenskiy-russian-invasion-hospital-bombing-latest-live-updates,17588,"<p><a href=""https://www.theguardian.com/world/live/2022/mar/10/ukraine-news-russia-war-kyiv-vladimir-putin-volodymyr-zelenskiy-russian-invasion-hospital-bombing-latest-live-updates?filterKeyEvents=false&amp;page=with:block-622a178f8f08527b368546c6#block-622a178f8f08527b368546c6"">International Red Cross warning</a> comes as UN says <a href=""https://www.theguardian.com/world/live/2022/mar/10/ukraine-news-russia-war-kyiv-vladimir-putin-volodymyr-zelenskiy-russian-invasion-hospital-bombing-latest-live-updates?page=with:block-622a36368f08d64fa95e9d79#block-622a36368f08d64fa95e9d79"">Mariupol maternity hospital was third of its kind destroyed since invasion</a>; <a href=""https://www.theguardian.com/world/live/2022/mar/10/ukraine-news-russia-war-kyiv-vladimir-putin-volodymyr-zelenskiy-russian-invasion-hospital-bombing-latest-live-updates?filterKeyEvents=false&amp;page=with:block-6229f58f8f08ec6557dfae20#block-6229f58f8f08ec6557dfae20"">Vitali Klitschko says half of Kyiv’s population has left</a></p><ul><li><a href=""https://www.theguardian.com/world/2022/mar/10/russia-ukraine-war-update-what-we-know-on-day-15-of-the-russian-invasion"">Day 15: what we know</a></li><li><a href=""https://www.theguardian.com/world/2022/mar/09/ukraine-mariupol-civilians-russia-war"">Zelenskiy: bombing of maternity hospital ‘genocide’</a></li><li><a href=""https://www.theguardian.com/world/2022/mar/10/ukraine-talks-turkey-russia-fail-progress-ceasefire"">Ukraine says talks in Turkey with Russia fail to make progress</a></li><li><a href=""https://www.theguardian.com/world/2022/mar/10/ukraine-war-sparks-anti-russian-consumer-protests-and-action-worldwide"">Anti-Russian consumer protests and action spreads worldwide</a></li><li><a href=""https://www.theguardian.com/world/2022/jan/26/living-in-ukraine-how-have-you-been-affected-by-the-current-situation"">Tell us: how have you been affected?</a></li></ul>",World news,News,liveblog,"Samantha Lock (now); Maanvi Singh, Gloria Oladipo, Léonie Chao-Fong and  Miranda Bryant (earlier)","Ukraine, Russia, World news, Volodymyr Zelenskyy, Europe",world/live/2022/mar/10/ukraine-news-russia-war-kyiv-vladimir-putin-volodymyr-zelenskiy-russian-invasion-hospital-bombing-latest-live-updates
‘Serious escalation’: US believes North Korea testing intercontinental missile,2022-03-10T21:00:12Z,"<p>Pyongyang launches were to test parts of intercontinental ballistic missile and not satellite surveillance system, US concludes</p>",https://www.theguardian.com/world/2022/mar/10/us-north-korea-icbm-missile-serious-escalation,651,"<p>Pyongyang launches were to test parts of intercontinental ballistic missile and not satellite surveillance system, US concludes</p>",World news,News,article,Julian Borger in Washington and Justin McCurry in Tokyo,"North Korea, US news, World news, Asia Pacific, Nuclear weapons, US foreign policy",world/2022/mar/10/us-north-korea-icbm-missile-serious-escalation
