headline,pub_date,snippet,web_url,word_count,abstract,section_name,pillar_name,type,byline,keywords,article_id
Daniel Andrews catches Covid as nation records three deaths – as it happened,2022-03-28T08:19:28Z,"<p><a href=""https://www.theguardian.com/australia-news/live/2022/mar/28/australia-news-live-updates-weather-nsw-queensland-floods-scott-morrison-budget-frydenberg-politics-election-parliament-covid-coronavirus-omicron?page=with:block-62414c488f08d422c5d5ec8c#block-62414c488f08d422c5d5ec8c"">Lismore and NSW SES issue evacuation orders</a>; <a href=""https://www.theguardian.com/australia-news/live/2022/mar/28/australia-news-live-updates-weather-nsw-queensland-floods-scott-morrison-budget-frydenberg-politics-election-parliament-covid-coronavirus-omicron?page=with:block-6240e5438f0867da3721a003#block-6240e5438f0867da3721a003"">man dies in flood waters</a> at Kingsthorpe; <a href=""https://www.theguardian.com/australia-news/live/2022/mar/28/australia-news-live-updates-weather-nsw-queensland-floods-scott-morrison-budget-frydenberg-politics-election-parliament-covid-coronavirus-omicron?page=with:block-624102218f08118734a739aa#block-624102218f08118734a739aa"">Victorian premier to isolate for seven days after positive Covid test</a>; <a href=""https://www.theguardian.com/australia-news/live/2022/mar/28/australia-news-live-updates-weather-nsw-queensland-floods-scott-morrison-budget-frydenberg-politics-election-parliament-covid-coronavirus-omicron?filterKeyEvents=false&amp;page=with:block-6240f2078f08d422c5d5ea33#block-6240f2078f08d422c5d5ea33"">Star casino group chief</a> steps down; <a href=""https://www.theguardian.com/australia-news/live/2022/mar/28/australia-news-live-updates-weather-nsw-queensland-floods-scott-morrison-budget-frydenberg-politics-election-parliament-covid-coronavirus-omicron?filterKeyEvents=false&amp;page=with:block-624114838f08d422c5d5eb41#block-624114838f08d422c5d5eb41"">nation records three Covid deaths</a>, <a href=""https://www.theguardian.com/australia-news/live/2022/mar/28/australia-news-live-updates-weather-nsw-queensland-floods-scott-morrison-budget-frydenberg-politics-election-parliament-covid-coronavirus-omicron?page=with:block-6240dffa8f0867da37219fe1#block-6240dffa8f0867da37219fe1"">all in NSW</a>. This blog is now closed</p><ul><li><a href=""https://www.theguardian.com/australia-news/2022/mar/28/morrison-plan-to-allow-renewable-agency-to-fund-fossil-fuels-blocked-by-liberal-led-committee"">Morrison government plan to let renewable agency fund fossil fuels blocked after Liberal-led committee’s motion</a></li><li><a href=""https://www.theguardian.com/australia-news/2022/mar/28/man-and-dogs-die-in-queensland-floods-as-deluge-returns-to-eastern-australia"">Flood evacuation warning issued for parts of Lismore after man and dogs die in Queensland</a></li><li><a href=""https://www.theguardian.com/australia-news/2022/mar/28/dont-seem-to-listen-authorities-urge-queenslanders-to-avoid-flood-waters-after-death-toll-rises"">‘Don’t seem to listen’: authorities urge Queenslanders to avoid flood waters after death toll rises</a></li><li>Follow <a href=""https://www.theguardian.com/world/series/ukraine-live/latest"">the Ukraine live blog</a></li><li><a href=""https://www.theguardian.com/world/coronavirus-outbreak"">See all our Covid-19 coverage</a></li><li><a href=""https://www.theguardian.com/technology/ng-interactive/2018/may/15/the-guardian-app?CMP=cvau_sfl"">Download the free Guardian app</a>; <a href=""https://www.theguardian.com/world/guardian-australia-morning-mail/2014/jun/24/-sp-guardian-australias-morning-mail-subscribe-by-email?CMP=cvau_sfl"">get our morning email briefing</a></li></ul>",https://www.theguardian.com/australia-news/live/2022/mar/28/australia-news-live-updates-weather-nsw-queensland-floods-scott-morrison-budget-frydenberg-politics-election-parliament-covid-coronavirus-omicron,7442,"<p><a href=""https://www.theguardian.com/australia-news/live/2022/mar/28/australia-news-live-updates-weather-nsw-queensland-floods-scott-morrison-budget-frydenberg-politics-election-parliament-covid-coronavirus-omicron?page=with:block-62414c488f08d422c5d5ec8c#block-62414c488f08d422c5d5ec8c"">Lismore and NSW SES issue evacuation orders</a>; <a href=""https://www.theguardian.com/australia-news/live/2022/mar/28/australia-news-live-updates-weather-nsw-queensland-floods-scott-morrison-budget-frydenberg-politics-election-parliament-covid-coronavirus-omicron?page=with:block-6240e5438f0867da3721a003#block-6240e5438f0867da3721a003"">man dies in flood waters</a> at Kingsthorpe; <a href=""https://www.theguardian.com/australia-news/live/2022/mar/28/australia-news-live-updates-weather-nsw-queensland-floods-scott-morrison-budget-frydenberg-politics-election-parliament-covid-coronavirus-omicron?page=with:block-624102218f08118734a739aa#block-624102218f08118734a739aa"">Victorian premier to isolate for seven days after positive Covid test</a>; <a href=""https://www.theguardian.com/australia-news/live/2022/mar/28/australia-news-live-updates-weather-nsw-queensland-floods-scott-morrison-budget-frydenberg-politics-election-parliament-covid-coronavirus-omicron?filterKeyEvents=false&amp;page=with:block-6240f2078f08d422c5d5ea33#block-6240f2078f08d422c5d5ea33"">Star casino group chief</a> steps down; <a href=""https://www.theguardian.com/australia-news/live/2022/mar/28/australia-news-live-updates-weather-nsw-queensland-floods-scott-morrison-budget-frydenberg-politics-election-parliament-covid-coronavirus-omicron?filterKeyEvents=false&amp;page=with:block-624114838f08d422c5d5eb41#block-624114838f08d422c5d5eb41"">nation records three Covid deaths</a>, <a href=""https://www.theguardian.com/australia-news/live/2022/mar/28/australia-news-live-updates-weather-nsw-queensland-floods-scott-morrison-budget-frydenberg-politics-election-parliament-covid-coronavirus-omicron?page=with:block-6240dffa8f0867da37219fe1#block-6240dffa8f0867da37219fe1"">all in NSW</a>. This blog is now closed</p><ul><li><a href=""https://www.theguardian.com/australia-news/2022/mar/28/morrison-plan-to-allow-renewable-agency-to-fund-fossil-fuels-blocked-by-liberal-led-committee"">Morrison government plan to let renewable agency fund fossil fuels blocked after Liberal-led committee’s motion</a></li><li><a href=""https://www.theguardian.com/australia-news/2022/mar/28/man-and-dogs-die-in-queensland-floods-as-deluge-returns-to-eastern-australia"">Flood evacuation warning issued for parts of Lismore after man and dogs die in Queensland</a></li><li><a href=""https://www.theguardian.com/australia-news/2022/mar/28/dont-seem-to-listen-authorities-urge-queenslanders-to-avoid-flood-waters-after-death-toll-rises"">‘Don’t seem to listen’: authorities urge Queenslanders to avoid flood waters after death toll rises</a></li><li>Follow <a href=""https://www.theguardian.com/world/series/ukraine-live/latest"">the Ukraine live blog</a></li><li><a href=""https://www.theguardian.com/world/coronavirus-outbreak"">See all our Covid-19 coverage</a></li><li><a href=""https://www.theguardian.com/technology/ng-interactive/2018/may/15/the-guardian-app?CMP=cvau_sfl"">Download the free Guardian app</a>; <a href=""https://www.theguardian.com/world/guardian-australia-morning-mail/2014/jun/24/-sp-guardian-australias-morning-mail-subscribe-by-email?CMP=cvau_sfl"">get our morning email briefing</a></li></ul>",Australia news,News,liveblog,"Elias Visontay, Tory Shepherd and Calla Wahlquist","Australia news, Scott Morrison, Anthony Albanese, New South Wales, Victoria, Queensland, Australia weather, Coronavirus, Australian election 2022, Australian politics",australia-news/live/2022/mar/28/australia-news-live-updates-weather-nsw-queensland-floods-scott-morrison-budget-frydenberg-politics-election-parliament-covid-coronavirus-omicron
Monday briefing: Russia and Ukraine to return to negotiating table,2022-03-28T05:42:30Z,<p>Zelenskiy prepared to discuss neutrality … Oscars in chaos as Will Smith slaps Chris Rock … and changes to England’s school system to be unveiled</p>,https://www.theguardian.com/world/2022/mar/28/monday-briefing-russia-and-ukraine-return-to-negotiating-table,1592,<p>Zelenskiy prepared to discuss neutrality … Oscars in chaos as Will Smith slaps Chris Rock … and changes to England’s school system to be unveiled</p>,World news,News,article,Martin Farrer,,world/2022/mar/28/monday-briefing-russia-and-ukraine-return-to-negotiating-table
Zelenskiy promises to work for new sanctions against Russia – as it happened,2022-03-28T04:00:50Z,"<p>Volodymyr Zelenskiy says <a href=""https://www.theguardian.com/world/live/2022/mar/27/russia-ukraine-war-latest-zelenskiy-calls-on-west-for-planes-and-tanks-biden-says-butcher-putin-cannot-remain-in-power-live?page=with:block-6240eafc8f0867da3721a029#block-6240eafc8f0867da3721a029"">new round of negotiations ahead</a> but that <a href=""https://www.theguardian.com/world/live/2022/mar/27/russia-ukraine-war-latest-zelenskiy-calls-on-west-for-planes-and-tanks-biden-says-butcher-putin-cannot-remain-in-power-live?page=with:block-6240a99c8f08d422c5d5e89e#block-6240a99c8f08d422c5d5e89e"">deal would have to be subject to referendum</a>; Joe Biden <a href=""https://www.theguardian.com/world/live/2022/mar/27/russia-ukraine-war-latest-zelenskiy-calls-on-west-for-planes-and-tanks-biden-says-butcher-putin-cannot-remain-in-power-live?page=with:block-6240f0d48f0867da3721a05d-pinned#block-6240f0d48f0867da3721a05d-pinned"">rejects suggestion he was calling for regime change</a> in Moscow. Follow live updates</p><ul><li><a href=""https://www.theguardian.com/world/2022/mar/28/russia-ukraine-war-what-we-know-on-day-33-of-the-russian-invasion"">Russia-Ukraine war: what we know on day 33 of the Russian invasion</a></li><li><a href=""https://www.theguardian.com/world/live/2022/mar/26/russia-ukraine-war-zelenskiy-hails-powerful-blows-by-ukrainian-army-as-russia-hints-at-scaling-back-offensive-live?page=with:block-623faac18f0867da37219998#block-623faac18f0867da37219998"">Ukrainian president tells Europe its own security is at stake</a></li><li><a href=""https://www.theguardian.com/us-news/2022/mar/27/us-denies-it-is-seeking-regime-change-in-russia-after-biden-comments-putin"">US denies it is seeking Russia regime change after Biden comments</a></li><li><a href=""https://www.theguardian.com/world/2022/mar/27/putin-wants-korean-scenario-for-ukraine-says-intelligence-chief"">Putin wants ‘Korean scenario’ for Ukraine, says intelligence chief</a></li><li><a href=""https://www.theguardian.com/us-news/2022/mar/27/joe-biden-vladimir-putin-remarks-focus-west-on-endgame-analysis-ukraine"">Analysis: Biden’s remark should focus west on what endgame should be</a></li></ul>",https://www.theguardian.com/world/live/2022/mar/27/russia-ukraine-war-latest-zelenskiy-calls-on-west-for-planes-and-tanks-biden-says-butcher-putin-cannot-remain-in-power-live,12481,"<p>Volodymyr Zelenskiy says <a href=""https://www.theguardian.com/world/live/2022/mar/27/russia-ukraine-war-latest-zelenskiy-calls-on-west-for-planes-and-tanks-biden-says-butcher-putin-cannot-remain-in-power-live?page=with:block-6240eafc8f0867da3721a029#block-6240eafc8f0867da3721a029"">new round of negotiations ahead</a> but that <a href=""https://www.theguardian.com/world/live/2022/mar/27/russia-ukraine-war-latest-zelenskiy-calls-on-west-for-planes-and-tanks-biden-says-butcher-putin-cannot-remain-in-power-live?page=with:block-6240a99c8f08d422c5d5e89e#block-6240a99c8f08d422c5d5e89e"">deal would have to be subject to referendum</a>; Joe Biden <a href=""https://www.theguardian.com/world/live/2022/mar/27/russia-ukraine-war-latest-zelenskiy-calls-on-west-for-planes-and-tanks-biden-says-butcher-putin-cannot-remain-in-power-live?page=with:block-6240f0d48f0867da3721a05d-pinned#block-6240f0d48f0867da3721a05d-pinned"">rejects suggestion he was calling for regime change</a> in Moscow. Follow live updates</p><ul><li><a href=""https://www.theguardian.com/world/2022/mar/28/russia-ukraine-war-what-we-know-on-day-33-of-the-russian-invasion"">Russia-Ukraine war: what we know on day 33 of the Russian invasion</a></li><li><a href=""https://www.theguardian.com/world/live/2022/mar/26/russia-ukraine-war-zelenskiy-hails-powerful-blows-by-ukrainian-army-as-russia-hints-at-scaling-back-offensive-live?page=with:block-623faac18f0867da37219998#block-623faac18f0867da37219998"">Ukrainian president tells Europe its own security is at stake</a></li><li><a href=""https://www.theguardian.com/us-news/2022/mar/27/us-denies-it-is-seeking-regime-change-in-russia-after-biden-comments-putin"">US denies it is seeking Russia regime change after Biden comments</a></li><li><a href=""https://www.theguardian.com/world/2022/mar/27/putin-wants-korean-scenario-for-ukraine-says-intelligence-chief"">Putin wants ‘Korean scenario’ for Ukraine, says intelligence chief</a></li><li><a href=""https://www.theguardian.com/us-news/2022/mar/27/joe-biden-vladimir-putin-remarks-focus-west-on-endgame-analysis-ukraine"">Analysis: Biden’s remark should focus west on what endgame should be</a></li></ul>",World news,News,liveblog,"Samantha Lock (now); Lois Beckett, Alexandra Topping, Tom Ambrose and Helen Livingstone (earlier)","Ukraine, Europe, World news, Russia, Volodymyr Zelenskyy, Vladimir Putin, Foreign policy, US foreign policy, Nato",world/live/2022/mar/27/russia-ukraine-war-latest-zelenskiy-calls-on-west-for-planes-and-tanks-biden-says-butcher-putin-cannot-remain-in-power-live
"Morning mail: world leaders distance from Biden’s Putin comments, budget infrastructure spend unveiled, strangest museum artefacts",2022-03-27T19:57:31Z,"<p><strong>Monday</strong>: The US has been forced to clarify it is not seeking regime change in Russia after Joe Biden’s comments. Plus: the inseparable couple torn apart by the pandemic</p><ul><li><em>Want to get the morning mail to your email inbox every weekday? <a href=""https://www.theguardian.com/world/guardian-australia-morning-mail/2014/jun/24/-sp-guardian-australias-morning-mail-subscribe-by-email?CMP=cvau_sfl&amp;CMP=mm_sfl"">Sign up here</a></em></li></ul>",https://www.theguardian.com/australia-news/2022/mar/28/morning-mail-world-leaders-distance-from-bidens-putin-comments-budget-infrastructure-spend-unveiled-strangest-museum-artefacts,1303,"<p><strong>Monday</strong>: The US has been forced to clarify it is not seeking regime change in Russia after Joe Biden’s comments. Plus: the inseparable couple torn apart by the pandemic</p><ul><li><em>Want to get the morning mail to your email inbox every weekday? <a href=""https://www.theguardian.com/world/guardian-australia-morning-mail/2014/jun/24/-sp-guardian-australias-morning-mail-subscribe-by-email?CMP=cvau_sfl&amp;CMP=mm_sfl"">Sign up here</a></em></li></ul>",Australia news,News,article,Tamara Howie,,australia-news/2022/mar/28/morning-mail-world-leaders-distance-from-bidens-putin-comments-budget-infrastructure-spend-unveiled-strangest-museum-artefacts
‘We’re way behind’: next US booster rollout faces delays and lack of funds,2022-03-27T09:00:21Z,"<p>With a potential second booster on the horizon for vulnerable groups, the White House is still struggling to drum up interest for additional shots – and funding</p>",https://www.theguardian.com/us-news/2022/mar/27/us-second-covid-booster-delays-funding,1082,"<p>With a potential second booster on the horizon for vulnerable groups, the White House is still struggling to drum up interest for additional shots – and funding</p>",US news,News,article,Melody Schreiber,"US news, Coronavirus, Vaccines and immunisation",us-news/2022/mar/27/us-second-covid-booster-delays-funding
Labor’s Katy Gallagher says ‘mean girls’ label ‘diminishes women’; 11 virus deaths – as it happened,2022-03-27T06:24:39Z,"<p>Man <a href=""https://www.theguardian.com/australia-news/live/2022/mar/27/australia-live-news-update-plans-for-free-travel-for-sydney-commuters-to-be-unveiled-kim-carr-to-make-statement-about-future-nsw-victoria-covid-cases-scott-morrison-federal-budget-cost-of-living?page=with:block-623fdf448f08118734a732e0#block-623fdf448f08118734a732e0"">drowns</a> on Sydney’s northern beaches;<strong> </strong><a href=""https://www.theguardian.com/australia-news/live/2022/mar/27/australia-live-news-update-plans-for-free-travel-for-sydney-commuters-to-be-unveiled-kim-carr-to-make-statement-about-future-nsw-victoria-covid-cases-scott-morrison-federal-budget-cost-of-living"">Labor senator Katy Gallagher</a> says she had no ‘difficult arguments’ with Kimberley Kitching beyond what was normal in politics; <a href=""https://www.theguardian.com/australia-news/live/2022/mar/27/australia-live-news-update-plans-for-free-travel-for-sydney-commuters-to-be-unveiled-kim-carr-to-make-statement-about-future-nsw-victoria-covid-cases-scott-morrison-federal-budget-cost-of-living?filterKeyEvents=false&amp;page=with:block-623feeaa8f08118734a73308#block-623feeaa8f08118734a73308"">11 coronavirus deaths</a> recorded nationwide. This blog is now closed</p><ul><li><a href=""https://www.theguardian.com/australia-news/2022/mar/27/sydney-commuters-to-get-free-public-transport-for-12-days-in-april"">Sydney commuters to get free public transport for 12 days in April</a></li><li><a href=""https://www.theguardian.com/australia-news/2022/mar/27/kim-carr-bows-out-after-three-decades-as-labor-senator-for-victoria"">Kim Carr bows out after three decades as Labor senator for Victoria</a></li><li>Follow <a href=""https://www.theguardian.com/world/live/2022/mar/27/russia-ukraine-war-latest-zelenskiy-calls-on-west-for-planes-and-tanks-biden-says-butcher-putin-cannot-remain-in-power-live"">the Ukraine live blog</a></li><li><a href=""https://www.theguardian.com/world/coronavirus-outbreak"">See all our coronavirus coverage</a></li><li><a href=""https://www.theguardian.com/technology/ng-interactive/2018/may/15/the-guardian-app?CMP=cvau_sfl"">Get our free news app</a>; <a href=""https://www.theguardian.com/world/guardian-australia-morning-mail/2014/jun/24/-sp-guardian-australias-morning-mail-subscribe-by-email?CMP=cvau_sfl"">get our morning email briefing</a></li></ul>",https://www.theguardian.com/australia-news/live/2022/mar/27/australia-live-news-update-plans-for-free-travel-for-sydney-commuters-to-be-unveiled-kim-carr-to-make-statement-about-future-nsw-victoria-covid-cases-scott-morrison-federal-budget-cost-of-living,4210,"<p>Man <a href=""https://www.theguardian.com/australia-news/live/2022/mar/27/australia-live-news-update-plans-for-free-travel-for-sydney-commuters-to-be-unveiled-kim-carr-to-make-statement-about-future-nsw-victoria-covid-cases-scott-morrison-federal-budget-cost-of-living?page=with:block-623fdf448f08118734a732e0#block-623fdf448f08118734a732e0"">drowns</a> on Sydney’s northern beaches;<strong> </strong><a href=""https://www.theguardian.com/australia-news/live/2022/mar/27/australia-live-news-update-plans-for-free-travel-for-sydney-commuters-to-be-unveiled-kim-carr-to-make-statement-about-future-nsw-victoria-covid-cases-scott-morrison-federal-budget-cost-of-living"">Labor senator Katy Gallagher</a> says she had no ‘difficult arguments’ with Kimberley Kitching beyond what was normal in politics; <a href=""https://www.theguardian.com/australia-news/live/2022/mar/27/australia-live-news-update-plans-for-free-travel-for-sydney-commuters-to-be-unveiled-kim-carr-to-make-statement-about-future-nsw-victoria-covid-cases-scott-morrison-federal-budget-cost-of-living?filterKeyEvents=false&amp;page=with:block-623feeaa8f08118734a73308#block-623feeaa8f08118734a73308"">11 coronavirus deaths</a> recorded nationwide. This blog is now closed</p><ul><li><a href=""https://www.theguardian.com/australia-news/2022/mar/27/sydney-commuters-to-get-free-public-transport-for-12-days-in-april"">Sydney commuters to get free public transport for 12 days in April</a></li><li><a href=""https://www.theguardian.com/australia-news/2022/mar/27/kim-carr-bows-out-after-three-decades-as-labor-senator-for-victoria"">Kim Carr bows out after three decades as Labor senator for Victoria</a></li><li>Follow <a href=""https://www.theguardian.com/world/live/2022/mar/27/russia-ukraine-war-latest-zelenskiy-calls-on-west-for-planes-and-tanks-biden-says-butcher-putin-cannot-remain-in-power-live"">the Ukraine live blog</a></li><li><a href=""https://www.theguardian.com/world/coronavirus-outbreak"">See all our coronavirus coverage</a></li><li><a href=""https://www.theguardian.com/technology/ng-interactive/2018/may/15/the-guardian-app?CMP=cvau_sfl"">Get our free news app</a>; <a href=""https://www.theguardian.com/world/guardian-australia-morning-mail/2014/jun/24/-sp-guardian-australias-morning-mail-subscribe-by-email?CMP=cvau_sfl"">get our morning email briefing</a></li></ul>",Australia news,News,liveblog,Nino Bucci and Royce Kurmelovs,"Australia news, Victoria, New South Wales, Coalition, Australian politics, Queensland, Labor party, Australian immigration and asylum, Health, Coronavirus, Australian economy, Flooding, NSW and Queensland floods 2022, Environment, Australia weather",australia-news/live/2022/mar/27/australia-live-news-update-plans-for-free-travel-for-sydney-commuters-to-be-unveiled-kim-carr-to-make-statement-about-future-nsw-victoria-covid-cases-scott-morrison-federal-budget-cost-of-living
Biden summons history in sweeping call for renewed alliance of democracies,2022-03-26T20:20:35Z,<p>President seeks to re-establish US as a leader in global affairs after years of Trump-led disengagement</p>,https://www.theguardian.com/us-news/2022/mar/26/joe-biden-poland-speech-russia-ukraine-nato,619,<p>President seeks to re-establish US as a leader in global affairs after years of Trump-led disengagement</p>,US news,News,article,Jessica Glenza,"Joe Biden, Ukraine, US news, Poland, Europe, World news, Russia, Nato, US foreign policy",us-news/2022/mar/26/joe-biden-poland-speech-russia-ukraine-nato
"‘Judge me on my actions’: can Andrew Forrest become Australia’s clean, green hero?",2022-03-26T19:00:06Z,"<p>The billionaire mining magnate known as Twiggy may be emulating Bill Gates with the scale of his philanthropy, but not everyone is convinced</p><ul><li><a href=""https://www.theguardian.com/australia-news/series/australian-news-live/latest"">Follow our Australia news live blog for the latest updates</a></li><li><a href=""https://www.theguardian.com/technology/ng-interactive/2018/may/15/the-guardian-app?CMP=cvau_sfl"">Get our free news app</a>; <a href=""https://www.theguardian.com/world/guardian-australia-morning-mail/2014/jun/24/-sp-guardian-australias-morning-mail-subscribe-by-email?CMP=cvau_sfl"">get our morning email briefing</a></li></ul>",https://www.theguardian.com/australia-news/2022/mar/27/judge-me-on-my-actions-can-andrew-forrest-become-australias-clean-green-hero,3127,"<p>The billionaire mining magnate known as Twiggy may be emulating Bill Gates with the scale of his philanthropy, but not everyone is convinced</p><ul><li><a href=""https://www.theguardian.com/australia-news/series/australian-news-live/latest"">Follow our Australia news live blog for the latest updates</a></li><li><a href=""https://www.theguardian.com/technology/ng-interactive/2018/may/15/the-guardian-app?CMP=cvau_sfl"">Get our free news app</a>; <a href=""https://www.theguardian.com/world/guardian-australia-morning-mail/2014/jun/24/-sp-guardian-australias-morning-mail-subscribe-by-email?CMP=cvau_sfl"">get our morning email briefing</a></li></ul>",Australia news,News,article,Tory Shepherd,"Andrew Forrest, Australia news, Mining, Hydrogen power, Green economy, Western Australia, Energy, Renewable energy, Energy, Philanthropy, Fossil fuels, Business, Cashless welfare card, Indigenous Australians",australia-news/2022/mar/27/judge-me-on-my-actions-can-andrew-forrest-become-australias-clean-green-hero
Red tape and long waits: US visas remain out of reach for Ukrainian refugees,2022-03-26T13:00:57Z,<p>Multiple programs with varying thresholds of eligibility mar attempts by many to gain visas</p>,https://www.theguardian.com/world/2022/mar/26/us-visas-remain-out-of-reach-ukrainian-refugees,1563,<p>Multiple programs with varying thresholds of eligibility mar attempts by many to gain visas</p>,World news,News,article,Susie Armitage,"Ukraine, Refugees, US immigration, US news",world/2022/mar/26/us-visas-remain-out-of-reach-ukrainian-refugees
"As Covid precautions fall away across US, some experts advise against ‘wishful thinking’",2022-03-26T10:00:54Z,<p>Public health authorities suggest Americans need to prepare to pivot back even as they tire of the forever pandemic</p>,https://www.theguardian.com/world/2022/mar/26/covid-precautions-fall-away-experts-advise-against-wishful-thinking,1086,<p>Public health authorities suggest Americans need to prepare to pivot back even as they tire of the forever pandemic</p>,World news,News,article,Melody Schreiber,"Coronavirus, US news",world/2022/mar/26/covid-precautions-fall-away-experts-advise-against-wishful-thinking
