headline,pub_date,snippet,web_url,word_count,abstract,section_name,pillar_name,type,byline,keywords,article_id
PM says ‘family-friendly’ budget will tackle cost of living pressure – as it happened,2022-10-24T07:36:24Z,"<ul><li><a href=""https://www.theguardian.com/australia-news/live/2022/oct/25/australia-politics-live-budget-jim-chalmers-deficit-debt-housing-cost-of-living-spending-economy-unemployment-inflation-labor-coalition-vic-nsw-qld-floods"">Federal budget 2022 live updates: follow our blog for the latest news</a></li><li><a href=""https://www.theguardian.com/australia-news/2022/oct/24/australian-budget-2022-preview-what-we-know-so-far"">What we know so far about the Albanese government’s first budget</a></li><li><a href=""https://www.theguardian.com/australia-news/2022/oct/24/moree-assesses-flood-damage-as-the-murray-river-peaks-in-echuca-with-more-wet-weather-on-the-way"">Moree assesses flood damage as the Murray River peaks in Echuca with more wet weather on the way</a></li><li><a href=""https://www.theguardian.com/australia-news/2022/oct/24/sydney-breaks-october-rainfall-record-with-victoria-also-on-track-for-wettest-ever-month"">Sydney breaks October rainfall record with Victoria also on track for wettest ever month</a></li><li>Get our <a href=""https://www.theguardian.com/australia-news/2022/sep/23/morning-mail-newsletter-best-daily-news-email-guardian-australia-free-sign-up-inbox-subscribe?CMP=cvau_sfl"">morning</a> and <a href=""https://www.theguardian.com/australia-news/2022/oct/13/afternoon-update-newsletter-best-daily-news-email-guardian-australia-free-sign-up?CMP=cvau_sfl"">afternoon</a> news emails, <a href=""https://www.theguardian.com/technology/ng-interactive/2018/may/15/the-guardian-app?CMP=cvau_sfl"">free app</a> or <a href=""https://www.theguardian.com/australia-news/series/full-story?CMP=cvau_sfl"">daily news podcast</a></li></ul>",https://www.theguardian.com/australia-news/live/2022/oct/24/australia-politics-live-budget-jim-chalmers-cuts-savings-outlook-economy-labor-gdp,12064,"<ul><li><a href=""https://www.theguardian.com/australia-news/live/2022/oct/25/australia-politics-live-budget-jim-chalmers-deficit-debt-housing-cost-of-living-spending-economy-unemployment-inflation-labor-coalition-vic-nsw-qld-floods"">Federal budget 2022 live updates: follow our blog for the latest news</a></li><li><a href=""https://www.theguardian.com/australia-news/2022/oct/24/australian-budget-2022-preview-what-we-know-so-far"">What we know so far about the Albanese government’s first budget</a></li><li><a href=""https://www.theguardian.com/australia-news/2022/oct/24/moree-assesses-flood-damage-as-the-murray-river-peaks-in-echuca-with-more-wet-weather-on-the-way"">Moree assesses flood damage as the Murray River peaks in Echuca with more wet weather on the way</a></li><li><a href=""https://www.theguardian.com/australia-news/2022/oct/24/sydney-breaks-october-rainfall-record-with-victoria-also-on-track-for-wettest-ever-month"">Sydney breaks October rainfall record with Victoria also on track for wettest ever month</a></li><li>Get our <a href=""https://www.theguardian.com/australia-news/2022/sep/23/morning-mail-newsletter-best-daily-news-email-guardian-australia-free-sign-up-inbox-subscribe?CMP=cvau_sfl"">morning</a> and <a href=""https://www.theguardian.com/australia-news/2022/oct/13/afternoon-update-newsletter-best-daily-news-email-guardian-australia-free-sign-up?CMP=cvau_sfl"">afternoon</a> news emails, <a href=""https://www.theguardian.com/technology/ng-interactive/2018/may/15/the-guardian-app?CMP=cvau_sfl"">free app</a> or <a href=""https://www.theguardian.com/australia-news/series/full-story?CMP=cvau_sfl"">daily news podcast</a></li></ul>",Australia news,News,liveblog,Caitlin Cassidy and Amy Remeikis (earlier),"Australia news, Jim Chalmers, Australian politics, Labor party, Australian economy, Coalition, Rural Australia, Victoria, New South Wales, Flooding, Australia weather, Canberra, October 2022 Australian budget",australia-news/live/2022/oct/24/australia-politics-live-budget-jim-chalmers-cuts-savings-outlook-economy-labor-gdp
SES urges residents of several NSW areas to evacuate – as it happened,2022-10-23T06:28:31Z,"<p>Flood waters in Victorian border towns reach record levels as residents of several NSW towns are urged to evacuate. This blog is now closed</p><ul><li><a href=""https://www.theguardian.com/australia-news/live/2022/oct/24/victoria-nsw-floods-live-updates-qld-queensland-australia-weather-emergency-flood-watch-warnings-road-closures-rain-forecast-latest-news"">Australia floods live updates on Monday: latest flood news from Victoria, NSW and Qld</a></li><li><a href=""https://www.theguardian.com/australia-news/2022/oct/22/lismore-residents-warned-of-major-flooding-as-heavy-rain-falls-along-the-east-coast"">Lismore residents warned of major flooding as heavy rain falls along the east coast</a></li><li>Get our <a href=""https://www.theguardian.com/australia-news/2022/sep/23/morning-mail-newsletter-best-daily-news-email-guardian-australia-free-sign-up-inbox-subscribe?CMP=cvau_sfl"">morning</a> and <a href=""https://www.theguardian.com/australia-news/2022/oct/13/afternoon-update-newsletter-best-daily-news-email-guardian-australia-free-sign-up?CMP=cvau_sfl"">afternoon</a> news emails, <a href=""https://www.theguardian.com/technology/ng-interactive/2018/may/15/the-guardian-app?CMP=cvau_sfl"">free app</a> or <a href=""https://www.theguardian.com/australia-news/series/full-story?CMP=cvau_sfl"">daily news podcast</a></li></ul>",https://www.theguardian.com/australia-news/live/2022/oct/23/australia-news-live-nsw-northern-rivers-flood-victoria-lismore-echuca-budget-chalmers-albanese-family-murray-river-rain-economy-inflation,7813,"<p>Flood waters in Victorian border towns reach record levels as residents of several NSW towns are urged to evacuate. This blog is now closed</p><ul><li><a href=""https://www.theguardian.com/australia-news/live/2022/oct/24/victoria-nsw-floods-live-updates-qld-queensland-australia-weather-emergency-flood-watch-warnings-road-closures-rain-forecast-latest-news"">Australia floods live updates on Monday: latest flood news from Victoria, NSW and Qld</a></li><li><a href=""https://www.theguardian.com/australia-news/2022/oct/22/lismore-residents-warned-of-major-flooding-as-heavy-rain-falls-along-the-east-coast"">Lismore residents warned of major flooding as heavy rain falls along the east coast</a></li><li>Get our <a href=""https://www.theguardian.com/australia-news/2022/sep/23/morning-mail-newsletter-best-daily-news-email-guardian-australia-free-sign-up-inbox-subscribe?CMP=cvau_sfl"">morning</a> and <a href=""https://www.theguardian.com/australia-news/2022/oct/13/afternoon-update-newsletter-best-daily-news-email-guardian-australia-free-sign-up?CMP=cvau_sfl"">afternoon</a> news emails, <a href=""https://www.theguardian.com/technology/ng-interactive/2018/may/15/the-guardian-app?CMP=cvau_sfl"">free app</a> or <a href=""https://www.theguardian.com/australia-news/series/full-story?CMP=cvau_sfl"">daily news podcast</a></li></ul>",Australia news,News,liveblog,Donna Lu (now) and Royce Kurmelovs (earlier),"Australia weather, Australia news, Australian economy, Jim Chalmers, Flooding, Australian politics, Environment, New South Wales, Victoria, Anthony Albanese, Liberal party, Queensland, Extreme weather",australia-news/live/2022/oct/23/australia-news-live-nsw-northern-rivers-flood-victoria-lismore-echuca-budget-chalmers-albanese-family-murray-river-rain-economy-inflation
From dance videos to global sensation: what you need to know about TikTok’s rise,2022-10-23T05:00:28Z,"<p>The app has grown at breakneck speed to surpass the internet behemoths in downloads</p><ul><li><a href=""https://www.theguardian.com/technology/series/the-tiktok-takeover"">Read the new Guardian series exploring the increasing power and reach of TikTok</a></li></ul>",https://www.theguardian.com/technology/2022/oct/22/tiktok-history-rise-algorithm-misinformation,1111,"<p>The app has grown at breakneck speed to surpass the internet behemoths in downloads</p><ul><li><a href=""https://www.theguardian.com/technology/series/the-tiktok-takeover"">Read the new Guardian series exploring the increasing power and reach of TikTok</a></li></ul>",Technology,News,article,Kari Paul,"Technology, TikTok, Social media, US news",technology/2022/oct/22/tiktok-history-rise-algorithm-misinformation
Flurry of support gives Sunak close to 90 backers – as it happened,2022-10-21T22:58:25Z,"<p>Late evening declarations from Hancock, Dowden, Ellwood and Tugendhat for former chancellor. This blog is now closed</p><ul><li><a href=""https://www.theguardian.com/politics/2022/oct/21/boris-johnson-gaining-ground-on-rishi-sunak-in-tory-leadership-race"">Johnson flies back to UK as Sunak’s backers claim he has passed threshold of 100 MPs</a></li></ul>",https://www.theguardian.com/politics/live/2022/oct/21/uk-politics-live-liz-truss-resigns-tories-tory-leadership-race-new-pm-contest-rishi-sunak-boris-johnson-penny-mordaunt,13318,"<p>Late evening declarations from Hancock, Dowden, Ellwood and Tugendhat for former chancellor. This blog is now closed</p><ul><li><a href=""https://www.theguardian.com/politics/2022/oct/21/boris-johnson-gaining-ground-on-rishi-sunak-in-tory-leadership-race"">Johnson flies back to UK as Sunak’s backers claim he has passed threshold of 100 MPs</a></li></ul>",Politics,News,liveblog,"Harry Taylor (now); Kevin Rawlinson, Léonie Chao-Fong and Helen Sullivan (earlier)","Conservative leadership, Liz Truss, Politics, UK news, Conservatives, Boris Johnson, Rishi Sunak, Penny Mordaunt",politics/live/2022/oct/21/uk-politics-live-liz-truss-resigns-tories-tory-leadership-race-new-pm-contest-rishi-sunak-boris-johnson-penny-mordaunt
Steve Bannon vows ‘very vigorous appeal’ to four-month prison sentence – as it happened,2022-10-21T20:09:30Z,"<ul><li>Former lead Trump strategist sentenced to prison and $6,500 in fines</li><li>Bannon says ‘I fully respect’ judge’s decision but vows to appeal</li><li><a href=""https://www.theguardian.com/info/2018/sep/17/guardian-us-morning-briefing-sign-up-to-stay-informed"">Sign up to receive First Thing – our daily briefing by email</a></li></ul>",https://www.theguardian.com/us-news/live/2022/oct/21/steve-bannon-sentencing-trump-jan-6-biden-student-loan-politics-latest,4882,"<ul><li>Former lead Trump strategist sentenced to prison and $6,500 in fines</li><li>Bannon says ‘I fully respect’ judge’s decision but vows to appeal</li><li><a href=""https://www.theguardian.com/info/2018/sep/17/guardian-us-morning-briefing-sign-up-to-stay-informed"">Sign up to receive First Thing – our daily briefing by email</a></li></ul>",US news,News,liveblog,Richard Luscombe,"US politics, Steve Bannon, US midterm elections 2022, Democrats, Republicans, US Congress, House of Representatives, US Senate, Joe Biden, US news",us-news/live/2022/oct/21/steve-bannon-sentencing-trump-jan-6-biden-student-loan-politics-latest
Australia failed to rescue citizens during the global Covid emergency – we can’t let it happen again,2022-10-21T01:10:15Z,"<p>Many Australians living overseas wanted or needed to return – yet we made it impossibly difficult for tens of thousands of people</p><ul><li><a href=""https://www.theguardian.com/australia-news/live/2022/oct/21/australia-news-live-updates-eastern-states-brace-for-more-rain-floods-victoria-weather-politics-labor-plans-pacific-aid-boost-liz-truss"">Follow our Australia news live blog for the latest updates</a></li><li>Get our <a href=""https://www.theguardian.com/australia-news/2022/sep/23/morning-mail-newsletter-best-daily-news-email-guardian-australia-free-sign-up-inbox-subscribe?CMP=cvau_sfl"">morning</a> and <a href=""https://www.theguardian.com/australia-news/2022/oct/13/afternoon-update-newsletter-best-daily-news-email-guardian-australia-free-sign-up?CMP=cvau_sfl"">afternoon</a> news emails, <a href=""https://www.theguardian.com/technology/ng-interactive/2018/may/15/the-guardian-app?CMP=cvau_sfl"">free app</a> or <a href=""https://www.theguardian.com/australia-news/series/full-story?CMP=cvau_sfl"">daily news podcast</a></li></ul>",https://www.theguardian.com/australia-news/commentisfree/2022/oct/21/australia-failed-to-rescue-citizens-during-the-global-covid-emergency-we-cant-let-it-happen-again,827,"<p>Many Australians living overseas wanted or needed to return – yet we made it impossibly difficult for tens of thousands of people</p><ul><li><a href=""https://www.theguardian.com/australia-news/live/2022/oct/21/australia-news-live-updates-eastern-states-brace-for-more-rain-floods-victoria-weather-politics-labor-plans-pacific-aid-boost-liz-truss"">Follow our Australia news live blog for the latest updates</a></li><li>Get our <a href=""https://www.theguardian.com/australia-news/2022/sep/23/morning-mail-newsletter-best-daily-news-email-guardian-australia-free-sign-up-inbox-subscribe?CMP=cvau_sfl"">morning</a> and <a href=""https://www.theguardian.com/australia-news/2022/oct/13/afternoon-update-newsletter-best-daily-news-email-guardian-australia-free-sign-up?CMP=cvau_sfl"">afternoon</a> news emails, <a href=""https://www.theguardian.com/technology/ng-interactive/2018/may/15/the-guardian-app?CMP=cvau_sfl"">free app</a> or <a href=""https://www.theguardian.com/australia-news/series/full-story?CMP=cvau_sfl"">daily news podcast</a></li></ul>",Australia news,News,article,Trent Zimmerman,"Australian politics, Coronavirus, Infectious diseases, Science, Australia news",australia-news/commentisfree/2022/oct/21/australia-failed-to-rescue-citizens-during-the-global-covid-emergency-we-cant-let-it-happen-again
PM calls for explanation on Thorpe’s undisclosed relationship – as it happened,2022-10-20T07:55:39Z,"<p>Greens leader Adam Bandt asked senator to step down from leadership team due to error of judgment. This blog is now closed</p><ul><li><a href=""https://www.theguardian.com/australia-news/2022/oct/20/lidia-thorpe-resigns-as-greens-deputy-leader-in-senate-over-relationship-with-former-bikie-boss"">Lidia Thorpe resigns as Greens deputy leader in Senate over relationship with former bikie boss</a></li><li>Get our <a href=""https://www.theguardian.com/australia-news/2022/sep/23/morning-mail-newsletter-best-daily-news-email-guardian-australia-free-sign-up-inbox-subscribe?CMP=cvau_sfl"">morning</a> and <a href=""https://www.theguardian.com/australia-news/2022/oct/13/afternoon-update-newsletter-best-daily-news-email-guardian-australia-free-sign-up?CMP=cvau_sfl"">afternoon</a> news emails, <a href=""https://www.theguardian.com/technology/ng-interactive/2018/may/15/the-guardian-app?CMP=cvau_sfl"">free app</a> or <a href=""https://www.theguardian.com/australia-news/series/full-story?CMP=cvau_sfl"">daily news podcast</a></li></ul>",https://www.theguardian.com/australia-news/live/2022/oct/20/australia-news-live-kerang-echuca-weather-floods-politics-anthony-albanese-daniel-andrews-vic-nsw-qld-covid,12082,"<p>Greens leader Adam Bandt asked senator to step down from leadership team due to error of judgment. This blog is now closed</p><ul><li><a href=""https://www.theguardian.com/australia-news/2022/oct/20/lidia-thorpe-resigns-as-greens-deputy-leader-in-senate-over-relationship-with-former-bikie-boss"">Lidia Thorpe resigns as Greens deputy leader in Senate over relationship with former bikie boss</a></li><li>Get our <a href=""https://www.theguardian.com/australia-news/2022/sep/23/morning-mail-newsletter-best-daily-news-email-guardian-australia-free-sign-up-inbox-subscribe?CMP=cvau_sfl"">morning</a> and <a href=""https://www.theguardian.com/australia-news/2022/oct/13/afternoon-update-newsletter-best-daily-news-email-guardian-australia-free-sign-up?CMP=cvau_sfl"">afternoon</a> news emails, <a href=""https://www.theguardian.com/technology/ng-interactive/2018/may/15/the-guardian-app?CMP=cvau_sfl"">free app</a> or <a href=""https://www.theguardian.com/australia-news/series/full-story?CMP=cvau_sfl"">daily news podcast</a></li></ul>",Australia news,News,liveblog,Mostafa Rachwani (now) and Natasha May (earlier),"Australia news, Victoria, Queensland, New South Wales, Australian politics, Anthony Albanese, Australian Greens, Labor party, Coalition, Environment, Lidia Thorpe",australia-news/live/2022/oct/20/australia-news-live-kerang-echuca-weather-floods-politics-anthony-albanese-daniel-andrews-vic-nsw-qld-covid
Biden to release 15m barrels from strategic reserve in effort to tamp down gas prices – as it happened,2022-10-19T20:02:16Z,"<p>Move is president’s attempt to mitigate concerns over the economy as midterms approach</p><ul><li><a href=""https://www.theguardian.com/info/2018/sep/17/guardian-us-morning-briefing-sign-up-to-stay-informed"">Sign up to receive First Thing – our daily briefing by email</a></li></ul>",https://www.theguardian.com/us-news/live/2022/oct/19/gas-prices-midterms-biden-strategic-reserve-trump-politics-latest,3803,"<p>Move is president’s attempt to mitigate concerns over the economy as midterms approach</p><ul><li><a href=""https://www.theguardian.com/info/2018/sep/17/guardian-us-morning-briefing-sign-up-to-stay-informed"">Sign up to receive First Thing – our daily briefing by email</a></li></ul>",US news,News,liveblog,Lauren Aratani,"US politics, US midterm elections 2022, Joe Biden, Republicans, Democrats, US Congress, House of Representatives, US Senate, US news",us-news/live/2022/oct/19/gas-prices-midterms-biden-strategic-reserve-trump-politics-latest
Body of man recovered from NSW flood waters; Medibank receives demands from alleged hackers – as it happened,2022-10-19T07:57:39Z,"<p>Body believed to be that of missing 63-year-old last seen in Hillston on Tuesday. This blog is now closed</p><ul><li><a href=""https://www.theguardian.com/australia-news/2022/oct/19/man-found-dead-in-victorian-floods-as-anxious-communities-watch-murray-river-rise"">Man found dead in NSW flood waters as anxious communities in two states watch Murray River rise</a></li><li>Get our <a href=""https://www.theguardian.com/australia-news/2022/sep/23/morning-mail-newsletter-best-daily-news-email-guardian-australia-free-sign-up-inbox-subscribe?CMP=cvau_sfl"">morning</a> and <a href=""https://www.theguardian.com/australia-news/2022/oct/13/afternoon-update-newsletter-best-daily-news-email-guardian-australia-free-sign-up?CMP=cvau_sfl"">afternoon</a> news emails, <a href=""https://www.theguardian.com/technology/ng-interactive/2018/may/15/the-guardian-app?CMP=cvau_sfl"">free app</a> or <a href=""https://www.theguardian.com/australia-news/series/full-story?CMP=cvau_sfl"">daily news podcast</a></li></ul>",https://www.theguardian.com/australia-news/live/2022/oct/19/victoria-floods-warnings-daniel-andrews-labor-coalition-albanese-politics,16416,"<p>Body believed to be that of missing 63-year-old last seen in Hillston on Tuesday. This blog is now closed</p><ul><li><a href=""https://www.theguardian.com/australia-news/2022/oct/19/man-found-dead-in-victorian-floods-as-anxious-communities-watch-murray-river-rise"">Man found dead in NSW flood waters as anxious communities in two states watch Murray River rise</a></li><li>Get our <a href=""https://www.theguardian.com/australia-news/2022/sep/23/morning-mail-newsletter-best-daily-news-email-guardian-australia-free-sign-up-inbox-subscribe?CMP=cvau_sfl"">morning</a> and <a href=""https://www.theguardian.com/australia-news/2022/oct/13/afternoon-update-newsletter-best-daily-news-email-guardian-australia-free-sign-up?CMP=cvau_sfl"">afternoon</a> news emails, <a href=""https://www.theguardian.com/technology/ng-interactive/2018/may/15/the-guardian-app?CMP=cvau_sfl"">free app</a> or <a href=""https://www.theguardian.com/australia-news/series/full-story?CMP=cvau_sfl"">daily news podcast</a></li></ul>",Australia news,News,liveblog,Mostafa Rachwani (now) and Natasha May (earlier),"Australia news, Victoria, Coalition, Labor party, Anthony Albanese, Daniel Andrews, Australian politics, World news",australia-news/live/2022/oct/19/victoria-floods-warnings-daniel-andrews-labor-coalition-albanese-politics
Australia’s ambassador to be summoned after Jerusalem reversal – as it happened,2022-10-18T08:09:01Z,"<p>Labor will reverse Coalition decision to recognise West Jerusalem as the capital of Israel. This blog is now closed</p><ul><li><a href=""https://www.theguardian.com/australia-news/2022/oct/18/penny-wong-denies-formal-change-on-australia-recognition-of-west-jerusalem-israel-capital"">Israel criticises Labor’s decision to drop recognition of West Jerusalem as capital</a></li><li>Get our<a href=""https://www.theguardian.com/australia-news/2022/sep/23/morning-mail-newsletter-best-daily-news-email-guardian-australia-free-sign-up-inbox-subscribe?CMP=cvau_sfl""> morning</a> and<a href=""https://www.theguardian.com/australia-news/2022/oct/13/afternoon-update-newsletter-best-daily-news-email-guardian-australia-free-sign-up?CMP=cvau_sfl""> afternoon</a> news emails,<a href=""https://www.theguardian.com/technology/ng-interactive/2018/may/15/the-guardian-app?CMP=cvau_sfl""> free app</a> or<a href=""https://www.theguardian.com/australia-news/series/full-story?CMP=cvau_sfl""> daily news podcast</a></li></ul>",https://www.theguardian.com/australia-news/live/2022/oct/18/australia-news-live-victoria-floods-flooding-murray-river-melbourne-flemington-racecourse-politics-coalition-labor,15799,"<p>Labor will reverse Coalition decision to recognise West Jerusalem as the capital of Israel. This blog is now closed</p><ul><li><a href=""https://www.theguardian.com/australia-news/2022/oct/18/penny-wong-denies-formal-change-on-australia-recognition-of-west-jerusalem-israel-capital"">Israel criticises Labor’s decision to drop recognition of West Jerusalem as capital</a></li><li>Get our<a href=""https://www.theguardian.com/australia-news/2022/sep/23/morning-mail-newsletter-best-daily-news-email-guardian-australia-free-sign-up-inbox-subscribe?CMP=cvau_sfl""> morning</a> and<a href=""https://www.theguardian.com/australia-news/2022/oct/13/afternoon-update-newsletter-best-daily-news-email-guardian-australia-free-sign-up?CMP=cvau_sfl""> afternoon</a> news emails,<a href=""https://www.theguardian.com/technology/ng-interactive/2018/may/15/the-guardian-app?CMP=cvau_sfl""> free app</a> or<a href=""https://www.theguardian.com/australia-news/series/full-story?CMP=cvau_sfl""> daily news podcast</a></li></ul>",Australia news,News,liveblog,Cait Kelly and Natasha May (earlier),"Australia news, Victoria, Labor party, Coalition, Anthony Albanese, Australian politics",australia-news/live/2022/oct/18/australia-news-live-victoria-floods-flooding-murray-river-melbourne-flemington-racecourse-politics-coalition-labor
Police investigate looting of flood-affected Melbourne property – as it happened,2022-10-17T07:47:51Z,"<p>Victorian premier Daniel Andrews today announced $315m in funding for floods clean-up and road repairs. This blog is now closed</p><ul><li>Get our <a href=""https://www.theguardian.com/australia-news/2022/sep/23/morning-mail-newsletter-best-daily-news-email-guardian-australia-free-sign-up-inbox-subscribe?CMP=cvau_sfl"">morning</a> and <a href=""https://www.theguardian.com/australia-news/2022/oct/13/afternoon-update-newsletter-best-daily-news-email-guardian-australia-free-sign-up?CMP=cvau_sfl"">afternoon</a> news emails, <a href=""https://www.theguardian.com/technology/ng-interactive/2018/may/15/the-guardian-app?CMP=cvau_sfl"">free app</a> or <a href=""https://www.theguardian.com/australia-news/series/full-story?CMP=cvau_sfl"">daily news podcast</a></li></ul>",https://www.theguardian.com/australia-news/live/2022/oct/17/floods-weather-victoria-qld-nsw-budget-economy-housing-climate,17639,"<p>Victorian premier Daniel Andrews today announced $315m in funding for floods clean-up and road repairs. This blog is now closed</p><ul><li>Get our <a href=""https://www.theguardian.com/australia-news/2022/sep/23/morning-mail-newsletter-best-daily-news-email-guardian-australia-free-sign-up-inbox-subscribe?CMP=cvau_sfl"">morning</a> and <a href=""https://www.theguardian.com/australia-news/2022/oct/13/afternoon-update-newsletter-best-daily-news-email-guardian-australia-free-sign-up?CMP=cvau_sfl"">afternoon</a> news emails, <a href=""https://www.theguardian.com/technology/ng-interactive/2018/may/15/the-guardian-app?CMP=cvau_sfl"">free app</a> or <a href=""https://www.theguardian.com/australia-news/series/full-story?CMP=cvau_sfl"">daily news podcast</a></li></ul>",Australia news,News,liveblog,Cait Kelly and Natasha May (earlier),"Australia news, Australian politics, Victoria, Labor party, Coalition, Anthony Albanese, Australia weather, Flooding, Environment",australia-news/live/2022/oct/17/floods-weather-victoria-qld-nsw-budget-economy-housing-climate
Peter Thiel’s midterm bet: the billionaire seeking to disrupt America’s democracy,2022-10-15T10:00:04Z,"<p>Re-energized this election cycle, the tech entrepreneur joins other mega-donors apparently out to undercut the political system</p>",https://www.theguardian.com/technology/2022/oct/15/peter-thiel-who-is-he-republican-donor-tech-entrepreneur,1634,"<p>Re-energized this election cycle, the tech entrepreneur joins other mega-donors apparently out to undercut the political system</p>",Technology,News,article,Andrew Gumbel in Los Angeles,"Peter Thiel, US midterm elections 2022, Republicans, Donald Trump, US politics, US political financing, US news",technology/2022/oct/15/peter-thiel-who-is-he-republican-donor-tech-entrepreneur
