headline,pub_date,snippet,web_url,word_count,abstract,section_name,pillar_name,type,byline,keywords,article_id
Debunked: Trump’s false claims in letter to January 6 panel,2022-10-20T10:00:52Z,<p>We fact-check each misleading assertion made by the former president in a lengthy letter to the Capitol attack committee</p>,https://www.theguardian.com/us-news/ng-interactive/2022/oct/20/trump-false-claims-january-6-panel-letter-debunked,3498,<p>We fact-check each misleading assertion made by the former president in a lengthy letter to the Capitol attack committee</p>,US news,News,interactive,Spenser Mestel,"Donald Trump, US news, January 6 hearings, Georgia, Wisconsin, Arizona, World news",us-news/ng-interactive/2022/oct/20/trump-false-claims-january-6-panel-letter-debunked
Hello Dankness review – Tom Hanks becomes a Bernie bro in Soda Jerk’s latest triumph,2022-10-19T15:00:27Z,"<p>These film-makers treat other movies as public property in a collage film pondering the end of reality</p><ul><li><a href=""https://www.theguardian.com/newsletters/2019/oct/18/saved-for-later-sign-up-for-guardian-australias-culture-and-lifestyle-email?CMP=cvau_sfl"">Get our weekend culture and lifestyle email</a></li></ul>",https://www.theguardian.com/film/2022/oct/20/hello-dankness-review-tom-hanks-becomes-a-bernie-bro-in-soda-jerks-latest-triumph,903,"<p>These film-makers treat other movies as public property in a collage film pondering the end of reality</p><ul><li><a href=""https://www.theguardian.com/newsletters/2019/oct/18/saved-for-later-sign-up-for-guardian-australias-culture-and-lifestyle-email?CMP=cvau_sfl"">Get our weekend culture and lifestyle email</a></li></ul>",Film,Arts,article,Luke Buckmaster,"Australian film, Film, Culture, Australia news",film/2022/oct/20/hello-dankness-review-tom-hanks-becomes-a-bernie-bro-in-soda-jerks-latest-triumph
First Thing: Biden vows to codify Roe if Democrats win midterms,2022-10-19T10:05:03Z,"<p>President casts election as a choice between Republicans who seek to impose a nationwide abortion ban and Democrats who aim to protect it. Plus, how to have a better funeral<br></p>",https://www.theguardian.com/us-news/2022/oct/19/first-thing-biden-vows-to-codify-roe-if-democrats-win-midterms,1296,"<p>President casts election as a choice between Republicans who seek to impose a nationwide abortion ban and Democrats who aim to protect it. Plus, how to have a better funeral<br></p>",US news,News,article,Nicola Slawson,US news,us-news/2022/oct/19/first-thing-biden-vows-to-codify-roe-if-democrats-win-midterms
First Thing: Russian airstrikes hit ‘critical infrastructure’ in Ukraine,2022-10-18T09:30:44Z,"<p>Fresh attacks hit Kyiv, Kryvyi Ri, Dnipro, Kharkiv and Mykolaiv, damaging energy facility. Plus, US Secret Service charged $1,185 a night for Trump hotel stays<strong><br></strong></p>",https://www.theguardian.com/us-news/2022/oct/18/first-thing-russian-airstrikes-hit-critical-infrastructure-in-ukraine,1384,"<p>Fresh attacks hit Kyiv, Kryvyi Ri, Dnipro, Kharkiv and Mykolaiv, damaging energy facility. Plus, US Secret Service charged $1,185 a night for Trump hotel stays<strong><br></strong></p>",US news,News,article,Nicola Slawson,US news,us-news/2022/oct/18/first-thing-russian-airstrikes-hit-critical-infrastructure-in-ukraine
Bibi review: Netanyahu memoir is hard-eyed – if not where Trump is concerned,2022-10-18T06:00:45Z,<p>The former Israeli PM is under a legal cloud but fighting for office again. His book is well-written and self-serving</p>,https://www.theguardian.com/books/2022/oct/18/bibi-review-benjamin-netanyahu-memoir-trump-obama-clinton-bush,955,<p>The former Israeli PM is under a legal cloud but fighting for office again. His book is well-written and self-serving</p>,Books,Arts,article,Lloyd Green,"Books, Benjamin Netanyahu, Israel, Middle East and north Africa, US politics, US news, US foreign policy, Donald Trump, Trump administration, Barack Obama, Obama administration, Joe Biden, Biden administration, World news, Politics books",books/2022/oct/18/bibi-review-benjamin-netanyahu-memoir-trump-obama-clinton-bush
First Thing: Russia hits Kyiv with ‘kamikaze’ drones,2022-10-17T10:05:42Z,"<p>Drones seen swooping low across skies of Ukraine’s capital as people seek cover. Plus, why pet shelters are overrun with guinea pigs</p><ul><li><strong><a href=""https://www.theguardian.com/info/2018/sep/17/guardian-us-morning-briefing-sign-up-to-stay-informed"">Don’t already get First Thing in your inbox? Sign up here</a><br></strong></li></ul>",https://www.theguardian.com/us-news/2022/oct/17/first-thing-russia-hits-kyiv-kamikaze-drones,1241,"<p>Drones seen swooping low across skies of Ukraine’s capital as people seek cover. Plus, why pet shelters are overrun with guinea pigs</p><ul><li><strong><a href=""https://www.theguardian.com/info/2018/sep/17/guardian-us-morning-briefing-sign-up-to-stay-informed"">Don’t already get First Thing in your inbox? Sign up here</a><br></strong></li></ul>",US news,News,article,Nicola Slawson,US news,us-news/2022/oct/17/first-thing-russia-hits-kyiv-kamikaze-drones
"Economy in crisis, Tories in meltdown: how I have told the sad, strange story of Britain ",2022-10-17T05:00:57Z,"<p>Brexit, Johnson, Truss’s U-turns – I have tried to explain it all to a US audience. I’ve found it hard to take it all in myself</p><ul><li>Stryker McGuire is a former editor at Newsweek and Bloomberg</li></ul>",https://www.theguardian.com/commentisfree/2022/oct/17/economy-crisis-tories-britain-brexit-johnson-truss-us,1252,"<p>Brexit, Johnson, Truss’s U-turns – I have tried to explain it all to a US audience. I’ve found it hard to take it all in myself</p><ul><li>Stryker McGuire is a former editor at Newsweek and Bloomberg</li></ul>",Opinion,Opinion,article,Stryker McGuire,"Brexit, Conservatives, Foreign policy, Politics, Liz Truss, Boris Johnson, David Cameron, UK news",commentisfree/2022/oct/17/economy-crisis-tories-britain-brexit-johnson-truss-us
Lula brands Bolsonaro ‘tiny little dictator’ in Brazil TV debate,2022-10-17T03:04:03Z,<p>Leftist challenger Luiz Inácio Lula da Silva calls incumbent Jair Bolsonaro a ‘shameless liar’ who ‘fooled around’ with Covid causing huge fatalities</p>,https://www.theguardian.com/world/2022/oct/17/lula-brands-bolsonaro-tiny-little-dictator-in-brazil-tv-debate,614,<p>Leftist challenger Luiz Inácio Lula da Silva calls incumbent Jair Bolsonaro a ‘shameless liar’ who ‘fooled around’ with Covid causing huge fatalities</p>,World news,News,article,Tom Phillips in Rio de Janeiro,"Brazil, Luiz Inácio Lula da Silva, Jair Bolsonaro, Americas, World news",world/2022/oct/17/lula-brands-bolsonaro-tiny-little-dictator-in-brazil-tv-debate
Republicans are trying to win by spreading three false talking points. Here’s the truth,2022-10-16T10:15:32Z,"<p>Republicans want midterm voters to believe lies about crime, inflation and taxes.<em> </em>This is what they’re claiming – followed by the facts</p>",https://www.theguardian.com/us-news/commentisfree/2022/oct/16/republican-talking-points-midterms-robert-reich,760,"<p>Republicans want midterm voters to believe lies about crime, inflation and taxes.<em> </em>This is what they’re claiming – followed by the facts</p>",US news,News,article,Robert Reich,"US midterm elections 2022, US politics, Republicans, US news, US economy",us-news/commentisfree/2022/oct/16/republican-talking-points-midterms-robert-reich
Paul LePage: is Maine ready to welcome back the ‘Trump before Trump’?,2022-10-16T09:00:31Z,"<p>The Republican ex-governor was known for his offensive, belligerent attitude –  but this time, he says he’s reformed</p>",https://www.theguardian.com/us-news/2022/oct/16/paul-lepage-maine-trump-governor-republicans,1653,"<p>The Republican ex-governor was known for his offensive, belligerent attitude –  but this time, he says he’s reformed</p>",US news,News,article,Joan E Greve in Portland,"Maine, US politics, US news, World news, US midterm elections 2022",us-news/2022/oct/16/paul-lepage-maine-trump-governor-republicans
Divided midterms: parties play up different issues as US elections loom,2022-10-16T09:00:30Z,"<p>Democrats and Republicans are largely talking past each other as they campaign, with little to no overlap on what they consider major issues</p>",https://www.theguardian.com/us-news/2022/oct/16/us-midterms-republicans-democrats-major-issues,1526,"<p>Democrats and Republicans are largely talking past each other as they campaign, with little to no overlap on what they consider major issues</p>",US news,News,article,David Smith in Washington,"US midterm elections 2022, US politics, Republicans, Democrats, US news",us-news/2022/oct/16/us-midterms-republicans-democrats-major-issues
Barack Obama to campaign for Mandela Barnes in Wisconsin Senate race,2022-10-15T16:02:28Z,"<p>Barnes, who would be the first Black senator from Wisconsin, is looking to unseat Republican Ron Johnson</p>",https://www.theguardian.com/us-news/2022/oct/15/barack-obama-mandela-barnes-wisconsin-senate,515,"<p>Barnes, who would be the first Black senator from Wisconsin, is looking to unseat Republican Ron Johnson</p>",US news,News,article,Lauren Aratani and agencies,"US midterm elections 2022, Barack Obama, Wisconsin, Democrats, US Senate, US politics, US news",us-news/2022/oct/15/barack-obama-mandela-barnes-wisconsin-senate
First Thing: Alex Jones ordered to pay Sandy Hook families $965m,2022-10-13T10:37:49Z,"<p>Infowars host punished over promotion of lie 2012 massacre never happened. Plus, 70% of animal populations wiped out since 1970</p>",https://www.theguardian.com/us-news/2022/oct/13/first-thing-alex-jones-ordered-to-pay-sandy-hook-families-965m,1491,"<p>Infowars host punished over promotion of lie 2012 massacre never happened. Plus, 70% of animal populations wiped out since 1970</p>",US news,News,article,Mattha Busby,US news,us-news/2022/oct/13/first-thing-alex-jones-ordered-to-pay-sandy-hook-families-965m
Thursday briefing: Has Saudi Arabia picked Putin over Biden?,2022-10-13T06:01:10Z,"<p>In today’s newsletter: After a summer spent persuading Saudi Arabia to lower oil costs, the world’s largest producer is doing the opposite – now the US president promises ‘consequences’</p><ul><li><strong><a href=""https://www.theguardian.com/global/ng-interactive/2022/apr/13/first-edition-sign-up-guardian"">Sign up here</a> for our daily newsletter, First Edition</strong></li></ul>",https://www.theguardian.com/world/2022/oct/13/first-edition-joe-biden-saudi-arabia,2500,"<p>In today’s newsletter: After a summer spent persuading Saudi Arabia to lower oil costs, the world’s largest producer is doing the opposite – now the US president promises ‘consequences’</p><ul><li><strong><a href=""https://www.theguardian.com/global/ng-interactive/2022/apr/13/first-edition-sign-up-guardian"">Sign up here</a> for our daily newsletter, First Edition</strong></li></ul>",World news,News,article,Archie Bland,"Saudi Arabia, Middle East and north Africa, World news",world/2022/oct/13/first-edition-joe-biden-saudi-arabia
Former New Zealand PM John Key says he would have voted for Trump and Bolsonaro,2022-10-13T00:59:24Z,"<p>Influential National party figure said he had never voted ‘anything other than right’, but that some on the right were ‘getting pretty crazy’</p>",https://www.theguardian.com/world/2022/oct/13/former-new-zealand-pm-john-key-says-he-would-have-voted-for-trump-and-bolsonaro,480,"<p>Influential National party figure said he had never voted ‘anything other than right’, but that some on the right were ‘getting pretty crazy’</p>",World news,News,article,Guardian staff,"New Zealand, John Key, Asia Pacific, World news, Donald Trump, Jair Bolsonaro, New Zealand politics, National Party",world/2022/oct/13/former-new-zealand-pm-john-key-says-he-would-have-voted-for-trump-and-bolsonaro
White House says ‘outcompeting China and restraining Russia’ top Biden foreign policy aims – as it happened,2022-10-12T20:07:13Z,"<p>National security strategy reveals president’s resolve to build international alliances to strengthen democracy</p><ul><li><a href=""https://www.theguardian.com/info/2018/sep/17/guardian-us-morning-briefing-sign-up-to-stay-informed"">Sign up to receive First Thing – our daily briefing by email</a></li></ul>",https://www.theguardian.com/us-news/live/2022/oct/12/jan-6-hearing-trump-evidence-biden-midterms-election-latest,4047,"<p>National security strategy reveals president’s resolve to build international alliances to strengthen democracy</p><ul><li><a href=""https://www.theguardian.com/info/2018/sep/17/guardian-us-morning-briefing-sign-up-to-stay-informed"">Sign up to receive First Thing – our daily briefing by email</a></li></ul>",US news,News,liveblog,Richard Luscombe (now) and Chris Stein (earlier),"US politics, January 6 hearings, Joe Biden, US midterm elections 2022, Republicans, Democrats, House of Representatives, US Senate, US Congress, US news",us-news/live/2022/oct/12/jan-6-hearing-trump-evidence-biden-midterms-election-latest
‘Be like North Carolina’: rightwing election efforts signal growing US movement,2022-10-11T11:00:03Z,<p>The state is only one of several where more and more people believe there is widespread voter fraud – and their efforts are gaining resources</p>,https://www.theguardian.com/us-news/2022/oct/11/election-integrity-north-carolina-voter-suppression,2880,<p>The state is only one of several where more and more people believe there is widespread voter fraud – and their efforts are gaining resources</p>,US news,News,article,"Jordan Wilkie and Laura Lee in Raleigh, North Carolina","US voting rights, North Carolina, US news",us-news/2022/oct/11/election-integrity-north-carolina-voter-suppression
America’s ‘weird’ economy isn’t working – can Democrats convince voters they can fix it? ,2022-10-10T12:17:54Z,"<p><strong>Economy in focus:</strong> Phoenix’s economy appears to be booming – but wages are failing to keep up, and prices are spiralling. How do voters see it?</p>",https://www.theguardian.com/us-news/2022/oct/10/arizona-midterms-crucial-senate-race,1815,"<p><strong>Economy in focus:</strong> Phoenix’s economy appears to be booming – but wages are failing to keep up, and prices are spiralling. How do voters see it?</p>",US news,News,article,Dominic Rushe in Phoenix,"US midterm elections 2022, Arizona, US news, US politics, US economy, Inflation, Economics, Joe Biden, Republicans, Democrats",us-news/2022/oct/10/arizona-midterms-crucial-senate-race
Confidence Man: The Making of Donald Trump and the Breaking of America by Maggie Haberman review – the vain sadist and his ‘shrink’,2022-10-09T12:00:00Z,"<p>The New York Times reporter’s eagerly awaited book on the ex-US president scathingly exposes the toxic mix of egotism, bigotry and delusion behind his cynical rise</p>",https://www.theguardian.com/books/2022/oct/09/confidence-man-the-making-of-donald-trump-and-the-breaking-of-america-by-maggie-haberman-review-the-vain-sadist-and-his-shrink,1061,"<p>The New York Times reporter’s eagerly awaited book on the ex-US president scathingly exposes the toxic mix of egotism, bigotry and delusion behind his cynical rise</p>",Books,Arts,article,Peter Conrad,"Biography books, Books, Donald Trump, Culture, US news, World news, Politics books, US politics",books/2022/oct/09/confidence-man-the-making-of-donald-trump-and-the-breaking-of-america-by-maggie-haberman-review-the-vain-sadist-and-his-shrink
Brazil election: why was Sunday’s result so disappointing for the left?,2022-10-03T09:19:54Z,<p>Closer than expected result in first round of voting means Luiz Inácio Lula da Silva and Jair Bolsonaro face runoff</p>,https://www.theguardian.com/world/2022/oct/03/brazil-election-explained-luiz-inacio-lula-da-silva-jair-bolsonaro-wins-first-round-far-right-momentum,1468,<p>Closer than expected result in first round of voting means Luiz Inácio Lula da Silva and Jair Bolsonaro face runoff</p>,World news,News,article,Archie Bland,"Brazil, Luiz Inácio Lula da Silva, Jair Bolsonaro, Americas, World news",world/2022/oct/03/brazil-election-explained-luiz-inacio-lula-da-silva-jair-bolsonaro-wins-first-round-far-right-momentum
Monday briefing: Bolsonaro is down in Brazil’s election – but not out,2022-10-03T05:59:20Z,"<p>In today’s newsletter: Brazilians will go to the polls again after leftist former president Lula won the first vote but failed to secure a majority over far right incumbent</p><ul><li><a href=""https://www.theguardian.com/global/2022/sep/20/sign-up-for-the-first-edition-newsletter-our-free-news-email"">Sign up here</a> for our new daily newsletter, First Edition</li></ul>",https://www.theguardian.com/world/2022/oct/03/monday-briefing-bolsonaro-is-down-in-brazils-election-but-not-out,2557,"<p>In today’s newsletter: Brazilians will go to the polls again after leftist former president Lula won the first vote but failed to secure a majority over far right incumbent</p><ul><li><a href=""https://www.theguardian.com/global/2022/sep/20/sign-up-for-the-first-edition-newsletter-our-free-news-email"">Sign up here</a> for our new daily newsletter, First Edition</li></ul>",World news,News,article,Archie Bland,"Brazil, Americas, World news, Jair Bolsonaro",world/2022/oct/03/monday-briefing-bolsonaro-is-down-in-brazils-election-but-not-out
First Thing: Rishi Sunak becomes UK’s PM after meeting the king,2022-10-25T10:11:03Z,"<p>Ex-chancellor is third Tory prime minister in less than two months and fifth in six years. Plus, the history of radical art protest by women</p><ul><li><strong><a href=""https://www.theguardian.com/info/2018/sep/17/guardian-us-morning-briefing-sign-up-to-stay-informed"">Don’t already get First Thing in your inbox? Sign up here</a></strong></li></ul>",https://www.theguardian.com/us-news/2022/oct/25/first-thing-rishi-sunak-become-uk-pm-after-meeting-king,1474,"<p>Ex-chancellor is third Tory prime minister in less than two months and fifth in six years. Plus, the history of radical art protest by women</p><ul><li><strong><a href=""https://www.theguardian.com/info/2018/sep/17/guardian-us-morning-briefing-sign-up-to-stay-informed"">Don’t already get First Thing in your inbox? Sign up here</a></strong></li></ul>",US news,News,article,Nicola Slawson,US news,us-news/2022/oct/25/first-thing-rishi-sunak-become-uk-pm-after-meeting-king
"Over 2,000 Guardian readers told us about their long Covid fight. Here are their stories",2022-10-25T07:00:29Z,"<p>The chronic condition has an array of physical and neurological symptoms, but most remain misunderstood</p>",https://www.theguardian.com/society/2022/oct/25/long-covid-fight-guardian-readers,1870,"<p>The chronic condition has an array of physical and neurological symptoms, but most remain misunderstood</p>",Society,News,article,"Guardian readers, as compiled by Clea Skopeliti","Society, Health",society/2022/oct/25/long-covid-fight-guardian-readers
Two shot dead at St Louis school as White House condemns ‘senseless violence’,2022-10-24T21:39:03Z,"<p>Gunman, 20, shot and killed two people at Central Visual and Performing Arts high school before police shot him dead</p>",https://www.theguardian.com/us-news/2022/oct/24/st-louis-school-shooting-latest,496,"<p>Gunman, 20, shot and killed two people at Central Visual and Performing Arts high school before police shot him dead</p>",US news,News,article,Gloria Oladipo and agencies,"US news, Missouri, Gun crime, US school shootings",us-news/2022/oct/24/st-louis-school-shooting-latest
"No indication Russia has decided to use nuclear weapon in Ukraine, says senior US official – as it happened",2022-10-24T18:01:05Z,"<p>US says Russia keeping lines of communication open after meeting between defense secretary Lloyd Austin and Russian defence minister Sergei Shoigu. This live blog is now closed</p><ul><li><a href=""https://www.theguardian.com/world/2022/oct/24/russia-ukraine-war-latest-what-we-know-on-day-243-of-the-invasion"">At a glance: what we know on day 243 of the invasion</a></li></ul>",https://www.theguardian.com/world/live/2022/oct/24/russia-ukraine-war-live-news-25000-have-fled-kherson-moscow-says-west-denounces-kremlin-dirty-bomb-claim,8534,"<p>US says Russia keeping lines of communication open after meeting between defense secretary Lloyd Austin and Russian defence minister Sergei Shoigu. This live blog is now closed</p><ul><li><a href=""https://www.theguardian.com/world/2022/oct/24/russia-ukraine-war-latest-what-we-know-on-day-243-of-the-invasion"">At a glance: what we know on day 243 of the invasion</a></li></ul>",World news,News,liveblog,"Léonie Chao-Fong, Zaina Alibhai and Samantha Lock","Ukraine, Russia, Europe, World news, Volodymyr Zelenskyy",world/live/2022/oct/24/russia-ukraine-war-live-news-25000-have-fled-kherson-moscow-says-west-denounces-kremlin-dirty-bomb-claim
"Ted Cruz took refuge in supply closet during January 6 riot, book reveals",2022-10-24T13:15:47Z,<p>Texas senator wrote he ‘vehemently disagreed’ with colleagues’ call to allow certification of 2020 election</p>,https://www.theguardian.com/us-news/2022/oct/24/ted-cruz-supply-closet-january-6-riot-book,588,<p>Texas senator wrote he ‘vehemently disagreed’ with colleagues’ call to allow certification of 2020 election</p>,US news,News,article,Ramon Antonio Vargas,"Ted Cruz, US Capitol attack, US politics, US news, Books",us-news/2022/oct/24/ted-cruz-supply-closet-january-6-riot-book
"Business groups block action that could help tackle biodiversity crisis, report finds",2022-10-24T10:00:03Z,"<p>Industry associations for sectors from oil to agriculture in the US and Europe found resisting wildlife-friendly laws, say researchers</p>",https://www.theguardian.com/environment/2022/oct/24/business-groups-block-action-that-could-help-tackle-biodiversity-crisis-aoe,935,"<p>Industry associations for sectors from oil to agriculture in the US and Europe found resisting wildlife-friendly laws, say researchers</p>",Environment,News,article,Phoebe Weston,"Lobbying, Politics, Biodiversity, Climate crisis, Environment, World news, Conservation, Wildlife, UK news, Oil and gas companies, Business, Pfas, Energy industry, Farming, European Commission, US news, Bees, Pesticides, Europe, Insects, Animals, European Union, Cop15",environment/2022/oct/24/business-groups-block-action-that-could-help-tackle-biodiversity-crisis-aoe
Doug Mastriano: is the Trump-backed election denier too extreme to win?,2022-10-24T06:00:59Z,"<p>The far-right Republican, running for governor in Pennsylvania, has extremist views – and he hasn’t softened his positions one bit</p>",https://www.theguardian.com/us-news/2022/oct/24/doug-mastriano-pennsylvania-republicans-trump-governor,1590,"<p>The far-right Republican, running for governor in Pennsylvania, has extremist views – and he hasn’t softened his positions one bit</p>",US news,News,article,"Adam Gabbatt in Butler county, Pennsylvania","Pennsylvania, US news, World news, US midterm elections 2022, Republicans, Donald Trump",us-news/2022/oct/24/doug-mastriano-pennsylvania-republicans-trump-governor
‘Like 13-year-olds invented a sport’: face-slapping league gets go-ahead in Vegas,2022-10-24T05:00:58Z,<p>Nevada’s athletic commission voted to oversee league of the controversial sport that has already seen one competitor die</p>,https://www.theguardian.com/us-news/2022/oct/24/nevada-new-face-slapping-league-ufc-dana-white,525,<p>Nevada’s athletic commission voted to oversee league of the controversial sport that has already seen one competitor die</p>,US news,News,article,Matthew Cantor,"Nevada, Sport, UFC, US news, MMA, Will Smith, Las Vegas",us-news/2022/oct/24/nevada-new-face-slapping-league-ufc-dana-white
Elon Musk Twitter saga could draw to end as deadline looms,2022-10-23T11:56:11Z,<p>Tesla chief executive has been given until 28 October to buy social network to avoid Delaware court case</p>,https://www.theguardian.com/technology/2022/oct/23/elon-musk-twitter-saga-could-draw-to-end-as-deadline-looms,868,<p>Tesla chief executive has been given until 28 October to buy social network to avoid Delaware court case</p>,Technology,News,article,Dan Milmo Global technology editor,"Elon Musk, X, World news, US news, Internet, Technology, Media",technology/2022/oct/23/elon-musk-twitter-saga-could-draw-to-end-as-deadline-looms
Democrats need to address economic fears now  – or risk losing their majorities ,2022-10-23T10:10:34Z,"<p>Until Democrats tell it like it is, their electoral majorities will continue to be fragile</p>",https://www.theguardian.com/commentisfree/2022/oct/23/inflation-democrats-economy-corporate-power,747,"<p>Until Democrats tell it like it is, their electoral majorities will continue to be fragile</p>",Opinion,Opinion,article,Robert Reich,"Inflation, US politics, Democrats, US midterm elections 2022, US news, US economy",commentisfree/2022/oct/23/inflation-democrats-economy-corporate-power
 Phyllis Nagy: ‘Knowing Patricia Highsmith changed my thinking about how a female writer could live’,2022-10-23T08:30:33Z,"<p>The American director and screenwriter on her new film about abortion activists in the 60s, Roe v Wade being overturned, and her ideal next Bond</p>",https://www.theguardian.com/film/2022/oct/23/phyllis-nagy-director-call-jane-patricia-highsmith-interview,1142,"<p>The American director and screenwriter on her new film about abortion activists in the 60s, Roe v Wade being overturned, and her ideal next Bond</p>",Film,Arts,article,Sarah Crompton,"Film, Abortion, Roe v Wade, Theatre, Culture, Stage, Republicans, Drama films",film/2022/oct/23/phyllis-nagy-director-call-jane-patricia-highsmith-interview
