headline,pub_date,snippet,web_url,word_count,abstract,section_name,pillar_name,type,byline,keywords,article_id
Georgia grand jury indictment: what we know so far in Trump case,2023-08-15T03:10:50Z,"<p>The grand jury in Fulton county court has issued an indictment accusing Donald Trump of efforts to overturn his 2020 election loss</p><ul><li><a href=""https://www.theguardian.com/us-news/live/2023/aug/15/trump-indictment-georgia-charges-fulton-county-2020-election-biden-latest-updates"">Trump indictment – live updates</a></li></ul>",https://www.theguardian.com/us-news/2023/aug/15/donald-trump-georgia-grand-jury-indictment-what-for-why-details-case-trial-everything-you-need-to-know,475,"<p>The grand jury in Fulton county court has issued an indictment accusing Donald Trump of efforts to overturn his 2020 election loss</p><ul><li><a href=""https://www.theguardian.com/us-news/live/2023/aug/15/trump-indictment-georgia-charges-fulton-county-2020-election-biden-latest-updates"">Trump indictment – live updates</a></li></ul>",US news,News,article,Guardian staff and agencies,"Donald Trump, Georgia, US news, World news, US politics, Republicans, US elections 2020, Donald Trump trials",us-news/2023/aug/15/donald-trump-georgia-grand-jury-indictment-what-for-why-details-case-trial-everything-you-need-to-know
"Morning Mail: Habitual gamblers targeted, the real reason Latham was dumped, fresh charges loom for Trump",2023-08-14T20:51:21Z,"<p>Want to get this in your inbox every weekday? <a href=""https://www.theguardian.com/australia-news/2022/sep/23/morning-mail-newsletter-best-daily-news-email-guardian-australia-free-sign-up-inbox-subscribe?CMP=cvau_sfl&amp;CMP=mm_sfl"">Sign up for the Morning Mail here</a>, and finish your day with <a href=""https://www.theguardian.com/australia-news/2022/oct/13/afternoon-update-newsletter-best-daily-news-email-guardian-australia-free-sign-up?CMP=cvau_sfl&amp;CMP=mm_sfl"">our Afternoon Update newsletter</a></p>",https://www.theguardian.com/australia-news/2023/aug/15/morning-mail-habitual-gamblers-targeted-the-real-reason-latham-was-dumped-fresh-charges-loom-for-trump,1034,"<p>Want to get this in your inbox every weekday? <a href=""https://www.theguardian.com/australia-news/2022/sep/23/morning-mail-newsletter-best-daily-news-email-guardian-australia-free-sign-up-inbox-subscribe?CMP=cvau_sfl&amp;CMP=mm_sfl"">Sign up for the Morning Mail here</a>, and finish your day with <a href=""https://www.theguardian.com/australia-news/2022/oct/13/afternoon-update-newsletter-best-daily-news-email-guardian-australia-free-sign-up?CMP=cvau_sfl&amp;CMP=mm_sfl"">our Afternoon Update newsletter</a></p>",Australia news,News,article,Paul Gallagher,Australia news,australia-news/2023/aug/15/morning-mail-habitual-gamblers-targeted-the-real-reason-latham-was-dumped-fresh-charges-loom-for-trump
UK employers to raise pay; tensions in Moscow as Russian rouble falls – as it happened,2023-08-14T14:37:04Z,"<p>Rolling live coverage of business, economics and financial markets</p>",https://www.theguardian.com/business/live/2023/aug/14/uk-employers-pay-rises-bank-of-england-ftse-100-china-property-mortgage-interest-rates-business-live,3528,"<p>Rolling live coverage of business, economics and financial markets</p>",Business,News,liveblog,Jasper Jolly,"Business, Pay, Work & careers, Bank of England, China",business/live/2023/aug/14/uk-employers-pay-rises-bank-of-england-ftse-100-china-property-mortgage-interest-rates-business-live
Trump has no serious first amendment defense in a court of law. Here’s why,2023-08-14T11:04:13Z,<p>Words that criminal defendants have written or spoken are used against them all the time. Perhaps you’ve heard of a confession?</p>,https://www.theguardian.com/commentisfree/2023/aug/14/trump-has-no-serious-first-amendment-defense-in-a-court-of-law-heres-why,1312,<p>Words that criminal defendants have written or spoken are used against them all the time. Perhaps you’ve heard of a confession?</p>,Opinion,Opinion,article,Laurence H Tribe and Dennis Aftergut,"US news, Donald Trump, US politics, Donald Trump trials",commentisfree/2023/aug/14/trump-has-no-serious-first-amendment-defense-in-a-court-of-law-heres-why
First Thing: Hawaii wildfires kill at least 93 people,2023-08-14T11:00:56Z,"<p>The death toll in Lahaina is expected to rise in what the deadliest US blaze in a century. Plus: press freedom outcry over police raid of small Kansas newspaper</p><ul><li><a href=""https://www.theguardian.com/info/2018/sep/17/guardian-us-morning-briefing-sign-up-to-stay-informed"">Don’t already get First Thing in your inbox? Sign up here</a></li></ul>",https://www.theguardian.com/us-news/2023/aug/14/first-thing-hawaii-wildfires-lahaina-kansas,1041,"<p>The death toll in Lahaina is expected to rise in what the deadliest US blaze in a century. Plus: press freedom outcry over police raid of small Kansas newspaper</p><ul><li><a href=""https://www.theguardian.com/info/2018/sep/17/guardian-us-morning-briefing-sign-up-to-stay-informed"">Don’t already get First Thing in your inbox? Sign up here</a></li></ul>",US news,News,article,Vivian Ho,US news,us-news/2023/aug/14/first-thing-hawaii-wildfires-lahaina-kansas
Donald Trump expected to face 2020 election charges in Georgia this week,2023-08-14T10:30:12Z,"<p>Witness summonses give clear indication prosecution is about to start, with indictments also expected against a dozen others</p>",https://www.theguardian.com/us-news/2023/aug/14/donald-trump-charges-georgia-2020-us-election-overturn-interference,691,"<p>Witness summonses give clear indication prosecution is about to start, with indictments also expected against a dozen others</p>",US news,News,article,Hugo Lowell,"Donald Trump, US news, World news, Georgia, US elections 2020, US politics, Donald Trump trials",us-news/2023/aug/14/donald-trump-charges-georgia-2020-us-election-overturn-interference
Afternoon Update: woman at centre of mushroom poisoning speaks; and Mark Latham dumped as NSW One Nation head,2023-08-14T06:48:28Z,"<p>Want to get this in your inbox every weekday? <a href=""https://www.theguardian.com/australia-news/2022/oct/13/afternoon-update-newsletter-best-daily-news-email-guardian-australia-free-sign-up?CMP=cvau_sfl&amp;CMP=au_sfl"">Sign up for the Afternoon Update here</a>, and start your day with <a href=""https://www.theguardian.com/australia-news/2022/sep/23/morning-mail-newsletter-best-daily-news-email-guardian-australia-free-sign-up-inbox-subscribe?CMP=cvau_sfl&amp;CMP=au_sfl"">our Morning Mail newsletter</a>.</p>",https://www.theguardian.com/australia-news/2023/aug/14/afternoon-update-woman-at-centre-of-mushroom-poisoning-speaks-and-mark-latham-dumped-as-nsw-one-nation-head,555,"<p>Want to get this in your inbox every weekday? <a href=""https://www.theguardian.com/australia-news/2022/oct/13/afternoon-update-newsletter-best-daily-news-email-guardian-australia-free-sign-up?CMP=cvau_sfl&amp;CMP=au_sfl"">Sign up for the Afternoon Update here</a>, and start your day with <a href=""https://www.theguardian.com/australia-news/2022/sep/23/morning-mail-newsletter-best-daily-news-email-guardian-australia-free-sign-up-inbox-subscribe?CMP=cvau_sfl&amp;CMP=au_sfl"">our Morning Mail newsletter</a>.</p>",Australia news,News,article,Cait Kelly,Australia news,australia-news/2023/aug/14/afternoon-update-woman-at-centre-of-mushroom-poisoning-speaks-and-mark-latham-dumped-as-nsw-one-nation-head
Waiting to Be Arrested at Night review – the Uyghurs’ fight for survival in a society where repression is routine,2023-08-14T06:00:08Z,"<p>The very fact of being a Uyghur in China turns everyday life into a political act, as this memoir by renowned poet Tahir Hamut Izgil recounts</p>",https://www.theguardian.com/books/2023/aug/14/waiting-to-be-arrested-at-night-tahir-hamut-izgil-review-the-uyghurs-fight-for-survival-in-a-society-where-repression-is-routine,947,"<p>The very fact of being a Uyghur in China turns everyday life into a political act, as this memoir by renowned poet Tahir Hamut Izgil recounts</p>",Books,Arts,article,Kenan Malik,"Autobiography and memoir, Uyghurs, Books, Culture, China",books/2023/aug/14/waiting-to-be-arrested-at-night-tahir-hamut-izgil-review-the-uyghurs-fight-for-survival-in-a-society-where-repression-is-routine
Hunter Biden’s attorney says special counsel has ‘no new evidence’ at hand,2023-08-14T05:00:07Z,"<p> If altered charges come back, lawyer says the question is: ‘What infected the process?’</p>",https://www.theguardian.com/us-news/2023/aug/14/hunter-biden-lawyer-special-counsel-appointment,843,"<p> If altered charges come back, lawyer says the question is: ‘What infected the process?’</p>",US news,News,article,Ramon Antonio Vargas,"Hunter Biden, US crime, Joe Biden, Donald Trump, US politics, US news",us-news/2023/aug/14/hunter-biden-lawyer-special-counsel-appointment
"Trump running for 2024 ‘to stay out of jail’, Republican rival says",2023-08-13T17:59:06Z,<p>Will Hurd offers sharp rebuke of Trump’s conduct: ‘This is about a president trying to overturn an election and creating a conspiracy’</p>,https://www.theguardian.com/us-news/2023/aug/13/trump-2024-election-republican-rival-will-hurd,722,<p>Will Hurd offers sharp rebuke of Trump’s conduct: ‘This is about a president trying to overturn an election and creating a conspiracy’</p>,US news,News,article,Adam Gabbatt,"US elections 2024, US news, US politics, Donald Trump, Republicans, Donald Trump trials",us-news/2023/aug/13/trump-2024-election-republican-rival-will-hurd
Can you change a Brexit state of mind? ,2023-08-13T09:00:43Z,"<p>If departing the EU has failed to deliver, why is the UK still so divided? Seven years on, we ask behavioural psychologists if cognitive dissonance can be overcome</p>",https://www.theguardian.com/politics/2023/aug/13/brexit-brain-science-psychology-divided-uk-debate,2763,"<p>If departing the EU has failed to deliver, why is the UK still so divided? Seven years on, we ask behavioural psychologists if cognitive dissonance can be overcome</p>",Politics,News,article,Tim Adams,"Brexit, Psychology, Society, Politics, Anxiety",politics/2023/aug/13/brexit-brain-science-psychology-divided-uk-debate
Losing Our Religion review: Trump and the crisis of US Christianity,2023-08-13T06:00:39Z,"<p>Russell Moore, formerly of the Southern Baptist Convention, thinks evangelicals have come dangerous adrift of morality</p>",https://www.theguardian.com/books/2023/aug/13/losing-our-religion-review-trump-crisis-christianity,994,"<p>Russell Moore, formerly of the Southern Baptist Convention, thinks evangelicals have come dangerous adrift of morality</p>",Books,Arts,article,Lloyd Green,"Books, Religion, Religion, Christianity, Evangelical Christianity, Politics books, US politics, Donald Trump, Trump administration, Republicans, The far right, US news, World news, Culture",books/2023/aug/13/losing-our-religion-review-trump-crisis-christianity
Georgia DA summons former lawmaker and journalist in Trump election inquiry,2023-08-12T21:48:26Z,<p>Fani Willis’s office will have former lieutenant governor Geoff Duncan and journalist George Chidi testify before a grand jury</p>,https://www.theguardian.com/us-news/2023/aug/12/georgia-da-fani-willis-summons-trump-election-inquiry,575,<p>Fani Willis’s office will have former lieutenant governor Geoff Duncan and journalist George Chidi testify before a grand jury</p>,US news,News,article,Maya Yang,"Donald Trump, Georgia, US elections 2020, US crime, US politics, US news, Donald Trump trials",us-news/2023/aug/12/georgia-da-fani-willis-summons-trump-election-inquiry
Can Britain recreate a microchip industry worth its salt?,2023-08-12T15:02:20Z,"<p>UK governments let processor manufacturing drift overseas for years. Now Covid and war have shown how vital homegrown capability is, the country is  scrambling to catch up. But so is everyone else</p>",https://www.theguardian.com/business/2023/aug/12/can-britain-create-a-microchip-industry-worth-its-salt,1489,"<p>UK governments let processor manufacturing drift overseas for years. Now Covid and war have shown how vital homegrown capability is, the country is  scrambling to catch up. But so is everyone else</p>",Business,News,article,Richard Partington,"Technology sector, Technology startups, Technology, Manufacturing sector, Newcastle, Globalisation, Business, Computing, UK news",business/2023/aug/12/can-britain-create-a-microchip-industry-worth-its-salt
The year that broke US politics: what 1968 can tell us about 2024,2023-08-12T10:00:15Z,"<p>Historian Luke Nichter considers the turmoil you know about – assassinations, chaotic conventions, the racist rise of George Wallace – but also the backroom dramas you don’t</p>",https://www.theguardian.com/books/2023/aug/12/the-year-that-broke-politics-1968-johnson-nixon-wallace-king-kennedy,1211,"<p>Historian Luke Nichter considers the turmoil you know about – assassinations, chaotic conventions, the racist rise of George Wallace – but also the backroom dramas you don’t</p>",Books,Arts,article,Rich Tenorio,"Books, History books, Politics books, Culture, Republicans, Democrats, US politics",books/2023/aug/12/the-year-that-broke-politics-1968-johnson-nixon-wallace-king-kennedy
Hawaii fires death toll rises to 67 – as it happened,2023-08-12T05:11:06Z,"<p>Governor says it’s too early to tell if Maui’s emergency siren system failed; Lahaina subject to 10pm-6am curfew and thousands still without power. This blog is now closed</p><ul><li><a href=""https://www.theguardian.com/us-news/2023/aug/11/hawaii-fires-death-toll-expected-rise-significantly-buildings-searched"">Full story: state’s deadliest natural disaster leaves 67 people dead</a></li><li><a href=""https://www.theguardian.com/us-news/gallery/2023/aug/11/aftermath-of-the-hawaii-wildfire-lahaina-maui-in-pictures"">Aftermath of the Hawaii wildfire – in pictures</a></li><li><a href=""https://www.theguardian.com/us-news/2023/aug/10/people-in-maui-how-have-you-been-affected-by-the-wildfires"">People in Maui: how have you been affected by the wildfires?</a></li></ul>",https://www.theguardian.com/us-news/live/2023/aug/11/hawaii-wildfires-maui-lahainia-search-survivors-evacuation,6615,"<p>Governor says it’s too early to tell if Maui’s emergency siren system failed; Lahaina subject to 10pm-6am curfew and thousands still without power. This blog is now closed</p><ul><li><a href=""https://www.theguardian.com/us-news/2023/aug/11/hawaii-fires-death-toll-expected-rise-significantly-buildings-searched"">Full story: state’s deadliest natural disaster leaves 67 people dead</a></li><li><a href=""https://www.theguardian.com/us-news/gallery/2023/aug/11/aftermath-of-the-hawaii-wildfire-lahaina-maui-in-pictures"">Aftermath of the Hawaii wildfire – in pictures</a></li><li><a href=""https://www.theguardian.com/us-news/2023/aug/10/people-in-maui-how-have-you-been-affected-by-the-wildfires"">People in Maui: how have you been affected by the wildfires?</a></li></ul>",US news,News,liveblog,"Adam Fulton and (earlier) Abené Clayton, Sam Levin, Gloria Oladipo and Martin Belam","Hawaii, Hawaii fires, US news, World news, Wildfires, Climate crisis",us-news/live/2023/aug/11/hawaii-wildfires-maui-lahainia-search-survivors-evacuation
"Republicans grumble that Hunter Biden special counsel is too little, too late",2023-08-11T20:42:47Z,<p>Merrick Garland’s announcement has failed to satisfy opponents of the president fully determined to uncover wrongdoing</p>,https://www.theguardian.com/us-news/2023/aug/11/why-hunter-biden-merrick-garland-special-counsel-investigation-republica,774,<p>Merrick Garland’s announcement has failed to satisfy opponents of the president fully determined to uncover wrongdoing</p>,US news,News,article,Joan E Greve in Washington,"Hunter Biden, US news, World news, US politics, Republicans, Joe Biden, Donald Trump",us-news/2023/aug/11/why-hunter-biden-merrick-garland-special-counsel-investigation-republica
Corrections and clarifications,2023-08-11T20:00:58Z,<p>Cheri Tremble  <strong>| </strong>Joe Taylor/Luton Town  <strong>|  </strong>Gnocchi recipe</p>,https://www.theguardian.com/news/2023/aug/11/corrections-and-clarifications,268,<p>Cheri Tremble  <strong>| </strong>Joe Taylor/Luton Town  <strong>|  </strong>Gnocchi recipe</p>,News,News,article,Corrections and clarifications column editor,,news/2023/aug/11/corrections-and-clarifications
" Inflammatory remarks could speed up 2020 election trial, judge warns Trump",2023-08-11T19:25:32Z,<p>Judge Tanya Chutkan rules ex-president free to share ‘non-sensitive materials’ but rejected majority of his other requests</p>,https://www.theguardian.com/us-news/2023/aug/11/trump-trial-date-sooner-warns-judge-tanya-chutkan,812,<p>Judge Tanya Chutkan rules ex-president free to share ‘non-sensitive materials’ but rejected majority of his other requests</p>,US news,News,article,Hugo Lowell in Washington,"Donald Trump, US elections 2020, US news, US politics, Donald Trump trials",us-news/2023/aug/11/trump-trial-date-sooner-warns-judge-tanya-chutkan
Zelenskiy sacks military recruitment heads over frontline bribes scandal,2023-08-11T19:08:18Z,"<p>Ukrainian president describes taking of cash from people who want to avoid conscription as form of treachery</p><ul><li><strong><a href=""https://www.theguardian.com/world/live/2023/aug/11/russia-ukraine-war-live-updates-missile-strikes-zaporizhzhia-hotel-deaths-casualties-injured"">Russia-Ukraine war – latest news updates</a></strong></li></ul>",https://www.theguardian.com/world/2023/aug/11/zelenskiy-sacks-all-military-recruitment-heads-over-frontline-bribes-scandal-ukraine,929,"<p>Ukrainian president describes taking of cash from people who want to avoid conscription as form of treachery</p><ul><li><strong><a href=""https://www.theguardian.com/world/live/2023/aug/11/russia-ukraine-war-live-updates-missile-strikes-zaporizhzhia-hotel-deaths-casualties-injured"">Russia-Ukraine war – latest news updates</a></strong></li></ul>",World news,News,article,Daniel Boffey in Kyiv,"Ukraine, Volodymyr Zelenskyy, Russia, Europe",world/2023/aug/11/zelenskiy-sacks-all-military-recruitment-heads-over-frontline-bribes-scandal-ukraine
Merrick Garland appoints special counsel in Hunter Biden investigation,2023-08-11T18:43:51Z,"<p>US attorney general makes announcement deepening inquiry into Joe Biden’s son ahead of 2024 election</p><ul><li><a href=""https://www.theguardian.com/us-news/2023/aug/11/hunter-biden-moments-timeline-special-counsel"">Timeline of Hunter Biden’s moments in the spotlight</a></li></ul>",https://www.theguardian.com/us-news/2023/aug/11/hunter-biden-special-counsel-investigation-merrick-garland,869,"<p>US attorney general makes announcement deepening inquiry into Joe Biden’s son ahead of 2024 election</p><ul><li><a href=""https://www.theguardian.com/us-news/2023/aug/11/hunter-biden-moments-timeline-special-counsel"">Timeline of Hunter Biden’s moments in the spotlight</a></li></ul>",US news,News,article,Martin Pengelly in Washington,"Hunter Biden, Merrick Garland, Joe Biden, US news, US politics, Democrats, Republicans, World news",us-news/2023/aug/11/hunter-biden-special-counsel-investigation-merrick-garland
"Russia-Ukraine war: Russian troops launch five missile strikes, killing one person – as it happened",2023-08-11T18:01:53Z,"<p>One missile strike was destroyed but probability of airstrikes remains high, says general staff of Ukraine’s armed forces</p><ul><li><strong><a href=""https://www.theguardian.com/world/2023/aug/11/russia-ukraine-war-at-a-glance-what-we-know-on-day-534-of-the-invasion"">Russia-Ukraine war at a glance</a></strong></li></ul>",https://www.theguardian.com/world/live/2023/aug/11/russia-ukraine-war-live-updates-missile-strikes-zaporizhzhia-hotel-deaths-casualties-injured,5129,"<p>One missile strike was destroyed but probability of airstrikes remains high, says general staff of Ukraine’s armed forces</p><ul><li><strong><a href=""https://www.theguardian.com/world/2023/aug/11/russia-ukraine-war-at-a-glance-what-we-know-on-day-534-of-the-invasion"">Russia-Ukraine war at a glance</a></strong></li></ul>",World news,News,liveblog,Vivian Ho (now); Martin Belam and Helen Sullivan (earlier),"Ukraine, Russia, Europe, World news",world/live/2023/aug/11/russia-ukraine-war-live-updates-missile-strikes-zaporizhzhia-hotel-deaths-casualties-injured
"Every time the music dies, we lose a little bit of our souls",2023-08-11T15:00:53Z,<p>Robbie Robertson is gone and our world – once again – is diminished</p>,https://www.theguardian.com/commentisfree/2023/aug/11/robbie-robertson-the-band-music-appreciation,837,<p>Robbie Robertson is gone and our world – once again – is diminished</p>,Opinion,Opinion,article,Margaret Sullivan,"The Band, Music",commentisfree/2023/aug/11/robbie-robertson-the-band-music-appreciation
Special counsel proposes January 2024 trial date in Trump election case,2023-08-10T23:00:13Z,<p>Filing sets aggressive timeline with 2 January 2024 trial date but ex-president’s lawyers are expected to seek delay</p>,https://www.theguardian.com/us-news/2023/aug/10/trump-trial-date-2020-election-jack-smith,681,<p>Filing sets aggressive timeline with 2 January 2024 trial date but ex-president’s lawyers are expected to seek delay</p>,US news,News,article,Hugo Lowell in Washington,"Donald Trump, US elections 2020, US news, US politics, Law (US), Donald Trump trials",us-news/2023/aug/10/trump-trial-date-2020-election-jack-smith
Prosecutors ask for 2 January start date for Trump 2020 election interference case – as it happened,2023-08-10T20:56:24Z,"<p>Federal prosecutors say they estimate it will take four to six weeks to present their case against former US president</p><ul><li><a href=""https://www.theguardian.com/us-news/2023/aug/10/trump-walt-nauta-valet-plead-not-guilty-classified-documents-case"">Full story: Trump and valet plead not guilty to new document charges</a></li></ul>",https://www.theguardian.com/us-news/live/2023/aug/10/trump-documents-indictment-valet-property-manager-mar-a-lago-biden-live-updates,6518,"<p>Federal prosecutors say they estimate it will take four to six weeks to present their case against former US president</p><ul><li><a href=""https://www.theguardian.com/us-news/2023/aug/10/trump-walt-nauta-valet-plead-not-guilty-classified-documents-case"">Full story: Trump and valet plead not guilty to new document charges</a></li></ul>",US news,News,liveblog,Léonie Chao-Fong,"US politics, Donald Trump, US news, Republicans, Democrats, Joe Biden, Donald Trump trials",us-news/live/2023/aug/10/trump-documents-indictment-valet-property-manager-mar-a-lago-biden-live-updates
White House asks Congress for additional $24bn in Ukraine aid,2023-08-10T20:35:47Z,<p>US has so far given Ukraine more than $113bn in aid since Russia invaded in February 2021</p>,https://www.theguardian.com/us-news/2023/aug/10/biden-white-house-congress-ukraine-aid-russia,491,<p>US has so far given Ukraine more than $113bn in aid since Russia invaded in February 2021</p>,US news,News,article,Mary Yang in Washington,"Biden administration, US news, US politics, Ukraine, Russia, Joe Biden",us-news/2023/aug/10/biden-white-house-congress-ukraine-aid-russia
Russia-Ukraine war: two killed in shelling of Russian village; drones targeting Moscow and Sevastopol shot down – as it happened,2023-08-10T17:37:07Z,"<p>Governor updates death toll to two killed in Ukrainian shelling of Chausy village in the Bryansk region<strong>; </strong>drones downed in Moscow area, mayor says</p><ul><li><a href=""https://www.theguardian.com/world/2023/aug/10/russia-ukraine-war-at-a-glance-what-we-know-on-day-533-of-the-invasion"">Russia-Ukraine war at a glance: what we know on day 533 of the invasion</a></li></ul>",https://www.theguardian.com/world/live/2023/aug/10/russia-ukraine-war-live-air-defences-shoot-down-drones-targeting-moscow-and-sevastopol-russian-officials-say,5085,"<p>Governor updates death toll to two killed in Ukrainian shelling of Chausy village in the Bryansk region<strong>; </strong>drones downed in Moscow area, mayor says</p><ul><li><a href=""https://www.theguardian.com/world/2023/aug/10/russia-ukraine-war-at-a-glance-what-we-know-on-day-533-of-the-invasion"">Russia-Ukraine war at a glance: what we know on day 533 of the invasion</a></li></ul>",World news,News,liveblog,Sammy Gecsoyler (now); Martin Belam and Helen Sullivan (earlier),"Ukraine, Russia, Europe, World news",world/live/2023/aug/10/russia-ukraine-war-live-air-defences-shoot-down-drones-targeting-moscow-and-sevastopol-russian-officials-say
Trump and valet plead not guilty to new charges in classified documents case,2023-08-10T16:14:40Z,"<p>Carlos De Oliveira, the property manager of Trump’s Mar-a-Lago estate, is also expected to enter a plea as well</p>",https://www.theguardian.com/us-news/2023/aug/10/trump-walt-nauta-valet-plead-not-guilty-classified-documents-case,633,"<p>Carlos De Oliveira, the property manager of Trump’s Mar-a-Lago estate, is also expected to enter a plea as well</p>",US news,News,article,Joan E Greve in Washington,"Donald Trump, Mar-a-Lago, US news, US politics, Donald Trump trials",us-news/2023/aug/10/trump-walt-nauta-valet-plead-not-guilty-classified-documents-case
