headline,pub_date,snippet,web_url,word_count,abstract,section_name,pillar_name,type,byline,keywords,article_id
"Russia-Ukraine war: arrest of Russian pro-war blogger likely to trigger fury in military, says UK – as it happened",2023-07-22T17:37:48Z,"<p>This blog is now closed. To read our latest news on Ukraine, click <a href=""https://www.theguardian.com/world/ukraine"">here</a></p><ul><li><a href=""https://www.theguardian.com/world/2023/jul/22/russia-ukraine-war-at-a-glance-what-we-know-on-day-514-of-the-invasion"">What we know on day 514 of the invasion</a></li></ul>",https://www.theguardian.com/world/live/2023/jul/22/russia-ukraine-war-live-zelenskiy-says-crimea-bridge-a-legitimate-target-un-warns-moscow-over-black-sea-military-tensions,5482,"<p>This blog is now closed. To read our latest news on Ukraine, click <a href=""https://www.theguardian.com/world/ukraine"">here</a></p><ul><li><a href=""https://www.theguardian.com/world/2023/jul/22/russia-ukraine-war-at-a-glance-what-we-know-on-day-514-of-the-invasion"">What we know on day 514 of the invasion</a></li></ul>",World news,News,liveblog,"Jane Clinton, Mattha Busby and Adam Fulton","Ukraine, Russia, Europe, World news, Volodymyr Zelenskyy, Vladimir Putin",world/live/2023/jul/22/russia-ukraine-war-live-zelenskiy-says-crimea-bridge-a-legitimate-target-un-warns-moscow-over-black-sea-military-tensions
"Filthy Rich Politicians: journalist Matt K Lewis on Trump, ethics and money in Washington",2023-07-22T11:00:11Z,"<p>New books discusses ‘disturbing’ discoveries about how politicos enrich themselves, from stocks to lobbying and book deals</p>",https://www.theguardian.com/books/2023/jul/22/filthy-rich-politicians-matt-k-lewis-congress-book,1184,"<p>New books discusses ‘disturbing’ discoveries about how politicos enrich themselves, from stocks to lobbying and book deals</p>",Books,Arts,article,Rich Tenorio,"Books, Politics books, US politics, US Congress, US Senate, House of Representatives, US political financing, US news, Culture, World news",books/2023/jul/22/filthy-rich-politicians-matt-k-lewis-congress-book
The Guardian view on Robert F Kennedy Jr: from Camelot to conspiracy-mongering,2023-07-19T18:07:29Z,<p>The lawyer trades on his family’s image while spreading dangerous ideas. No wonder Republicans hype his bid for the Democratic nomination</p>,https://www.theguardian.com/commentisfree/2023/jul/19/the-guardian-view-on-robert-f-kennedy-jr-from-camelot-to-conspiracy-mongering,564,<p>The lawyer trades on his family’s image while spreading dangerous ideas. No wonder Republicans hype his bid for the Democratic nomination</p>,Opinion,Opinion,article,Editorial,"US politics, US elections 2024, US news, World news, Joe Biden, Democrats, Republicans",commentisfree/2023/jul/19/the-guardian-view-on-robert-f-kennedy-jr-from-camelot-to-conspiracy-mongering
The Other Pandemic by James Ball review: QAnon as post-truth pathogen,2023-07-19T08:00:00Z,<p>An insightful book about the conspiracy movement compares it persuasively to a self-replicating disease</p>,https://www.theguardian.com/books/2023/jul/19/the-other-pandemic-by-james-ball-review-qanon-as-post-truth-pathogen,730,<p>An insightful book about the conspiracy movement compares it persuasively to a self-replicating disease</p>,Books,Arts,article,Rafael Behr,"Books, QAnon, Culture, Politics books, Trump administration",books/2023/jul/19/the-other-pandemic-by-james-ball-review-qanon-as-post-truth-pathogen
Extreme weather live: Phoenix breaks record with 19th day of 110F highs in a row; Europe swelters under heatwave – as it happened,2023-07-18T20:53:44Z,"<p>Arizona state capital suffering from longest heatwave in 50 years; <a href=""https://www.theguardian.com/environment/live/2023/jul/18/europe-heat-wave-2023-us-asia-heatwave-live-updates-extreme-severe-weather-hottest-record-temperature-red-alert-climate-crisis-latest-news?page=with:block-64b6c2138f08d284f1f0c2ea#block-64b6c2138f08d284f1f0c2ea"">Italian hospitals see rise in urgent cases due to hot weather</a></p><ul><li><a href=""https://www.theguardian.com/world/2023/jul/17/extreme-temperatures-recorded-across-northern-hemisphere"">Extreme temperatures recorded across northern hemisphere</a></li></ul>",https://www.theguardian.com/environment/live/2023/jul/18/europe-heat-wave-2023-us-asia-heatwave-live-updates-extreme-severe-weather-hottest-record-temperature-red-alert-climate-crisis-latest-news,12274,"<p>Arizona state capital suffering from longest heatwave in 50 years; <a href=""https://www.theguardian.com/environment/live/2023/jul/18/europe-heat-wave-2023-us-asia-heatwave-live-updates-extreme-severe-weather-hottest-record-temperature-red-alert-climate-crisis-latest-news?page=with:block-64b6c2138f08d284f1f0c2ea#block-64b6c2138f08d284f1f0c2ea"">Italian hospitals see rise in urgent cases due to hot weather</a></p><ul><li><a href=""https://www.theguardian.com/world/2023/jul/17/extreme-temperatures-recorded-across-northern-hemisphere"">Extreme temperatures recorded across northern hemisphere</a></li></ul>",Environment,News,liveblog,"Erum Salam (now); Gloria Oladipo, Kevin Rawlinson, Damien Gayle, Rebecca Ratcliffe and Helen Sullivan (earlier)","Climate crisis, Europe, US news, Environment, World news",environment/live/2023/jul/18/europe-heat-wave-2023-us-asia-heatwave-live-updates-extreme-severe-weather-hottest-record-temperature-red-alert-climate-crisis-latest-news
I took RFK Jr’s phone call long ago. Now I regret it,2023-07-18T10:07:36Z,"<p>When I was the New York Times public editor, Kennedy vented on the phone – his ugly theories have sullied the family name</p>",https://www.theguardian.com/commentisfree/2023/jul/18/robert-f-kennedy-phone-call-margaret-sullivan,799,"<p>When I was the New York Times public editor, Kennedy vented on the phone – his ugly theories have sullied the family name</p>",Opinion,Opinion,article,Margaret Sullivan,"Democrats, US politics, Republicans",commentisfree/2023/jul/18/robert-f-kennedy-phone-call-margaret-sullivan
"Jamie Driscoll to stand as independent candidate for north-east mayor after quitting Labour and raising £30,000 – as it happened",2023-07-17T16:22:16Z,"<p>Driscoll raises funds needed to pay for campaign after leaving Labour and announcing plans to run against former party. <strong>This live blog is closed</strong></p><ul><li><a href=""https://www.theguardian.com/politics/2023/jul/17/jamie-driscoll-resigns-labour-blocked-north-east-mayor"">Jamie Driscoll quits Labour after snub in north-east mayor race</a></li></ul>",https://www.theguardian.com/politics/live/2023/jul/17/two-child-benefit-cap-labour-conservatives-rishi-sunak-education-uk-politics-latest,6232,"<p>Driscoll raises funds needed to pay for campaign after leaving Labour and announcing plans to run against former party. <strong>This live blog is closed</strong></p><ul><li><a href=""https://www.theguardian.com/politics/2023/jul/17/jamie-driscoll-resigns-labour-blocked-north-east-mayor"">Jamie Driscoll quits Labour after snub in north-east mayor race</a></li></ul>",Politics,News,liveblog,Andrew Sparrow,"Politics, UK news, Conservatives, Rishi Sunak, Labour, Benefits, Welfare, Students, Universities, Higher education, Hospitals, Nao, Mayoral elections, North of England, Migration, Immigration and asylum, Refugees, House of Lords, Robert Jenrick, Scotland, Scottish politics",politics/live/2023/jul/17/two-child-benefit-cap-labour-conservatives-rishi-sunak-education-uk-politics-latest
Can Europe’s marauding far right be slain? Spain’s voters hold the answer,2023-07-16T07:00:01Z,"<p>Prime minister Pedro Sánchez gambled on a snap election. If he loses, the heirs of the age of Franco could be back in power for the first time in nearly 50 years</p>",https://www.theguardian.com/world/commentisfree/2023/jul/16/can-europes-marauding-far-right-be-slain-spains-voters-hold-the-answer,929,"<p>Prime minister Pedro Sánchez gambled on a snap election. If he loses, the heirs of the age of Franco could be back in power for the first time in nearly 50 years</p>",World news,News,article,Simon Tisdall,"Pedro Sánchez, Spain, Europe, World news, Francisco Franco, Jean-Luc Mélenchon, Giorgia Meloni",world/commentisfree/2023/jul/16/can-europes-marauding-far-right-be-slain-spains-voters-hold-the-answer
Committee report is rightfully scathing on UK’s China strategy,2023-07-13T16:22:09Z,<p>The ISC’s warnings are unlikely to act as much of a brake on Britain’s approach to China</p>,https://www.theguardian.com/world/2023/jul/13/isc-report-scathing-uk-china-strategy,1037,<p>The ISC’s warnings are unlikely to act as much of a brake on Britain’s approach to China</p>,World news,News,article,Patrick Wintour Diplomatic editor,"China, UK news, US news, European Union, Europe, Conservatives, Asia Pacific, Politics, World news",world/2023/jul/13/isc-report-scathing-uk-china-strategy
Afternoon Update: Morrison ally faces possible Liberal expulsion; first home buyers slash spending; and the 10 highest-paid Australian CEOs,2023-07-13T06:35:38Z,"<p>Want to get this in your inbox every weekday? <a href=""https://www.theguardian.com/australia-news/2022/oct/13/afternoon-update-newsletter-best-daily-news-email-guardian-australia-free-sign-up?CMP=cvau_sfl&amp;CMP=au_sfl"">Sign up for the Afternoon Update here</a>, and start your day with <a href=""https://www.theguardian.com/australia-news/2022/sep/23/morning-mail-newsletter-best-daily-news-email-guardian-australia-free-sign-up-inbox-subscribe?CMP=cvau_sfl&amp;CMP=au_sfl"">our Morning Mail newsletter</a>.</p>",https://www.theguardian.com/australia-news/2023/jul/13/afternoon-update-morrison-ally-faces-possible-liberal-expulsion-first-home-buyers-slash-spending-and-the-10-highest-paid-australian-ceos,898,"<p>Want to get this in your inbox every weekday? <a href=""https://www.theguardian.com/australia-news/2022/oct/13/afternoon-update-newsletter-best-daily-news-email-guardian-australia-free-sign-up?CMP=cvau_sfl&amp;CMP=au_sfl"">Sign up for the Afternoon Update here</a>, and start your day with <a href=""https://www.theguardian.com/australia-news/2022/sep/23/morning-mail-newsletter-best-daily-news-email-guardian-australia-free-sign-up-inbox-subscribe?CMP=cvau_sfl&amp;CMP=au_sfl"">our Morning Mail newsletter</a>.</p>",Australia news,News,article,Antoun Issa,Australia news,australia-news/2023/jul/13/afternoon-update-morrison-ally-faces-possible-liberal-expulsion-first-home-buyers-slash-spending-and-the-10-highest-paid-australian-ceos
Wray calls conspiracy theories of FBI involvement in January 6 ‘ludicrous’ – as it happened,2023-07-12T20:00:24Z,"<p>FBI director Christopher Wray appears before House panel as White House condemns Republican attacks on law enforcement</p><ul><li><a href=""https://www.theguardian.com/us-news/2023/jul/12/fbi-director-christopher-wray-testifies-house-judiciary-committee"">Full report: House Republicans grill Wray</a></li></ul>",https://www.theguardian.com/us-news/live/2023/jul/12/fbi-wray-house-republicans-trump-biden-inflation-politics-live-updates,3538,"<p>FBI director Christopher Wray appears before House panel as White House condemns Republican attacks on law enforcement</p><ul><li><a href=""https://www.theguardian.com/us-news/2023/jul/12/fbi-director-christopher-wray-testifies-house-judiciary-committee"">Full report: House Republicans grill Wray</a></li></ul>",US news,News,liveblog,Chris Stein US politics live blogger,"FBI, US politics, Republicans, US news, World news, Donald Trump, Joe Biden, US elections 2024, Donald Trump trials",us-news/live/2023/jul/12/fbi-wray-house-republicans-trump-biden-inflation-politics-live-updates
 California faces backlash as it weighs historic reparations for Black residents,2023-07-11T11:00:33Z,<p>The state has become the focus of the nation’s divisive reparations conversation as it advances its reparations efforts</p>,https://www.theguardian.com/us-news/2023/jul/11/california-historic-reparations-black-residents,1913,<p>The state has become the focus of the nation’s divisive reparations conversation as it advances its reparations efforts</p>,US news,News,article,Sonya Singh,"California, Race, US news, US politics",us-news/2023/jul/11/california-historic-reparations-black-residents
Sky News Australia to launch new channel dedicated to covering Indigenous voice,2023-07-11T01:08:50Z,"<p>Murdoch-owned rolling news channel will show news, analysis, commentary and documentary programming about the impending referendum</p><ul><li><strong><a href=""https://www.theguardian.com/australia-news/live/2023/jul/11/australia-news-live-anthony-albanese-germany-nato-climate-club-indigenous-voice-support-falls-robodebt-scheme-rental-crisis"">Follow our Australia news live blog for the latest updates</a></strong></li><li><strong>Get our <a href=""https://www.theguardian.com/australia-news/2022/oct/29/email-newsletters-guardian-australia-best-daily-news-emails-newsletter-free-sign-up-inbox-subscribe-headlines?CMP=cvau_sfl"">morning and afternoon news emails</a>, <a href=""https://app.adjust.com/w4u7jx3"">free app</a> or <a href=""https://www.theguardian.com/australia-news/series/full-story?CMP=cvau_sfl"">daily news podcast</a></strong></li></ul>",https://www.theguardian.com/media/2023/jul/11/sky-news-australia-to-launch-new-channel-dedicated-to-covering-indigenous-voice,545,"<p>Murdoch-owned rolling news channel will show news, analysis, commentary and documentary programming about the impending referendum</p><ul><li><strong><a href=""https://www.theguardian.com/australia-news/live/2023/jul/11/australia-news-live-anthony-albanese-germany-nato-climate-club-indigenous-voice-support-falls-robodebt-scheme-rental-crisis"">Follow our Australia news live blog for the latest updates</a></strong></li><li><strong>Get our <a href=""https://www.theguardian.com/australia-news/2022/oct/29/email-newsletters-guardian-australia-best-daily-news-emails-newsletter-free-sign-up-inbox-subscribe-headlines?CMP=cvau_sfl"">morning and afternoon news emails</a>, <a href=""https://app.adjust.com/w4u7jx3"">free app</a> or <a href=""https://www.theguardian.com/australia-news/series/full-story?CMP=cvau_sfl"">daily news podcast</a></strong></li></ul>",Media,News,article,Amanda Meade,"Sky News Australia, Australian media, Australia news, News Corporation, Indigenous voice to parliament, Indigenous Australians",media/2023/jul/11/sky-news-australia-to-launch-new-channel-dedicated-to-covering-indigenous-voice
US supreme court: Clarence Thomas reportedly accepted more undisclosed gifts as calls for reform grow – as it happened,2023-07-10T20:00:46Z,"<p>Media reports say justice has benefited from being part of elite, wealthy circle; campaigners to call on Congress calling for corruption investigation</p>",https://www.theguardian.com/law/live/2023/jul/10/biden-uk-nato-ukraine-supreme-court-politics-live-updates,4529,"<p>Media reports say justice has benefited from being part of elite, wealthy circle; campaigners to call on Congress calling for corruption investigation</p>",US news,News,liveblog,Léonie Chao-Fong,"US supreme court, Law, Law (US), US news, World news, Joe Biden, Democrats, Republicans, US elections 2024, Donald Trump",law/live/2023/jul/10/biden-uk-nato-ukraine-supreme-court-politics-live-updates
The threat from Russia is not going away. Europe has to get serious about its own defence,2023-07-10T15:29:57Z,"<p>Guns or butter? To build up the military capacity vital for self-protection, European nations will have to make painful choices </p>",https://www.theguardian.com/world/commentisfree/2023/jul/10/russia-threat-europe-defence-military,932,"<p>Guns or butter? To build up the military capacity vital for self-protection, European nations will have to make painful choices </p>",Opinion,Opinion,article,Paul Taylor,"Nato, Russia, European Union, Germany, Defence policy, Europe",world/commentisfree/2023/jul/10/russia-threat-europe-defence-military
‘A deranged ploy’: how Republicans are fueling the disinformation wars,2023-07-10T10:00:11Z,<p>Several actions by the far right in the last month could result in a flood of conspiracy theories before the 2024 election</p>,https://www.theguardian.com/world/2023/jul/10/republicans-fuel-the-disinformation-wars,1119,<p>Several actions by the far right in the last month could result in a flood of conspiracy theories before the 2024 election</p>,World news,News,article,Nick Robins-Early,"The far right, US politics, House of Representatives, Republicans, US news",world/2023/jul/10/republicans-fuel-the-disinformation-wars
Americans will have to restart student loan payments – here’s what to know,2023-07-10T10:00:10Z,<p>After a three-year pause borrowers will have to reckon with their student debt once again in October</p>,https://www.theguardian.com/money/2023/jul/10/us-student-loans-restart-payments,798,<p>After a three-year pause borrowers will have to reckon with their student debt once again in October</p>,Money,Lifestyle,article,Lauren Aratani in New York,"US student debt, US student finance, US personal finance, Joe Biden, US news, US politics",money/2023/jul/10/us-student-loans-restart-payments
Why aren’t Americans happier about the economy?,2023-07-10T04:08:03Z,"<p>The economy is getting better overall – but as the rich get richer and the poor grow poorer, overall has become a worse gauge of wellbeing </p>",https://www.theguardian.com/commentisfree/2023/jul/10/america-economy-robert-reich,701,"<p>The economy is getting better overall – but as the rich get richer and the poor grow poorer, overall has become a worse gauge of wellbeing </p>",Opinion,Opinion,article,Robert Reich,"US economy, US news, US politics",commentisfree/2023/jul/10/america-economy-robert-reich
Rightwing figures sign up for Meta’s Threads app ‘within 24 hours’ of release ,2023-07-09T22:18:41Z,"<p>White nationalist Richard Spencer and white supremacist Nick Fuentes join app, according to Media Matters</p>",https://www.theguardian.com/technology/2023/jul/09/meta-threads-app-rightwing-fringe-figures-sign-up,839,"<p>White nationalist Richard Spencer and white supremacist Nick Fuentes join app, according to Media Matters</p>",Technology,News,article,Diana Ramirez-Simon,"Meta, Threads, Mark Zuckerberg, Technology, X, Internet, Elon Musk",technology/2023/jul/09/meta-threads-app-rightwing-fringe-figures-sign-up
Missed all our net zero targets? No sweat. Rishi Sunak is 100% on it,2023-07-09T06:03:36Z,"The PM acts as if he has some cunning plan, but even his own global heating advisers can’t see how",https://www.theguardian.com/commentisfree/2023/jul/09/missed-net-zero-targets-uk-rishi-sunak-cunning-plan,1057,"The PM acts as if he has some cunning plan, but even his own global heating advisers can’t see how",Opinion,Opinion,article,Gaia Vince,"Climate crisis, Rishi Sunak, Climate aid, Environment, Politics",commentisfree/2023/jul/09/missed-net-zero-targets-uk-rishi-sunak-cunning-plan
The Observer view on why the British right should be giving Joe Biden a warm welcome,2023-07-08T18:12:00Z,"On the eve of his visit to meet Rishi Sunak and the King, his critics here are wrong to claim the US leader is ‘anti-British’",https://www.theguardian.com/commentisfree/2023/jul/08/joe-biden-warm-welcome-britain,906,"On the eve of his visit to meet Rishi Sunak and the King, his critics here are wrong to claim the US leader is ‘anti-British’",Opinion,Opinion,article,Observer editorial,"Joe Biden, Conservatives, US elections 2024, US news",commentisfree/2023/jul/08/joe-biden-warm-welcome-britain
Casey DeSantis ‘mamas’ video labeled ‘desperate effort’ to save husband’s campaign,2023-07-07T18:30:28Z,<p>Florida first lady outlines Ron DeSantis’s hardline rightwing agenda in video accusing progressives of ‘coming after our kids’</p>,https://www.theguardian.com/us-news/2023/jul/07/casey-desantis-parents-rights-video-mamas-for-desantis,590,<p>Florida first lady outlines Ron DeSantis’s hardline rightwing agenda in video accusing progressives of ‘coming after our kids’</p>,US news,News,article,Martin Pengelly in Washington,"Ron DeSantis, Republicans, US elections 2024, US news",us-news/2023/jul/07/casey-desantis-parents-rights-video-mamas-for-desantis
Boris Johnson claims he ‘reminded’ Trump about key role in Ukraine aid,2023-07-06T04:01:02Z,<p>Former British prime minister says in interview that Trump ‘played an important role’ in arming Ukraine and set an example</p>,https://www.theguardian.com/politics/2023/jul/06/boris-johnson-trump-ukraine-aid-arms-russia,827,<p>Former British prime minister says in interview that Trump ‘played an important role’ in arming Ukraine and set an example</p>,Politics,News,article,Martin Pengelly in Washington,"Boris Johnson, Donald Trump, Ukraine, Russia, World news, US news, US politics, US foreign policy, Republicans, Politics, Europe",politics/2023/jul/06/boris-johnson-trump-ukraine-aid-arms-russia
‘Get a grip and listen’: Scottish voters share views as Yousaf reaches 100 days in office,2023-07-05T04:00:23Z,<p>Focus group compares first minister with Sturgeon and discusses appeal of Labour as cost of living crisis continues</p>,https://www.theguardian.com/uk-news/2023/jul/05/scottish-voters-humza-yousaf-100-days-in-office-snp,1101,<p>Focus group compares first minister with Sturgeon and discusses appeal of Labour as cost of living crisis continues</p>,UK news,News,article,Libby Brooks Scotland correspondent,"Scotland, UK news, Politics, Humza Yousaf, Nicola Sturgeon, Scottish National party (SNP), Labour, Scottish politics",uk-news/2023/jul/05/scottish-voters-humza-yousaf-100-days-in-office-snp
Rise in racist abuse against Sadiq Khan linked to London clean air zone expansion ,2023-07-05T04:00:22Z,"<p>Study by Greater London authority finds mayor has received over 300,000 pieces of racist abuse since being elected</p>",https://www.theguardian.com/politics/2023/jul/05/rise-in-racist-abuse-against-sadiq-khan-linked-to-london-clean-air-zone-expansion,573,"<p>Study by Greater London authority finds mayor has received over 300,000 pieces of racist abuse since being elected</p>",Politics,News,article,Peter Walker Deputy political editor,"Sadiq Khan, Race, Social media, Air pollution, Politics, UK news, London",politics/2023/jul/05/rise-in-racist-abuse-against-sadiq-khan-linked-to-london-clean-air-zone-expansion
The supreme court backed voting rights this term – is it enough to protect the 2024 election?,2023-07-02T09:00:38Z,"<p>One ruling will help Black voters gain representation, while another protects the popular vote at the state level</p>",https://www.theguardian.com/us-news/2023/jul/02/supreme-court-voting-rights-rulings-2024-presidential-election,1037,"<p>One ruling will help Black voters gain representation, while another protects the popular vote at the state level</p>",US news,News,article,Sam Levine in New York,"US supreme court, US voting rights, US elections 2024, Alabama, Georgia, Wisconsin, US news, Law (US)",us-news/2023/jul/02/supreme-court-voting-rights-rulings-2024-presidential-election
The Big Break: Ben Terris on his portrait of Washington after Trump,2023-07-02T07:00:35Z,"<p>The Washington Post reporter discusses his tale of pollsters, chancers, gamblers and more in a capital rocked to its core</p>",https://www.theguardian.com/books/2023/jul/02/the-big-break-ben-terris-book-washington-trump,1195,"<p>The Washington Post reporter discusses his tale of pollsters, chancers, gamblers and more in a capital rocked to its core</p>",Books,Arts,article,Rich Tenorio,"Books, Politics books, US politics, Biden administration, Trump administration, Republicans, Democrats, Joe Biden, Donald Trump, US Congress, House of Representatives, US Senate, Culture, US news",books/2023/jul/02/the-big-break-ben-terris-book-washington-trump
"US-China cultural exchange at low point after tensions and Covid, data shows",2023-07-22T07:00:06Z,"<p>Tourism, academia and literature all exhibit signs that trend of closer ties has gone into reverse</p>",https://www.theguardian.com/world/2023/jul/22/us-china-cultural-exchange-at-low-point-after-tensions-and-covid-data-shows,709,"<p>Tourism, academia and literature all exhibit signs that trend of closer ties has gone into reverse</p>",World news,News,article,Michael Goodier and Amy Hawkins,"China, US news, Asia Pacific, World news, Coronavirus, Donald Trump, Joe Biden, Barack Obama",world/2023/jul/22/us-china-cultural-exchange-at-low-point-after-tensions-and-covid-data-shows
