headline,pub_date,snippet,web_url,word_count,abstract,section_name,pillar_name,type,byline,keywords,article_id
What ethical controversies are US supreme court justices facing?,2023-07-12T17:28:50Z,"<p>Ethical concerns are swirling around the nation’s highest court, centering on Clarence Thomas and other conservative justices</p>",https://www.theguardian.com/law/2023/jul/12/us-supreme-court-justices-ethics-rules-controversy-explain,772,"<p>Ethical concerns are swirling around the nation’s highest court, centering on Clarence Thomas and other conservative justices</p>",US news,News,article,Edwin Rios,"US supreme court, US news, US politics",law/2023/jul/12/us-supreme-court-justices-ethics-rules-controversy-explain
First Thing: Iowa Republicans pass six-week abortion ban,2023-07-12T10:03:13Z,"<p>Legislation latest in raft of state anti-abortion laws since Roe v Wade was overturned. Plus, Trump not entitled to immunity</p>",https://www.theguardian.com/us-news/2023/jul/12/first-thing-iowa-republicans-pass-six-week-abortion-ban,1806,"<p>Legislation latest in raft of state anti-abortion laws since Roe v Wade was overturned. Plus, Trump not entitled to immunity</p>",US news,News,article,Mattha Busby,US news,us-news/2023/jul/12/first-thing-iowa-republicans-pass-six-week-abortion-ban
Lawyers with supreme court business paid Clarence Thomas aide via Venmo,2023-07-12T10:00:00Z,"<p>Payments to Rajan Vasisht, an aide from 2019-21, underscore ties between the justice and lawyers who argue cases in front of him</p><ul><li><a href=""https://www.theguardian.com/law/2023/jul/12/us-supreme-court-justices-ethics-rules-controversy-explain"">Luxury trips and property deals: supreme court controversies explained</a></li></ul><p></p>",https://www.theguardian.com/us-news/2023/jul/12/clarence-thomas-aide-venmo-payments-lawyers-supreme-court,986,"<p>Payments to Rajan Vasisht, an aide from 2019-21, underscore ties between the justice and lawyers who argue cases in front of him</p><ul><li><a href=""https://www.theguardian.com/law/2023/jul/12/us-supreme-court-justices-ethics-rules-controversy-explain"">Luxury trips and property deals: supreme court controversies explained</a></li></ul><p></p>",US news,News,article,Stephanie Kirchgaessner in Washington,"Clarence Thomas, US supreme court, Law (US), US news",us-news/2023/jul/12/clarence-thomas-aide-venmo-payments-lawyers-supreme-court
Trump documents trial judge sets first hearing; Georgia grand jury set to weigh 2020 election charges – as it happened,2023-07-11T20:06:03Z,"<p>Aileen Cannon sets 18 July for hearing as ex-US president asks for trial delay; grand jury to decide if Trump has case to answer on election interference</p><ul><li><a href=""https://www.theguardian.com/us-news/2023/jul/11/trump-classified-documents-trial-after-2024-election"">Trump asks for documents trial delay until after 2024 US election</a></li></ul>",https://www.theguardian.com/us-news/live/2023/jul/11/trump-georgia-grand-jury-biden-nato-ukraine-politics-live-updates,4427,"<p>Aileen Cannon sets 18 July for hearing as ex-US president asks for trial delay; grand jury to decide if Trump has case to answer on election interference</p><ul><li><a href=""https://www.theguardian.com/us-news/2023/jul/11/trump-classified-documents-trial-after-2024-election"">Trump asks for documents trial delay until after 2024 US election</a></li></ul>",US news,News,liveblog,Léonie Chao-Fong,"US politics, US news, Donald Trump, Georgia, US elections 2020, US Congress, House of Representatives, US Senate, Democrats, Republicans, Joe Biden, Nato",us-news/live/2023/jul/11/trump-georgia-grand-jury-biden-nato-ukraine-politics-live-updates
Vermont capital cut off by flood waters as dam threatens to overflow,2023-07-11T18:47:10Z,"<p>Deadly deluge has saturated parts of New England and New York, while the south and west are under worsening heatwave</p>",https://www.theguardian.com/us-news/2023/jul/11/vermont-flooding-dam-montpelier,878,"<p>Deadly deluge has saturated parts of New England and New York, while the south and west are under worsening heatwave</p>",US news,News,article,Guardian staff and agency,"Vermont, Extreme weather, Flooding, New York, US news",us-news/2023/jul/11/vermont-flooding-dam-montpelier
Georgia grand jury selected in Trump case over attempt to overturn 2020 defeat,2023-07-11T17:33:45Z,<p>Grand jury will decide later this summer whether the former president and his associates will face criminal charges</p>,https://www.theguardian.com/us-news/2023/jul/11/georgia-jury-trump-2020-criminal-charges-lost-election-overturn,661,<p>Grand jury will decide later this summer whether the former president and his associates will face criminal charges</p>,US news,News,article,Martin Pengelly in Washington,"Donald Trump, Georgia, US news, US crime, US politics, US elections 2020, Donald Trump trials",us-news/2023/jul/11/georgia-jury-trump-2020-criminal-charges-lost-election-overturn
Trump asks for classified documents trial to take place after 2024 election,2023-07-11T11:58:45Z,<p>Ex-president’s lawyers made clear their preference and intentions to delay proceedings as they opposed December trial date</p>,https://www.theguardian.com/us-news/2023/jul/11/trump-classified-documents-trial-after-2024-election,545,<p>Ex-president’s lawyers made clear their preference and intentions to delay proceedings as they opposed December trial date</p>,US news,News,article,Hugo Lowell,"Donald Trump, US news, Mar-a-Lago, Law (US), Donald Trump trials",us-news/2023/jul/11/trump-classified-documents-trial-after-2024-election
Downing Street plays down reports of UK-US split over Ukraine Nato membership after Sunak-Biden meeting - as it happened,2023-07-10T16:00:33Z,<p>No 10 spokesperson says UK ‘certainly’ wants to support Ukraine on the pathway to joining Nato after reports of rift</p>,https://www.theguardian.com/politics/live/2023/jul/10/joe-biden-rishi-sunak-king-charles-downing-street-nato-summit-ukraine-uk-politics-live,3842,<p>No 10 spokesperson says UK ‘certainly’ wants to support Ukraine on the pathway to joining Nato after reports of rift</p>,Politics,News,liveblog,Miranda Bryant (now) and Tom Bryant (earlier),"Politics, Rishi Sunak, Joe Biden, UK news, Conservatives, King Charles III, Ukraine, Nato",politics/live/2023/jul/10/joe-biden-rishi-sunak-king-charles-downing-street-nato-summit-ukraine-uk-politics-live
How to keep AI sweet: ask it about marmalade,2023-07-10T16:00:16Z,<p>Global conservation | An early lunch | Cat’s dinner | Customer feedback | The Lord’s name</p>,https://www.theguardian.com/technology/2023/jul/10/how-to-keep-ai-sweet-ask-it-about-marmalade,325,<p>Global conservation | An early lunch | Cat’s dinner | Customer feedback | The Lord’s name</p>,Technology,News,article,,"Artificial intelligence (AI), Food, Life and style, Cancer, Online shopping, Religion, Anglicanism, UK news, Christianity",technology/2023/jul/10/how-to-keep-ai-sweet-ask-it-about-marmalade
"Tube train drivers to join strikes in late July; EasyJet cancels 1,700 flights, blaming Gatwick delays – as it happened",2023-07-10T14:22:37Z,"<p>Rolling coverage of the latest economic and financial news</p><ul><li><a href=""https://www.theguardian.com/politics/2023/jul/09/jeremy-hunt-pension-fund-investments-mansion-house-speech"">Jeremy Hunt to unveil pension fund deal aimed at helping fast-growing firms</a></li></ul>",https://www.theguardian.com/business/live/2023/jul/10/thames-water-750m-emergency-equity-funding-nationalisation-sewage-bt-group-philip-jansen-resign-leave-andrew-bailey-bank-of-england-mansion-house-business-live,3954,"<p>Rolling coverage of the latest economic and financial news</p><ul><li><a href=""https://www.theguardian.com/politics/2023/jul/09/jeremy-hunt-pension-fund-investments-mansion-house-speech"">Jeremy Hunt to unveil pension fund deal aimed at helping fast-growing firms</a></li></ul>",Business,News,liveblog,Jasper Jolly,"Business, Economics, Stock markets, FTSE, Water industry",business/live/2023/jul/10/thames-water-750m-emergency-equity-funding-nationalisation-sewage-bt-group-philip-jansen-resign-leave-andrew-bailey-bank-of-england-mansion-house-business-live
US supreme court ethics: chief justice urged to testify for ‘good of democracy’,2023-07-10T10:39:44Z,<p>Ro Khanna of California wants John Roberts’ account of controversies besetting the ‘out of touch’ court</p>,https://www.theguardian.com/law/2023/jul/10/ro-khanna-urges-chief-justice-john-roberts-testify-ethics-scandals,781,<p>Ro Khanna of California wants John Roberts’ account of controversies besetting the ‘out of touch’ court</p>,US news,News,article,Martin Pengelly in Washington,"US supreme court, Law (US), US Congress, House of Representatives, US Senate, US news, US politics, Democrats, Ethics",law/2023/jul/10/ro-khanna-urges-chief-justice-john-roberts-testify-ethics-scandals
Moscow hits out as Turkey allows return of ‘hero’ Mariupol commanders – as it happened,2023-07-08T18:55:01Z,"<p>Moscow says men’s return to Ukraine is a ‘direct violation’ of prisoner swap agreement</p><ul><li><a href=""https://www.theguardian.com/world/2023/jul/08/ukraine-cluster-munitions-rishi-sunak-aid"">UK will not supply cluster munitions to Ukraine, says Sunak</a></li><li><a href=""https://www.theguardian.com/world/2023/jul/08/volodymyr-zelenskiy-snake-island-visit-ukraine"">Zelenskiy visits Snake Island on 500th day of Russian invasion</a></li><li><a href=""https://www.theguardian.com/world/2023/jul/08/russia-ukraine-war-at-a-glance-what-we-know-on-day-500-of-the-invasion"">What we know on day 500 of the invasion</a></li></ul>",https://www.theguardian.com/world/live/2023/jul/08/russia-ukraine-war-live-ukraine-makes-tactically-significant-gains-in-bakhmut-says-us-thinktank-as-war-enters-500th-day,7098,"<p>Moscow says men’s return to Ukraine is a ‘direct violation’ of prisoner swap agreement</p><ul><li><a href=""https://www.theguardian.com/world/2023/jul/08/ukraine-cluster-munitions-rishi-sunak-aid"">UK will not supply cluster munitions to Ukraine, says Sunak</a></li><li><a href=""https://www.theguardian.com/world/2023/jul/08/volodymyr-zelenskiy-snake-island-visit-ukraine"">Zelenskiy visits Snake Island on 500th day of Russian invasion</a></li><li><a href=""https://www.theguardian.com/world/2023/jul/08/russia-ukraine-war-at-a-glance-what-we-know-on-day-500-of-the-invasion"">What we know on day 500 of the invasion</a></li></ul>",World news,News,liveblog,"Christy Cooney (now); Joe Middleton , Tom Ambrose  and Yang Tian (earlier)","Russia, Ukraine, Europe, World news",world/live/2023/jul/08/russia-ukraine-war-live-ukraine-makes-tactically-significant-gains-in-bakhmut-says-us-thinktank-as-war-enters-500th-day
"AI has yet to produce a masterpiece, but after sucking our souls dry it may yet",2023-07-08T15:31:19Z,"With authors claiming OpenAI breached their copyright by ‘ingesting’ their books, an experiment seemed in order. It didn’t go well",https://www.theguardian.com/commentisfree/2023/jul/08/openai-mona-awad-paul-tremblay-salisbury-council-pink-concerts,631,"With authors claiming OpenAI breached their copyright by ‘ingesting’ their books, an experiment seemed in order. It didn’t go well",Opinion,Opinion,article,Bidisha Mamata,"UK news, OpenAI, Artificial intelligence (AI), Local government, Society, Music, Culture, Pink, Lil Nas X",commentisfree/2023/jul/08/openai-mona-awad-paul-tremblay-salisbury-council-pink-concerts
"Has Trump really turned on Kari Lake, one of his loudest cheerleaders?",2023-07-08T13:00:17Z,<p>Her biggest political accomplishment was losing Arizona’s gubernatorial race in 2022 – and now Trump and his team think she might be too thirsty for attention</p>,https://www.theguardian.com/commentisfree/2023/jul/08/kari-lake-trump-week-in-patriarchy,1068,<p>Her biggest political accomplishment was losing Arizona’s gubernatorial race in 2022 – and now Trump and his team think she might be too thirsty for attention</p>,Opinion,Opinion,article,Arwa Mahdawi,"Donald Trump, Republicans, US news",commentisfree/2023/jul/08/kari-lake-trump-week-in-patriarchy
‘Righteous anger was a part of it’: the shocking story of New York’s gay bar killer,2023-07-08T13:00:16Z,"<p>In the docuseries Last Call, the story of a killer stalking the city’s gay bars becomes an indictment of a system that let him get away with it</p>",https://www.theguardian.com/tv-and-radio/2023/jul/08/last-call-documentary-new-york-gay-bar-killer,1568,"<p>In the docuseries Last Call, the story of a killer stalking the city’s gay bars becomes an indictment of a system that let him get away with it</p>",Television & radio,Arts,article,Benjamin Lee,"Documentary, True crime books, HBO, Factual TV, Television, Television & radio, Culture, US television",tv-and-radio/2023/jul/08/last-call-documentary-new-york-gay-bar-killer
White nationalist publisher’s data exposed in Amazon cloud leak,2023-07-08T12:00:15Z,<p>Data from Greg Johnson’s Counter-Currents sheds light on how organization promotes its ideology online</p>,https://www.theguardian.com/world/2023/jul/08/counter-currents-data-leak-amazon-cloud-greg-johnson,1131,<p>Data from Greg Johnson’s Counter-Currents sheds light on how organization promotes its ideology online</p>,World news,News,article,Jason Wilson,"The far right, US news",world/2023/jul/08/counter-currents-data-leak-amazon-cloud-greg-johnson
‘I’m in Tora prison. Help me’: one daughter’s fight to free her father,2023-07-08T00:00:01Z,"<p>When Australian Hazem Hamouda was whisked from Cairo airport to the notorious Tora prison, his daughter had no idea where he was – or that she’d spend the next year trying to get him out</p><ul><li><strong><a href=""https://www.theguardian.com/australia-news/2021/dec/21/sign-up-for-five-great-reads-guardian-australias-wrap-of-our-best-summer-stories"">Sign up for a weekly email featuring our best reads</a></strong></li></ul>",https://www.theguardian.com/books/2023/jul/08/hazem-and-lamisse-hamouda-cairo-tora-prison-the-shape-of-dust,1731,"<p>When Australian Hazem Hamouda was whisked from Cairo airport to the notorious Tora prison, his daughter had no idea where he was – or that she’d spend the next year trying to get him out</p><ul><li><strong><a href=""https://www.theguardian.com/australia-news/2021/dec/21/sign-up-for-five-great-reads-guardian-australias-wrap-of-our-best-summer-stories"">Sign up for a weekly email featuring our best reads</a></strong></li></ul>",Books,Arts,article,Sarah Ayoub,"Australian books, Human rights, Books, Law",books/2023/jul/08/hazem-and-lamisse-hamouda-cairo-tora-prison-the-shape-of-dust
Biden says sending cluster bombs to Ukraine was ‘difficult decision’ – as it happened,2023-07-07T22:00:33Z,"<p>President tells CNN he took the recommendation for controversial weapons because Ukraine is ‘running out of ammunition’</p><ul><li><a href=""https://www.theguardian.com/world/2023/jul/06/what-are-cluster-bombs-biden-ukraine-russia"">What are cluster bombs and why are they controversial?</a></li></ul>",https://www.theguardian.com/us-news/live/2023/jul/07/biden-cluster-bombs-ukraine-war-trump-desantis-2024-politics-live-updates,7640,"<p>President tells CNN he took the recommendation for controversial weapons because Ukraine is ‘running out of ammunition’</p><ul><li><a href=""https://www.theguardian.com/world/2023/jul/06/what-are-cluster-bombs-biden-ukraine-russia"">What are cluster bombs and why are they controversial?</a></li></ul>",US news,News,liveblog,Maya Yang (now); Léonie Chao-Fong and Gloria Oladipo (earlier),"US politics, US news, World news, Ukraine, Joe Biden, Biden administration, Europe",us-news/live/2023/jul/07/biden-cluster-bombs-ukraine-war-trump-desantis-2024-politics-live-updates
"Volodymyr Zelenskiy discusses peace plan, Nato and grain deal with Erdoğan in Turkey – as it happened",2023-07-07T21:03:09Z,"<p>Ukraine president meets with Turkish leader after summits across Europe </p><ul><li><a href=""https://www.theguardian.com/world/2023/jul/07/russia-ukraine-war-at-a-glance-what-we-know-on-day-499-of-the-invasion"">What we know on day 499 of the invasion</a></li></ul>",https://www.theguardian.com/world/live/2023/jul/07/russia-ukraine-war-live-zelenskiy-nato-membership,8007,"<p>Ukraine president meets with Turkish leader after summits across Europe </p><ul><li><a href=""https://www.theguardian.com/world/2023/jul/07/russia-ukraine-war-at-a-glance-what-we-know-on-day-499-of-the-invasion"">What we know on day 499 of the invasion</a></li></ul>",World news,News,liveblog,"Nadeem Badshah (now); Mattha Busby, Martin Belam and Helen Sullivan (earlier)","Ukraine, Russia, Europe, World news, Nato",world/live/2023/jul/07/russia-ukraine-war-live-zelenskiy-nato-membership
Secret US-Russia talks over Ukraine ‘not sanctioned by Biden administration’,2023-07-07T17:41:48Z,"<p>Washington denies authorising former officials’ meeting with Russia’s foreign minister, Sergei Lavrov</p><ul><li><a href=""https://www.theguardian.com/world/live/2023/jul/07/russia-ukraine-war-live-zelenskiy-nato-membership"">Russia-Ukraine war – latest news updates</a></li><li><a href=""https://www.theguardian.com/world/russia+ukraine"">See all our Russia-Ukraine war coverage</a></li></ul>",https://www.theguardian.com/us-news/2023/jul/07/russia-us-talks-ukraine-war-biden,1039,"<p>Washington denies authorising former officials’ meeting with Russia’s foreign minister, Sergei Lavrov</p><ul><li><a href=""https://www.theguardian.com/world/live/2023/jul/07/russia-ukraine-war-live-zelenskiy-nato-membership"">Russia-Ukraine war – latest news updates</a></li><li><a href=""https://www.theguardian.com/world/russia+ukraine"">See all our Russia-Ukraine war coverage</a></li></ul>",US news,News,article,Dan Sabbagh and David Smith in Washington,"US foreign policy, US news, Joe Biden, Russia, Ukraine, Biden administration, World news",us-news/2023/jul/07/russia-us-talks-ukraine-war-biden
 Russia-Ukraine war at a glance: what we know on day 499 of the invasion,2023-07-07T14:09:32Z,"<p>10 people killed in Lviv missile strike; US poised to send cluster munitions to Ukraine</p><ul><li><a href=""https://www.theguardian.com/world/russia+ukraine"">See all our Russia-Ukraine war coverage</a></li></ul>",https://www.theguardian.com/world/2023/jul/07/russia-ukraine-war-at-a-glance-what-we-know-on-day-499-of-the-invasion,829,"<p>10 people killed in Lviv missile strike; US poised to send cluster munitions to Ukraine</p><ul><li><a href=""https://www.theguardian.com/world/russia+ukraine"">See all our Russia-Ukraine war coverage</a></li></ul>",World news,News,article,Helen Sullivan and Martin Belam,"Ukraine, Russia, Europe",world/2023/jul/07/russia-ukraine-war-at-a-glance-what-we-know-on-day-499-of-the-invasion
Ukraine welcomes forthcoming US decision to send cluster bombs,2023-07-07T13:34:32Z,"<p>Kyiv says it needs ‘weapons, more weapons, and more weapons’ and hits out after Human Rights Watch report on civilian deaths</p><ul><li><a href=""https://www.theguardian.com/world/live/2023/jul/07/russia-ukraine-war-live-zelenskiy-nato-membership"">Russia-Ukraine war – latest news updates</a></li></ul>",https://www.theguardian.com/world/2023/jul/07/ukraine-welcomes-us-decision-to-send-cluster-bombs,789,"<p>Kyiv says it needs ‘weapons, more weapons, and more weapons’ and hits out after Human Rights Watch report on civilian deaths</p><ul><li><a href=""https://www.theguardian.com/world/live/2023/jul/07/russia-ukraine-war-live-zelenskiy-nato-membership"">Russia-Ukraine war – latest news updates</a></li></ul>",World news,News,article,Luke Harding in Kyiv,"Ukraine, Russia, Europe, World news, US foreign policy, Cluster bombs, US news",world/2023/jul/07/ukraine-welcomes-us-decision-to-send-cluster-bombs
Key Democrat attacks US supreme court chief justice over ethics scandal,2023-07-07T06:00:24Z,"<p>Dick Durbin, chair of Senate judiciary committee, condemns John Roberts for failure to reform court as donor controversy swirls</p>",https://www.theguardian.com/us-news/2023/jul/07/us-supreme-court-john-roberts-dick-durbin,477,"<p>Dick Durbin, chair of Senate judiciary committee, condemns John Roberts for failure to reform court as donor controversy swirls</p>",US news,News,article,Martin Pengelly in Washington,"US politics, US supreme court, Democrats, US news, Law (US), Law",us-news/2023/jul/07/us-supreme-court-john-roberts-dick-durbin
Friday briefing: What Meta’s ‘friendly’ new app means for the future of social media,2023-07-07T05:45:23Z,"<p>In today’s newsletter: Mark Zuckerberg’s new venture launches at a time of disarray for its competitor – can Threads unravel Twitter?</p><p><strong>• <a href=""https://www.theguardian.com/global/2022/sep/20/sign-up-for-the-first-edition-newsletter-our-free-news-email"">Sign up here for our daily newsletter, First Edition</a></strong></p>",https://www.theguardian.com/world/2023/jul/07/first-edition-threads-meta-mark-zuckerberg-elon-musk-twitter,2643,"<p>In today’s newsletter: Mark Zuckerberg’s new venture launches at a time of disarray for its competitor – can Threads unravel Twitter?</p><p><strong>• <a href=""https://www.theguardian.com/global/2022/sep/20/sign-up-for-the-first-edition-newsletter-our-free-news-email"">Sign up here for our daily newsletter, First Edition</a></strong></p>",World news,News,article,Esther Addley,,world/2023/jul/07/first-edition-threads-meta-mark-zuckerberg-elon-musk-twitter
Russia-Ukraine war live: six die in missile strike on Lviv – as it happened,2023-07-06T21:53:03Z,"<p>US reportedly considering sending cluster munitions banned by most of world under treaty US, Russia and Ukraine did not sign</p><ul><li><a href=""https://www.theguardian.com/world/2023/jul/06/russia-ukraine-cluster-bombs-biden-human-rights-watch"">US expected to supply cluster bombs to Ukraine</a></li><li><a href=""https://www.theguardian.com/world/2023/jul/06/russia-ukraine-war-at-a-glance-what-we-know-on-day-498-of-the-invasion"">At a glance: what we know on day 498 of the invasion</a></li></ul>",https://www.theguardian.com/world/live/2023/jul/06/russia-ukraine-war-live-lviv-missile-strike,11452,"<p>US reportedly considering sending cluster munitions banned by most of world under treaty US, Russia and Ukraine did not sign</p><ul><li><a href=""https://www.theguardian.com/world/2023/jul/06/russia-ukraine-cluster-bombs-biden-human-rights-watch"">US expected to supply cluster bombs to Ukraine</a></li><li><a href=""https://www.theguardian.com/world/2023/jul/06/russia-ukraine-war-at-a-glance-what-we-know-on-day-498-of-the-invasion"">At a glance: what we know on day 498 of the invasion</a></li></ul>",World news,News,liveblog,"Léonie Chao-Fong (now); Donna Ferguson, Martin Belam and Helen Sullivan (earlier)","Russia, Ukraine, Europe, World news",world/live/2023/jul/06/russia-ukraine-war-live-lviv-missile-strike
Trump valet Walt Nauta pleads not guilty in Mar-a-Lago documents case – as it happened,2023-07-06T20:00:24Z,<p>Former US president’s ‘body man’ appears in Miami court on charges relating to classified documents found at resort</p>,https://www.theguardian.com/us-news/live/2023/jul/06/trump-news-documents-mar-a-lago-walt-nauta-biden-2024-politics-live-updates,3351,<p>Former US president’s ‘body man’ appears in Miami court on charges relating to classified documents found at resort</p>,US news,News,liveblog,Chris Stein,"Donald Trump, US news, World news, Mar-a-Lago, Republicans, US elections 2024, US politics, Donald Trump trials",us-news/live/2023/jul/06/trump-news-documents-mar-a-lago-walt-nauta-biden-2024-politics-live-updates
US expected to provide cluster bombs to Ukraine,2023-07-06T18:03:13Z,"<p>Human Rights Watch calls for immediate halt and urges US not to supply bombs amid reports Biden is to include them in aid package</p><ul><li><a href=""https://www.theguardian.com/world/2023/jul/06/what-are-cluster-bombs-biden-ukraine-russia"">Explainer: What are cluster bombs?</a></li></ul>",https://www.theguardian.com/world/2023/jul/06/russia-ukraine-cluster-bombs-biden-human-rights-watch,459,"<p>Human Rights Watch calls for immediate halt and urges US not to supply bombs amid reports Biden is to include them in aid package</p><ul><li><a href=""https://www.theguardian.com/world/2023/jul/06/what-are-cluster-bombs-biden-ukraine-russia"">Explainer: What are cluster bombs?</a></li></ul>",World news,News,article,Léonie Chao-Fong in Washington,"Ukraine, Russia, World news, Europe",world/2023/jul/06/russia-ukraine-cluster-bombs-biden-human-rights-watch
Threads review: Twitter without the rough edges or news,2023-07-06T16:43:42Z,<p>Site has potential to suck the remaining life – and advertising revenue – out of Musk’s struggling network</p>,https://www.theguardian.com/media/2023/jul/06/threads-review-twitter-without-rough-edges-or-news,925,<p>Site has potential to suck the remaining life – and advertising revenue – out of Musk’s struggling network</p>,Media,News,article,Jim Waterson Media editor,"Social media, Threads, Social networking, Instagram, X, Mark Zuckerberg, Elon Musk, Blogging, Digital media, Internet, Media, Newspapers & magazines, Technology, World news, UK news, Meta",media/2023/jul/06/threads-review-twitter-without-rough-edges-or-news
